"LINESTRING (-0.105593 51.488852,-0.115659 51.486824", "From Kennington Station, Kennington to Kennington Lane Tesco, Vauxhall"
"LINESTRING (-0.143613 51.523518,-0.135025 51.518162", "From Bolsover Street, Fitzrovia to Rathbone Street, Fitzrovia"
"LINESTRING (-0.191351 51.513489,-0.187842 51.509908", "From Princes Square, Bayswater to Black Lion Gate, Kensington Gardens"
"LINESTRING (-0.179854 51.501715,-0.187842 51.509908", "From Queen's Gate, Kensington Gardens to Black Lion Gate, Kensington Gardens"
"LINESTRING (-0.179077 51.495592,-0.187842 51.509908", "From Natural History Museum, South Kensington to Black Lion Gate, Kensington Gardens"
"LINESTRING (-0.160529 51.512232,-0.187842 51.509908", "From Speakers' Corner 2, Hyde Park to Black Lion Gate, Kensington Gardens"
"LINESTRING (-0.1844 51.502042,-0.187842 51.509908", "From Palace Gate, Kensington Gardens to Black Lion Gate, Kensington Gardens"
"LINESTRING (-0.187842 51.509908,-0.187842 51.509908", "From Black Lion Gate, Kensington Gardens to Black Lion Gate, Kensington Gardens"
"LINESTRING (-0.132102 51.498125,-0.187842 51.509908", "From Abbey Orchard Street, Westminster to Black Lion Gate, Kensington Gardens"
"LINESTRING (-0.164032 51.525194,-0.187842 51.509908", "From Rossmore Road, Marylebone to Black Lion Gate, Kensington Gardens"
"LINESTRING (-0.216104 51.50659,-0.187842 51.509908", "From Queensdale Road, Shepherd's Bush to Black Lion Gate, Kensington Gardens"
"LINESTRING (-0.1844 51.502042,-0.187842 51.509908", "From Palace Gate, Kensington Gardens to Black Lion Gate, Kensington Gardens"
"LINESTRING (-0.159925 51.512301,-0.187842 51.509908", "From Speakers' Corner 1, Hyde Park to Black Lion Gate, Kensington Gardens"
"LINESTRING (-0.162146 51.512151,-0.187842 51.509908", "From Cumberland Gate, Hyde Park to Black Lion Gate, Kensington Gardens"
"LINESTRING (-0.160529 51.512232,-0.187842 51.509908", "From Speakers' Corner 2, Hyde Park to Black Lion Gate, Kensington Gardens"
"LINESTRING (-0.1844 51.502042,-0.187842 51.509908", "From Palace Gate, Kensington Gardens to Black Lion Gate, Kensington Gardens"
"LINESTRING (-0.160529 51.512232,-0.187842 51.509908", "From Speakers' Corner 2, Hyde Park to Black Lion Gate, Kensington Gardens"
"LINESTRING (-0.17977 51.51348,-0.187842 51.509908", "From Devonshire Terrace, Bayswater to Black Lion Gate, Kensington Gardens"
"LINESTRING (-0.159925 51.512301,-0.187842 51.509908", "From Speakers' Corner 1, Hyde Park to Black Lion Gate, Kensington Gardens"
"LINESTRING (-0.191351 51.513489,-0.187842 51.509908", "From Princes Square, Bayswater to Black Lion Gate, Kensington Gardens"
"LINESTRING (-0.174554 51.499917,-0.187842 51.509908", "From Exhibition Road, Knightsbridge to Black Lion Gate, Kensington Gardens"
"LINESTRING (-0.149569 51.50274,-0.187842 51.509908", "From Wellington Arch, Hyde Park to Black Lion Gate, Kensington Gardens"
"LINESTRING (-0.139625 51.490962,-0.187842 51.509908", "From Gloucester Street, Pimlico to Black Lion Gate, Kensington Gardens"
"LINESTRING (-0.187842 51.509908,-0.187842 51.509908", "From Black Lion Gate, Kensington Gardens to Black Lion Gate, Kensington Gardens"
"LINESTRING (-0.15352 51.503117,-0.187842 51.509908", "From Hyde Park Corner, Hyde Park to Black Lion Gate, Kensington Gardens"
"LINESTRING (-0.187842 51.509908,-0.187842 51.509908", "From Black Lion Gate, Kensington Gardens to Black Lion Gate, Kensington Gardens"
"LINESTRING (-0.159925 51.512301,-0.187842 51.509908", "From Speakers' Corner 1, Hyde Park to Black Lion Gate, Kensington Gardens"
"LINESTRING (-0.139625 51.490962,-0.187842 51.509908", "From Gloucester Street, Pimlico to Black Lion Gate, Kensington Gardens"
"LINESTRING (-0.18697 51.51616,-0.187842 51.509908", "From Bishop's Bridge Road West, Bayswater to Black Lion Gate, Kensington Gardens"
"LINESTRING (-0.149569 51.50274,-0.187842 51.509908", "From Wellington Arch, Hyde Park to Black Lion Gate, Kensington Gardens"
"LINESTRING (-0.187842 51.509908,-0.187842 51.509908", "From Black Lion Gate, Kensington Gardens to Black Lion Gate, Kensington Gardens"
"LINESTRING (-0.160529 51.512232,-0.187842 51.509908", "From Speakers' Corner 2, Hyde Park to Black Lion Gate, Kensington Gardens"
"LINESTRING (-0.179854 51.501715,-0.187842 51.509908", "From Queen's Gate, Kensington Gardens to Black Lion Gate, Kensington Gardens"
"LINESTRING (-0.187842 51.509908,-0.187842 51.509908", "From Black Lion Gate, Kensington Gardens to Black Lion Gate, Kensington Gardens"
"LINESTRING (-0.15352 51.503117,-0.187842 51.509908", "From Hyde Park Corner, Hyde Park to Black Lion Gate, Kensington Gardens"
"LINESTRING (-0.179854 51.501715,-0.187842 51.509908", "From Queen's Gate, Kensington Gardens to Black Lion Gate, Kensington Gardens"
"LINESTRING (-0.15352 51.503117,-0.187842 51.509908", "From Hyde Park Corner, Hyde Park to Black Lion Gate, Kensington Gardens"
"LINESTRING (-0.1844 51.502042,-0.187842 51.509908", "From Palace Gate, Kensington Gardens to Black Lion Gate, Kensington Gardens"
"LINESTRING (-0.1844 51.502042,-0.187842 51.509908", "From Palace Gate, Kensington Gardens to Black Lion Gate, Kensington Gardens"
"LINESTRING (-0.160529 51.512232,-0.187842 51.509908", "From Speakers' Corner 2, Hyde Park to Black Lion Gate, Kensington Gardens"
"LINESTRING (-0.179854 51.501715,-0.187842 51.509908", "From Queen's Gate, Kensington Gardens to Black Lion Gate, Kensington Gardens"
"LINESTRING (-0.216104 51.50659,-0.187842 51.509908", "From Queensdale Road, Shepherd's Bush to Black Lion Gate, Kensington Gardens"
"LINESTRING (-0.174554 51.499917,-0.187842 51.509908", "From Exhibition Road, Knightsbridge to Black Lion Gate, Kensington Gardens"
"LINESTRING (-0.197524 51.511084,-0.187842 51.509908", "From Pembridge Villas, Notting Hill to Black Lion Gate, Kensington Gardens"
"LINESTRING (-0.160529 51.512232,-0.187842 51.509908", "From Speakers' Corner 2, Hyde Park to Black Lion Gate, Kensington Gardens"
"LINESTRING (-0.132102 51.498125,-0.187842 51.509908", "From Abbey Orchard Street, Westminster to Black Lion Gate, Kensington Gardens"
"LINESTRING (-0.196422 51.509353,-0.187842 51.509908", "From Notting Hill Gate Station, Notting Hill to Black Lion Gate, Kensington Gardens"
"LINESTRING (-0.159925 51.512301,-0.187842 51.509908", "From Speakers' Corner 1, Hyde Park to Black Lion Gate, Kensington Gardens"
"LINESTRING (-0.15352 51.503117,-0.187842 51.509908", "From Hyde Park Corner, Hyde Park to Black Lion Gate, Kensington Gardens"
"LINESTRING (-0.155349 51.502757,-0.187842 51.509908", "From Knightsbridge, Hyde Park to Black Lion Gate, Kensington Gardens"
"LINESTRING (-0.174554 51.499917,-0.187842 51.509908", "From Exhibition Road, Knightsbridge to Black Lion Gate, Kensington Gardens"
"LINESTRING (-0.187842 51.509908,-0.187842 51.509908", "From Black Lion Gate, Kensington Gardens to Black Lion Gate, Kensington Gardens"
"LINESTRING (-0.155349 51.502757,-0.187842 51.509908", "From Knightsbridge, Hyde Park to Black Lion Gate, Kensington Gardens"
"LINESTRING (-0.216104 51.50659,-0.187842 51.509908", "From Queensdale Road, Shepherd's Bush to Black Lion Gate, Kensington Gardens"
"LINESTRING (-0.137043 51.511897,-0.085666 51.499075", "From Golden Square, Soho to Long Lane , Bermondsey"
"LINESTRING (-0.106 51.496127,-0.085666 51.499075", "From Geraldine Street, Elephant & Castle to Long Lane , Bermondsey"
"LINESTRING (-0.08974 51.500823,-0.085666 51.499075", "From Empire Square, The Borough to Long Lane , Bermondsey"
"LINESTRING (-0.15352 51.503117,-0.085666 51.499075", "From Hyde Park Corner, Hyde Park to Long Lane , Bermondsey"
"LINESTRING (-0.103137 51.506692,-0.085666 51.499075", "From Poured Lines, Bankside to Long Lane , Bermondsey"
"LINESTRING (-0.137043 51.511897,-0.085666 51.499075", "From Golden Square, Soho to Long Lane , Bermondsey"
"LINESTRING (-0.074754 51.523648,-0.085666 51.499075", "From Bethnal Green Road, Shoreditch to Long Lane , Bermondsey"
"LINESTRING (-0.085666 51.499075,-0.085666 51.499075", "From Long Lane , Bermondsey to Long Lane , Bermondsey"
"LINESTRING (-0.111435 51.48894,-0.085666 51.499075", "From Kennington Cross, Kennington to Long Lane , Bermondsey"
"LINESTRING (-0.122492 51.486343,-0.085666 51.499075", "From Kennington Lane Rail Bridge, Vauxhall to Long Lane , Bermondsey"
"LINESTRING (-0.091773 51.504627,-0.085666 51.499075", "From Hop Exchange, The Borough to Long Lane , Bermondsey"
"LINESTRING (-0.091773 51.504627,-0.085666 51.499075", "From Hop Exchange, The Borough to Long Lane , Bermondsey"
"LINESTRING (-0.142844 51.506613,-0.119047 51.509631", "From Green Park Station, Mayfair to Embankment (Savoy), Strand"
"LINESTRING (-0.173881 51.494412,-0.119047 51.509631", "From South Kensington Station, South Kensington to Embankment (Savoy), Strand"
"LINESTRING (-0.131213 51.513103,-0.117122 51.490994", "From Frith Street, Soho to Black Prince Road, Vauxhall"
"LINESTRING (-0.117122 51.490994,-0.117122 51.490994", "From Black Prince Road, Vauxhall to Black Prince Road, Vauxhall"
"LINESTRING (-0.093051 51.511246,-0.117122 51.490994", "From Queen Street 2, Bank to Black Prince Road, Vauxhall"
"LINESTRING (-0.117122 51.490994,-0.117122 51.490994", "From Black Prince Road, Vauxhall to Black Prince Road, Vauxhall"
"LINESTRING (-0.117122 51.490994,-0.117122 51.490994", "From Black Prince Road, Vauxhall to Black Prince Road, Vauxhall"
"LINESTRING (-0.120903 51.488124,-0.117122 51.490994", "From Vauxhall Walk, Vauxhall to Black Prince Road, Vauxhall"
"LINESTRING (-0.157436 51.512276,-0.117122 51.490994", "From Green Street, Mayfair to Black Prince Road, Vauxhall"
"LINESTRING (-0.132053 51.518587,-0.117122 51.490994", "From Bayley Street , Bloomsbury to Black Prince Road, Vauxhall"
"LINESTRING (-0.117122 51.490994,-0.117122 51.490994", "From Black Prince Road, Vauxhall to Black Prince Road, Vauxhall"
"LINESTRING (-0.131773 51.506633,-0.117122 51.490994", "From Waterloo Place, St. James's to Black Prince Road, Vauxhall"
"LINESTRING (-0.117863 51.515208,-0.117122 51.490994", "From Sardinia Street, Holborn to Black Prince Road, Vauxhall"
"LINESTRING (-0.117122 51.490994,-0.117122 51.490994", "From Black Prince Road, Vauxhall to Black Prince Road, Vauxhall"
"LINESTRING (-0.120903 51.488124,-0.117122 51.490994", "From Vauxhall Walk, Vauxhall to Black Prince Road, Vauxhall"
"LINESTRING (-0.117122 51.490994,-0.117122 51.490994", "From Black Prince Road, Vauxhall to Black Prince Road, Vauxhall"
"LINESTRING (-0.137424 51.498865,-0.117122 51.490994", "From Buckingham Gate, Westminster to Black Prince Road, Vauxhall"
"LINESTRING (-0.135777 51.51953,-0.140485 51.519181", "From Charlotte Street, Fitzrovia to Foley Street, Fitzrovia"
"LINESTRING (-0.13151 51.509639,-0.140485 51.519181", "From Panton Street, West End to Foley Street, Fitzrovia"
"LINESTRING (-0.147983 51.519167,-0.140485 51.519181", "From New Cavendish Street, Marylebone to Foley Street, Fitzrovia"
"LINESTRING (-0.132328 51.515631,-0.140485 51.519181", "From Soho Square , Soho to Foley Street, Fitzrovia"
"LINESTRING (-0.13011 51.513527,-0.140485 51.519181", "From Moor Street, Soho to Foley Street, Fitzrovia"
"LINESTRING (-0.147203 51.515308,-0.140485 51.519181", "From Chapel Place, Marylebone to Foley Street, Fitzrovia"
"LINESTRING (-0.124749 51.509462,-0.140485 51.519181", "From William IV Street, Strand to Foley Street, Fitzrovia"
"LINESTRING (-0.092921 51.494436,-0.140485 51.519181", "From New Kent Road, The Borough to Foley Street, Fitzrovia"
"LINESTRING (-0.137043 51.511897,-0.140485 51.519181", "From Golden Square, Soho to Foley Street, Fitzrovia"
"LINESTRING (-0.144083 51.525595,-0.140485 51.519181", "From Longford Street, The Regent's Park to Foley Street, Fitzrovia"
"LINESTRING (-0.13011 51.513527,-0.140485 51.519181", "From Moor Street, Soho to Foley Street, Fitzrovia"
"LINESTRING (-0.17677 51.530889,-0.17677 51.530889", "From Grove End Road, St. John's Wood to Grove End Road, St. John's Wood"
"LINESTRING (-0.130431 51.52168,-0.17677 51.530889", "From Malet Street, Bloomsbury to Grove End Road, St. John's Wood"
"LINESTRING (-0.165668 51.524561,-0.17677 51.530889", "From Broadley Terrace, Marylebone to Grove End Road, St. John's Wood"
"LINESTRING (-0.193487 51.513735,-0.17677 51.530889", "From Hereford Road, Bayswater to Grove End Road, St. John's Wood"
"LINESTRING (-0.17677 51.530889,-0.17677 51.530889", "From Grove End Road, St. John's Wood to Grove End Road, St. John's Wood"
"LINESTRING (-0.202608 51.51632,-0.17677 51.530889", "From All Saints Church, Portobello to Grove End Road, St. John's Wood"
"LINESTRING (-0.154907 51.522481,-0.138072 51.517344", "From Westminster University, Marylebone to Wells Street, Fitzrovia"
"LINESTRING (-0.075885 51.536585,-0.138072 51.517344", "From Dunston Road , Haggerston to Wells Street, Fitzrovia"
"LINESTRING (-0.138072 51.517344,-0.138072 51.517344", "From Wells Street, Fitzrovia to Wells Street, Fitzrovia"
"LINESTRING (-0.13214 51.519572,-0.138072 51.517344", "From Store Street, Bloomsbury to Wells Street, Fitzrovia"
"LINESTRING (-0.047218 51.526041,-0.138072 51.517344", "From Bancroft Road, Bethnal Green to Wells Street, Fitzrovia"
"LINESTRING (-0.13151 51.509639,-0.138072 51.517344", "From Panton Street, West End to Wells Street, Fitzrovia"
"LINESTRING (-0.143613 51.523518,-0.138072 51.517344", "From Bolsover Street, Fitzrovia to Wells Street, Fitzrovia"
"LINESTRING (-0.157436 51.512276,-0.138072 51.517344", "From Green Street, Mayfair to Wells Street, Fitzrovia"
"LINESTRING (-0.157436 51.512276,-0.138072 51.517344", "From Green Street, Mayfair to Wells Street, Fitzrovia"
"LINESTRING (-0.157436 51.512276,-0.138072 51.517344", "From Green Street, Mayfair to Wells Street, Fitzrovia"
"LINESTRING (-0.157436 51.512276,-0.138072 51.517344", "From Green Street, Mayfair to Wells Street, Fitzrovia"
"LINESTRING (-0.075885 51.536585,-0.138072 51.517344", "From Dunston Road , Haggerston to Wells Street, Fitzrovia"
"LINESTRING (-0.08249 51.53558,-0.138072 51.517344", "From Pitfield Street North,Hoxton to Wells Street, Fitzrovia"
"LINESTRING (-0.157436 51.512276,-0.138072 51.517344", "From Green Street, Mayfair to Wells Street, Fitzrovia"
"LINESTRING (-0.138072 51.517344,-0.138072 51.517344", "From Wells Street, Fitzrovia to Wells Street, Fitzrovia"
"LINESTRING (-0.144466 51.528302,-0.138072 51.517344", "From Albany Street, The Regent's Park to Wells Street, Fitzrovia"
"LINESTRING (-0.158264 51.514577,-0.138072 51.517344", "From Old Quebec Street, Marylebone to Wells Street, Fitzrovia"
"LINESTRING (-0.117661 51.482678,-0.083159 51.500889", "From Ashmole Estate, Oval to Tyers Gate, Bermondsey"
"LINESTRING (-0.083159 51.500889,-0.083159 51.500889", "From Tyers Gate, Bermondsey to Tyers Gate, Bermondsey"
"LINESTRING (-0.117661 51.482678,-0.083159 51.500889", "From Ashmole Estate, Oval to Tyers Gate, Bermondsey"
"LINESTRING (-0.101536 51.49217,-0.083159 51.500889", "From Hampton Street, Walworth to Tyers Gate, Bermondsey"
"LINESTRING (-0.057159 51.511088,-0.083159 51.500889", "From Shadwell Station, Shadwell to Tyers Gate, Bermondsey"
"LINESTRING (-0.117661 51.482678,-0.083159 51.500889", "From Ashmole Estate, Oval to Tyers Gate, Bermondsey"
"LINESTRING (-0.091773 51.504627,-0.083159 51.500889", "From Hop Exchange, The Borough to Tyers Gate, Bermondsey"
"LINESTRING (-0.145211 51.520715,-0.153463 51.525367", "From Portland Place, Marylebone to The Tennis Courts, The Regent's Park"
"LINESTRING (-0.172528 51.533043,-0.153463 51.525367", "From Wellington Road, St. John's Wood to The Tennis Courts, The Regent's Park"
"LINESTRING (-0.163609 51.51809,-0.14296 51.497998", "From Shouldham Street, Marylebone to Warwick Row, Westminster"
"LINESTRING (-0.141423 51.514499,-0.14296 51.497998", "From Little Argyll Street, West End to Warwick Row, Westminster"
"LINESTRING (-0.111257 51.514274,-0.14296 51.497998", "From Chancery Lane, Holborn to Warwick Row, Westminster"
"LINESTRING (-0.1844 51.502042,-0.14296 51.497998", "From Palace Gate, Kensington Gardens to Warwick Row, Westminster"
"LINESTRING (-0.1844 51.502042,-0.14296 51.497998", "From Palace Gate, Kensington Gardens to Warwick Row, Westminster"
"LINESTRING (-0.1844 51.502042,-0.14296 51.497998", "From Palace Gate, Kensington Gardens to Warwick Row, Westminster"
"LINESTRING (-0.1844 51.502042,-0.14296 51.497998", "From Palace Gate, Kensington Gardens to Warwick Row, Westminster"
"LINESTRING (-0.134621 51.507424,-0.14296 51.497998", "From St. James's Square, St. James's to Warwick Row, Westminster"
"LINESTRING (-0.141423 51.514499,-0.14296 51.497998", "From Little Argyll Street, West End to Warwick Row, Westminster"
"LINESTRING (-0.08066 51.514225,-0.093913 51.496791", "From St. Mary Axe, Aldgate to Dickens Square, Borough"
"LINESTRING (-0.13011 51.513527,-0.093913 51.496791", "From Moor Street, Soho to Dickens Square, Borough"
"LINESTRING (-0.13011 51.513527,-0.093913 51.496791", "From Moor Street, Soho to Dickens Square, Borough"
"LINESTRING (-0.081608 51.497855,-0.093913 51.496791", "From Bermondsey Street, Bermondsey to Dickens Square, Borough"
"LINESTRING (-0.091773 51.504627,-0.093913 51.496791", "From Hop Exchange, The Borough to Dickens Square, Borough"
"LINESTRING (-0.119643 51.511756,-0.093913 51.496791", "From Wellington Street , Strand to Dickens Square, Borough"
"LINESTRING (-0.093051 51.511246,-0.138846 51.510048", "From Queen Street 2, Bank to Sackville Street, Mayfair"
"LINESTRING (-0.097122 51.529423,-0.138846 51.510048", "From Macclesfield Rd, St Lukes to Sackville Street, Mayfair"
"LINESTRING (-0.141334 51.492345,-0.138846 51.510048", "From Guildhouse Street, Victoria to Sackville Street, Mayfair"
"LINESTRING (-0.134407 51.526236,-0.138846 51.510048", "From Euston Road, Euston to Sackville Street, Mayfair"
"LINESTRING (-0.158249 51.516892,-0.138846 51.510048", "From George Place Mews, Marylebone to Sackville Street, Mayfair"
"LINESTRING (-0.127854 51.517727,-0.138846 51.510048", "From Great Russell Street, Bloomsbury to Sackville Street, Mayfair"
"LINESTRING (-0.128585 51.516118,-0.138846 51.510048", "From Earnshaw Street , Covent Garden to Sackville Street, Mayfair"
"LINESTRING (-0.133972 51.472993,-0.138846 51.510048", "From Union Grove, Wandsworth Road to Sackville Street, Mayfair"
"LINESTRING (-0.140485 51.519181,-0.138846 51.510048", "From Foley Street, Fitzrovia to Sackville Street, Mayfair"
"LINESTRING (-0.176268 51.524826,-0.138846 51.510048", "From Aberdeen Place, St. John's Wood to Sackville Street, Mayfair"
"LINESTRING (-0.158105 51.494645,-0.138846 51.510048", "From Cadogan Place, Knightsbridge to Sackville Street, Mayfair"
"LINESTRING (-0.09885 51.515418,-0.138846 51.510048", "From Newgate Street , St. Paul's to Sackville Street, Mayfair"
"LINESTRING (-0.079201 51.537277,-0.088542 51.527025", "From Hertford Road, De Beauvoir Town to Baldwin Street, St. Luke's"
"LINESTRING (-0.079201 51.537277,-0.088542 51.527025", "From Hertford Road, De Beauvoir Town to Baldwin Street, St. Luke's"
"LINESTRING (-0.079201 51.537277,-0.088542 51.527025", "From Hertford Road, De Beauvoir Town to Baldwin Street, St. Luke's"
"LINESTRING (-0.079201 51.537277,-0.088542 51.527025", "From Hertford Road, De Beauvoir Town to Baldwin Street, St. Luke's"
"LINESTRING (-0.102757 51.536384,-0.088542 51.527025", "From Islington Green, Angel to Baldwin Street, St. Luke's"
"LINESTRING (-0.079201 51.537277,-0.088542 51.527025", "From Hertford Road, De Beauvoir Town to Baldwin Street, St. Luke's"
"LINESTRING (-0.079201 51.537277,-0.088542 51.527025", "From Hertford Road, De Beauvoir Town to Baldwin Street, St. Luke's"
"LINESTRING (-0.129925 51.493072,-0.139956 51.493573", "From Vincent Street, Pimlico to Queen Mother Sports Centre, Victoria"
"LINESTRING (-0.111435 51.48894,-0.139956 51.493573", "From Kennington Cross, Kennington to Queen Mother Sports Centre, Victoria"
"LINESTRING (-0.121394 51.493699,-0.139956 51.493573", "From Fire Brigade Pier, Vauxhall to Queen Mother Sports Centre, Victoria"
"LINESTRING (-0.149004 51.485821,-0.139956 51.493573", "From Chelsea Bridge, Pimlico to Queen Mother Sports Centre, Victoria"
"LINESTRING (-0.129925 51.493072,-0.139956 51.493573", "From Vincent Street, Pimlico to Queen Mother Sports Centre, Victoria"
"LINESTRING (-0.139221 51.461388,-0.139956 51.493573", "From Clapham Common Station, Clapham Common to Queen Mother Sports Centre, Victoria"
"LINESTRING (-0.135478 51.495827,-0.139956 51.493573", "From Rochester Row, Westminster to Queen Mother Sports Centre, Victoria"
"LINESTRING (-0.131773 51.506633,-0.139956 51.493573", "From Waterloo Place, St. James's to Queen Mother Sports Centre, Victoria"
"LINESTRING (-0.137424 51.498865,-0.139956 51.493573", "From Buckingham Gate, Westminster to Queen Mother Sports Centre, Victoria"
"LINESTRING (-0.149186 51.490491,-0.139956 51.493573", "From Ebury Bridge, Pimlico to Queen Mother Sports Centre, Victoria"
"LINESTRING (-0.131773 51.506633,-0.139956 51.493573", "From Waterloo Place, St. James's to Queen Mother Sports Centre, Victoria"
"LINESTRING (-0.129361 51.488365,-0.139956 51.493573", "From Vauxhall Bridge , Pimlico to Queen Mother Sports Centre, Victoria"
"LINESTRING (-0.121394 51.493699,-0.139956 51.493573", "From Fire Brigade Pier, Vauxhall to Queen Mother Sports Centre, Victoria"
"LINESTRING (-0.129925 51.493072,-0.139956 51.493573", "From Vincent Street, Pimlico to Queen Mother Sports Centre, Victoria"
"LINESTRING (-0.121394 51.493699,-0.139956 51.493573", "From Fire Brigade Pier, Vauxhall to Queen Mother Sports Centre, Victoria"
"LINESTRING (-0.140741 51.488057,-0.139956 51.493573", "From Alderney Street, Pimlico to Queen Mother Sports Centre, Victoria"
"LINESTRING (-0.140947 51.49616,-0.139956 51.493573", "From Ashley Place, Victoria to Queen Mother Sports Centre, Victoria"
"LINESTRING (-0.127554 51.493978,-0.139956 51.493573", "From Page Street, Westminster to Queen Mother Sports Centre, Victoria"
"LINESTRING (-0.101536 51.49217,-0.081608 51.497855", "From Hampton Street, Walworth to Bermondsey Street, Bermondsey"
"LINESTRING (-0.026262 51.536039,-0.081608 51.497855", "From Wendon Street, Old Ford to Bermondsey Street, Bermondsey"
"LINESTRING (-0.102996 51.486929,-0.081608 51.497855", "From Doddington Grove, Kennington to Bermondsey Street, Bermondsey"
"LINESTRING (-0.08066 51.514225,-0.081608 51.497855", "From St. Mary Axe, Aldgate to Bermondsey Street, Bermondsey"
"LINESTRING (-0.09644 51.507385,-0.081608 51.497855", "From New Globe Walk, Bankside to Bermondsey Street, Bermondsey"
"LINESTRING (-0.081608 51.497855,-0.081608 51.497855", "From Bermondsey Street, Bermondsey to Bermondsey Street, Bermondsey"
"LINESTRING (-0.019355 51.496137,-0.081608 51.497855", "From Millharbour, Millwall to Bermondsey Street, Bermondsey"
"LINESTRING (-0.081608 51.497855,-0.081608 51.497855", "From Bermondsey Street, Bermondsey to Bermondsey Street, Bermondsey"
"LINESTRING (-0.091773 51.504627,-0.081608 51.497855", "From Hop Exchange, The Borough to Bermondsey Street, Bermondsey"
"LINESTRING (-0.103137 51.506692,-0.081608 51.497855", "From Poured Lines, Bankside to Bermondsey Street, Bermondsey"
"LINESTRING (-0.081608 51.497855,-0.081608 51.497855", "From Bermondsey Street, Bermondsey to Bermondsey Street, Bermondsey"
"LINESTRING (-0.093913 51.496791,-0.081608 51.497855", "From Dickens Square, Borough to Bermondsey Street, Bermondsey"
"LINESTRING (-0.117122 51.490994,-0.081608 51.497855", "From Black Prince Road, Vauxhall to Bermondsey Street, Bermondsey"
"LINESTRING (-0.096496 51.517821,-0.081608 51.497855", "From Museum of London, Barbican to Bermondsey Street, Bermondsey"
"LINESTRING (-0.025996 51.509303,-0.081608 51.497855", "From Westferry DLR, Limehouse to Bermondsey Street, Bermondsey"
"LINESTRING (-0.07962 51.503493,-0.081608 51.497855", "From Tooley Street, Bermondsey to Bermondsey Street, Bermondsey"
"LINESTRING (-0.103137 51.506692,-0.081608 51.497855", "From Poured Lines, Bankside to Bermondsey Street, Bermondsey"
"LINESTRING (-0.10527 51.515809,-0.081608 51.497855", "From Stonecutter Street, Holborn to Bermondsey Street, Bermondsey"
"LINESTRING (-0.074189 51.502279,-0.081608 51.497855", "From Curlew Street, Shad Thames to Bermondsey Street, Bermondsey"
"LINESTRING (-0.09644 51.507385,-0.081608 51.497855", "From New Globe Walk, Bankside to Bermondsey Street, Bermondsey"
"LINESTRING (-0.07962 51.503493,-0.081608 51.497855", "From Tooley Street, Bermondsey to Bermondsey Street, Bermondsey"
"LINESTRING (-0.093913 51.496791,-0.081608 51.497855", "From Dickens Square, Borough to Bermondsey Street, Bermondsey"
"LINESTRING (-0.109256 51.526443,-0.081608 51.497855", "From Tysoe Street, Clerkenwell to Bermondsey Street, Bermondsey"
"LINESTRING (-0.103137 51.506692,-0.081608 51.497855", "From Poured Lines, Bankside to Bermondsey Street, Bermondsey"
"LINESTRING (-0.089887 51.520858,-0.081608 51.497855", "From Bunhill Row, Moorgate to Bermondsey Street, Bermondsey"
"LINESTRING (-0.019355 51.496137,-0.081608 51.497855", "From Millharbour, Millwall to Bermondsey Street, Bermondsey"
"LINESTRING (-0.062546 51.535678,-0.073955 51.526293", "From Regent's Row , Haggerston to Palissy Street, Shoreditch"
"LINESTRING (-0.09734 51.520841,-0.073955 51.526293", "From Aldersgate Street, Barbican to Palissy Street, Shoreditch"
"LINESTRING (-0.062546 51.535678,-0.073955 51.526293", "From Regent's Row , Haggerston to Palissy Street, Shoreditch"
"LINESTRING (-0.09734 51.520841,-0.073955 51.526293", "From Aldersgate Street, Barbican to Palissy Street, Shoreditch"
"LINESTRING (-0.08299 51.53213,-0.073955 51.526293", "From Pitfield Street Central, Hoxton to Palissy Street, Shoreditch"
"LINESTRING (-0.058005 51.527152,-0.073955 51.526293", "From Pott Street, Bethnal Green to Palissy Street, Shoreditch"
"LINESTRING (-0.075885 51.536585,-0.073955 51.526293", "From Dunston Road , Haggerston to Palissy Street, Shoreditch"
"LINESTRING (-0.054162 51.536424,-0.073955 51.526293", "From Victoria Park Road, Hackney Central to Palissy Street, Shoreditch"
