"LINESTRING (-0.087587 51.514441,-0.066035 51.531864", "From Bank of England Museum, Bank to Goldsmith's Row, Haggerston"
"LINESTRING (-0.106992 51.534504,-0.066035 51.531864", "From Liverpool Road (N1 Centre), Angel to Goldsmith's Row, Haggerston"
"LINESTRING (-0.06142 51.532091,-0.066035 51.531864", "From Pritchard's Road, Bethnal Green to Goldsmith's Row, Haggerston"
"LINESTRING (-0.066035 51.531864,-0.066035 51.531864", "From Goldsmith's Row, Haggerston to Goldsmith's Row, Haggerston"
"LINESTRING (-0.062546 51.535678,-0.066035 51.531864", "From Regent's Row , Haggerston to Goldsmith's Row, Haggerston"
"LINESTRING (-0.11655 51.51824,-0.066035 51.531864", "From Red Lion Street, Holborn to Goldsmith's Row, Haggerston"
"LINESTRING (-0.075885 51.536585,-0.066035 51.531864", "From Dunston Road , Haggerston to Goldsmith's Row, Haggerston"
"LINESTRING (-0.07813 51.526377,-0.066035 51.531864", "From Shoreditch High Street, Shoreditch to Goldsmith's Row, Haggerston"
"LINESTRING (-0.075885 51.536585,-0.066035 51.531864", "From Dunston Road , Haggerston to Goldsmith's Row, Haggerston"
"LINESTRING (-0.07813 51.526377,-0.066035 51.531864", "From Shoreditch High Street, Shoreditch to Goldsmith's Row, Haggerston"
"LINESTRING (-0.11655 51.51824,-0.066035 51.531864", "From Red Lion Street, Holborn to Goldsmith's Row, Haggerston"
"LINESTRING (-0.11655 51.51824,-0.066035 51.531864", "From Red Lion Street, Holborn to Goldsmith's Row, Haggerston"
"LINESTRING (-0.069743 51.528222,-0.066035 51.531864", "From Wellington Row, Bethnal Green to Goldsmith's Row, Haggerston"
"LINESTRING (-0.055894 51.528936,-0.066035 51.531864", "From York Hall, Bethnal Green to Goldsmith's Row, Haggerston"
"LINESTRING (-0.055894 51.528936,-0.066035 51.531864", "From York Hall, Bethnal Green to Goldsmith's Row, Haggerston"
"LINESTRING (-0.079201 51.537277,-0.066035 51.531864", "From Hertford Road, De Beauvoir Town to Goldsmith's Row, Haggerston"
"LINESTRING (-0.055894 51.528936,-0.066035 51.531864", "From York Hall, Bethnal Green to Goldsmith's Row, Haggerston"
"LINESTRING (-0.106992 51.534504,-0.066035 51.531864", "From Liverpool Road (N1 Centre), Angel to Goldsmith's Row, Haggerston"
"LINESTRING (-0.122502 51.523951,-0.147154 51.537349", "From Brunswick Square, Bloomsbury to Gloucester Avenue, Camden Town"
"LINESTRING (-0.119123 51.519435,-0.147154 51.537349", "From Red Lion Square, Holborn to Gloucester Avenue, Camden Town"
"LINESTRING (-0.171103 51.518268,-0.147154 51.537349", "From St Mary's Hospital, Paddington to Gloucester Avenue, Camden Town"
"LINESTRING (-0.119123 51.519435,-0.147154 51.537349", "From Red Lion Square, Holborn to Gloucester Avenue, Camden Town"
"LINESTRING (-0.157183 51.52026,-0.147154 51.537349", "From Crawford Street, Marylebone to Gloucester Avenue, Camden Town"
"LINESTRING (-0.157183 51.52026,-0.147154 51.537349", "From Crawford Street, Marylebone to Gloucester Avenue, Camden Town"
"LINESTRING (-0.147154 51.537349,-0.147154 51.537349", "From Gloucester Avenue, Camden Town to Gloucester Avenue, Camden Town"
"LINESTRING (-0.147154 51.537349,-0.147154 51.537349", "From Gloucester Avenue, Camden Town to Gloucester Avenue, Camden Town"
"LINESTRING (-0.157183 51.52026,-0.147154 51.537349", "From Crawford Street, Marylebone to Gloucester Avenue, Camden Town"
"LINESTRING (-0.147154 51.537349,-0.147154 51.537349", "From Gloucester Avenue, Camden Town to Gloucester Avenue, Camden Town"
"LINESTRING (-0.122502 51.523951,-0.147154 51.537349", "From Brunswick Square, Bloomsbury to Gloucester Avenue, Camden Town"
"LINESTRING (-0.147154 51.537349,-0.147154 51.537349", "From Gloucester Avenue, Camden Town to Gloucester Avenue, Camden Town"
"LINESTRING (-0.09885 51.515418,-0.06992 51.53385", "From Newgate Street , St. Paul's to Queensbridge Road, Haggerston"
"LINESTRING (-0.06992 51.53385,-0.06992 51.53385", "From Queensbridge Road, Haggerston to Queensbridge Road, Haggerston"
"LINESTRING (-0.086379 51.534042,-0.06992 51.53385", "From Shoreditch Park, Hoxton to Queensbridge Road, Haggerston"
"LINESTRING (-0.06142 51.532091,-0.06992 51.53385", "From Pritchard's Road, Bethnal Green to Queensbridge Road, Haggerston"
"LINESTRING (-0.036017 51.525941,-0.06992 51.53385", "From Clinton Road, Mile End to Queensbridge Road, Haggerston"
"LINESTRING (-0.062546 51.535678,-0.06992 51.53385", "From Regent's Row , Haggerston to Queensbridge Road, Haggerston"
"LINESTRING (-0.036017 51.525941,-0.06992 51.53385", "From Clinton Road, Mile End to Queensbridge Road, Haggerston"
"LINESTRING (-0.062546 51.535678,-0.06992 51.53385", "From Regent's Row , Haggerston to Queensbridge Road, Haggerston"
"LINESTRING (-0.075901 51.531091,-0.06992 51.53385", "From Hoxton Station, Hoxton to Queensbridge Road, Haggerston"
"LINESTRING (-0.075901 51.531091,-0.06992 51.53385", "From Hoxton Station, Hoxton to Queensbridge Road, Haggerston"
"LINESTRING (-0.062546 51.535678,-0.067937 51.51793", "From Regent's Row , Haggerston to Old Montague Street, Whitechapel"
"LINESTRING (-0.053558 51.511066,-0.067937 51.51793", "From Sutton Street, Shadwell to Old Montague Street, Whitechapel"
"LINESTRING (-0.065006 51.508622,-0.067937 51.51793", "From Pennington Street, Wapping to Old Montague Street, Whitechapel"
"LINESTRING (-0.043371 51.518369,-0.067937 51.51793", "From Rectory Square, Stepney to Old Montague Street, Whitechapel"
"LINESTRING (-0.082422 51.516154,-0.067937 51.51793", "From Wormwood Street, Liverpool Street to Old Montague Street, Whitechapel"
"LINESTRING (-0.079248 51.524526,-0.067937 51.51793", "From New Inn Yard, Shoreditch to Old Montague Street, Whitechapel"
"LINESTRING (-0.062546 51.535678,-0.067937 51.51793", "From Regent's Row , Haggerston to Old Montague Street, Whitechapel"
"LINESTRING (-0.079249 51.518908,-0.067937 51.51793", "From Brushfield Street, Liverpool Street to Old Montague Street, Whitechapel"
"LINESTRING (-0.075855 51.517475,-0.067937 51.51793", "From Bell Lane, Liverpool Street to Old Montague Street, Whitechapel"
"LINESTRING (-0.053558 51.511066,-0.067937 51.51793", "From Sutton Street, Shadwell to Old Montague Street, Whitechapel"
"LINESTRING (-0.075375 51.528187,-0.067937 51.51793", "From Columbia Road, Shoreditch to Old Montague Street, Whitechapel"
"LINESTRING (-0.021345 51.519265,-0.067937 51.51793", "From Furze Green, Bow to Old Montague Street, Whitechapel"
"LINESTRING (-0.110699 51.501444,-0.067937 51.51793", "From Baylis Road, Waterloo to Old Montague Street, Whitechapel"
"LINESTRING (-0.08066 51.514225,-0.067937 51.51793", "From St. Mary Axe, Aldgate to Old Montague Street, Whitechapel"
"LINESTRING (-0.043371 51.518369,-0.067937 51.51793", "From Rectory Square, Stepney to Old Montague Street, Whitechapel"
"LINESTRING (-0.074754 51.523648,-0.067937 51.51793", "From Bethnal Green Road, Shoreditch to Old Montague Street, Whitechapel"
"LINESTRING (-0.07813 51.526377,-0.067937 51.51793", "From Shoreditch High Street, Shoreditch to Old Montague Street, Whitechapel"
"LINESTRING (-0.08066 51.514225,-0.067937 51.51793", "From St. Mary Axe, Aldgate to Old Montague Street, Whitechapel"
"LINESTRING (-0.084439 51.524696,-0.067937 51.51793", "From Leonard Circus , Shoreditch to Old Montague Street, Whitechapel"
"LINESTRING (-0.034903 51.518541,-0.067937 51.51793", "From Mile End Stadium, Mile End to Old Montague Street, Whitechapel"
"LINESTRING (-0.020068 51.50357,-0.00699 51.508981", "From Jubilee Plaza, Canary Wharf to Naval Row, Blackwall"
"LINESTRING (-0.074754 51.523648,-0.00699 51.508981", "From Bethnal Green Road, Shoreditch to Naval Row, Blackwall"
"LINESTRING (-0.08497 51.50964,-0.00699 51.508981", "From Monument Street, Monument to Naval Row, Blackwall"
"LINESTRING (-0.109006 51.521661,-0.075901 51.531091", "From Hatton Wall, Holborn to Hoxton Station, Hoxton"
"LINESTRING (-0.123509 51.52625,-0.075901 51.531091", "From Tavistock Place, Bloomsbury to Hoxton Station, Hoxton"
"LINESTRING (-0.06142 51.532091,-0.075901 51.531091", "From Pritchard's Road, Bethnal Green to Hoxton Station, Hoxton"
"LINESTRING (-0.093903 51.530991,-0.075901 51.531091", "From Wenlock Road , Hoxton to Hoxton Station, Hoxton"
"LINESTRING (-0.07813 51.526377,-0.075901 51.531091", "From Shoreditch High Street, Shoreditch to Hoxton Station, Hoxton"
"LINESTRING (-0.123509 51.52625,-0.075901 51.531091", "From Tavistock Place, Bloomsbury to Hoxton Station, Hoxton"
"LINESTRING (-0.075901 51.531091,-0.075901 51.531091", "From Hoxton Station, Hoxton to Hoxton Station, Hoxton"
"LINESTRING (-0.06142 51.532091,-0.075901 51.531091", "From Pritchard's Road, Bethnal Green to Hoxton Station, Hoxton"
"LINESTRING (-0.075901 51.531091,-0.075901 51.531091", "From Hoxton Station, Hoxton to Hoxton Station, Hoxton"
"LINESTRING (-0.07813 51.526377,-0.075901 51.531091", "From Shoreditch High Street, Shoreditch to Hoxton Station, Hoxton"
"LINESTRING (-0.155525 51.516204,-0.144466 51.528302", "From Portman Square, Marylebone to Albany Street, The Regent's Park"
"LINESTRING (-0.137694 51.514667,-0.144466 51.528302", "From Great Marlborough St, Soho to Albany Street, The Regent's Park"
"LINESTRING (-0.138231 51.525542,-0.144466 51.528302", "From Hampstead Road, Euston to Albany Street, The Regent's Park"
"LINESTRING (-0.135777 51.51953,-0.144466 51.528302", "From Charlotte Street, Fitzrovia to Albany Street, The Regent's Park"
"LINESTRING (-0.139258 51.533403,-0.144466 51.528302", "From Harrington Square 2, Camden Town to Albany Street, The Regent's Park"
"LINESTRING (-0.138019 51.524438,-0.144466 51.528302", "From Warren Street Station, Euston to Albany Street, The Regent's Park"
"LINESTRING (-0.156285 51.535836,-0.144466 51.528302", "From London Zoo,  The Regent's Park to Albany Street, The Regent's Park"
"LINESTRING (-0.164393 51.516517,-0.144466 51.528302", "From Nutford Place, Marylebone to Albany Street, The Regent's Park"
"LINESTRING (-0.135777 51.51953,-0.144466 51.528302", "From Charlotte Street, Fitzrovia to Albany Street, The Regent's Park"
"LINESTRING (-0.11548 51.528915,-0.142844 51.506613", "From Great Percy Street, Clerkenwell to Green Park Station, Mayfair"
"LINESTRING (-0.209378 51.489591,-0.142844 51.506613", "From Vereker Road, West Kensington to Green Park Station, Mayfair"
"LINESTRING (-0.194757 51.493343,-0.142844 51.506613", "From Nevern Place, Earl's Court to Green Park Station, Mayfair"
"LINESTRING (-0.092921 51.494436,-0.142844 51.506613", "From New Kent Road, The Borough to Green Park Station, Mayfair"
"LINESTRING (-0.11548 51.528915,-0.142844 51.506613", "From Great Percy Street, Clerkenwell to Green Park Station, Mayfair"
"LINESTRING (-0.183289 51.496462,-0.142844 51.506613", "From Gloucester Road (Central), South Kensington to Green Park Station, Mayfair"
"LINESTRING (-0.091773 51.504627,-0.142844 51.506613", "From Hop Exchange, The Borough to Green Park Station, Mayfair"
"LINESTRING (-0.206029 51.49087,-0.142844 51.506613", "From West Kensington Station, West Kensington to Green Park Station, Mayfair"
"LINESTRING (-0.179369 51.487196,-0.142844 51.506613", "From Drayton Gardens, West Chelsea to Green Park Station, Mayfair"
"LINESTRING (-0.162298 51.522511,-0.142844 51.506613", "From Boston Place, Marylebone to Green Park Station, Mayfair"
"LINESTRING (-0.124749 51.509462,-0.142844 51.506613", "From William IV Street, Strand to Green Park Station, Mayfair"
"LINESTRING (-0.139956 51.493573,-0.142844 51.506613", "From Queen Mother Sports Centre, Victoria to Green Park Station, Mayfair"
"LINESTRING (-0.091773 51.504627,-0.142844 51.506613", "From Hop Exchange, The Borough to Green Park Station, Mayfair"
"LINESTRING (-0.183289 51.496462,-0.142844 51.506613", "From Gloucester Road (Central), South Kensington to Green Park Station, Mayfair"
"LINESTRING (-0.091773 51.504627,-0.142844 51.506613", "From Hop Exchange, The Borough to Green Park Station, Mayfair"
"LINESTRING (-0.18267 51.494185,-0.142844 51.506613", "From Gloucester Road Station, South Kensington to Green Park Station, Mayfair"
"LINESTRING (-0.091773 51.504627,-0.142844 51.506613", "From Hop Exchange, The Borough to Green Park Station, Mayfair"
"LINESTRING (-0.091773 51.504627,-0.142844 51.506613", "From Hop Exchange, The Borough to Green Park Station, Mayfair"
"LINESTRING (-0.136928 51.493985,-0.142844 51.506613", "From Vincent Square, Westminster to Green Park Station, Mayfair"
"LINESTRING (-0.056667 51.511542,-0.033828 51.514115", "From Watney Street, Shadwell to Salmon Lane, Limehouse"
"LINESTRING (-0.036017 51.525941,-0.033828 51.514115", "From Clinton Road, Mile End to Salmon Lane, Limehouse"
"LINESTRING (-0.038986 51.512871,-0.033828 51.514115", "From Flamborough Street, Limehouse to Salmon Lane, Limehouse"
"LINESTRING (-0.100791 51.518218,-0.033828 51.514115", "From West Smithfield Rotunda, Farringdon to Salmon Lane, Limehouse"
"LINESTRING (-0.202608 51.51632,-0.204666 51.509591", "From All Saints Church, Portobello to Lansdowne Walk, Ladbroke Grove"
"LINESTRING (-0.096317 51.526008,-0.102208 51.526153", "From Finsbury Leisure Centre, St. Luke's to Percival Street, Finsbury"
"LINESTRING (-0.113001 51.50486,-0.102208 51.526153", "From Waterloo Road, South Bank to Percival Street, Finsbury"
"LINESTRING (-0.089887 51.520858,-0.102208 51.526153", "From Bunhill Row, Moorgate to Percival Street, Finsbury"
"LINESTRING (-0.089887 51.520858,-0.102208 51.526153", "From Bunhill Row, Moorgate to Percival Street, Finsbury"
"LINESTRING (-0.062546 51.535678,-0.102208 51.526153", "From Regent's Row , Haggerston to Percival Street, Finsbury"
"LINESTRING (-0.13214 51.519572,-0.102208 51.526153", "From Store Street, Bloomsbury to Percival Street, Finsbury"
"LINESTRING (-0.133201 51.512515,-0.102208 51.526153", "From Wardour Street, Soho to Percival Street, Finsbury"
"LINESTRING (-0.100168 51.530344,-0.102208 51.526153", "From City Road, Angel to Percival Street, Finsbury"
"LINESTRING (-0.13214 51.519572,-0.102208 51.526153", "From Store Street, Bloomsbury to Percival Street, Finsbury"
"LINESTRING (-0.109256 51.526443,-0.102208 51.526153", "From Tysoe Street, Clerkenwell to Percival Street, Finsbury"
"LINESTRING (-0.116191 51.535467,-0.145246 51.539957", "From Carnegie Street, King's Cross to Arlington Road, Camden Town"
"LINESTRING (-0.116191 51.535467,-0.145246 51.539957", "From Carnegie Street, King's Cross to Arlington Road, Camden Town"
"LINESTRING (-0.128377 51.523673,-0.145246 51.539957", "From Bedford Way, Bloomsbury to Arlington Road, Camden Town"
"LINESTRING (-0.136792 51.533005,-0.145246 51.539957", "From Eversholt Street , Camden Town to Arlington Road, Camden Town"
"LINESTRING (-0.116191 51.535467,-0.145246 51.539957", "From Carnegie Street, King's Cross to Arlington Road, Camden Town"
"LINESTRING (-0.17219 51.526448,-0.145246 51.539957", "From Lisson Grove, St. John's Wood to Arlington Road, Camden Town"
"LINESTRING (-0.09885 51.515418,-0.145246 51.539957", "From Newgate Street , St. Paul's to Arlington Road, Camden Town"
"LINESTRING (-0.100186 51.505817,-0.145246 51.539957", "From Bankside Mix, Bankside to Arlington Road, Camden Town"
"LINESTRING (-0.069543 51.525645,-0.107987 51.517428", "From Granby Street, Shoreditch to New Fetter Lane, Holborn"
"LINESTRING (-0.109006 51.521661,-0.107987 51.517428", "From Hatton Wall, Holborn to New Fetter Lane, Holborn"
"LINESTRING (-0.069543 51.525645,-0.107987 51.517428", "From Granby Street, Shoreditch to New Fetter Lane, Holborn"
"LINESTRING (-0.007542 51.493381,-0.002275 51.509474", "From Jubilee Crescent, Cubitt Town to East India DLR, Blackwall"
"LINESTRING (-0.01646 51.505772,-0.002275 51.509474", "From Import Dock, Canary Wharf to East India DLR, Blackwall"
"LINESTRING (-0.025996 51.509303,-0.002275 51.509474", "From Westferry DLR, Limehouse to East India DLR, Blackwall"
"LINESTRING (-0.136123 51.482362,-0.002275 51.509474", "From Riverlight North, Nine Elms to East India DLR, Blackwall"
"LINESTRING (-0.136123 51.482362,-0.002275 51.509474", "From Riverlight North, Nine Elms to East India DLR, Blackwall"
"LINESTRING (-0.025296 51.527058,-0.002275 51.509474", "From Bow Road Station, Bow to East India DLR, Blackwall"
"LINESTRING (-0.025996 51.509303,-0.002275 51.509474", "From Westferry DLR, Limehouse to East India DLR, Blackwall"
"LINESTRING (-0.025296 51.527058,-0.002275 51.509474", "From Bow Road Station, Bow to East India DLR, Blackwall"
"LINESTRING (-0.136123 51.482362,-0.002275 51.509474", "From Riverlight North, Nine Elms to East India DLR, Blackwall"
"LINESTRING (-0.110889 51.495718,-0.107913 51.498386", "From Kennington Road  , Vauxhall to Westminster Bridge Road, Elephant & Castle"
"LINESTRING (-0.10044 51.498898,-0.107913 51.498386", "From Borough Road, Elephant & Castle to Westminster Bridge Road, Elephant & Castle"
"LINESTRING (-0.10044 51.498898,-0.107913 51.498386", "From Borough Road, Elephant & Castle to Westminster Bridge Road, Elephant & Castle"
"LINESTRING (-0.08974 51.500823,-0.107913 51.498386", "From Empire Square, The Borough to Westminster Bridge Road, Elephant & Castle"
"LINESTRING (-0.117069 51.53136,-0.107913 51.498386", "From Calshot Street , King's Cross to Westminster Bridge Road, Elephant & Castle"
"LINESTRING (-0.104193 51.49605,-0.104193 51.49605", "From Gaywood  Street, Elephant & Castle to Gaywood  Street, Elephant & Castle"
"LINESTRING (-0.015578 51.52512,-0.039264 51.521564", "From Devons Road, Bow to Harford Street, Mile End"
"LINESTRING (-0.039264 51.521564,-0.039264 51.521564", "From Harford Street, Mile End to Harford Street, Mile End"
"LINESTRING (-0.08497 51.50964,-0.039264 51.521564", "From Monument Street, Monument to Harford Street, Mile End"
"LINESTRING (-0.06555 51.528681,-0.039264 51.521564", "From Durant Street, Bethnal Green to Harford Street, Mile End"
"LINESTRING (-0.108028 51.518825,-0.039264 51.521564", "From Hatton Garden, Holborn to Harford Street, Mile End"
"LINESTRING (-0.021345 51.519265,-0.039264 51.521564", "From Furze Green, Bow to Harford Street, Mile End"
"LINESTRING (-0.021345 51.519265,-0.039264 51.521564", "From Furze Green, Bow to Harford Street, Mile End"
"LINESTRING (-0.009001 51.487129,-0.01646 51.505772", "From Saunders Ness Road, Cubitt Town to Import Dock, Canary Wharf"
"LINESTRING (-0.002275 51.509474,-0.01646 51.505772", "From East India DLR, Blackwall to Import Dock, Canary Wharf"
"LINESTRING (-0.009001 51.487129,-0.01646 51.505772", "From Saunders Ness Road, Cubitt Town to Import Dock, Canary Wharf"
"LINESTRING (-0.002275 51.509474,-0.01646 51.505772", "From East India DLR, Blackwall to Import Dock, Canary Wharf"
"LINESTRING (-0.014438 51.5112,-0.01646 51.505772", "From Chrisp Street Market, Poplar to Import Dock, Canary Wharf"
"LINESTRING (-0.055656 51.514222,-0.056667 51.511542", "From Watney Market, Stepney to Watney Street, Shadwell"
"LINESTRING (-0.090847 51.525893,-0.056667 51.511542", "From Bath Street, St. Luke's to Watney Street, Shadwell"
"LINESTRING (-0.020068 51.50357,-0.056667 51.511542", "From Jubilee Plaza, Canary Wharf to Watney Street, Shadwell"
"LINESTRING (-0.047548 51.528869,-0.056667 51.511542", "From Globe Town Market, Bethnal Green to Watney Street, Shadwell"
"LINESTRING (-0.056667 51.511542,-0.056667 51.511542", "From Watney Street, Shadwell to Watney Street, Shadwell"
"LINESTRING (-0.053177 51.515975,-0.056667 51.511542", "From Jubilee Street, Stepney to Watney Street, Shadwell"
"LINESTRING (-0.047784 51.51328,-0.056667 51.511542", "From Albert Gardens, Stepney to Watney Street, Shadwell"
"LINESTRING (-0.058005 51.527152,-0.056667 51.511542", "From Pott Street, Bethnal Green to Watney Street, Shadwell"
"LINESTRING (-0.053177 51.515975,-0.056667 51.511542", "From Jubilee Street, Stepney to Watney Street, Shadwell"
"LINESTRING (-0.06415 51.51295,-0.056667 51.511542", "From Christian Street, Whitechapel to Watney Street, Shadwell"
"LINESTRING (-0.06691 51.507131,-0.056667 51.511542", "From Nesham Street, Wapping to Watney Street, Shadwell"
"LINESTRING (-0.083159 51.500889,-0.056667 51.511542", "From Tyers Gate, Bermondsey to Watney Street, Shadwell"
"LINESTRING (-0.070542 51.505697,-0.056667 51.511542", "From St. Katharine's Way, Tower to Watney Street, Shadwell"
"LINESTRING (-0.056667 51.511542,-0.056667 51.511542", "From Watney Street, Shadwell to Watney Street, Shadwell"
"LINESTRING (-0.073438 51.51838,-0.056667 51.511542", "From Fashion Street, Whitechapel to Watney Street, Shadwell"
"LINESTRING (-0.021582 51.487679,-0.056667 51.511542", "From Napier Avenue, Millwall to Watney Street, Shadwell"
"LINESTRING (-0.056667 51.511542,-0.056667 51.511542", "From Watney Street, Shadwell to Watney Street, Shadwell"
"LINESTRING (-0.056667 51.511542,-0.056667 51.511542", "From Watney Street, Shadwell to Watney Street, Shadwell"
"LINESTRING (-0.020068 51.50357,-0.056667 51.511542", "From Jubilee Plaza, Canary Wharf to Watney Street, Shadwell"
"LINESTRING (-0.053177 51.515975,-0.062546 51.535678", "From Jubilee Street, Stepney to Regent's Row , Haggerston"
"LINESTRING (-0.062546 51.535678,-0.062546 51.535678", "From Regent's Row , Haggerston to Regent's Row , Haggerston"
"LINESTRING (-0.079201 51.537277,-0.062546 51.535678", "From Hertford Road, De Beauvoir Town to Regent's Row , Haggerston"
"LINESTRING (-0.160854 51.535892,-0.062546 51.535678", "From Prince Albert Road, The Regent's Park to Regent's Row , Haggerston"
"LINESTRING (-0.094934 51.522954,-0.062546 51.535678", "From Roscoe Street, St. Luke's to Regent's Row , Haggerston"
"LINESTRING (-0.028941 51.542118,-0.062546 51.535678", "From Cadogan Close, Victoria Park to Regent's Row , Haggerston"
"LINESTRING (-0.043371 51.518369,-0.062546 51.535678", "From Rectory Square, Stepney to Regent's Row , Haggerston"
"LINESTRING (-0.144664 51.538071,-0.062546 51.535678", "From Parkway, Camden Town to Regent's Row , Haggerston"
"LINESTRING (-0.069543 51.525645,-0.062546 51.535678", "From Granby Street, Shoreditch to Regent's Row , Haggerston"
"LINESTRING (-0.144664 51.538071,-0.062546 51.535678", "From Parkway, Camden Town to Regent's Row , Haggerston"
"LINESTRING (-0.054162 51.536424,-0.062546 51.535678", "From Victoria Park Road, Hackney Central to Regent's Row , Haggerston"
"LINESTRING (-0.09315 51.53356,-0.062546 51.535678", "From Eagle Wharf Road, Hoxton to Regent's Row , Haggerston"
"LINESTRING (-0.073955 51.526293,-0.062546 51.535678", "From Palissy Street, Shoreditch to Regent's Row , Haggerston"
"LINESTRING (-0.057544 51.504749,-0.062546 51.535678", "From Wapping Lane, Wapping to Regent's Row , Haggerston"
"LINESTRING (-0.078869 51.521113,-0.062546 51.535678", "From Norton Folgate, Liverpool Street to Regent's Row , Haggerston"
"LINESTRING (-0.029138 51.516196,-0.062546 51.535678", "From Burdett Road, Mile End to Regent's Row , Haggerston"
"LINESTRING (-0.043371 51.518369,-0.062546 51.535678", "From Rectory Square, Stepney to Regent's Row , Haggerston"
"LINESTRING (-0.075901 51.531091,-0.062546 51.535678", "From Hoxton Station, Hoxton to Regent's Row , Haggerston"
"LINESTRING (-0.071653 51.522617,-0.062546 51.535678", "From Brick Lane Market, Shoreditch to Regent's Row , Haggerston"
"LINESTRING (-0.042744 51.530326,-0.062546 51.535678", "From Twig Folly Bridge, Mile End to Regent's Row , Haggerston"
"LINESTRING (-0.07813 51.526377,-0.062546 51.535678", "From Shoreditch High Street, Shoreditch to Regent's Row , Haggerston"
"LINESTRING (-0.102208 51.526153,-0.062546 51.535678", "From Percival Street, Finsbury to Regent's Row , Haggerston"
"LINESTRING (-0.124678 51.51908,-0.062546 51.535678", "From British Museum, Bloomsbury to Regent's Row , Haggerston"
"LINESTRING (-0.079249 51.518908,-0.062546 51.535678", "From Brushfield Street, Liverpool Street to Regent's Row , Haggerston"
"LINESTRING (-0.022793 51.497304,-0.062546 51.535678", "From Alpha Grove, Millwall to Regent's Row , Haggerston"
"LINESTRING (-0.075901 51.531091,-0.062546 51.535678", "From Hoxton Station, Hoxton to Regent's Row , Haggerston"
"LINESTRING (-0.062546 51.535678,-0.062546 51.535678", "From Regent's Row , Haggerston to Regent's Row , Haggerston"
"LINESTRING (-0.038986 51.512871,-0.062546 51.535678", "From Flamborough Street, Limehouse to Regent's Row , Haggerston"
"LINESTRING (-0.074754 51.523648,-0.062546 51.535678", "From Bethnal Green Road, Shoreditch to Regent's Row , Haggerston"
"LINESTRING (-0.073955 51.526293,-0.062546 51.535678", "From Palissy Street, Shoreditch to Regent's Row , Haggerston"
"LINESTRING (-0.104298 51.526717,-0.062546 51.535678", "From Finsbury Library , Finsbury to Regent's Row , Haggerston"
"LINESTRING (-0.102208 51.526153,-0.062546 51.535678", "From Percival Street, Finsbury to Regent's Row , Haggerston"
"LINESTRING (-0.075885 51.536585,-0.062546 51.535678", "From Dunston Road , Haggerston to Regent's Row , Haggerston"
"LINESTRING (-0.025296 51.527058,-0.062546 51.535678", "From Bow Road Station, Bow to Regent's Row , Haggerston"
"LINESTRING (-0.066035 51.531864,-0.062546 51.535678", "From Goldsmith's Row, Haggerston to Regent's Row , Haggerston"
"LINESTRING (-0.079249 51.518908,-0.062546 51.535678", "From Brushfield Street, Liverpool Street to Regent's Row , Haggerston"
"LINESTRING (-0.025296 51.527058,-0.062546 51.535678", "From Bow Road Station, Bow to Regent's Row , Haggerston"
"LINESTRING (-0.075885 51.536585,-0.062546 51.535678", "From Dunston Road , Haggerston to Regent's Row , Haggerston"
"LINESTRING (-0.114079 51.522264,-0.062546 51.535678", "From Northington Street , Holborn to Regent's Row , Haggerston"
"LINESTRING (-0.066035 51.531864,-0.062546 51.535678", "From Goldsmith's Row, Haggerston to Regent's Row , Haggerston"
"LINESTRING (-0.111257 51.514274,-0.062546 51.535678", "From Chancery Lane, Holborn to Regent's Row , Haggerston"
"LINESTRING (-0.054883 51.522561,-0.062546 51.535678", "From Cephas Street, Bethnal Green to Regent's Row , Haggerston"
"LINESTRING (-0.104298 51.526717,-0.062546 51.535678", "From Finsbury Library , Finsbury to Regent's Row , Haggerston"
"LINESTRING (-0.08249 51.53558,-0.062546 51.535678", "From Pitfield Street North,Hoxton to Regent's Row , Haggerston"
