"LINESTRING (-0.143613 51.523518,-0.137694 51.514667", "From Bolsover Street, Fitzrovia to Great Marlborough St, Soho"
"LINESTRING (-0.159237 51.501855,-0.137694 51.514667", "From Seville Street, Knightsbridge to Great Marlborough St, Soho"
"LINESTRING (-0.081608 51.497855,-0.137694 51.514667", "From Bermondsey Street, Bermondsey to Great Marlborough St, Soho"
"LINESTRING (-0.168917 51.497056,-0.137694 51.514667", "From Holy Trinity Brompton, Knightsbridge to Great Marlborough St, Soho"
"LINESTRING (-0.139625 51.490962,-0.137694 51.514667", "From Gloucester Street, Pimlico to Great Marlborough St, Soho"
"LINESTRING (-0.147203 51.515308,-0.137694 51.514667", "From Chapel Place, Marylebone to Great Marlborough St, Soho"
"LINESTRING (-0.159237 51.501855,-0.137694 51.514667", "From Seville Street, Knightsbridge to Great Marlborough St, Soho"
"LINESTRING (-0.132328 51.515631,-0.137694 51.514667", "From Soho Square , Soho to Great Marlborough St, Soho"
"LINESTRING (-0.121723 51.510701,-0.137694 51.514667", "From Southampton Street, Strand to Great Marlborough St, Soho"
"LINESTRING (-0.138853 51.541603,-0.137694 51.514667", "From Bonny Street, Camden Town to Great Marlborough St, Soho"
"LINESTRING (-0.111606 51.505569,-0.137694 51.514667", "From Stamford Street, South Bank to Great Marlborough St, Soho"
"LINESTRING (-0.081608 51.497855,-0.137694 51.514667", "From Bermondsey Street, Bermondsey to Great Marlborough St, Soho"
"LINESTRING (-0.118295 51.52728,-0.137694 51.514667", "From Ampton Street , Clerkenwell to Great Marlborough St, Soho"
"LINESTRING (-0.081608 51.497855,-0.137694 51.514667", "From Bermondsey Street, Bermondsey to Great Marlborough St, Soho"
"LINESTRING (-0.112824 51.503791,-0.137694 51.514667", "From Waterloo Station 3, Waterloo to Great Marlborough St, Soho"
"LINESTRING (-0.168917 51.497056,-0.137694 51.514667", "From Holy Trinity Brompton, Knightsbridge to Great Marlborough St, Soho"
"LINESTRING (-0.081608 51.497855,-0.137694 51.514667", "From Bermondsey Street, Bermondsey to Great Marlborough St, Soho"
"LINESTRING (-0.108657 51.51795,-0.137694 51.514667", "From Holborn Circus, Holborn to Great Marlborough St, Soho"
"LINESTRING (-0.125979 51.526357,-0.137694 51.514667", "From Cartwright Gardens , Bloomsbury to Great Marlborough St, Soho"
"LINESTRING (-0.108657 51.51795,-0.137694 51.514667", "From Holborn Circus, Holborn to Great Marlborough St, Soho"
"LINESTRING (-0.18697 51.51616,-0.137694 51.514667", "From Bishop's Bridge Road West, Bayswater to Great Marlborough St, Soho"
"LINESTRING (-0.114079 51.522264,-0.137694 51.514667", "From Northington Street , Holborn to Great Marlborough St, Soho"
"LINESTRING (-0.159237 51.501855,-0.137694 51.514667", "From Seville Street, Knightsbridge to Great Marlborough St, Soho"
"LINESTRING (-0.151926 51.516814,-0.137694 51.514667", "From Hinde Street, Marylebone to Great Marlborough St, Soho"
"LINESTRING (-0.078869 51.521113,-0.131773 51.506633", "From Norton Folgate, Liverpool Street to Waterloo Place, St. James's"
"LINESTRING (-0.078869 51.521113,-0.131773 51.506633", "From Norton Folgate, Liverpool Street to Waterloo Place, St. James's"
"LINESTRING (-0.158456 51.502953,-0.131773 51.506633", "From Albert Gate, Hyde Park to Waterloo Place, St. James's"
"LINESTRING (-0.193068 51.500397,-0.131773 51.506633", "From Wright's Lane, Kensington to Waterloo Place, St. James's"
"LINESTRING (-0.140485 51.519181,-0.131773 51.506633", "From Foley Street, Fitzrovia to Waterloo Place, St. James's"
"LINESTRING (-0.158456 51.502953,-0.131773 51.506633", "From Albert Gate, Hyde Park to Waterloo Place, St. James's"
"LINESTRING (-0.131773 51.506633,-0.131773 51.506633", "From Waterloo Place, St. James's to Waterloo Place, St. James's"
"LINESTRING (-0.138733 51.496753,-0.131773 51.506633", "From Howick Place, Westminster to Waterloo Place, St. James's"
"LINESTRING (-0.10997 51.529163,-0.131773 51.506633", "From River Street , Clerkenwell to Waterloo Place, St. James's"
"LINESTRING (-0.1844 51.502042,-0.131773 51.506633", "From Palace Gate, Kensington Gardens to Waterloo Place, St. James's"
"LINESTRING (-0.158456 51.502953,-0.131773 51.506633", "From Albert Gate, Hyde Park to Waterloo Place, St. James's"
"LINESTRING (-0.138733 51.496753,-0.131773 51.506633", "From Howick Place, Westminster to Waterloo Place, St. James's"
"LINESTRING (-0.078869 51.521113,-0.131773 51.506633", "From Norton Folgate, Liverpool Street to Waterloo Place, St. James's"
"LINESTRING (-0.158456 51.502953,-0.131773 51.506633", "From Albert Gate, Hyde Park to Waterloo Place, St. James's"
"LINESTRING (-0.117122 51.490994,-0.131773 51.506633", "From Black Prince Road, Vauxhall to Waterloo Place, St. James's"
"LINESTRING (-0.131773 51.506633,-0.131773 51.506633", "From Waterloo Place, St. James's to Waterloo Place, St. James's"
"LINESTRING (-0.142207 51.485357,-0.141334 51.492345", "From Grosvenor Road, Pimlico to Guildhouse Street, Victoria"
"LINESTRING (-0.174971 51.485121,-0.141334 51.492345", "From The Vale, Chelsea to Guildhouse Street, Victoria"
"LINESTRING (-0.141423 51.514499,-0.141334 51.492345", "From Little Argyll Street, West End to Guildhouse Street, Victoria"
"LINESTRING (-0.19701 51.473763,-0.141334 51.492345", "From Irene Road, Parsons Green to Guildhouse Street, Victoria"
"LINESTRING (-0.138846 51.510048,-0.141334 51.492345", "From Sackville Street, Mayfair to Guildhouse Street, Victoria"
"LINESTRING (-0.096317 51.526008,-0.121328 51.517606", "From Finsbury Leisure Centre, St. Luke's to Southampton Place, Holborn"
"LINESTRING (-0.124678 51.51908,-0.121328 51.517606", "From British Museum, Bloomsbury to Southampton Place, Holborn"
"LINESTRING (-0.073438 51.51838,-0.121328 51.517606", "From Fashion Street, Whitechapel to Southampton Place, Holborn"
"LINESTRING (-0.11548 51.528915,-0.121328 51.517606", "From Great Percy Street, Clerkenwell to Southampton Place, Holborn"
"LINESTRING (-0.042744 51.530326,-0.121328 51.517606", "From Twig Folly Bridge, Mile End to Southampton Place, Holborn"
"LINESTRING (-0.09022 51.491484,-0.121328 51.517606", "From Rodney Road , Walworth to Southampton Place, Holborn"
"LINESTRING (-0.073438 51.51838,-0.121328 51.517606", "From Fashion Street, Whitechapel to Southampton Place, Holborn"
"LINESTRING (-0.109006 51.521661,-0.121328 51.517606", "From Hatton Wall, Holborn to Southampton Place, Holborn"
"LINESTRING (-0.087262 51.506304,-0.121328 51.517606", "From Duke Street Hill, London Bridge to Southampton Place, Holborn"
"LINESTRING (-0.104724 51.52836,-0.121328 51.517606", "From St. John Street, Finsbury to Southampton Place, Holborn"
"LINESTRING (-0.134234 51.494591,-0.167894 51.493184", "From Greycoat Street , Westminster to Sloane Avenue, Knightsbridge"
"LINESTRING (-0.138364 51.492111,-0.167894 51.493184", "From Tachbrook Street, Victoria to Sloane Avenue, Knightsbridge"
"LINESTRING (-0.187404 51.487958,-0.167894 51.493184", "From Harcourt Terrace, West Brompton to Sloane Avenue, Knightsbridge"
"LINESTRING (-0.138364 51.492111,-0.167894 51.493184", "From Tachbrook Street, Victoria to Sloane Avenue, Knightsbridge"
"LINESTRING (-0.183853 51.480898,-0.167894 51.493184", "From Thorndike Close, West Chelsea to Sloane Avenue, Knightsbridge"
"LINESTRING (-0.159925 51.512301,-0.167894 51.493184", "From Speakers' Corner 1, Hyde Park to Sloane Avenue, Knightsbridge"
"LINESTRING (-0.1844 51.502042,-0.167894 51.493184", "From Palace Gate, Kensington Gardens to Sloane Avenue, Knightsbridge"
"LINESTRING (-0.205921 51.511624,-0.167894 51.493184", "From Ladbroke Grove Central, Ladbroke Grove to Sloane Avenue, Knightsbridge"
"LINESTRING (-0.161765 51.487964,-0.167894 51.493184", "From Ormonde Gate, Chelsea to Sloane Avenue, Knightsbridge"
"LINESTRING (-0.135635 51.488226,-0.167894 51.493184", "From St. George's Square, Pimlico to Sloane Avenue, Knightsbridge"
"LINESTRING (-0.187404 51.487958,-0.167894 51.493184", "From Harcourt Terrace, West Brompton to Sloane Avenue, Knightsbridge"
"LINESTRING (-0.158105 51.494645,-0.167894 51.493184", "From Cadogan Place, Knightsbridge to Sloane Avenue, Knightsbridge"
"LINESTRING (-0.15934 51.500241,-0.167894 51.493184", "From Harriet Street, Knightsbridge to Sloane Avenue, Knightsbridge"
"LINESTRING (-0.159919 51.492462,-0.167894 51.493184", "From Cadogan Gardens, Chelsea to Sloane Avenue, Knightsbridge"
"LINESTRING (-0.162727 51.489932,-0.167894 51.493184", "From Royal Avenue 1, Chelsea to Sloane Avenue, Knightsbridge"
"LINESTRING (-0.153645 51.512911,-0.167894 51.493184", "From North Audley Street, Mayfair to Sloane Avenue, Knightsbridge"
"LINESTRING (-0.19617 51.490853,-0.167894 51.493184", "From Trebovir Road, Earl's Court to Sloane Avenue, Knightsbridge"
"LINESTRING (-0.140947 51.49616,-0.167894 51.493184", "From Ashley Place, Victoria to Sloane Avenue, Knightsbridge"
"LINESTRING (-0.159919 51.492462,-0.167894 51.493184", "From Cadogan Gardens, Chelsea to Sloane Avenue, Knightsbridge"
"LINESTRING (-0.216305 51.483356,-0.167894 51.493184", "From Everington Street, Fulham to Sloane Avenue, Knightsbridge"
"LINESTRING (-0.187404 51.487958,-0.167894 51.493184", "From Harcourt Terrace, West Brompton to Sloane Avenue, Knightsbridge"
"LINESTRING (-0.158264 51.514577,-0.183118 51.515607", "From Old Quebec Street, Marylebone to Cleveland Gardens, Bayswater"
"LINESTRING (-0.187842 51.509908,-0.183118 51.515607", "From Black Lion Gate, Kensington Gardens to Cleveland Gardens, Bayswater"
"LINESTRING (-0.158456 51.502953,-0.183118 51.515607", "From Albert Gate, Hyde Park to Cleveland Gardens, Bayswater"
"LINESTRING (-0.19096 51.51244,-0.183118 51.515607", "From Ilchester Gardens, Bayswater to Cleveland Gardens, Bayswater"
"LINESTRING (-0.188098 51.517919,-0.183118 51.515607", "From Gloucester Terrace, Bayswater to Cleveland Gardens, Bayswater"
"LINESTRING (-0.183118 51.515607,-0.183118 51.515607", "From Cleveland Gardens, Bayswater to Cleveland Gardens, Bayswater"
"LINESTRING (-0.128585 51.516118,-0.183118 51.515607", "From Earnshaw Street , Covent Garden to Cleveland Gardens, Bayswater"
"LINESTRING (-0.164032 51.525194,-0.183716 51.517932", "From Rossmore Road, Marylebone to Orsett Terrace, Bayswater"
"LINESTRING (-0.200838 51.514311,-0.183716 51.517932", "From Turquoise Island, Notting Hill to Orsett Terrace, Bayswater"
"LINESTRING (-0.17977 51.51348,-0.159237 51.501855", "From Devonshire Terrace, Bayswater to Seville Street, Knightsbridge"
"LINESTRING (-0.138089 51.484839,-0.159237 51.501855", "From Claverton Street, Pimlico to Seville Street, Knightsbridge"
"LINESTRING (-0.17977 51.51348,-0.159237 51.501855", "From Devonshire Terrace, Bayswater to Seville Street, Knightsbridge"
"LINESTRING (-0.159925 51.512301,-0.159237 51.501855", "From Speakers' Corner 1, Hyde Park to Seville Street, Knightsbridge"
"LINESTRING (-0.18267 51.494185,-0.159237 51.501855", "From Gloucester Road Station, South Kensington to Seville Street, Knightsbridge"
"LINESTRING (-0.208486 51.506465,-0.159237 51.501855", "From Princedale Road , Holland Park to Seville Street, Knightsbridge"
"LINESTRING (-0.208486 51.506465,-0.159237 51.501855", "From Princedale Road , Holland Park to Seville Street, Knightsbridge"
"LINESTRING (-0.208486 51.506465,-0.159237 51.501855", "From Princedale Road , Holland Park to Seville Street, Knightsbridge"
"LINESTRING (-0.208486 51.506465,-0.159237 51.501855", "From Princedale Road , Holland Park to Seville Street, Knightsbridge"
"LINESTRING (-0.16716 51.47518,-0.159237 51.501855", "From Surrey Lane, Battersea to Seville Street, Knightsbridge"
"LINESTRING (-0.149569 51.50274,-0.159237 51.501855", "From Wellington Arch, Hyde Park to Seville Street, Knightsbridge"
"LINESTRING (-0.208486 51.506465,-0.159237 51.501855", "From Princedale Road , Holland Park to Seville Street, Knightsbridge"
"LINESTRING (-0.18267 51.494185,-0.159237 51.501855", "From Gloucester Road Station, South Kensington to Seville Street, Knightsbridge"
"LINESTRING (-0.159925 51.512301,-0.159237 51.501855", "From Speakers' Corner 1, Hyde Park to Seville Street, Knightsbridge"
"LINESTRING (-0.159919 51.492462,-0.159237 51.501855", "From Cadogan Gardens, Chelsea to Seville Street, Knightsbridge"
"LINESTRING (-0.222456 51.488144,-0.159237 51.501855", "From Beryl Road, Hammersmith to Seville Street, Knightsbridge"
"LINESTRING (-0.171681 51.522892,-0.159237 51.501855", "From Penfold Street, Marylebone to Seville Street, Knightsbridge"
"LINESTRING (-0.216145 51.46161,-0.159237 51.501855", "From Disraeli Road, Putney to Seville Street, Knightsbridge"
"LINESTRING (-0.138089 51.484839,-0.159237 51.501855", "From Claverton Street, Pimlico to Seville Street, Knightsbridge"
"LINESTRING (-0.183846 51.523344,-0.159237 51.501855", "From Warwick Avenue Station, Maida Vale to Seville Street, Knightsbridge"
"LINESTRING (-0.168917 51.497056,-0.159237 51.501855", "From Holy Trinity Brompton, Knightsbridge to Seville Street, Knightsbridge"
"LINESTRING (-0.140741 51.488057,-0.147624 51.49395", "From Alderney Street, Pimlico to Eccleston Place, Victoria"
"LINESTRING (-0.140741 51.488057,-0.147624 51.49395", "From Alderney Street, Pimlico to Eccleston Place, Victoria"
"LINESTRING (-0.196422 51.509353,-0.147624 51.49395", "From Notting Hill Gate Station, Notting Hill to Eccleston Place, Victoria"
"LINESTRING (-0.196422 51.509353,-0.147624 51.49395", "From Notting Hill Gate Station, Notting Hill to Eccleston Place, Victoria"
"LINESTRING (-0.130699 51.50777,-0.147624 51.49395", "From Pall Mall East, West End to Eccleston Place, Victoria"
"LINESTRING (-0.164393 51.516517,-0.147624 51.49395", "From Nutford Place, Marylebone to Eccleston Place, Victoria"
"LINESTRING (-0.106323 51.490757,-0.147624 51.49395", "From Cotton Garden Estate, Kennington to Eccleston Place, Victoria"
"LINESTRING (-0.156876 51.49313,-0.147624 51.49395", "From Sedding Street, Sloane Square to Eccleston Place, Victoria"
"LINESTRING (-0.191462 51.501364,-0.147624 51.49395", "From Derry Street, Kensington to Eccleston Place, Victoria"
"LINESTRING (-0.225787 51.514767,-0.147624 51.49395", "From BBC White City, White City to Eccleston Place, Victoria"
"LINESTRING (-0.112031 51.49914,-0.147624 51.49395", "From Lambeth North Station, Waterloo to Eccleston Place, Victoria"
"LINESTRING (-0.176267 51.472876,-0.147624 51.49395", "From Vicarage Crescent, Battersea to Eccleston Place, Victoria"
"LINESTRING (-0.162146 51.512151,-0.147624 51.49395", "From Cumberland Gate, Hyde Park to Eccleston Place, Victoria"
"LINESTRING (-0.140741 51.488057,-0.147624 51.49395", "From Alderney Street, Pimlico to Eccleston Place, Victoria"
"LINESTRING (-0.140741 51.488057,-0.147624 51.49395", "From Alderney Street, Pimlico to Eccleston Place, Victoria"
"LINESTRING (-0.179702 51.499428,-0.195455 51.500401", "From Imperial College, Knightsbridge to Argyll Road, Kensington"
"LINESTRING (-0.083159 51.500889,-0.195455 51.500401", "From Tyers Gate, Bermondsey to Argyll Road, Kensington"
"LINESTRING (-0.08497 51.50964,-0.195455 51.500401", "From Monument Street, Monument to Argyll Road, Kensington"
"LINESTRING (-0.126021 51.508103,-0.195455 51.500401", "From Craven Street, Strand to Argyll Road, Kensington"
"LINESTRING (-0.193487 51.513735,-0.195455 51.500401", "From Hereford Road, Bayswater to Argyll Road, Kensington"
"LINESTRING (-0.165164 51.514746,-0.165164 51.514746", "From Porchester Place, Paddington to Porchester Place, Paddington"
"LINESTRING (-0.163667 51.520331,-0.165164 51.514746", "From Seymour Place, Marylebone to Porchester Place, Paddington"
"LINESTRING (-0.176268 51.524826,-0.165164 51.514746", "From Aberdeen Place, St. John's Wood to Porchester Place, Paddington"
"LINESTRING (-0.174554 51.499917,-0.165164 51.514746", "From Exhibition Road, Knightsbridge to Porchester Place, Paddington"
"LINESTRING (-0.131961 51.508446,-0.165164 51.514746", "From Charles II Street, West End to Porchester Place, Paddington"
"LINESTRING (-0.21985 51.493267,-0.165164 51.514746", "From Hammersmith Road, Hammersmith to Porchester Place, Paddington"
"LINESTRING (-0.131961 51.508446,-0.165164 51.514746", "From Charles II Street, West End to Porchester Place, Paddington"
"LINESTRING (-0.165164 51.514746,-0.165164 51.514746", "From Porchester Place, Paddington to Porchester Place, Paddington"
"LINESTRING (-0.165164 51.514746,-0.165164 51.514746", "From Porchester Place, Paddington to Porchester Place, Paddington"
"LINESTRING (-0.131961 51.508446,-0.165164 51.514746", "From Charles II Street, West End to Porchester Place, Paddington"
"LINESTRING (-0.131961 51.508446,-0.165164 51.514746", "From Charles II Street, West End to Porchester Place, Paddington"
"LINESTRING (-0.179702 51.499428,-0.165164 51.514746", "From Imperial College, Knightsbridge to Porchester Place, Paddington"
"LINESTRING (-0.187842 51.509908,-0.165164 51.514746", "From Black Lion Gate, Kensington Gardens to Porchester Place, Paddington"
"LINESTRING (-0.165164 51.514746,-0.165164 51.514746", "From Porchester Place, Paddington to Porchester Place, Paddington"
"LINESTRING (-0.114333 51.531825,-0.108068 51.527842", "From Rodney Street, Angel to Hardwick Street, Clerkenwell"
"LINESTRING (-0.197574 51.499606,-0.186753 51.491615", "From Phillimore Gardens, Kensington to Collingham Gardens, Earl's Court"
"LINESTRING (-0.209121 51.491026,-0.186753 51.491615", "From Gwendwr Road, West Kensington to Collingham Gardens, Earl's Court"
"LINESTRING (-0.1844 51.502042,-0.186753 51.491615", "From Palace Gate, Kensington Gardens to Collingham Gardens, Earl's Court"
"LINESTRING (-0.149186 51.490491,-0.186753 51.491615", "From Ebury Bridge, Pimlico to Collingham Gardens, Earl's Court"
"LINESTRING (-0.209121 51.491026,-0.186753 51.491615", "From Gwendwr Road, West Kensington to Collingham Gardens, Earl's Court"
"LINESTRING (-0.174691 51.45787,-0.173715 51.491211", "From Spencer Park, Wandsworth Common to Sumner Place, South Kensington"
"LINESTRING (-0.198286 51.493724,-0.173715 51.491211", "From West Cromwell Road, Earl's Court to Sumner Place, South Kensington"
"LINESTRING (-0.19617 51.490853,-0.173715 51.491211", "From Trebovir Road, Earl's Court to Sumner Place, South Kensington"
"LINESTRING (-0.18119 51.485587,-0.173715 51.491211", "From Limerston Street, West Chelsea to Sumner Place, South Kensington"
"LINESTRING (-0.171681 51.522892,-0.173715 51.491211", "From Penfold Street, Marylebone to Sumner Place, South Kensington"
"LINESTRING (-0.194116 51.479932,-0.173715 51.491211", "From Fulham Broadway, Walham Green to Sumner Place, South Kensington"
"LINESTRING (-0.173715 51.491211,-0.173715 51.491211", "From Sumner Place, South Kensington to Sumner Place, South Kensington"
"LINESTRING (-0.171681 51.522892,-0.173715 51.491211", "From Penfold Street, Marylebone to Sumner Place, South Kensington"
"LINESTRING (-0.222293 51.501594,-0.173715 51.491211", "From Shepherd's Bush Road North, Shepherd's Bush to Sumner Place, South Kensington"
"LINESTRING (-0.173715 51.491211,-0.173715 51.491211", "From Sumner Place, South Kensington to Sumner Place, South Kensington"
"LINESTRING (-0.079249 51.518908,-0.113001 51.50486", "From Brushfield Street, Liverpool Street to Waterloo Road, South Bank"
"LINESTRING (-0.098497 51.503688,-0.113001 51.50486", "From Union Street, The Borough to Waterloo Road, South Bank"
"LINESTRING (-0.082989 51.510484,-0.115057 51.512582", "From Great Tower Street, Monument to Strand, Strand"
"LINESTRING (-0.058641 51.515256,-0.115057 51.512582", "From Philpot Street, Whitechapel to Strand, Strand"
"LINESTRING (-0.038986 51.512871,-0.115057 51.512582", "From Flamborough Street, Limehouse to Strand, Strand"
"LINESTRING (-0.082989 51.510484,-0.115057 51.512582", "From Great Tower Street, Monument to Strand, Strand"
"LINESTRING (-0.18697 51.51616,-0.115057 51.512582", "From Bishop's Bridge Road West, Bayswater to Strand, Strand"
"LINESTRING (-0.082989 51.510484,-0.115057 51.512582", "From Great Tower Street, Monument to Strand, Strand"
"LINESTRING (-0.074431 51.519362,-0.115057 51.512582", "From Fournier Street, Whitechapel to Strand, Strand"
"LINESTRING (-0.073955 51.526293,-0.079608 51.521668", "From Palissy Street, Shoreditch to Worship Street, Shoreditch"
"LINESTRING (-0.047548 51.528869,-0.079608 51.521668", "From Globe Town Market, Bethnal Green to Worship Street, Shoreditch"
"LINESTRING (-0.073955 51.526293,-0.079608 51.521668", "From Palissy Street, Shoreditch to Worship Street, Shoreditch"
"LINESTRING (-0.094475 51.521747,-0.079608 51.521668", "From Golden Lane, Barbican to Worship Street, Shoreditch"
"LINESTRING (-0.099981 51.532661,-0.079608 51.521668", "From Graham Street, Angel to Worship Street, Shoreditch"
"LINESTRING (-0.099981 51.532661,-0.079608 51.521668", "From Graham Street, Angel to Worship Street, Shoreditch"
"LINESTRING (-0.073537 51.514233,-0.079608 51.521668", "From Braham Street, Aldgate to Worship Street, Shoreditch"
"LINESTRING (-0.099981 51.532661,-0.079608 51.521668", "From Graham Street, Angel to Worship Street, Shoreditch"
"LINESTRING (-0.09734 51.520841,-0.079608 51.521668", "From Aldersgate Street, Barbican to Worship Street, Shoreditch"
"LINESTRING (-0.047548 51.528869,-0.079608 51.521668", "From Globe Town Market, Bethnal Green to Worship Street, Shoreditch"
"LINESTRING (-0.213872 51.51687,-0.188098 51.517919", "From St. Mark's Road, North Kensington to Gloucester Terrace, Bayswater"
"LINESTRING (-0.187402 51.51031,-0.188098 51.517919", "From Queensway, Kensington Gardens to Gloucester Terrace, Bayswater"
"LINESTRING (-0.183846 51.523344,-0.188098 51.517919", "From Warwick Avenue Station, Maida Vale to Gloucester Terrace, Bayswater"
"LINESTRING (-0.187402 51.51031,-0.188098 51.517919", "From Queensway, Kensington Gardens to Gloucester Terrace, Bayswater"
"LINESTRING (-0.174554 51.499917,-0.188098 51.517919", "From Exhibition Road, Knightsbridge to Gloucester Terrace, Bayswater"
"LINESTRING (-0.200742 51.502319,-0.188098 51.517919", "From Holland Park, Kensington to Gloucester Terrace, Bayswater"
"LINESTRING (-0.193487 51.513735,-0.188098 51.517919", "From Hereford Road, Bayswater to Gloucester Terrace, Bayswater"
"LINESTRING (-0.138364 51.492111,-0.140947 51.49616", "From Tachbrook Street, Victoria to Ashley Place, Victoria"
"LINESTRING (-0.07962 51.503493,-0.140947 51.49616", "From Tooley Street, Bermondsey to Ashley Place, Victoria"
"LINESTRING (-0.128585 51.516118,-0.140947 51.49616", "From Earnshaw Street , Covent Garden to Ashley Place, Victoria"
"LINESTRING (-0.115057 51.512582,-0.140947 51.49616", "From Strand, Strand to Ashley Place, Victoria"
"LINESTRING (-0.113134 51.483145,-0.140947 51.49616", "From Kennington Oval, Oval to Ashley Place, Victoria"
"LINESTRING (-0.167894 51.493184,-0.140947 51.49616", "From Sloane Avenue, Knightsbridge to Ashley Place, Victoria"
"LINESTRING (-0.104193 51.49605,-0.140947 51.49616", "From Gaywood  Street, Elephant & Castle to Ashley Place, Victoria"
"LINESTRING (-0.132224 51.49206,-0.140947 51.49616", "From Regency Street, Westminster to Ashley Place, Victoria"
"LINESTRING (-0.167894 51.493184,-0.140947 51.49616", "From Sloane Avenue, Knightsbridge to Ashley Place, Victoria"
"LINESTRING (-0.132224 51.49206,-0.140947 51.49616", "From Regency Street, Westminster to Ashley Place, Victoria"
"LINESTRING (-0.193068 51.500397,-0.140947 51.49616", "From Wright's Lane, Kensington to Ashley Place, Victoria"
"LINESTRING (-0.162727 51.489932,-0.140947 51.49616", "From Royal Avenue 1, Chelsea to Ashley Place, Victoria"
"LINESTRING (-0.135635 51.488226,-0.140947 51.49616", "From St. George's Square, Pimlico to Ashley Place, Victoria"
"LINESTRING (-0.130699 51.50777,-0.140947 51.49616", "From Pall Mall East, West End to Ashley Place, Victoria"
"LINESTRING (-0.121723 51.510701,-0.140947 51.49616", "From Southampton Street, Strand to Ashley Place, Victoria"
"LINESTRING (-0.115156 51.489479,-0.140947 51.49616", "From Sancroft Street, Vauxhall to Ashley Place, Victoria"
"LINESTRING (-0.201005 51.51787,-0.141923 51.489856", "From Westbourne Park Road, Portobello to Warwick Square, Pimlico"
"LINESTRING (-0.132102 51.498125,-0.141923 51.489856", "From Abbey Orchard Street, Westminster to Warwick Square, Pimlico"
"LINESTRING (-0.127575 51.495805,-0.141923 51.489856", "From Smith Square, Westminster to Warwick Square, Pimlico"
"LINESTRING (-0.144132 51.493204,-0.141923 51.489856", "From Belgrave Road, Victoria to Warwick Square, Pimlico"
"LINESTRING (-0.174971 51.485121,-0.141923 51.489856", "From The Vale, Chelsea to Warwick Square, Pimlico"
"LINESTRING (-0.124469 51.485917,-0.141923 51.489856", "From Vauxhall Cross, Vauxhall to Warwick Square, Pimlico"
"LINESTRING (-0.123702 51.506767,-0.141923 51.489856", "From Northumberland Avenue, Strand to Warwick Square, Pimlico"
"LINESTRING (-0.140947 51.49616,-0.153645 51.512911", "From Ashley Place, Victoria to North Audley Street, Mayfair"
"LINESTRING (-0.117495 51.498241,-0.153645 51.512911", "From Archbishop's Park, Waterloo to North Audley Street, Mayfair"
"LINESTRING (-0.136052 51.527326,-0.153645 51.512911", "From Drummond Street , Euston to North Audley Street, Mayfair"
"LINESTRING (-0.179668 51.511654,-0.153645 51.512911", "From Lancaster Gate , Bayswater to North Audley Street, Mayfair"
"LINESTRING (-0.145211 51.520715,-0.153645 51.512911", "From Portland Place, Marylebone to North Audley Street, Mayfair"
"LINESTRING (-0.158456 51.502953,-0.153645 51.512911", "From Albert Gate, Hyde Park to North Audley Street, Mayfair"
"LINESTRING (-0.159925 51.512301,-0.152317 51.499412", "From Speakers' Corner 1, Hyde Park to Belgrave Square, Belgravia"
"LINESTRING (-0.159925 51.512301,-0.152317 51.499412", "From Speakers' Corner 1, Hyde Park to Belgrave Square, Belgravia"
"LINESTRING (-0.159925 51.512301,-0.152317 51.499412", "From Speakers' Corner 1, Hyde Park to Belgrave Square, Belgravia"
"LINESTRING (-0.17581 51.517335,-0.165842 51.522029", "From South Wharf Road, Paddington to Bell Street , Marylebone"
"LINESTRING (-0.17581 51.517335,-0.165842 51.522029", "From South Wharf Road, Paddington to Bell Street , Marylebone"
