"LINESTRING (-0.150181 51.536922,-0.139016 51.520994", "From London Zoo Car Park, The Regent's Park to Howland Street, Fitzrovia"
"LINESTRING (-0.122299 51.530199,-0.139016 51.520994", "From Birkenhead Street, King's Cross to Howland Street, Fitzrovia"
"LINESTRING (-0.138853 51.541603,-0.139016 51.520994", "From Bonny Street, Camden Town to Howland Street, Fitzrovia"
"LINESTRING (-0.125979 51.526357,-0.124826 51.516226", "From Cartwright Gardens , Bloomsbury to High Holborn , Covent Garden"
"LINESTRING (-0.089659 51.52548,-0.124826 51.516226", "From Old Street Station, St. Luke's to High Holborn , Covent Garden"
"LINESTRING (-0.138853 51.541603,-0.124826 51.516226", "From Bonny Street, Camden Town to High Holborn , Covent Garden"
"LINESTRING (-0.097441 51.511961,-0.124826 51.516226", "From Queen Victoria Street, St. Paul's to High Holborn , Covent Garden"
"LINESTRING (-0.123616 51.529943,-0.124826 51.516226", "From Belgrove Street , King's Cross to High Holborn , Covent Garden"
"LINESTRING (-0.106408 51.530515,-0.124826 51.516226", "From Chadwell Street, Angel to High Holborn , Covent Garden"
"LINESTRING (-0.149004 51.485821,-0.124826 51.516226", "From Chelsea Bridge, Pimlico to High Holborn , Covent Garden"
"LINESTRING (-0.124121 51.523418,-0.124826 51.516226", "From Russell Square Station, Bloomsbury to High Holborn , Covent Garden"
"LINESTRING (-0.062806 51.539834,-0.124826 51.516226", "From Lansdowne Drive, Hackney Central to High Holborn , Covent Garden"
"LINESTRING (-0.114934 51.49288,-0.13544 51.497829", "From Lollard Street, Vauxhall to Butler Place, Westminster"
"LINESTRING (-0.172528 51.533043,-0.13544 51.497829", "From Wellington Road, St. John's Wood to Butler Place, Westminster"
"LINESTRING (-0.132328 51.515631,-0.13544 51.497829", "From Soho Square , Soho to Butler Place, Westminster"
"LINESTRING (-0.133201 51.512515,-0.13544 51.497829", "From Wardour Street, Soho to Butler Place, Westminster"
"LINESTRING (-0.151359 51.522008,-0.13544 51.497829", "From Beaumont Street, Marylebone to Butler Place, Westminster"
"LINESTRING (-0.125972 51.49764,-0.13544 51.497829", "From Abingdon Green, Westminster to Butler Place, Westminster"
"LINESTRING (-0.161765 51.487964,-0.138733 51.496753", "From Ormonde Gate, Chelsea to Howick Place, Westminster"
"LINESTRING (-0.092176 51.520044,-0.138733 51.496753", "From Barbican Centre, Barbican to Howick Place, Westminster"
"LINESTRING (-0.129698 51.500703,-0.138733 51.496753", "From Storey's Gate, Westminster to Howick Place, Westminster"
"LINESTRING (-0.17219 51.526448,-0.138733 51.496753", "From Lisson Grove, St. John's Wood to Howick Place, Westminster"
"LINESTRING (-0.114934 51.49288,-0.138733 51.496753", "From Lollard Street, Vauxhall to Howick Place, Westminster"
"LINESTRING (-0.027616 51.529452,-0.138733 51.496753", "From Malmesbury Road, Bow to Howick Place, Westminster"
"LINESTRING (-0.127554 51.493978,-0.138733 51.496753", "From Page Street, Westminster to Howick Place, Westminster"
"LINESTRING (-0.132845 51.489975,-0.138733 51.496753", "From Rampayne Street, Pimlico to Howick Place, Westminster"
"LINESTRING (-0.176268 51.524826,-0.138733 51.496753", "From Aberdeen Place, St. John's Wood to Howick Place, Westminster"
"LINESTRING (-0.079201 51.537277,-0.138733 51.496753", "From Hertford Road, De Beauvoir Town to Howick Place, Westminster"
"LINESTRING (-0.10988 51.49775,-0.138733 51.496753", "From King Edward Walk, Waterloo to Howick Place, Westminster"
"LINESTRING (-0.17977 51.51348,-0.138733 51.496753", "From Devonshire Terrace, Bayswater to Howick Place, Westminster"
"LINESTRING (-0.038986 51.512871,-0.133952 51.536264", "From Flamborough Street, Limehouse to Royal College Street, Camden Town"
"LINESTRING (-0.145393 51.542138,-0.13214 51.519572", "From Castlehaven Road, Camden Town to Store Street, Bloomsbury"
"LINESTRING (-0.120973 51.530059,-0.13214 51.519572", "From St. Chad's Street, King's Cross to Store Street, Bloomsbury"
"LINESTRING (-0.120973 51.530059,-0.13214 51.519572", "From St. Chad's Street, King's Cross to Store Street, Bloomsbury"
"LINESTRING (-0.088542 51.527025,-0.13214 51.519572", "From Baldwin Street, St. Luke's to Store Street, Bloomsbury"
"LINESTRING (-0.068161 51.509786,-0.13214 51.519572", "From Dock Street, Wapping to Store Street, Bloomsbury"
"LINESTRING (-0.13214 51.519572,-0.13214 51.519572", "From Store Street, Bloomsbury to Store Street, Bloomsbury"
"LINESTRING (-0.100168 51.530344,-0.100168 51.530344", "From City Road, Angel to City Road, Angel"
"LINESTRING (-0.089887 51.520858,-0.100168 51.530344", "From Bunhill Row, Moorgate to City Road, Angel"
"LINESTRING (-0.066078 51.514924,-0.100168 51.530344", "From LMU Commercial Road, Whitechapel to City Road, Angel"
"LINESTRING (-0.109025 51.534408,-0.100168 51.530344", "From Cloudesley Road, Angel to City Road, Angel"
"LINESTRING (-0.094475 51.521747,-0.100168 51.530344", "From Golden Lane, Barbican to City Road, Angel"
"LINESTRING (-0.079201 51.537277,-0.100168 51.530344", "From Hertford Road, De Beauvoir Town to City Road, Angel"
"LINESTRING (-0.147154 51.537349,-0.100168 51.530344", "From Gloucester Avenue, Camden Town to City Road, Angel"
"LINESTRING (-0.090847 51.525893,-0.100168 51.530344", "From Bath Street, St. Luke's to City Road, Angel"
"LINESTRING (-0.096317 51.526008,-0.100168 51.530344", "From Finsbury Leisure Centre, St. Luke's to City Road, Angel"
"LINESTRING (-0.134621 51.507424,-0.151126 51.510919", "From St. James's Square, St. James's to Millennium Hotel, Mayfair"
"LINESTRING (-0.151126 51.510919,-0.151126 51.510919", "From Millennium Hotel, Mayfair to Millennium Hotel, Mayfair"
"LINESTRING (-0.151126 51.510919,-0.151126 51.510919", "From Millennium Hotel, Mayfair to Millennium Hotel, Mayfair"
"LINESTRING (-0.156166 51.518913,-0.164207 51.517372", "From Baker Street, Marylebone to Harrowby Street, Marylebone"
"LINESTRING (-0.165164 51.514746,-0.164207 51.517372", "From Porchester Place, Paddington to Harrowby Street, Marylebone"
"LINESTRING (-0.187402 51.51031,-0.164207 51.517372", "From Queensway, Kensington Gardens to Harrowby Street, Marylebone"
"LINESTRING (-0.179592 51.525575,-0.164207 51.517372", "From Clifton Road, Maida Vale to Harrowby Street, Marylebone"
"LINESTRING (-0.170279 51.506451,-0.164207 51.517372", "From Triangle Car Park, Hyde Park to Harrowby Street, Marylebone"
"LINESTRING (-0.141423 51.514499,-0.164207 51.517372", "From Little Argyll Street, West End to Harrowby Street, Marylebone"
"LINESTRING (-0.157183 51.52026,-0.164207 51.517372", "From Crawford Street, Marylebone to Harrowby Street, Marylebone"
"LINESTRING (-0.150908 51.47505,-0.15934 51.500241", "From Alfreda Street, Battersea Park to Harriet Street, Knightsbridge"
"LINESTRING (-0.173881 51.494412,-0.15934 51.500241", "From South Kensington Station, South Kensington to Harriet Street, Knightsbridge"
"LINESTRING (-0.15934 51.500241,-0.15934 51.500241", "From Harriet Street, Knightsbridge to Harriet Street, Knightsbridge"
"LINESTRING (-0.142844 51.506613,-0.15934 51.500241", "From Green Park Station, Mayfair to Harriet Street, Knightsbridge"
"LINESTRING (-0.215895 51.476885,-0.15934 51.500241", "From Finlay Street, Fulham to Harriet Street, Knightsbridge"
"LINESTRING (-0.159237 51.501855,-0.15934 51.500241", "From Seville Street, Knightsbridge to Harriet Street, Knightsbridge"
"LINESTRING (-0.15934 51.500241,-0.15934 51.500241", "From Harriet Street, Knightsbridge to Harriet Street, Knightsbridge"
"LINESTRING (-0.170703 51.470847,-0.15934 51.500241", "From Simpson Street, Clapham Junction to Harriet Street, Knightsbridge"
"LINESTRING (-0.173881 51.494412,-0.15934 51.500241", "From South Kensington Station, South Kensington to Harriet Street, Knightsbridge"
"LINESTRING (-0.209973 51.481021,-0.15934 51.500241", "From Aintree Street, Fulham to Harriet Street, Knightsbridge"
"LINESTRING (-0.15934 51.500241,-0.15934 51.500241", "From Harriet Street, Knightsbridge to Harriet Street, Knightsbridge"
"LINESTRING (-0.170703 51.470847,-0.15934 51.500241", "From Simpson Street, Clapham Junction to Harriet Street, Knightsbridge"
"LINESTRING (-0.173881 51.494412,-0.15934 51.500241", "From South Kensington Station, South Kensington to Harriet Street, Knightsbridge"
"LINESTRING (-0.191722 51.461083,-0.15934 51.500241", "From Smugglers Way, Wandsworth to Harriet Street, Knightsbridge"
"LINESTRING (-0.15934 51.500241,-0.15934 51.500241", "From Harriet Street, Knightsbridge to Harriet Street, Knightsbridge"
"LINESTRING (-0.15934 51.500241,-0.15934 51.500241", "From Harriet Street, Knightsbridge to Harriet Street, Knightsbridge"
"LINESTRING (-0.15934 51.500241,-0.15934 51.500241", "From Harriet Street, Knightsbridge to Harriet Street, Knightsbridge"
"LINESTRING (-0.173881 51.494412,-0.15934 51.500241", "From South Kensington Station, South Kensington to Harriet Street, Knightsbridge"
"LINESTRING (-0.138089 51.484839,-0.15934 51.500241", "From Claverton Street, Pimlico to Harriet Street, Knightsbridge"
"LINESTRING (-0.130431 51.52168,-0.15934 51.500241", "From Malet Street, Bloomsbury to Harriet Street, Knightsbridge"
"LINESTRING (-0.162298 51.522511,-0.174593 51.520205", "From Boston Place, Marylebone to Paddington Green, Paddington"
"LINESTRING (-0.162298 51.522511,-0.174593 51.520205", "From Boston Place, Marylebone to Paddington Green, Paddington"
"LINESTRING (-0.193487 51.513735,-0.174593 51.520205", "From Hereford Road, Bayswater to Paddington Green, Paddington"
"LINESTRING (-0.174593 51.520205,-0.174593 51.520205", "From Paddington Green, Paddington to Paddington Green, Paddington"
"LINESTRING (-0.106237 51.507244,-0.10988 51.49775", "From Milroy Walk, South Bank to King Edward Walk, Waterloo"
"LINESTRING (-0.106237 51.507244,-0.10988 51.49775", "From Milroy Walk, South Bank to King Edward Walk, Waterloo"
"LINESTRING (-0.094524 51.500694,-0.10988 51.49775", "From Borough High Street, The Borough to King Edward Walk, Waterloo"
"LINESTRING (-0.124642 51.481747,-0.10988 51.49775", "From South Lambeth Road, Vauxhall to King Edward Walk, Waterloo"
"LINESTRING (-0.137424 51.498865,-0.10988 51.49775", "From Buckingham Gate, Westminster to King Edward Walk, Waterloo"
"LINESTRING (-0.08974 51.500823,-0.117863 51.515208", "From Empire Square, The Borough to Sardinia Street, Holborn"
"LINESTRING (-0.132328 51.515631,-0.117863 51.515208", "From Soho Square , Soho to Sardinia Street, Holborn"
"LINESTRING (-0.107349 51.511891,-0.117863 51.515208", "From Tallis Street, Temple to Sardinia Street, Holborn"
"LINESTRING (-0.073955 51.526293,-0.117863 51.515208", "From Palissy Street, Shoreditch to Sardinia Street, Holborn"
"LINESTRING (-0.178433 51.492479,-0.176415 51.499806", "From Queen's Gate (South), South Kensington to Prince Consort Road, Knightsbridge"
"LINESTRING (-0.215804 51.494347,-0.176415 51.499806", "From Brook Green South, Brook Green to Prince Consort Road, Knightsbridge"
"LINESTRING (-0.145904 51.507069,-0.176415 51.499806", "From Curzon Street, Mayfair to Prince Consort Road, Knightsbridge"
"LINESTRING (-0.174347 51.476964,-0.176415 51.499806", "From Battersea Church Road, Battersea to Prince Consort Road, Knightsbridge"
"LINESTRING (-0.170329 51.477684,-0.176415 51.499806", "From Westbridge Road, Battersea to Prince Consort Road, Knightsbridge"
"LINESTRING (-0.142844 51.506613,-0.176415 51.499806", "From Green Park Station, Mayfair to Prince Consort Road, Knightsbridge"
"LINESTRING (-0.170703 51.470847,-0.176415 51.499806", "From Simpson Street, Clapham Junction to Prince Consort Road, Knightsbridge"
"LINESTRING (-0.09734 51.520841,-0.113864 51.504027", "From Aldersgate Street, Barbican to Waterloo Station 1, Waterloo"
"LINESTRING (-0.130504 51.526838,-0.113864 51.504027", "From Endsleigh Gardens, Euston to Waterloo Station 1, Waterloo"
"LINESTRING (-0.078869 51.521113,-0.113864 51.504027", "From Norton Folgate, Liverpool Street to Waterloo Station 1, Waterloo"
"LINESTRING (-0.076341 51.534464,-0.113864 51.504027", "From Whiston Road, Haggerston to Waterloo Station 1, Waterloo"
"LINESTRING (-0.130504 51.526838,-0.113864 51.504027", "From Endsleigh Gardens, Euston to Waterloo Station 1, Waterloo"
"LINESTRING (-0.122492 51.486343,-0.113864 51.504027", "From Kennington Lane Rail Bridge, Vauxhall to Waterloo Station 1, Waterloo"
"LINESTRING (-0.06691 51.507131,-0.113864 51.504027", "From Nesham Street, Wapping to Waterloo Station 1, Waterloo"
"LINESTRING (-0.178656 51.501432,-0.113864 51.504027", "From Kensington Gore, Knightsbridge to Waterloo Station 1, Waterloo"
"LINESTRING (-0.06111 51.518675,-0.113864 51.504027", "From Royal London Hospital, Whitechapel to Waterloo Station 1, Waterloo"
"LINESTRING (-0.075578 51.52127,-0.113864 51.504027", "From Commercial Street, Shoreditch to Waterloo Station 1, Waterloo"
"LINESTRING (-0.121723 51.510701,-0.113864 51.504027", "From Southampton Street, Strand to Waterloo Station 1, Waterloo"
"LINESTRING (-0.118478 51.514409,-0.113864 51.504027", "From Kingsway, Covent Garden to Waterloo Station 1, Waterloo"
"LINESTRING (-0.09734 51.520841,-0.113864 51.504027", "From Aldersgate Street, Barbican to Waterloo Station 1, Waterloo"
"LINESTRING (-0.099994 51.522853,-0.113864 51.504027", "From Berry Street, Clerkenwell to Waterloo Station 1, Waterloo"
"LINESTRING (-0.115057 51.512582,-0.113864 51.504027", "From Strand, Strand to Waterloo Station 1, Waterloo"
"LINESTRING (-0.198286 51.493724,-0.194392 51.501945", "From West Cromwell Road, Earl's Court to Kensington Town Hall, Kensington"
"LINESTRING (-0.187842 51.509908,-0.194392 51.501945", "From Black Lion Gate, Kensington Gardens to Kensington Town Hall, Kensington"
"LINESTRING (-0.173757 51.496471,-0.194392 51.501945", "From Exhibition Road Museums 1, South Kensington to Kensington Town Hall, Kensington"
"LINESTRING (-0.111014 51.493686,-0.125674 51.491884", "From Walnut Tree Walk, Vauxhall to Millbank Tower, Pimlico"
"LINESTRING (-0.085666 51.499075,-0.125674 51.491884", "From Long Lane , Bermondsey to Millbank Tower, Pimlico"
"LINESTRING (-0.104193 51.49605,-0.125674 51.491884", "From Gaywood  Street, Elephant & Castle to Millbank Tower, Pimlico"
"LINESTRING (-0.167919 51.484984,-0.125674 51.491884", "From Phene Street, Chelsea to Millbank Tower, Pimlico"
"LINESTRING (-0.191722 51.461083,-0.125674 51.491884", "From Smugglers Way, Wandsworth to Millbank Tower, Pimlico"
"LINESTRING (-0.167919 51.484984,-0.125674 51.491884", "From Phene Street, Chelsea to Millbank Tower, Pimlico"
"LINESTRING (-0.150908 51.47505,-0.125674 51.491884", "From Alfreda Street, Battersea Park to Millbank Tower, Pimlico"
"LINESTRING (-0.205279 51.487244,-0.125674 51.491884", "From Star Road, West Kensington to Millbank Tower, Pimlico"
"LINESTRING (-0.205279 51.487244,-0.125674 51.491884", "From Star Road, West Kensington to Millbank Tower, Pimlico"
"LINESTRING (-0.089446 51.497382,-0.125674 51.491884", "From Great Dover Street, The Borough to Millbank Tower, Pimlico"
"LINESTRING (-0.119123 51.519435,-0.113656 51.505354", "From Red Lion Square, Holborn to Waterloo Bridge, South Bank"
"LINESTRING (-0.138535 51.538792,-0.113656 51.505354", "From St Martins Close, Camden Town to Waterloo Bridge, South Bank"
"LINESTRING (-0.101384 51.49652,-0.113656 51.505354", "From Ontario Street, Elephant & Castle to Waterloo Bridge, South Bank"
"LINESTRING (-0.127854 51.517727,-0.113656 51.505354", "From Great Russell Street, Bloomsbury to Waterloo Bridge, South Bank"
"LINESTRING (-0.179702 51.499428,-0.179077 51.495592", "From Imperial College, Knightsbridge to Natural History Museum, South Kensington"
"LINESTRING (-0.179702 51.499428,-0.179077 51.495592", "From Imperial College, Knightsbridge to Natural History Museum, South Kensington"
"LINESTRING (-0.210279 51.468814,-0.200838 51.514311", "From Putney Bridge Station, Fulham to Turquoise Island, Notting Hill"
"LINESTRING (-0.19024 51.515529,-0.200838 51.514311", "From Westbourne Grove, Bayswater to Turquoise Island, Notting Hill"
"LINESTRING (-0.213872 51.51687,-0.200838 51.514311", "From St. Mark's Road, North Kensington to Turquoise Island, Notting Hill"
"LINESTRING (-0.193764 51.508605,-0.200838 51.514311", "From Palace Gardens Terrace, Notting Hill to Turquoise Island, Notting Hill"
"LINESTRING (-0.191496 51.503157,-0.200838 51.514311", "From Kensington Church Street, Kensington to Turquoise Island, Notting Hill"
"LINESTRING (-0.213872 51.51687,-0.200838 51.514311", "From St. Mark's Road, North Kensington to Turquoise Island, Notting Hill"
"LINESTRING (-0.196422 51.509353,-0.200838 51.514311", "From Notting Hill Gate Station, Notting Hill to Turquoise Island, Notting Hill"
"LINESTRING (-0.083935 51.520009,-0.200838 51.514311", "From Sun Street, Liverpool Street to Turquoise Island, Notting Hill"
"LINESTRING (-0.217515 51.500353,-0.200838 51.514311", "From Richmond Way, Shepherd's Bush to Turquoise Island, Notting Hill"
"LINESTRING (-0.187402 51.51031,-0.200838 51.514311", "From Queensway, Kensington Gardens to Turquoise Island, Notting Hill"
"LINESTRING (-0.163667 51.520331,-0.200838 51.514311", "From Seymour Place, Marylebone to Turquoise Island, Notting Hill"
"LINESTRING (-0.1844 51.502042,-0.200838 51.514311", "From Palace Gate, Kensington Gardens to Turquoise Island, Notting Hill"
"LINESTRING (-0.213872 51.51687,-0.200838 51.514311", "From St. Mark's Road, North Kensington to Turquoise Island, Notting Hill"
"LINESTRING (-0.196422 51.509353,-0.200838 51.514311", "From Notting Hill Gate Station, Notting Hill to Turquoise Island, Notting Hill"
"LINESTRING (-0.229116 51.492084,-0.200838 51.514311", "From Bridge Avenue, Hammersmith to Turquoise Island, Notting Hill"
"LINESTRING (-0.141923 51.489856,-0.150666 51.506864", "From Warwick Square, Pimlico to Stanhope Gate, Mayfair"
"LINESTRING (-0.139625 51.490962,-0.150666 51.506864", "From Gloucester Street, Pimlico to Stanhope Gate, Mayfair"
"LINESTRING (-0.164393 51.516517,-0.150666 51.506864", "From Nutford Place, Marylebone to Stanhope Gate, Mayfair"
"LINESTRING (-0.148105 51.514759,-0.135777 51.51953", "From Marylebone Lane, Marylebone to Charlotte Street, Fitzrovia"
"LINESTRING (-0.144228 51.518117,-0.135777 51.51953", "From Broadcasting House, Marylebone to Charlotte Street, Fitzrovia"
"LINESTRING (-0.143613 51.523518,-0.135777 51.51953", "From Bolsover Street, Fitzrovia to Charlotte Street, Fitzrovia"
"LINESTRING (-0.148105 51.514759,-0.135777 51.51953", "From Marylebone Lane, Marylebone to Charlotte Street, Fitzrovia"
"LINESTRING (-0.139016 51.520994,-0.135777 51.51953", "From Howland Street, Fitzrovia to Charlotte Street, Fitzrovia"
"LINESTRING (-0.139016 51.520994,-0.135777 51.51953", "From Howland Street, Fitzrovia to Charlotte Street, Fitzrovia"
"LINESTRING (-0.153645 51.512911,-0.135777 51.51953", "From North Audley Street, Mayfair to Charlotte Street, Fitzrovia"
"LINESTRING (-0.148105 51.514759,-0.135777 51.51953", "From Marylebone Lane, Marylebone to Charlotte Street, Fitzrovia"
"LINESTRING (-0.147624 51.49395,-0.131213 51.513103", "From Eccleston Place, Victoria to Frith Street, Soho"
"LINESTRING (-0.132053 51.518587,-0.131213 51.513103", "From Bayley Street , Bloomsbury to Frith Street, Soho"
"LINESTRING (-0.118677 51.5338,-0.131213 51.513103", "From Killick Street, King's Cross to Frith Street, Soho"
"LINESTRING (-0.150481 51.51217,-0.131213 51.513103", "From Grosvenor Square, Mayfair to Frith Street, Soho"
"LINESTRING (-0.169249 51.515953,-0.131213 51.513103", "From Southwick Street, Paddington to Frith Street, Soho"
"LINESTRING (-0.113001 51.50486,-0.131213 51.513103", "From Waterloo Road, South Bank to Frith Street, Soho"
"LINESTRING (-0.105344 51.515059,-0.131213 51.513103", "From St. Bride Street, Holborn to Frith Street, Soho"
"LINESTRING (-0.119643 51.511756,-0.131213 51.513103", "From Wellington Street , Strand to Frith Street, Soho"
"LINESTRING (-0.075375 51.528187,-0.131213 51.513103", "From Columbia Road, Shoreditch to Frith Street, Soho"
"LINESTRING (-0.13225 51.528833,-0.131213 51.513103", "From Doric Way , Somers Town to Frith Street, Soho"
"LINESTRING (-0.102757 51.536384,-0.131213 51.513103", "From Islington Green, Angel to Frith Street, Soho"
"LINESTRING (-0.077121 51.511594,-0.131213 51.513103", "From Crosswall, Tower to Frith Street, Soho"
"LINESTRING (-0.123509 51.52625,-0.131213 51.513103", "From Tavistock Place, Bloomsbury to Frith Street, Soho"
"LINESTRING (-0.108657 51.51795,-0.131213 51.513103", "From Holborn Circus, Holborn to Frith Street, Soho"
"LINESTRING (-0.116191 51.535467,-0.131213 51.513103", "From Carnegie Street, King's Cross to Frith Street, Soho"
"LINESTRING (-0.108657 51.51795,-0.131213 51.513103", "From Holborn Circus, Holborn to Frith Street, Soho"
"LINESTRING (-0.131213 51.513103,-0.131213 51.513103", "From Frith Street, Soho to Frith Street, Soho"
"LINESTRING (-0.135635 51.488226,-0.131213 51.513103", "From St. George's Square, Pimlico to Frith Street, Soho"
"LINESTRING (-0.124807 51.53724,-0.131213 51.513103", "From Handyside Street, King's Cross to Frith Street, Soho"
"LINESTRING (-0.096317 51.526008,-0.131213 51.513103", "From Finsbury Leisure Centre, St. Luke's to Frith Street, Soho"
"LINESTRING (-0.103132 51.498744,-0.131213 51.513103", "From LSBU (Borough Road), Elephant & Castle to Frith Street, Soho"
"LINESTRING (-0.147624 51.49395,-0.131213 51.513103", "From Eccleston Place, Victoria to Frith Street, Soho"
"LINESTRING (-0.124121 51.523418,-0.131213 51.513103", "From Russell Square Station, Bloomsbury to Frith Street, Soho"
"LINESTRING (-0.119643 51.511756,-0.131213 51.513103", "From Wellington Street , Strand to Frith Street, Soho"
"LINESTRING (-0.077121 51.511594,-0.131213 51.513103", "From Crosswall, Tower to Frith Street, Soho"
"LINESTRING (-0.055846 51.499169,-0.131213 51.513103", "From Rotherhithe Roundabout, Rotherhithe to Frith Street, Soho"
"LINESTRING (-0.091938 51.492807,-0.131213 51.513103", "From Victory Place, Walworth to Frith Street, Soho"
"LINESTRING (-0.228188 51.494499,-0.192404 51.496481", "From Southerton Road, Hammersmith to Marloes Road, Kensington"
"LINESTRING (-0.193068 51.500397,-0.192404 51.496481", "From Wright's Lane, Kensington to Marloes Road, Kensington"
"LINESTRING (-0.222456 51.488144,-0.192404 51.496481", "From Beryl Road, Hammersmith to Marloes Road, Kensington"
"LINESTRING (-0.193068 51.500397,-0.192404 51.496481", "From Wright's Lane, Kensington to Marloes Road, Kensington"
"LINESTRING (-0.191462 51.501364,-0.192404 51.496481", "From Derry Street, Kensington to Marloes Road, Kensington"
"LINESTRING (-0.124749 51.509462,-0.121394 51.493699", "From William IV Street, Strand to Fire Brigade Pier, Vauxhall"
"LINESTRING (-0.122492 51.486343,-0.121394 51.493699", "From Kennington Lane Rail Bridge, Vauxhall to Fire Brigade Pier, Vauxhall"
"LINESTRING (-0.116625 51.486965,-0.121394 51.493699", "From Vauxhall Street, Vauxhall to Fire Brigade Pier, Vauxhall"
"LINESTRING (-0.111435 51.48894,-0.121394 51.493699", "From Kennington Cross, Kennington to Fire Brigade Pier, Vauxhall"
"LINESTRING (-0.130458 51.494816,-0.121394 51.493699", "From Horseferry Road, Westminster to Fire Brigade Pier, Vauxhall"
"LINESTRING (-0.174971 51.485121,-0.121394 51.493699", "From The Vale, Chelsea to Fire Brigade Pier, Vauxhall"
"LINESTRING (-0.114686 51.506133,-0.121394 51.493699", "From Belvedere Road 1, South Bank to Fire Brigade Pier, Vauxhall"
"LINESTRING (-0.124642 51.481747,-0.121394 51.493699", "From South Lambeth Road, Vauxhall to Fire Brigade Pier, Vauxhall"
"LINESTRING (-0.123179 51.506543,-0.121394 51.493699", "From Whitehall Place, Strand to Fire Brigade Pier, Vauxhall"
"LINESTRING (-0.111435 51.48894,-0.121394 51.493699", "From Kennington Cross, Kennington to Fire Brigade Pier, Vauxhall"
"LINESTRING (-0.129925 51.493072,-0.121723 51.510701", "From Vincent Street, Pimlico to Southampton Street, Strand"
"LINESTRING (-0.183165 51.474665,-0.121723 51.510701", "From Imperial Wharf Station, Sands End to Southampton Street, Strand"
"LINESTRING (-0.06691 51.507131,-0.121723 51.510701", "From Nesham Street, Wapping to Southampton Street, Strand"
"LINESTRING (-0.132053 51.518587,-0.121723 51.510701", "From Bayley Street , Bloomsbury to Southampton Street, Strand"
"LINESTRING (-0.091938 51.492807,-0.121723 51.510701", "From Victory Place, Walworth to Southampton Street, Strand"
"LINESTRING (-0.132053 51.518587,-0.121723 51.510701", "From Bayley Street , Bloomsbury to Southampton Street, Strand"
"LINESTRING (-0.122492 51.486343,-0.121723 51.510701", "From Kennington Lane Rail Bridge, Vauxhall to Southampton Street, Strand"
"LINESTRING (-0.038775 51.516,-0.121723 51.510701", "From Aston Street, Stepney to Southampton Street, Strand"
"LINESTRING (-0.132053 51.518587,-0.121723 51.510701", "From Bayley Street , Bloomsbury to Southampton Street, Strand"
"LINESTRING (-0.055846 51.499169,-0.121723 51.510701", "From Rotherhithe Roundabout, Rotherhithe to Southampton Street, Strand"
"LINESTRING (-0.038775 51.516,-0.121723 51.510701", "From Aston Street, Stepney to Southampton Street, Strand"
"LINESTRING (-0.121723 51.510701,-0.121723 51.510701", "From Southampton Street, Strand to Southampton Street, Strand"
"LINESTRING (-0.174554 51.499917,-0.155757 51.51013", "From Exhibition Road, Knightsbridge to Upper Grosvenor Street, Mayfair"
"LINESTRING (-0.151296 51.50923,-0.155757 51.51013", "From South Audley Street, Mayfair to Upper Grosvenor Street, Mayfair"
"LINESTRING (-0.131213 51.513103,-0.068856 51.521776", "From Frith Street, Soho to Buxton Street 1, Shoreditch"
"LINESTRING (-0.019355 51.496137,-0.068856 51.521776", "From Millharbour, Millwall to Buxton Street 1, Shoreditch"
"LINESTRING (-0.05438 51.520019,-0.068856 51.521776", "From Ansell House, Stepney to Buxton Street 1, Shoreditch"
"LINESTRING (-0.120202 51.523346,-0.068856 51.521776", "From Guilford Street , Bloomsbury to Buxton Street 1, Shoreditch"
"LINESTRING (-0.079249 51.518908,-0.068856 51.521776", "From Brushfield Street, Liverpool Street to Buxton Street 1, Shoreditch"
