"LINESTRING (-0.057544 51.504749,-0.017676 51.503083", "From Wapping Lane, Wapping to Upper Bank Street, Canary Wharf"
"LINESTRING (-0.057544 51.504749,-0.017676 51.503083", "From Wapping Lane, Wapping to Upper Bank Street, Canary Wharf"
"LINESTRING (-0.157275 51.510017,-0.218337 51.506256", "From Park Lane , Hyde Park to Westfield Southern Terrace ,Shepherd's Bush"
"LINESTRING (-0.157275 51.510017,-0.218337 51.506256", "From Park Lane , Hyde Park to Westfield Southern Terrace ,Shepherd's Bush"
"LINESTRING (-0.216016 51.509224,-0.218337 51.506256", "From Rifle Place, Avondale to Westfield Southern Terrace ,Shepherd's Bush"
"LINESTRING (-0.216016 51.509224,-0.218337 51.506256", "From Rifle Place, Avondale to Westfield Southern Terrace ,Shepherd's Bush"
"LINESTRING (-0.133201 51.512515,-0.141728 51.539099", "From Wardour Street, Soho to Greenland Road, Camden Town"
"LINESTRING (-0.14326 51.541007,-0.141728 51.539099", "From Hawley Crescent, Camden Town to Greenland Road, Camden Town"
"LINESTRING (-0.083353 51.529537,-0.141728 51.539099", "From Fanshaw Street, Hoxton to Greenland Road, Camden Town"
"LINESTRING (-0.15352 51.503117,-0.141728 51.539099", "From Hyde Park Corner, Hyde Park to Greenland Road, Camden Town"
"LINESTRING (-0.132053 51.518587,-0.141728 51.539099", "From Bayley Street , Bloomsbury to Greenland Road, Camden Town"
"LINESTRING (-0.13558 51.513684,-0.141728 51.539099", "From Broadwick Street, Soho to Greenland Road, Camden Town"
"LINESTRING (-0.131961 51.508446,-0.141728 51.539099", "From Charles II Street, West End to Greenland Road, Camden Town"
"LINESTRING (-0.141728 51.539099,-0.141728 51.539099", "From Greenland Road, Camden Town to Greenland Road, Camden Town"
"LINESTRING (-0.132053 51.518587,-0.141728 51.539099", "From Bayley Street , Bloomsbury to Greenland Road, Camden Town"
"LINESTRING (-0.132053 51.518587,-0.141728 51.539099", "From Bayley Street , Bloomsbury to Greenland Road, Camden Town"
"LINESTRING (-0.123616 51.529943,-0.141728 51.539099", "From Belgrove Street , King's Cross to Greenland Road, Camden Town"
"LINESTRING (-0.141728 51.539099,-0.141728 51.539099", "From Greenland Road, Camden Town to Greenland Road, Camden Town"
"LINESTRING (-0.133201 51.512515,-0.141728 51.539099", "From Wardour Street, Soho to Greenland Road, Camden Town"
"LINESTRING (-0.141728 51.539099,-0.141728 51.539099", "From Greenland Road, Camden Town to Greenland Road, Camden Town"
"LINESTRING (-0.133952 51.536264,-0.141728 51.539099", "From Royal College Street, Camden Town to Greenland Road, Camden Town"
"LINESTRING (-0.132053 51.518587,-0.141728 51.539099", "From Bayley Street , Bloomsbury to Greenland Road, Camden Town"
"LINESTRING (-0.141728 51.539099,-0.141728 51.539099", "From Greenland Road, Camden Town to Greenland Road, Camden Town"
"LINESTRING (-0.132328 51.515631,-0.141728 51.539099", "From Soho Square , Soho to Greenland Road, Camden Town"
"LINESTRING (-0.14326 51.541007,-0.141728 51.539099", "From Hawley Crescent, Camden Town to Greenland Road, Camden Town"
"LINESTRING (-0.142844 51.506613,-0.18119 51.485587", "From Green Park Station, Mayfair to Limerston Street, West Chelsea"
"LINESTRING (-0.174347 51.476964,-0.18119 51.485587", "From Battersea Church Road, Battersea to Limerston Street, West Chelsea"
"LINESTRING (-0.125674 51.491884,-0.18119 51.485587", "From Millbank Tower, Pimlico to Limerston Street, West Chelsea"
"LINESTRING (-0.142844 51.506613,-0.18119 51.485587", "From Green Park Station, Mayfair to Limerston Street, West Chelsea"
"LINESTRING (-0.116688 51.520596,-0.18119 51.485587", "From Theobald's Road , Holborn to Limerston Street, West Chelsea"
"LINESTRING (-0.142844 51.506613,-0.18119 51.485587", "From Green Park Station, Mayfair to Limerston Street, West Chelsea"
"LINESTRING (-0.125674 51.491884,-0.18119 51.485587", "From Millbank Tower, Pimlico to Limerston Street, West Chelsea"
"LINESTRING (-0.131961 51.508446,-0.18119 51.485587", "From Charles II Street, West End to Limerston Street, West Chelsea"
"LINESTRING (-0.141923 51.489856,-0.18119 51.485587", "From Warwick Square, Pimlico to Limerston Street, West Chelsea"
"LINESTRING (-0.174347 51.476964,-0.18119 51.485587", "From Battersea Church Road, Battersea to Limerston Street, West Chelsea"
"LINESTRING (-0.09315 51.53356,-0.09315 51.53356", "From Eagle Wharf Road, Hoxton to Eagle Wharf Road, Hoxton"
"LINESTRING (-0.138231 51.525542,-0.09315 51.53356", "From Hampstead Road, Euston to Eagle Wharf Road, Hoxton"
"LINESTRING (-0.069743 51.528222,-0.09315 51.53356", "From Wellington Row, Bethnal Green to Eagle Wharf Road, Hoxton"
"LINESTRING (-0.10548 51.532199,-0.09315 51.53356", "From Torrens Street, Angel to Eagle Wharf Road, Hoxton"
"LINESTRING (-0.070133 51.515231,-0.09315 51.53356", "From Central House, Whitechapel to Eagle Wharf Road, Hoxton"
"LINESTRING (-0.062546 51.535678,-0.09315 51.53356", "From Regent's Row , Haggerston to Eagle Wharf Road, Hoxton"
"LINESTRING (-0.062546 51.535678,-0.09315 51.53356", "From Regent's Row , Haggerston to Eagle Wharf Road, Hoxton"
"LINESTRING (-0.062546 51.535678,-0.09315 51.53356", "From Regent's Row , Haggerston to Eagle Wharf Road, Hoxton"
"LINESTRING (-0.058005 51.527152,-0.09315 51.53356", "From Pott Street, Bethnal Green to Eagle Wharf Road, Hoxton"
"LINESTRING (-0.09315 51.53356,-0.09315 51.53356", "From Eagle Wharf Road, Hoxton to Eagle Wharf Road, Hoxton"
"LINESTRING (-0.096317 51.526008,-0.09315 51.53356", "From Finsbury Leisure Centre, St. Luke's to Eagle Wharf Road, Hoxton"
"LINESTRING (-0.06555 51.528681,-0.09315 51.53356", "From Durant Street, Bethnal Green to Eagle Wharf Road, Hoxton"
"LINESTRING (-0.079201 51.537277,-0.09315 51.53356", "From Hertford Road, De Beauvoir Town to Eagle Wharf Road, Hoxton"
"LINESTRING (-0.070133 51.515231,-0.09315 51.53356", "From Central House, Whitechapel to Eagle Wharf Road, Hoxton"
"LINESTRING (-0.066035 51.531864,-0.09315 51.53356", "From Goldsmith's Row, Haggerston to Eagle Wharf Road, Hoxton"
"LINESTRING (-0.033085 51.532513,-0.09315 51.53356", "From Ford Road, Old Ford to Eagle Wharf Road, Hoxton"
"LINESTRING (-0.069743 51.528222,-0.09315 51.53356", "From Wellington Row, Bethnal Green to Eagle Wharf Road, Hoxton"
"LINESTRING (-0.07813 51.526377,-0.09315 51.53356", "From Shoreditch High Street, Shoreditch to Eagle Wharf Road, Hoxton"
"LINESTRING (-0.062546 51.535678,-0.09315 51.53356", "From Regent's Row , Haggerston to Eagle Wharf Road, Hoxton"
"LINESTRING (-0.06797 51.504904,-0.022793 51.497304", "From Wapping High Street, Wapping to Alpha Grove, Millwall"
"LINESTRING (-0.026768 51.520398,-0.047548 51.528869", "From Ackroyd Drive, Bow to Globe Town Market, Bethnal Green"
"LINESTRING (-0.066078 51.514924,-0.047548 51.528869", "From LMU Commercial Road, Whitechapel to Globe Town Market, Bethnal Green"
"LINESTRING (-0.051394 51.520893,-0.047548 51.528869", "From Cleveland Way, Stepney to Globe Town Market, Bethnal Green"
"LINESTRING (-0.04667 51.521889,-0.047548 51.528869", "From Stepney Green Station, Stepney to Globe Town Market, Bethnal Green"
"LINESTRING (-0.089659 51.52548,-0.047548 51.528869", "From Old Street Station, St. Luke's to Globe Town Market, Bethnal Green"
"LINESTRING (-0.026768 51.520398,-0.047548 51.528869", "From Ackroyd Drive, Bow to Globe Town Market, Bethnal Green"
"LINESTRING (-0.054162 51.536424,-0.047548 51.528869", "From Victoria Park Road, Hackney Central to Globe Town Market, Bethnal Green"
"LINESTRING (-0.11655 51.51824,-0.047548 51.528869", "From Red Lion Street, Holborn to Globe Town Market, Bethnal Green"
"LINESTRING (-0.116628 51.500089,-0.047548 51.528869", "From Lambeth Palace Road, Waterloo to Globe Town Market, Bethnal Green"
"LINESTRING (-0.116628 51.500089,-0.047548 51.528869", "From Lambeth Palace Road, Waterloo to Globe Town Market, Bethnal Green"
"LINESTRING (-0.069543 51.525645,-0.057133 51.527607", "From Granby Street, Shoreditch to Hollybush Gardens, Bethnal Green"
"LINESTRING (-0.121328 51.517606,-0.057133 51.527607", "From Southampton Place, Holborn to Hollybush Gardens, Bethnal Green"
"LINESTRING (-0.02163 51.540311,-0.057133 51.527607", "From Monier Road, Hackney Wick to Hollybush Gardens, Bethnal Green"
"LINESTRING (-0.02163 51.540311,-0.057133 51.527607", "From Monier Road, Hackney Wick to Hollybush Gardens, Bethnal Green"
"LINESTRING (-0.069542 51.512363,-0.057133 51.527607", "From Leman Street, Aldgate to Hollybush Gardens, Bethnal Green"
"LINESTRING (-0.062697 51.518154,-0.057133 51.527607", "From New Road 1 , Whitechapel to Hollybush Gardens, Bethnal Green"
"LINESTRING (-0.02163 51.540311,-0.057133 51.527607", "From Monier Road, Hackney Wick to Hollybush Gardens, Bethnal Green"
"LINESTRING (-0.062697 51.518154,-0.057133 51.527607", "From New Road 1 , Whitechapel to Hollybush Gardens, Bethnal Green"
"LINESTRING (-0.062697 51.518154,-0.057133 51.527607", "From New Road 1 , Whitechapel to Hollybush Gardens, Bethnal Green"
"LINESTRING (-0.066035 51.531864,-0.057133 51.527607", "From Goldsmith's Row, Haggerston to Hollybush Gardens, Bethnal Green"
"LINESTRING (-0.066035 51.531864,-0.057133 51.527607", "From Goldsmith's Row, Haggerston to Hollybush Gardens, Bethnal Green"
"LINESTRING (-0.10454 51.505461,-0.102996 51.486929", "From Blackfriars Road, Southwark to Doddington Grove, Kennington"
"LINESTRING (-0.102091 51.500693,-0.102996 51.486929", "From Webber Street , Southwark to Doddington Grove, Kennington"
"LINESTRING (-0.10454 51.505461,-0.102996 51.486929", "From Blackfriars Road, Southwark to Doddington Grove, Kennington"
"LINESTRING (-0.128585 51.516118,-0.102996 51.486929", "From Earnshaw Street , Covent Garden to Doddington Grove, Kennington"
"LINESTRING (-0.116628 51.500089,-0.102996 51.486929", "From Lambeth Palace Road, Waterloo to Doddington Grove, Kennington"
"LINESTRING (-0.128585 51.516118,-0.102996 51.486929", "From Earnshaw Street , Covent Garden to Doddington Grove, Kennington"
"LINESTRING (-0.10454 51.505461,-0.102996 51.486929", "From Blackfriars Road, Southwark to Doddington Grove, Kennington"
"LINESTRING (-0.10454 51.505461,-0.102996 51.486929", "From Blackfriars Road, Southwark to Doddington Grove, Kennington"
"LINESTRING (-0.102996 51.486929,-0.102996 51.486929", "From Doddington Grove, Kennington to Doddington Grove, Kennington"
"LINESTRING (-0.102091 51.500693,-0.102996 51.486929", "From Webber Street , Southwark to Doddington Grove, Kennington"
"LINESTRING (-0.10454 51.505461,-0.102996 51.486929", "From Blackfriars Road, Southwark to Doddington Grove, Kennington"
"LINESTRING (-0.10044 51.498898,-0.102996 51.486929", "From Borough Road, Elephant & Castle to Doddington Grove, Kennington"
"LINESTRING (-0.145393 51.542138,-0.147983 51.519167", "From Castlehaven Road, Camden Town to New Cavendish Street, Marylebone"
"LINESTRING (-0.147983 51.519167,-0.147983 51.519167", "From New Cavendish Street, Marylebone to New Cavendish Street, Marylebone"
"LINESTRING (-0.147983 51.519167,-0.147983 51.519167", "From New Cavendish Street, Marylebone to New Cavendish Street, Marylebone"
"LINESTRING (-0.147983 51.519167,-0.147983 51.519167", "From New Cavendish Street, Marylebone to New Cavendish Street, Marylebone"
"LINESTRING (-0.120718 51.511968,-0.147983 51.519167", "From Tavistock Street, Covent Garden to New Cavendish Street, Marylebone"
"LINESTRING (-0.138019 51.524438,-0.147983 51.519167", "From Warren Street Station, Euston to New Cavendish Street, Marylebone"
"LINESTRING (-0.128377 51.523673,-0.147983 51.519167", "From Bedford Way, Bloomsbury to New Cavendish Street, Marylebone"
"LINESTRING (-0.138019 51.524438,-0.147983 51.519167", "From Warren Street Station, Euston to New Cavendish Street, Marylebone"
"LINESTRING (-0.145393 51.542138,-0.147983 51.519167", "From Castlehaven Road, Camden Town to New Cavendish Street, Marylebone"
"LINESTRING (-0.120718 51.511968,-0.147983 51.519167", "From Tavistock Street, Covent Garden to New Cavendish Street, Marylebone"
"LINESTRING (-0.129925 51.493072,-0.19096 51.51244", "From Vincent Street, Pimlico to Ilchester Gardens, Bayswater"
"LINESTRING (-0.149569 51.50274,-0.19096 51.51244", "From Wellington Arch, Hyde Park to Ilchester Gardens, Bayswater"
"LINESTRING (-0.157275 51.510017,-0.19096 51.51244", "From Park Lane , Hyde Park to Ilchester Gardens, Bayswater"
"LINESTRING (-0.159237 51.501855,-0.19096 51.51244", "From Seville Street, Knightsbridge to Ilchester Gardens, Bayswater"
"LINESTRING (-0.213872 51.51687,-0.19096 51.51244", "From St. Mark's Road, North Kensington to Ilchester Gardens, Bayswater"
"LINESTRING (-0.157275 51.510017,-0.19096 51.51244", "From Park Lane , Hyde Park to Ilchester Gardens, Bayswater"
"LINESTRING (-0.157275 51.510017,-0.19096 51.51244", "From Park Lane , Hyde Park to Ilchester Gardens, Bayswater"
"LINESTRING (-0.129925 51.493072,-0.19096 51.51244", "From Vincent Street, Pimlico to Ilchester Gardens, Bayswater"
"LINESTRING (-0.191351 51.513489,-0.19096 51.51244", "From Princes Square, Bayswater to Ilchester Gardens, Bayswater"
"LINESTRING (-0.158456 51.502953,-0.19096 51.51244", "From Albert Gate, Hyde Park to Ilchester Gardens, Bayswater"
"LINESTRING (-0.191351 51.513489,-0.19096 51.51244", "From Princes Square, Bayswater to Ilchester Gardens, Bayswater"
"LINESTRING (-0.213872 51.51687,-0.19096 51.51244", "From St. Mark's Road, North Kensington to Ilchester Gardens, Bayswater"
"LINESTRING (-0.108657 51.51795,-0.19096 51.51244", "From Holborn Circus, Holborn to Ilchester Gardens, Bayswater"
"LINESTRING (-0.149569 51.50274,-0.19096 51.51244", "From Wellington Arch, Hyde Park to Ilchester Gardens, Bayswater"
"LINESTRING (-0.174554 51.499917,-0.19096 51.51244", "From Exhibition Road, Knightsbridge to Ilchester Gardens, Bayswater"
"LINESTRING (-0.158456 51.502953,-0.19096 51.51244", "From Albert Gate, Hyde Park to Ilchester Gardens, Bayswater"
"LINESTRING (-0.196422 51.509353,-0.19096 51.51244", "From Notting Hill Gate Station, Notting Hill to Ilchester Gardens, Bayswater"
"LINESTRING (-0.197609 51.483911,-0.19096 51.51244", "From Halford Road, West Kensington to Ilchester Gardens, Bayswater"
"LINESTRING (-0.202608 51.51632,-0.19096 51.51244", "From All Saints Church, Portobello to Ilchester Gardens, Bayswater"
"LINESTRING (-0.108657 51.51795,-0.19096 51.51244", "From Holborn Circus, Holborn to Ilchester Gardens, Bayswater"
"LINESTRING (-0.158456 51.502953,-0.19096 51.51244", "From Albert Gate, Hyde Park to Ilchester Gardens, Bayswater"
"LINESTRING (-0.159237 51.501855,-0.19096 51.51244", "From Seville Street, Knightsbridge to Ilchester Gardens, Bayswater"
"LINESTRING (-0.129925 51.493072,-0.19096 51.51244", "From Vincent Street, Pimlico to Ilchester Gardens, Bayswater"
"LINESTRING (-0.014582 51.490645,-0.014582 51.490645", "From Mudchute DLR, Cubitt Town to Mudchute DLR, Cubitt Town"
"LINESTRING (-0.014582 51.490645,-0.014582 51.490645", "From Mudchute DLR, Cubitt Town to Mudchute DLR, Cubitt Town"
"LINESTRING (-0.009001 51.487129,-0.014582 51.490645", "From Saunders Ness Road, Cubitt Town to Mudchute DLR, Cubitt Town"
"LINESTRING (-0.025996 51.509303,-0.014582 51.490645", "From Westferry DLR, Limehouse to Mudchute DLR, Cubitt Town"
"LINESTRING (-0.114605 51.495656,-0.08497 51.50964", "From Sail Street, Vauxhall to Monument Street, Monument"
"LINESTRING (-0.114605 51.495656,-0.08497 51.50964", "From Sail Street, Vauxhall to Monument Street, Monument"
"LINESTRING (-0.08497 51.50964,-0.08497 51.50964", "From Monument Street, Monument to Monument Street, Monument"
"LINESTRING (-0.150481 51.51217,-0.08497 51.50964", "From Grosvenor Square, Mayfair to Monument Street, Monument"
"LINESTRING (-0.114605 51.495656,-0.08497 51.50964", "From Sail Street, Vauxhall to Monument Street, Monument"
"LINESTRING (-0.147478 51.492369,-0.08497 51.50964", "From Elizabeth Bridge, Victoria to Monument Street, Monument"
"LINESTRING (-0.114605 51.495656,-0.08497 51.50964", "From Sail Street, Vauxhall to Monument Street, Monument"
"LINESTRING (-0.08497 51.50964,-0.08497 51.50964", "From Monument Street, Monument to Monument Street, Monument"
"LINESTRING (-0.147478 51.492369,-0.08497 51.50964", "From Elizabeth Bridge, Victoria to Monument Street, Monument"
"LINESTRING (-0.147478 51.492369,-0.08497 51.50964", "From Elizabeth Bridge, Victoria to Monument Street, Monument"
"LINESTRING (-0.09734 51.520841,-0.08497 51.50964", "From Aldersgate Street, Barbican to Monument Street, Monument"
"LINESTRING (-0.070329 51.539083,-0.0801 51.52959", "From Shoreditch Court, Haggerston to Hoxton Street, Hoxton"
"LINESTRING (-0.096317 51.526008,-0.0801 51.52959", "From Finsbury Leisure Centre, St. Luke's to Hoxton Street, Hoxton"
"LINESTRING (-0.042744 51.530326,-0.0801 51.52959", "From Twig Folly Bridge, Mile End to Hoxton Street, Hoxton"
"LINESTRING (-0.047784 51.51328,-0.0801 51.52959", "From Albert Gardens, Stepney to Hoxton Street, Hoxton"
"LINESTRING (-0.089659 51.52548,-0.0801 51.52959", "From Old Street Station, St. Luke's to Hoxton Street, Hoxton"
"LINESTRING (-0.149035 51.481121,-0.179369 51.487196", "From Sopwith Way, Battersea Park to Drayton Gardens, West Chelsea"
"LINESTRING (-0.173881 51.494412,-0.179369 51.487196", "From South Kensington Station, South Kensington to Drayton Gardens, West Chelsea"
"LINESTRING (-0.173881 51.494412,-0.179369 51.487196", "From South Kensington Station, South Kensington to Drayton Gardens, West Chelsea"
"LINESTRING (-0.175407 51.462305,-0.179369 51.487196", "From Plough Terrace, Clapham Junction to Drayton Gardens, West Chelsea"
"LINESTRING (-0.135635 51.488226,-0.179369 51.487196", "From St. George's Square, Pimlico to Drayton Gardens, West Chelsea"
"LINESTRING (-0.16716 51.47518,-0.179369 51.487196", "From Surrey Lane, Battersea to Drayton Gardens, West Chelsea"
"LINESTRING (-0.215895 51.476885,-0.224303 51.506093", "From Finlay Street, Fulham to Westfield Library Corner, Shepherd's Bush"
"LINESTRING (-0.132224 51.49206,-0.224303 51.506093", "From Regency Street, Westminster to Westfield Library Corner, Shepherd's Bush"
"LINESTRING (-0.222456 51.488144,-0.224303 51.506093", "From Beryl Road, Hammersmith to Westfield Library Corner, Shepherd's Bush"
"LINESTRING (-0.191803 51.473611,-0.224303 51.506093", "From Sandilands Road, Walham Green to Westfield Library Corner, Shepherd's Bush"
"LINESTRING (-0.205279 51.487244,-0.224303 51.506093", "From Star Road, West Kensington to Westfield Library Corner, Shepherd's Bush"
"LINESTRING (-0.132224 51.49206,-0.224303 51.506093", "From Regency Street, Westminster to Westfield Library Corner, Shepherd's Bush"
"LINESTRING (-0.187402 51.51031,-0.18377 51.5171", "From Queensway, Kensington Gardens to Bishop's Bridge Road East, Bayswater"
"LINESTRING (-0.187402 51.51031,-0.18377 51.5171", "From Queensway, Kensington Gardens to Bishop's Bridge Road East, Bayswater"
"LINESTRING (-0.124749 51.509462,-0.11934 51.531066", "From William IV Street, Strand to Northdown Street, King's Cross"
"LINESTRING (-0.062546 51.535678,-0.11934 51.531066", "From Regent's Row , Haggerston to Northdown Street, King's Cross"
"LINESTRING (-0.124749 51.509462,-0.11934 51.531066", "From William IV Street, Strand to Northdown Street, King's Cross"
"LINESTRING (-0.144165 51.510736,-0.117774 51.513875", "From Bruton Street, Mayfair to Kingsway Southbound, Strand"
"LINESTRING (-0.087459 51.528673,-0.117774 51.513875", "From East Road, Hoxton to Kingsway Southbound, Strand"
"LINESTRING (-0.116764 51.51362,-0.117774 51.513875", "From Houghton Street, Strand to Kingsway Southbound, Strand"
"LINESTRING (-0.211316 51.500088,-0.21985 51.493267", "From Russell Gardens, Olympia to Hammersmith Road, Hammersmith"
"LINESTRING (-0.21985 51.493267,-0.21985 51.493267", "From Hammersmith Road, Hammersmith to Hammersmith Road, Hammersmith"
"LINESTRING (-0.205876 51.475698,-0.21985 51.493267", "From Chesilton Road, Fulham to Hammersmith Road, Hammersmith"
"LINESTRING (-0.108657 51.51795,-0.21985 51.493267", "From Holborn Circus, Holborn to Hammersmith Road, Hammersmith"
"LINESTRING (-0.21985 51.493267,-0.21985 51.493267", "From Hammersmith Road, Hammersmith to Hammersmith Road, Hammersmith"
"LINESTRING (-0.132224 51.49206,-0.21985 51.493267", "From Regency Street, Westminster to Hammersmith Road, Hammersmith"
"LINESTRING (-0.082422 51.516154,-0.21985 51.493267", "From Wormwood Street, Liverpool Street to Hammersmith Road, Hammersmith"
"LINESTRING (-0.21985 51.493267,-0.21985 51.493267", "From Hammersmith Road, Hammersmith to Hammersmith Road, Hammersmith"
"LINESTRING (-0.21985 51.493267,-0.21985 51.493267", "From Hammersmith Road, Hammersmith to Hammersmith Road, Hammersmith"
"LINESTRING (-0.132224 51.49206,-0.21985 51.493267", "From Regency Street, Westminster to Hammersmith Road, Hammersmith"
"LINESTRING (-0.169249 51.515953,-0.21985 51.493267", "From Southwick Street, Paddington to Hammersmith Road, Hammersmith"
"LINESTRING (-0.209378 51.489591,-0.199783 51.472817", "From Vereker Road, West Kensington to Parson's Green , Parson's Green"
"LINESTRING (-0.206827 51.467601,-0.199783 51.472817", "From Ranelagh Gardens, Fulham to Parson's Green , Parson's Green"
"LINESTRING (-0.162727 51.489932,-0.199783 51.472817", "From Royal Avenue 1, Chelsea to Parson's Green , Parson's Green"
"LINESTRING (-0.194116 51.479932,-0.199783 51.472817", "From Fulham Broadway, Walham Green to Parson's Green , Parson's Green"
"LINESTRING (-0.193254 51.476259,-0.199783 51.472817", "From Eel Brook Common, Walham Green to Parson's Green , Parson's Green"
"LINESTRING (-0.196274 51.46904,-0.199783 51.472817", "From Peterborough Road, Sands End to Parson's Green , Parson's Green"
"LINESTRING (-0.170703 51.470847,-0.199783 51.472817", "From Simpson Street, Clapham Junction to Parson's Green , Parson's Green"
"LINESTRING (-0.127554 51.493978,-0.199783 51.472817", "From Page Street, Westminster to Parson's Green , Parson's Green"
"LINESTRING (-0.173881 51.494412,-0.199783 51.472817", "From South Kensington Station, South Kensington to Parson's Green , Parson's Green"
"LINESTRING (-0.187278 51.475142,-0.20782 51.473471", "From Imperial Road, Sands End to Fulham Park Road, Fulham"
"LINESTRING (-0.223852 51.483732,-0.20782 51.473471", "From Rainville Road, Hammersmith to Fulham Park Road, Fulham"
"LINESTRING (-0.193254 51.476259,-0.20782 51.473471", "From Eel Brook Common, Walham Green to Fulham Park Road, Fulham"
"LINESTRING (-0.223616 51.485743,-0.20782 51.473471", "From Manbre Road, Hammersmith to Fulham Park Road, Fulham"
"LINESTRING (-0.193254 51.476259,-0.20782 51.473471", "From Eel Brook Common, Walham Green to Fulham Park Road, Fulham"
"LINESTRING (-0.201968 51.475089,-0.20782 51.473471", "From Parsons Green Station, Parsons Green to Fulham Park Road, Fulham"
"LINESTRING (-0.236769 51.494223,-0.20782 51.473471", "From Ravenscourt Park Station, Hammersmith to Fulham Park Road, Fulham"
"LINESTRING (-0.20782 51.473471,-0.20782 51.473471", "From Fulham Park Road, Fulham to Fulham Park Road, Fulham"
"LINESTRING (-0.061698 51.4954,-0.228188 51.494499", "From Clements Road, Bermondsey to Southerton Road, Hammersmith"
"LINESTRING (-0.125674 51.491884,-0.228188 51.494499", "From Millbank Tower, Pimlico to Southerton Road, Hammersmith"
"LINESTRING (-0.125674 51.491884,-0.228188 51.494499", "From Millbank Tower, Pimlico to Southerton Road, Hammersmith"
"LINESTRING (-0.061698 51.4954,-0.228188 51.494499", "From Clements Road, Bermondsey to Southerton Road, Hammersmith"
"LINESTRING (-0.179077 51.495592,-0.228188 51.494499", "From Natural History Museum, South Kensington to Southerton Road, Hammersmith"
"LINESTRING (-0.234055 51.492736,-0.223616 51.485743", "From Hammersmith Town Hall, Hammersmith to Manbre Road, Hammersmith"
"LINESTRING (-0.209378 51.489591,-0.223616 51.485743", "From Vereker Road, West Kensington to Manbre Road, Hammersmith"
"LINESTRING (-0.116628 51.500089,-0.124642 51.481747", "From Lambeth Palace Road, Waterloo to South Lambeth Road, Vauxhall"
"LINESTRING (-0.118256 51.47659,-0.124642 51.481747", "From Albert Square, Stockwell to South Lambeth Road, Vauxhall"
"LINESTRING (-0.125674 51.491884,-0.124642 51.481747", "From Millbank Tower, Pimlico to South Lambeth Road, Vauxhall"
"LINESTRING (-0.156876 51.49313,-0.124642 51.481747", "From Sedding Street, Sloane Square to South Lambeth Road, Vauxhall"
"LINESTRING (-0.061698 51.4954,-0.225787 51.514767", "From Clements Road, Bermondsey to BBC White City, White City"
"LINESTRING (-0.224103 51.509158,-0.225787 51.514767", "From Westfield Ariel Way, White City to BBC White City, White City"
"LINESTRING (-0.179702 51.499428,-0.225787 51.514767", "From Imperial College, Knightsbridge to BBC White City, White City"
"LINESTRING (-0.133972 51.472993,-0.133972 51.472993", "From Union Grove, Wandsworth Road to Union Grove, Wandsworth Road"
"LINESTRING (-0.133972 51.472993,-0.133972 51.472993", "From Union Grove, Wandsworth Road to Union Grove, Wandsworth Road"
"LINESTRING (-0.117495 51.498241,-0.133972 51.472993", "From Archbishop's Park, Waterloo to Union Grove, Wandsworth Road"
"LINESTRING (-0.133972 51.472993,-0.133972 51.472993", "From Union Grove, Wandsworth Road to Union Grove, Wandsworth Road"
"LINESTRING (-0.133972 51.472993,-0.133972 51.472993", "From Union Grove, Wandsworth Road to Union Grove, Wandsworth Road"
"LINESTRING (-0.122831 51.472509,-0.133972 51.472993", "From Binfield Road, Stockwell to Union Grove, Wandsworth Road"
"LINESTRING (-0.122806 51.490435,-0.133972 51.472993", "From Albert Embankment, Vauxhall to Union Grove, Wandsworth Road"
"LINESTRING (-0.172078 51.482567,-0.133972 51.472993", "From Danvers Street, West Chelsea to Union Grove, Wandsworth Road"
"LINESTRING (-0.169821 51.466633,-0.133972 51.472993", "From Falcon Road, Clapham Junction to Union Grove, Wandsworth Road"
"LINESTRING (-0.141812 51.469259,-0.133972 51.472993", "From Wandsworth Rd, Isley Court, Wandsworth Road to Union Grove, Wandsworth Road"
"LINESTRING (-0.122831 51.472509,-0.133972 51.472993", "From Binfield Road, Stockwell to Union Grove, Wandsworth Road"
