"LINESTRING (-0.139956 51.493573,-0.167894 51.493184", "From Queen Mother Sports Centre, Victoria to Sloane Avenue, Knightsbridge"
"LINESTRING (-0.158963 51.524517,-0.183118 51.515607", "From Park Road (Baker Street), The Regent's Park to Cleveland Gardens, Bayswater"
"LINESTRING (-0.18498 51.501737,-0.183118 51.515607", "From De Vere Gardens, Kensington to Cleveland Gardens, Bayswater"
"LINESTRING (-0.158264 51.514577,-0.183118 51.515607", "From Old Quebec Street, Marylebone to Cleveland Gardens, Bayswater"
"LINESTRING (-0.183118 51.515607,-0.183118 51.515607", "From Cleveland Gardens, Bayswater to Cleveland Gardens, Bayswater"
"LINESTRING (-0.183118 51.515607,-0.183118 51.515607", "From Cleveland Gardens, Bayswater to Cleveland Gardens, Bayswater"
"LINESTRING (-0.164207 51.517372,-0.183716 51.517932", "From Harrowby Street, Marylebone to Orsett Terrace, Bayswater"
"LINESTRING (-0.174411 51.511933,-0.183716 51.517932", "From Bayswater Road, Hyde Park to Orsett Terrace, Bayswater"
"LINESTRING (-0.183716 51.517932,-0.183716 51.517932", "From Orsett Terrace, Bayswater to Orsett Terrace, Bayswater"
"LINESTRING (-0.141923 51.489856,-0.159237 51.501855", "From Warwick Square, Pimlico to Seville Street, Knightsbridge"
"LINESTRING (-0.165164 51.514746,-0.159237 51.501855", "From Porchester Place, Paddington to Seville Street, Knightsbridge"
"LINESTRING (-0.167894 51.493184,-0.159237 51.501855", "From Sloane Avenue, Knightsbridge to Seville Street, Knightsbridge"
"LINESTRING (-0.167894 51.493184,-0.159237 51.501855", "From Sloane Avenue, Knightsbridge to Seville Street, Knightsbridge"
"LINESTRING (-0.089446 51.497382,-0.159237 51.501855", "From Great Dover Street, The Borough to Seville Street, Knightsbridge"
"LINESTRING (-0.167894 51.493184,-0.159237 51.501855", "From Sloane Avenue, Knightsbridge to Seville Street, Knightsbridge"
"LINESTRING (-0.167894 51.493184,-0.159237 51.501855", "From Sloane Avenue, Knightsbridge to Seville Street, Knightsbridge"
"LINESTRING (-0.132328 51.515631,-0.159237 51.501855", "From Soho Square , Soho to Seville Street, Knightsbridge"
"LINESTRING (-0.204815 51.484386,-0.159237 51.501855", "From Normand Park, West Kensington to Seville Street, Knightsbridge"
"LINESTRING (-0.161765 51.487964,-0.159237 51.501855", "From Ormonde Gate, Chelsea to Seville Street, Knightsbridge"
"LINESTRING (-0.167894 51.493184,-0.159237 51.501855", "From Sloane Avenue, Knightsbridge to Seville Street, Knightsbridge"
"LINESTRING (-0.167894 51.493184,-0.159237 51.501855", "From Sloane Avenue, Knightsbridge to Seville Street, Knightsbridge"
"LINESTRING (-0.174554 51.499917,-0.147624 51.49395", "From Exhibition Road, Knightsbridge to Eccleston Place, Victoria"
"LINESTRING (-0.14177 51.479501,-0.147624 51.49395", "From Battersea Park Road, Nine Elms to Eccleston Place, Victoria"
"LINESTRING (-0.117774 51.513875,-0.147624 51.49395", "From Kingsway Southbound, Strand to Eccleston Place, Victoria"
"LINESTRING (-0.187842 51.509908,-0.147624 51.49395", "From Black Lion Gate, Kensington Gardens to Eccleston Place, Victoria"
"LINESTRING (-0.150481 51.51217,-0.147624 51.49395", "From Grosvenor Square, Mayfair to Eccleston Place, Victoria"
"LINESTRING (-0.174653 51.527294,-0.147624 51.49395", "From St. John's Wood Road, St. John's Wood to Eccleston Place, Victoria"
"LINESTRING (-0.159169 51.475153,-0.147624 51.49395", "From Prince of Wales Drive, Battersea Park to Eccleston Place, Victoria"
"LINESTRING (-0.117495 51.498241,-0.147624 51.49395", "From Archbishop's Park, Waterloo to Eccleston Place, Victoria"
"LINESTRING (-0.124826 51.516226,-0.147624 51.49395", "From High Holborn , Covent Garden to Eccleston Place, Victoria"
"LINESTRING (-0.19617 51.490853,-0.147624 51.49395", "From Trebovir Road, Earl's Court to Eccleston Place, Victoria"
"LINESTRING (-0.179668 51.511654,-0.195455 51.500401", "From Lancaster Gate , Bayswater to Argyll Road, Kensington"
"LINESTRING (-0.195455 51.500401,-0.195455 51.500401", "From Argyll Road, Kensington to Argyll Road, Kensington"
"LINESTRING (-0.208888 51.5212,-0.195455 51.500401", "From Bevington Road West, North Kensington to Argyll Road, Kensington"
"LINESTRING (-0.170703 51.470847,-0.195455 51.500401", "From Simpson Street, Clapham Junction to Argyll Road, Kensington"
"LINESTRING (-0.205284 51.496712,-0.195455 51.500401", "From Warwick Road, Olympia to Argyll Road, Kensington"
"LINESTRING (-0.214594 51.510928,-0.195455 51.500401", "From Sirdar Road, Avondale to Argyll Road, Kensington"
"LINESTRING (-0.179702 51.499428,-0.195455 51.500401", "From Imperial College, Knightsbridge to Argyll Road, Kensington"
"LINESTRING (-0.179077 51.495592,-0.195455 51.500401", "From Natural History Museum, South Kensington to Argyll Road, Kensington"
"LINESTRING (-0.195455 51.500401,-0.195455 51.500401", "From Argyll Road, Kensington to Argyll Road, Kensington"
"LINESTRING (-0.165471 51.498884,-0.195455 51.500401", "From Montpelier Street, Knightsbridge to Argyll Road, Kensington"
"LINESTRING (-0.158264 51.514577,-0.195455 51.500401", "From Old Quebec Street, Marylebone to Argyll Road, Kensington"
"LINESTRING (-0.148105 51.514759,-0.165164 51.514746", "From Marylebone Lane, Marylebone to Porchester Place, Paddington"
"LINESTRING (-0.183165 51.474665,-0.165164 51.514746", "From Imperial Wharf Station, Sands End to Porchester Place, Paddington"
"LINESTRING (-0.17219 51.526448,-0.165164 51.514746", "From Lisson Grove, St. John's Wood to Porchester Place, Paddington"
"LINESTRING (-0.154106 51.517703,-0.165164 51.514746", "From George Street, Marylebone to Porchester Place, Paddington"
"LINESTRING (-0.165471 51.498884,-0.165164 51.514746", "From Montpelier Street, Knightsbridge to Porchester Place, Paddington"
"LINESTRING (-0.165164 51.514746,-0.165164 51.514746", "From Porchester Place, Paddington to Porchester Place, Paddington"
"LINESTRING (-0.170703 51.470847,-0.165164 51.514746", "From Simpson Street, Clapham Junction to Porchester Place, Paddington"
"LINESTRING (-0.211593 51.51323,-0.165164 51.514746", "From Clarendon Road, Avondale to Porchester Place, Paddington"
"LINESTRING (-0.15352 51.503117,-0.165164 51.514746", "From Hyde Park Corner, Hyde Park to Porchester Place, Paddington"
"LINESTRING (-0.145827 51.507326,-0.165164 51.514746", "From Clarges Street, Mayfair to Porchester Place, Paddington"
"LINESTRING (-0.187842 51.509908,-0.165164 51.514746", "From Black Lion Gate, Kensington Gardens to Porchester Place, Paddington"
"LINESTRING (-0.06142 51.532091,-0.108068 51.527842", "From Pritchard's Road, Bethnal Green to Hardwick Street, Clerkenwell"
"LINESTRING (-0.10454 51.505461,-0.108068 51.527842", "From Blackfriars Road, Southwark to Hardwick Street, Clerkenwell"
"LINESTRING (-0.106992 51.534504,-0.108068 51.527842", "From Liverpool Road (N1 Centre), Angel to Hardwick Street, Clerkenwell"
"LINESTRING (-0.093421 51.529154,-0.108068 51.527842", "From Windsor Terrace, Hoxton to Hardwick Street, Clerkenwell"
"LINESTRING (-0.174971 51.485121,-0.186753 51.491615", "From The Vale, Chelsea to Collingham Gardens, Earl's Court"
"LINESTRING (-0.20782 51.473471,-0.186753 51.491615", "From Fulham Park Road, Fulham to Collingham Gardens, Earl's Court"
"LINESTRING (-0.170329 51.477684,-0.186753 51.491615", "From Westbridge Road, Battersea to Collingham Gardens, Earl's Court"
"LINESTRING (-0.186753 51.491615,-0.186753 51.491615", "From Collingham Gardens, Earl's Court to Collingham Gardens, Earl's Court"
"LINESTRING (-0.179038 51.479573,-0.186753 51.491615", "From Lots Road, West Chelsea to Collingham Gardens, Earl's Court"
"LINESTRING (-0.18267 51.494185,-0.186753 51.491615", "From Gloucester Road Station, South Kensington to Collingham Gardens, Earl's Court"
"LINESTRING (-0.201968 51.475089,-0.186753 51.491615", "From Parsons Green Station, Parsons Green to Collingham Gardens, Earl's Court"
"LINESTRING (-0.20782 51.473471,-0.186753 51.491615", "From Fulham Park Road, Fulham to Collingham Gardens, Earl's Court"
"LINESTRING (-0.142943 51.496863,-0.173715 51.491211", "From Allington Street, Victoria to Sumner Place, South Kensington"
"LINESTRING (-0.183118 51.515607,-0.173715 51.491211", "From Cleveland Gardens, Bayswater to Sumner Place, South Kensington"
"LINESTRING (-0.139016 51.520994,-0.173715 51.491211", "From Howland Street, Fitzrovia to Sumner Place, South Kensington"
"LINESTRING (-0.166878 51.488023,-0.173715 51.491211", "From Flood Street, Chelsea to Sumner Place, South Kensington"
"LINESTRING (-0.20782 51.473471,-0.173715 51.491211", "From Fulham Park Road, Fulham to Sumner Place, South Kensington"
"LINESTRING (-0.120718 51.511968,-0.113001 51.50486", "From Tavistock Street, Covent Garden to Waterloo Road, South Bank"
"LINESTRING (-0.075459 51.509506,-0.113001 51.50486", "From Tower Gardens , Tower to Waterloo Road, South Bank"
"LINESTRING (-0.120718 51.511968,-0.113001 51.50486", "From Tavistock Street, Covent Garden to Waterloo Road, South Bank"
"LINESTRING (-0.144165 51.510736,-0.113001 51.50486", "From Bruton Street, Mayfair to Waterloo Road, South Bank"
"LINESTRING (-0.099141 51.512484,-0.113001 51.50486", "From Godliman Street, St. Paul's to Waterloo Road, South Bank"
"LINESTRING (-0.111257 51.514274,-0.113001 51.50486", "From Chancery Lane, Holborn to Waterloo Road, South Bank"
"LINESTRING (-0.102996 51.486929,-0.113001 51.50486", "From Doddington Grove, Kennington to Waterloo Road, South Bank"
"LINESTRING (-0.112031 51.49914,-0.113001 51.50486", "From Lambeth North Station, Waterloo to Waterloo Road, South Bank"
"LINESTRING (-0.144165 51.510736,-0.113001 51.50486", "From Bruton Street, Mayfair to Waterloo Road, South Bank"
"LINESTRING (-0.075459 51.509506,-0.113001 51.50486", "From Tower Gardens , Tower to Waterloo Road, South Bank"
"LINESTRING (-0.144165 51.510736,-0.113001 51.50486", "From Bruton Street, Mayfair to Waterloo Road, South Bank"
"LINESTRING (-0.144165 51.510736,-0.113001 51.50486", "From Bruton Street, Mayfair to Waterloo Road, South Bank"
"LINESTRING (-0.111257 51.514274,-0.113001 51.50486", "From Chancery Lane, Holborn to Waterloo Road, South Bank"
"LINESTRING (-0.091773 51.504627,-0.113001 51.50486", "From Hop Exchange, The Borough to Waterloo Road, South Bank"
"LINESTRING (-0.117122 51.490994,-0.113001 51.50486", "From Black Prince Road, Vauxhall to Waterloo Road, South Bank"
"LINESTRING (-0.129698 51.500703,-0.113001 51.50486", "From Storey's Gate, Westminster to Waterloo Road, South Bank"
"LINESTRING (-0.112031 51.49914,-0.113001 51.50486", "From Lambeth North Station, Waterloo to Waterloo Road, South Bank"
"LINESTRING (-0.144165 51.510736,-0.113001 51.50486", "From Bruton Street, Mayfair to Waterloo Road, South Bank"
"LINESTRING (-0.129698 51.500703,-0.113001 51.50486", "From Storey's Gate, Westminster to Waterloo Road, South Bank"
"LINESTRING (-0.170329 51.477684,-0.115057 51.512582", "From Westbridge Road, Battersea to Strand, Strand"
"LINESTRING (-0.189155 51.477292,-0.115057 51.512582", "From Michael Road, Walham Green to Strand, Strand"
"LINESTRING (-0.110121 51.488105,-0.115057 51.512582", "From Cleaver Street, Kennington to Strand, Strand"
"LINESTRING (-0.096496 51.517821,-0.115057 51.512582", "From Museum of London, Barbican to Strand, Strand"
"LINESTRING (-0.113001 51.50486,-0.115057 51.512582", "From Waterloo Road, South Bank to Strand, Strand"
"LINESTRING (-0.09294 51.511553,-0.115057 51.512582", "From Queen Street 1, Bank to Strand, Strand"
"LINESTRING (-0.110699 51.501444,-0.115057 51.512582", "From Baylis Road, Waterloo to Strand, Strand"
"LINESTRING (-0.190393 51.490163,-0.115057 51.512582", "From Bramham Gardens, Earl's Court to Strand, Strand"
"LINESTRING (-0.170329 51.477684,-0.115057 51.512582", "From Westbridge Road, Battersea to Strand, Strand"
"LINESTRING (-0.149186 51.490491,-0.115057 51.512582", "From Ebury Bridge, Pimlico to Strand, Strand"
"LINESTRING (-0.131213 51.513103,-0.079608 51.521668", "From Frith Street, Soho to Worship Street, Shoreditch"
"LINESTRING (-0.08299 51.53213,-0.079608 51.521668", "From Pitfield Street Central, Hoxton to Worship Street, Shoreditch"
"LINESTRING (-0.193487 51.513735,-0.079608 51.521668", "From Hereford Road, Bayswater to Worship Street, Shoreditch"
"LINESTRING (-0.131213 51.513103,-0.079608 51.521668", "From Frith Street, Soho to Worship Street, Shoreditch"
"LINESTRING (-0.058005 51.527152,-0.079608 51.521668", "From Pott Street, Bethnal Green to Worship Street, Shoreditch"
"LINESTRING (-0.089659 51.52548,-0.079608 51.521668", "From Old Street Station, St. Luke's to Worship Street, Shoreditch"
"LINESTRING (-0.086379 51.534042,-0.079608 51.521668", "From Shoreditch Park, Hoxton to Worship Street, Shoreditch"
"LINESTRING (-0.053558 51.511066,-0.079608 51.521668", "From Sutton Street, Shadwell to Worship Street, Shoreditch"
"LINESTRING (-0.193487 51.513735,-0.079608 51.521668", "From Hereford Road, Bayswater to Worship Street, Shoreditch"
"LINESTRING (-0.079201 51.537277,-0.079608 51.521668", "From Hertford Road, De Beauvoir Town to Worship Street, Shoreditch"
"LINESTRING (-0.086379 51.534042,-0.079608 51.521668", "From Shoreditch Park, Hoxton to Worship Street, Shoreditch"
"LINESTRING (-0.074284 51.539328,-0.079608 51.521668", "From Haggerston Road, Haggerston to Worship Street, Shoreditch"
"LINESTRING (-0.074284 51.539328,-0.079608 51.521668", "From Haggerston Road, Haggerston to Worship Street, Shoreditch"
"LINESTRING (-0.164393 51.516517,-0.188098 51.517919", "From Nutford Place, Marylebone to Gloucester Terrace, Bayswater"
"LINESTRING (-0.183846 51.523344,-0.188098 51.517919", "From Warwick Avenue Station, Maida Vale to Gloucester Terrace, Bayswater"
"LINESTRING (-0.175116 51.523353,-0.188098 51.517919", "From Frampton Street, Paddington to Gloucester Terrace, Bayswater"
"LINESTRING (-0.201554 51.512136,-0.188098 51.517919", "From Chepstow Villas, Notting Hill to Gloucester Terrace, Bayswater"
"LINESTRING (-0.121328 51.517606,-0.188098 51.517919", "From Southampton Place, Holborn to Gloucester Terrace, Bayswater"
"LINESTRING (-0.219486 51.512981,-0.188098 51.517919", "From Freston Road, Avondale to Gloucester Terrace, Bayswater"
"LINESTRING (-0.144664 51.538071,-0.188098 51.517919", "From Parkway, Camden Town to Gloucester Terrace, Bayswater"
"LINESTRING (-0.193764 51.508605,-0.188098 51.517919", "From Palace Gardens Terrace, Notting Hill to Gloucester Terrace, Bayswater"
"LINESTRING (-0.213872 51.51687,-0.188098 51.517919", "From St. Mark's Road, North Kensington to Gloucester Terrace, Bayswater"
"LINESTRING (-0.205991 51.501391,-0.188098 51.517919", "From Abbotsbury Road, Holland Park to Gloucester Terrace, Bayswater"
"LINESTRING (-0.208888 51.5212,-0.140947 51.49616", "From Bevington Road West, North Kensington to Ashley Place, Victoria"
"LINESTRING (-0.169249 51.515953,-0.140947 51.49616", "From Southwick Street, Paddington to Ashley Place, Victoria"
"LINESTRING (-0.132102 51.498125,-0.140947 51.49616", "From Abbey Orchard Street, Westminster to Ashley Place, Victoria"
"LINESTRING (-0.16716 51.47518,-0.140947 51.49616", "From Surrey Lane, Battersea to Ashley Place, Victoria"
"LINESTRING (-0.169249 51.515953,-0.140947 51.49616", "From Southwick Street, Paddington to Ashley Place, Victoria"
"LINESTRING (-0.172078 51.482567,-0.140947 51.49616", "From Danvers Street, West Chelsea to Ashley Place, Victoria"
"LINESTRING (-0.132845 51.489975,-0.140947 51.49616", "From Rampayne Street, Pimlico to Ashley Place, Victoria"
"LINESTRING (-0.140741 51.488057,-0.140947 51.49616", "From Alderney Street, Pimlico to Ashley Place, Victoria"
"LINESTRING (-0.130458 51.494816,-0.140947 51.49616", "From Horseferry Road, Westminster to Ashley Place, Victoria"
"LINESTRING (-0.132102 51.498125,-0.140947 51.49616", "From Abbey Orchard Street, Westminster to Ashley Place, Victoria"
"LINESTRING (-0.141923 51.489856,-0.141923 51.489856", "From Warwick Square, Pimlico to Warwick Square, Pimlico"
"LINESTRING (-0.159237 51.501855,-0.141923 51.489856", "From Seville Street, Knightsbridge to Warwick Square, Pimlico"
"LINESTRING (-0.172078 51.482567,-0.141923 51.489856", "From Danvers Street, West Chelsea to Warwick Square, Pimlico"
"LINESTRING (-0.144132 51.493204,-0.141923 51.489856", "From Belgrave Road, Victoria to Warwick Square, Pimlico"
"LINESTRING (-0.141334 51.492345,-0.141923 51.489856", "From Guildhouse Street, Victoria to Warwick Square, Pimlico"
"LINESTRING (-0.091773 51.504627,-0.141923 51.489856", "From Hop Exchange, The Borough to Warwick Square, Pimlico"
"LINESTRING (-0.134621 51.507424,-0.141923 51.489856", "From St. James's Square, St. James's to Warwick Square, Pimlico"
"LINESTRING (-0.144132 51.493204,-0.141923 51.489856", "From Belgrave Road, Victoria to Warwick Square, Pimlico"
"LINESTRING (-0.106408 51.530515,-0.141923 51.489856", "From Chadwell Street, Angel to Warwick Square, Pimlico"
"LINESTRING (-0.199135 51.468418,-0.141923 51.489856", "From Broomhouse Lane, Parsons Green to Warwick Square, Pimlico"
"LINESTRING (-0.191496 51.503157,-0.141923 51.489856", "From Kensington Church Street, Kensington to Warwick Square, Pimlico"
"LINESTRING (-0.158105 51.494645,-0.153645 51.512911", "From Cadogan Place, Knightsbridge to North Audley Street, Mayfair"
"LINESTRING (-0.179077 51.495592,-0.153645 51.512911", "From Natural History Museum, South Kensington to North Audley Street, Mayfair"
"LINESTRING (-0.09315 51.53356,-0.153645 51.512911", "From Eagle Wharf Road, Hoxton to North Audley Street, Mayfair"
"LINESTRING (-0.17677 51.530889,-0.153645 51.512911", "From Grove End Road, St. John's Wood to North Audley Street, Mayfair"
"LINESTRING (-0.09885 51.515418,-0.153645 51.512911", "From Newgate Street , St. Paul's to North Audley Street, Mayfair"
"LINESTRING (-0.173757 51.496471,-0.153645 51.512911", "From Exhibition Road Museums 1, South Kensington to North Audley Street, Mayfair"
"LINESTRING (-0.141327 51.520253,-0.153645 51.512911", "From Great Titchfield Street, Fitzrovia to North Audley Street, Mayfair"
"LINESTRING (-0.117974 51.494881,-0.153645 51.512911", "From Lambeth Road, Vauxhall to North Audley Street, Mayfair"
"LINESTRING (-0.124826 51.516226,-0.153645 51.512911", "From High Holborn , Covent Garden to North Audley Street, Mayfair"
"LINESTRING (-0.140947 51.49616,-0.153645 51.512911", "From Ashley Place, Victoria to North Audley Street, Mayfair"
"LINESTRING (-0.143495 51.509992,-0.153645 51.512911", "From Grafton Street, Mayfair to North Audley Street, Mayfair"
"LINESTRING (-0.157436 51.512276,-0.153645 51.512911", "From Green Street, Mayfair to North Audley Street, Mayfair"
"LINESTRING (-0.161765 51.487964,-0.153645 51.512911", "From Ormonde Gate, Chelsea to North Audley Street, Mayfair"
"LINESTRING (-0.08249 51.53558,-0.153645 51.512911", "From Pitfield Street North,Hoxton to North Audley Street, Mayfair"
"LINESTRING (-0.159237 51.501855,-0.152317 51.499412", "From Seville Street, Knightsbridge to Belgrave Square, Belgravia"
"LINESTRING (-0.150481 51.51217,-0.152317 51.499412", "From Grosvenor Square, Mayfair to Belgrave Square, Belgravia"
"LINESTRING (-0.159237 51.501855,-0.152317 51.499412", "From Seville Street, Knightsbridge to Belgrave Square, Belgravia"
"LINESTRING (-0.141334 51.492345,-0.152317 51.499412", "From Guildhouse Street, Victoria to Belgrave Square, Belgravia"
"LINESTRING (-0.112432 51.526599,-0.152317 51.499412", "From Margery Street, Clerkenwell to Belgrave Square, Belgravia"
"LINESTRING (-0.159237 51.501855,-0.152317 51.499412", "From Seville Street, Knightsbridge to Belgrave Square, Belgravia"
"LINESTRING (-0.159237 51.501855,-0.152317 51.499412", "From Seville Street, Knightsbridge to Belgrave Square, Belgravia"
"LINESTRING (-0.159237 51.501855,-0.152317 51.499412", "From Seville Street, Knightsbridge to Belgrave Square, Belgravia"
"LINESTRING (-0.159237 51.501855,-0.152317 51.499412", "From Seville Street, Knightsbridge to Belgrave Square, Belgravia"
"LINESTRING (-0.147478 51.492369,-0.152317 51.499412", "From Elizabeth Bridge, Victoria to Belgrave Square, Belgravia"
"LINESTRING (-0.172528 51.533043,-0.165842 51.522029", "From Wellington Road, St. John's Wood to Bell Street , Marylebone"
"LINESTRING (-0.174554 51.499917,-0.165842 51.522029", "From Exhibition Road, Knightsbridge to Bell Street , Marylebone"
"LINESTRING (-0.183118 51.515607,-0.165842 51.522029", "From Cleveland Gardens, Bayswater to Bell Street , Marylebone"
"LINESTRING (-0.202608 51.51632,-0.165842 51.522029", "From All Saints Church, Portobello to Bell Street , Marylebone"
"LINESTRING (-0.197524 51.511084,-0.136123 51.482362", "From Pembridge Villas, Notting Hill to Riverlight North, Nine Elms"
"LINESTRING (-0.124469 51.485917,-0.136123 51.482362", "From Vauxhall Cross, Vauxhall to Riverlight North, Nine Elms"
"LINESTRING (-0.122806 51.490435,-0.136123 51.482362", "From Albert Embankment, Vauxhall to Riverlight North, Nine Elms"
"LINESTRING (-0.113134 51.483145,-0.136123 51.482362", "From Kennington Oval, Oval to Riverlight North, Nine Elms"
"LINESTRING (-0.116493 51.477839,-0.136123 51.482362", "From Caldwell Street, Stockwell to Riverlight North, Nine Elms"
"LINESTRING (-0.153463 51.525367,-0.145211 51.520715", "From The Tennis Courts, The Regent's Park to Portland Place, Marylebone"
"LINESTRING (-0.154701 51.520583,-0.145211 51.520715", "From Paddington Street, Marylebone to Portland Place, Marylebone"
"LINESTRING (-0.159919 51.492462,-0.145211 51.520715", "From Cadogan Gardens, Chelsea to Portland Place, Marylebone"
"LINESTRING (-0.166878 51.488023,-0.145211 51.520715", "From Flood Street, Chelsea to Portland Place, Marylebone"
"LINESTRING (-0.165297 51.461923,-0.140741 51.488057", "From Limburg Road, Clapham Junction to Alderney Street, Pimlico"
"LINESTRING (-0.140947 51.49616,-0.140741 51.488057", "From Ashley Place, Victoria to Alderney Street, Pimlico"
"LINESTRING (-0.138364 51.492111,-0.140741 51.488057", "From Tachbrook Street, Victoria to Alderney Street, Pimlico"
"LINESTRING (-0.135478 51.495827,-0.140741 51.488057", "From Rochester Row, Westminster to Alderney Street, Pimlico"
"LINESTRING (-0.149186 51.490491,-0.140741 51.488057", "From Ebury Bridge, Pimlico to Alderney Street, Pimlico"
"LINESTRING (-0.173881 51.494412,-0.140741 51.488057", "From South Kensington Station, South Kensington to Alderney Street, Pimlico"
"LINESTRING (-0.182435 51.478169,-0.140741 51.488057", "From Upcerne Road, West Chelsea to Alderney Street, Pimlico"
"LINESTRING (-0.147478 51.492369,-0.140741 51.488057", "From Elizabeth Bridge, Victoria to Alderney Street, Pimlico"
"LINESTRING (-0.139956 51.493573,-0.140741 51.488057", "From Queen Mother Sports Centre, Victoria to Alderney Street, Pimlico"
"LINESTRING (-0.116279 51.524564,-0.17581 51.517335", "From Wren Street, Holborn to South Wharf Road, Paddington"
"LINESTRING (-0.18119 51.485587,-0.17581 51.517335", "From Limerston Street, West Chelsea to South Wharf Road, Paddington"
"LINESTRING (-0.179702 51.499428,-0.17581 51.517335", "From Imperial College, Knightsbridge to South Wharf Road, Paddington"
"LINESTRING (-0.173757 51.496471,-0.17581 51.517335", "From Exhibition Road Museums 1, South Kensington to South Wharf Road, Paddington"
"LINESTRING (-0.214428 51.486062,-0.178433 51.492479", "From Greyhound Road, Hammersmith to Queen's Gate (South), South Kensington"
"LINESTRING (-0.176415 51.499806,-0.178433 51.492479", "From Prince Consort Road, Knightsbridge to Queen's Gate (South), South Kensington"
"LINESTRING (-0.187404 51.487958,-0.178433 51.492479", "From Harcourt Terrace, West Brompton to Queen's Gate (South), South Kensington"
"LINESTRING (-0.158105 51.494645,-0.178433 51.492479", "From Cadogan Place, Knightsbridge to Queen's Gate (South), South Kensington"
"LINESTRING (-0.174554 51.499917,-0.178433 51.492479", "From Exhibition Road, Knightsbridge to Queen's Gate (South), South Kensington"
"LINESTRING (-0.183289 51.496462,-0.178433 51.492479", "From Gloucester Road (Central), South Kensington to Queen's Gate (South), South Kensington"
"LINESTRING (-0.185296 51.495362,-0.178433 51.492479", "From Emperor's Gate, South Kensington to Queen's Gate (South), South Kensington"
"LINESTRING (-0.159919 51.492462,-0.178433 51.492479", "From Cadogan Gardens, Chelsea to Queen's Gate (South), South Kensington"
"LINESTRING (-0.139625 51.490962,-0.178433 51.492479", "From Gloucester Street, Pimlico to Queen's Gate (South), South Kensington"
"LINESTRING (-0.187402 51.51031,-0.178433 51.492479", "From Queensway, Kensington Gardens to Queen's Gate (South), South Kensington"
"LINESTRING (-0.157183 51.52026,-0.164393 51.516517", "From Crawford Street, Marylebone to Nutford Place, Marylebone"
"LINESTRING (-0.15352 51.503117,-0.164393 51.516517", "From Hyde Park Corner, Hyde Park to Nutford Place, Marylebone"
"LINESTRING (-0.15352 51.503117,-0.164393 51.516517", "From Hyde Park Corner, Hyde Park to Nutford Place, Marylebone"
"LINESTRING (-0.190393 51.490163,-0.164393 51.516517", "From Bramham Gardens, Earl's Court to Nutford Place, Marylebone"
"LINESTRING (-0.164393 51.516517,-0.164393 51.516517", "From Nutford Place, Marylebone to Nutford Place, Marylebone"
"LINESTRING (-0.099489 51.524868,-0.109914 51.531666", "From Sadlers Sports Centre, Finsbury to Claremont Square, Angel"
"LINESTRING (-0.070329 51.539083,-0.109914 51.531666", "From Shoreditch Court, Haggerston to Claremont Square, Angel"
"LINESTRING (-0.070329 51.539083,-0.109914 51.531666", "From Shoreditch Court, Haggerston to Claremont Square, Angel"
"LINESTRING (-0.144664 51.538071,-0.109914 51.531666", "From Parkway, Camden Town to Claremont Square, Angel"
"LINESTRING (-0.070329 51.539083,-0.109914 51.531666", "From Shoreditch Court, Haggerston to Claremont Square, Angel"
"LINESTRING (-0.083632 51.502153,-0.109914 51.531666", "From Snowsfields, London Bridge to Claremont Square, Angel"
"LINESTRING (-0.09022 51.491484,-0.132845 51.489975", "From Rodney Road , Walworth to Rampayne Street, Pimlico"
"LINESTRING (-0.131773 51.506633,-0.132845 51.489975", "From Waterloo Place, St. James's to Rampayne Street, Pimlico"
