"LINESTRING (-0.075459 51.509506,-0.139956 51.493573", "From Tower Gardens , Tower to Queen Mother Sports Centre, Victoria"
"LINESTRING (-0.075578 51.52127,-0.081608 51.497855", "From Commercial Street, Shoreditch to Bermondsey Street, Bermondsey"
"LINESTRING (-0.081608 51.497855,-0.081608 51.497855", "From Bermondsey Street, Bermondsey to Bermondsey Street, Bermondsey"
"LINESTRING (-0.098031 51.505224,-0.081608 51.497855", "From Lavington Street, Bankside to Bermondsey Street, Bermondsey"
"LINESTRING (-0.07962 51.503493,-0.081608 51.497855", "From Tooley Street, Bermondsey to Bermondsey Street, Bermondsey"
"LINESTRING (-0.138089 51.484839,-0.081608 51.497855", "From Claverton Street, Pimlico to Bermondsey Street, Bermondsey"
"LINESTRING (-0.11655 51.51824,-0.081608 51.497855", "From Red Lion Street, Holborn to Bermondsey Street, Bermondsey"
"LINESTRING (-0.112824 51.503791,-0.081608 51.497855", "From Waterloo Station 3, Waterloo to Bermondsey Street, Bermondsey"
"LINESTRING (-0.120718 51.511968,-0.081608 51.497855", "From Tavistock Street, Covent Garden to Bermondsey Street, Bermondsey"
"LINESTRING (-0.102091 51.500693,-0.081608 51.497855", "From Webber Street , Southwark to Bermondsey Street, Bermondsey"
"LINESTRING (-0.107349 51.511891,-0.081608 51.497855", "From Tallis Street, Temple to Bermondsey Street, Bermondsey"
"LINESTRING (-0.135188 51.525227,-0.081608 51.497855", "From Gower Place , Euston to Bermondsey Street, Bermondsey"
"LINESTRING (-0.098497 51.503688,-0.081608 51.497855", "From Union Street, The Borough to Bermondsey Street, Bermondsey"
"LINESTRING (-0.100186 51.505817,-0.081608 51.497855", "From Bankside Mix, Bankside to Bermondsey Street, Bermondsey"
"LINESTRING (-0.092921 51.494436,-0.081608 51.497855", "From New Kent Road, The Borough to Bermondsey Street, Bermondsey"
"LINESTRING (-0.09022 51.491484,-0.081608 51.497855", "From Rodney Road , Walworth to Bermondsey Street, Bermondsey"
"LINESTRING (-0.05438 51.520019,-0.073955 51.526293", "From Ansell House, Stepney to Palissy Street, Shoreditch"
"LINESTRING (-0.054883 51.522561,-0.073955 51.526293", "From Cephas Street, Bethnal Green to Palissy Street, Shoreditch"
"LINESTRING (-0.055656 51.514222,-0.073955 51.526293", "From Watney Market, Stepney to Palissy Street, Shoreditch"
"LINESTRING (-0.043371 51.518369,-0.073955 51.526293", "From Rectory Square, Stepney to Palissy Street, Shoreditch"
"LINESTRING (-0.05438 51.520019,-0.073955 51.526293", "From Ansell House, Stepney to Palissy Street, Shoreditch"
"LINESTRING (-0.039264 51.521564,-0.073955 51.526293", "From Harford Street, Mile End to Palissy Street, Shoreditch"
"LINESTRING (-0.069543 51.525645,-0.083067 51.523196", "From Granby Street, Shoreditch to Clifton Street, Shoreditch"
"LINESTRING (-0.069543 51.525645,-0.083067 51.523196", "From Granby Street, Shoreditch to Clifton Street, Shoreditch"
"LINESTRING (-0.069543 51.525645,-0.083067 51.523196", "From Granby Street, Shoreditch to Clifton Street, Shoreditch"
"LINESTRING (-0.011889 51.538718,-0.083067 51.523196", "From Podium, Queen Elizabeth Olympic Park to Clifton Street, Shoreditch"
"LINESTRING (-0.101536 51.49217,-0.101384 51.49652", "From Hampton Street, Walworth to Ontario Street, Elephant & Castle"
"LINESTRING (-0.09022 51.491484,-0.101384 51.49652", "From Rodney Road , Walworth to Ontario Street, Elephant & Castle"
"LINESTRING (-0.113001 51.50486,-0.101384 51.49652", "From Waterloo Road, South Bank to Ontario Street, Elephant & Castle"
"LINESTRING (-0.113001 51.50486,-0.101384 51.49652", "From Waterloo Road, South Bank to Ontario Street, Elephant & Castle"
"LINESTRING (-0.106237 51.507244,-0.101384 51.49652", "From Milroy Walk, South Bank to Ontario Street, Elephant & Castle"
"LINESTRING (-0.092754 51.505974,-0.101384 51.49652", "From Park Street, Bankside to Ontario Street, Elephant & Castle"
"LINESTRING (-0.132328 51.515631,-0.129697 51.509087", "From Soho Square , Soho to St. Martin's Street, West End"
"LINESTRING (-0.15352 51.503117,-0.129697 51.509087", "From Hyde Park Corner, Hyde Park to St. Martin's Street, West End"
"LINESTRING (-0.124469 51.485917,-0.129697 51.509087", "From Vauxhall Cross, Vauxhall to St. Martin's Street, West End"
"LINESTRING (-0.15352 51.503117,-0.129697 51.509087", "From Hyde Park Corner, Hyde Park to St. Martin's Street, West End"
"LINESTRING (-0.15352 51.503117,-0.129697 51.509087", "From Hyde Park Corner, Hyde Park to St. Martin's Street, West End"
"LINESTRING (-0.135188 51.525227,-0.129697 51.509087", "From Gower Place , Euston to St. Martin's Street, West End"
"LINESTRING (-0.132328 51.515631,-0.129697 51.509087", "From Soho Square , Soho to St. Martin's Street, West End"
"LINESTRING (-0.145904 51.507069,-0.129697 51.509087", "From Curzon Street, Mayfair to St. Martin's Street, West End"
"LINESTRING (-0.15352 51.503117,-0.129697 51.509087", "From Hyde Park Corner, Hyde Park to St. Martin's Street, West End"
"LINESTRING (-0.132224 51.49206,-0.129697 51.509087", "From Regency Street, Westminster to St. Martin's Street, West End"
"LINESTRING (-0.15352 51.503117,-0.129697 51.509087", "From Hyde Park Corner, Hyde Park to St. Martin's Street, West End"
"LINESTRING (-0.145904 51.507069,-0.129697 51.509087", "From Curzon Street, Mayfair to St. Martin's Street, West End"
"LINESTRING (-0.037366 51.534137,-0.099981 51.532661", "From Driffield Road, Old Ford to Graham Street, Angel"
"LINESTRING (-0.103137 51.506692,-0.099981 51.532661", "From Poured Lines, Bankside to Graham Street, Angel"
"LINESTRING (-0.096317 51.526008,-0.099981 51.532661", "From Finsbury Leisure Centre, St. Luke's to Graham Street, Angel"
"LINESTRING (-0.10997 51.529163,-0.099981 51.532661", "From River Street , Clerkenwell to Graham Street, Angel"
"LINESTRING (-0.074284 51.539328,-0.099981 51.532661", "From Haggerston Road, Haggerston to Graham Street, Angel"
"LINESTRING (-0.075885 51.536585,-0.099981 51.532661", "From Dunston Road , Haggerston to Graham Street, Angel"
"LINESTRING (-0.079608 51.521668,-0.099981 51.532661", "From Worship Street, Shoreditch to Graham Street, Angel"
"LINESTRING (-0.079201 51.537277,-0.099981 51.532661", "From Hertford Road, De Beauvoir Town to Graham Street, Angel"
"LINESTRING (-0.074284 51.539328,-0.099981 51.532661", "From Haggerston Road, Haggerston to Graham Street, Angel"
"LINESTRING (-0.10997 51.529163,-0.099981 51.532661", "From River Street , Clerkenwell to Graham Street, Angel"
"LINESTRING (-0.097122 51.529423,-0.085603 51.53095", "From Macclesfield Rd, St Lukes to New North Road 1, Hoxton"
"LINESTRING (-0.074284 51.539328,-0.085603 51.53095", "From Haggerston Road, Haggerston to New North Road 1, Hoxton"
"LINESTRING (-0.120202 51.523346,-0.086016 51.53114", "From Guilford Street , Bloomsbury to New North Road 2, Hoxton"
"LINESTRING (-0.079249 51.518908,-0.086016 51.53114", "From Brushfield Street, Liverpool Street to New North Road 2, Hoxton"
"LINESTRING (-0.084605 51.521283,-0.086016 51.53114", "From Christopher Street, Liverpool Street to New North Road 2, Hoxton"
"LINESTRING (-0.08249 51.53558,-0.086016 51.53114", "From Pitfield Street North,Hoxton to New North Road 2, Hoxton"
"LINESTRING (-0.106992 51.534504,-0.160854 51.535892", "From Liverpool Road (N1 Centre), Angel to Prince Albert Road, The Regent's Park"
"LINESTRING (-0.160854 51.535892,-0.160854 51.535892", "From Prince Albert Road, The Regent's Park to Prince Albert Road, The Regent's Park"
"LINESTRING (-0.160854 51.535892,-0.160854 51.535892", "From Prince Albert Road, The Regent's Park to Prince Albert Road, The Regent's Park"
"LINESTRING (-0.147983 51.519167,-0.160854 51.535892", "From New Cavendish Street, Marylebone to Prince Albert Road, The Regent's Park"
"LINESTRING (-0.160854 51.535892,-0.160854 51.535892", "From Prince Albert Road, The Regent's Park to Prince Albert Road, The Regent's Park"
"LINESTRING (-0.129698 51.500703,-0.160854 51.535892", "From Storey's Gate, Westminster to Prince Albert Road, The Regent's Park"
"LINESTRING (-0.100186 51.505817,-0.160854 51.535892", "From Bankside Mix, Bankside to Prince Albert Road, The Regent's Park"
"LINESTRING (-0.160854 51.535892,-0.160854 51.535892", "From Prince Albert Road, The Regent's Park to Prince Albert Road, The Regent's Park"
"LINESTRING (-0.179668 51.511654,-0.179135 51.516417", "From Lancaster Gate , Bayswater to Eastbourne Mews, Paddington"
"LINESTRING (-0.128585 51.516118,-0.179135 51.516417", "From Earnshaw Street , Covent Garden to Eastbourne Mews, Paddington"
"LINESTRING (-0.154106 51.517703,-0.179135 51.516417", "From George Street, Marylebone to Eastbourne Mews, Paddington"
"LINESTRING (-0.079249 51.518908,-0.089887 51.520858", "From Brushfield Street, Liverpool Street to Bunhill Row, Moorgate"
"LINESTRING (-0.091773 51.504627,-0.089887 51.520858", "From Hop Exchange, The Borough to Bunhill Row, Moorgate"
"LINESTRING (-0.074284 51.539328,-0.089887 51.520858", "From Haggerston Road, Haggerston to Bunhill Row, Moorgate"
"LINESTRING (-0.055846 51.499169,-0.089887 51.520858", "From Rotherhithe Roundabout, Rotherhithe to Bunhill Row, Moorgate"
"LINESTRING (-0.06415 51.51295,-0.089887 51.520858", "From Christian Street, Whitechapel to Bunhill Row, Moorgate"
"LINESTRING (-0.09885 51.515418,-0.089887 51.520858", "From Newgate Street , St. Paul's to Bunhill Row, Moorgate"
"LINESTRING (-0.09294 51.51397,-0.089887 51.520858", "From Cheapside, Bank to Bunhill Row, Moorgate"
"LINESTRING (-0.224303 51.506093,-0.194757 51.493343", "From Westfield Library Corner, Shepherd's Bush to Nevern Place, Earl's Court"
"LINESTRING (-0.183834 51.497924,-0.194757 51.493343", "From Gloucester Road (North), Kensington to Nevern Place, Earl's Court"
"LINESTRING (-0.183834 51.497924,-0.194757 51.493343", "From Gloucester Road (North), Kensington to Nevern Place, Earl's Court"
"LINESTRING (-0.195455 51.500401,-0.194757 51.493343", "From Argyll Road, Kensington to Nevern Place, Earl's Court"
"LINESTRING (-0.191462 51.501364,-0.194757 51.493343", "From Derry Street, Kensington to Nevern Place, Earl's Court"
"LINESTRING (-0.16716 51.47518,-0.194757 51.493343", "From Surrey Lane, Battersea to Nevern Place, Earl's Court"
"LINESTRING (-0.204815 51.484386,-0.194757 51.493343", "From Normand Park, West Kensington to Nevern Place, Earl's Court"
"LINESTRING (-0.224303 51.506093,-0.194757 51.493343", "From Westfield Library Corner, Shepherd's Bush to Nevern Place, Earl's Court"
"LINESTRING (-0.165471 51.498884,-0.194757 51.493343", "From Montpelier Street, Knightsbridge to Nevern Place, Earl's Court"
"LINESTRING (-0.187842 51.509908,-0.193764 51.508605", "From Black Lion Gate, Kensington Gardens to Palace Gardens Terrace, Notting Hill"
"LINESTRING (-0.1844 51.502042,-0.193764 51.508605", "From Palace Gate, Kensington Gardens to Palace Gardens Terrace, Notting Hill"
"LINESTRING (-0.165471 51.498884,-0.193764 51.508605", "From Montpelier Street, Knightsbridge to Palace Gardens Terrace, Notting Hill"
"LINESTRING (-0.13558 51.513684,-0.193764 51.508605", "From Broadwick Street, Soho to Palace Gardens Terrace, Notting Hill"
"LINESTRING (-0.13558 51.513684,-0.193764 51.508605", "From Broadwick Street, Soho to Palace Gardens Terrace, Notting Hill"
"LINESTRING (-0.083935 51.520009,-0.193764 51.508605", "From Sun Street, Liverpool Street to Palace Gardens Terrace, Notting Hill"
"LINESTRING (-0.193764 51.508605,-0.193764 51.508605", "From Palace Gardens Terrace, Notting Hill to Palace Gardens Terrace, Notting Hill"
"LINESTRING (-0.201554 51.512136,-0.193764 51.508605", "From Chepstow Villas, Notting Hill to Palace Gardens Terrace, Notting Hill"
"LINESTRING (-0.200838 51.514311,-0.193764 51.508605", "From Turquoise Island, Notting Hill to Palace Gardens Terrace, Notting Hill"
"LINESTRING (-0.183716 51.517932,-0.193764 51.508605", "From Orsett Terrace, Bayswater to Palace Gardens Terrace, Notting Hill"
"LINESTRING (-0.106237 51.507244,-0.115851 51.505044", "From Milroy Walk, South Bank to Concert Hall Approach 1, South Bank"
"LINESTRING (-0.115851 51.505044,-0.115851 51.505044", "From Concert Hall Approach 1, South Bank to Concert Hall Approach 1, South Bank"
"LINESTRING (-0.106237 51.507244,-0.115851 51.505044", "From Milroy Walk, South Bank to Concert Hall Approach 1, South Bank"
"LINESTRING (-0.115851 51.505044,-0.115851 51.505044", "From Concert Hall Approach 1, South Bank to Concert Hall Approach 1, South Bank"
"LINESTRING (-0.110121 51.488105,-0.115851 51.505044", "From Cleaver Street, Kennington to Concert Hall Approach 1, South Bank"
"LINESTRING (-0.115851 51.505044,-0.115851 51.505044", "From Concert Hall Approach 1, South Bank to Concert Hall Approach 1, South Bank"
"LINESTRING (-0.04667 51.521889,-0.115851 51.505044", "From Stepney Green Station, Stepney to Concert Hall Approach 1, South Bank"
"LINESTRING (-0.115851 51.505044,-0.115851 51.505044", "From Concert Hall Approach 1, South Bank to Concert Hall Approach 1, South Bank"
"LINESTRING (-0.047548 51.528869,-0.115851 51.505044", "From Globe Town Market, Bethnal Green to Concert Hall Approach 1, South Bank"
"LINESTRING (-0.221791 51.49968,-0.120718 51.511968", "From Blythe Road West, Shepherd's Bush to Tavistock Street, Covent Garden"
"LINESTRING (-0.141423 51.514499,-0.120718 51.511968", "From Little Argyll Street, West End to Tavistock Street, Covent Garden"
"LINESTRING (-0.138231 51.525542,-0.120718 51.511968", "From Hampstead Road, Euston to Tavistock Street, Covent Garden"
"LINESTRING (-0.138231 51.525542,-0.120718 51.511968", "From Hampstead Road, Euston to Tavistock Street, Covent Garden"
"LINESTRING (-0.110699 51.501444,-0.120718 51.511968", "From Baylis Road, Waterloo to Tavistock Street, Covent Garden"
"LINESTRING (-0.132102 51.498125,-0.120718 51.511968", "From Abbey Orchard Street, Westminster to Tavistock Street, Covent Garden"
"LINESTRING (-0.113001 51.50486,-0.120718 51.511968", "From Waterloo Road, South Bank to Tavistock Street, Covent Garden"
"LINESTRING (-0.151359 51.522008,-0.120718 51.511968", "From Beaumont Street, Marylebone to Tavistock Street, Covent Garden"
"LINESTRING (-0.138231 51.525542,-0.120718 51.511968", "From Hampstead Road, Euston to Tavistock Street, Covent Garden"
"LINESTRING (-0.134407 51.526236,-0.120718 51.511968", "From Euston Road, Euston to Tavistock Street, Covent Garden"
"LINESTRING (-0.125078 51.534667,-0.120718 51.511968", "From Good's Way, King's Cross to Tavistock Street, Covent Garden"
"LINESTRING (-0.132328 51.515631,-0.120718 51.511968", "From Soho Square , Soho to Tavistock Street, Covent Garden"
"LINESTRING (-0.125078 51.534667,-0.120718 51.511968", "From Good's Way, King's Cross to Tavistock Street, Covent Garden"
"LINESTRING (-0.113001 51.50486,-0.120718 51.511968", "From Waterloo Road, South Bank to Tavistock Street, Covent Garden"
"LINESTRING (-0.126021 51.508103,-0.115533 51.504942", "From Craven Street, Strand to Concert Hall Approach 2, South Bank"
"LINESTRING (-0.081608 51.497855,-0.115533 51.504942", "From Bermondsey Street, Bermondsey to Concert Hall Approach 2, South Bank"
"LINESTRING (-0.075855 51.517475,-0.115533 51.504942", "From Bell Lane, Liverpool Street to Concert Hall Approach 2, South Bank"
"LINESTRING (-0.075855 51.517475,-0.115533 51.504942", "From Bell Lane, Liverpool Street to Concert Hall Approach 2, South Bank"
"LINESTRING (-0.124642 51.481747,-0.115533 51.504942", "From South Lambeth Road, Vauxhall to Concert Hall Approach 2, South Bank"
"LINESTRING (-0.079248 51.524526,-0.115533 51.504942", "From New Inn Yard, Shoreditch to Concert Hall Approach 2, South Bank"
"LINESTRING (-0.109914 51.531666,-0.115533 51.504942", "From Claremont Square, Angel to Concert Hall Approach 2, South Bank"
"LINESTRING (-0.081608 51.497855,-0.115533 51.504942", "From Bermondsey Street, Bermondsey to Concert Hall Approach 2, South Bank"
"LINESTRING (-0.124642 51.481747,-0.115533 51.504942", "From South Lambeth Road, Vauxhall to Concert Hall Approach 2, South Bank"
"LINESTRING (-0.187402 51.51031,-0.197524 51.511084", "From Queensway, Kensington Gardens to Pembridge Villas, Notting Hill"
"LINESTRING (-0.187402 51.51031,-0.197524 51.511084", "From Queensway, Kensington Gardens to Pembridge Villas, Notting Hill"
"LINESTRING (-0.202608 51.51632,-0.197524 51.511084", "From All Saints Church, Portobello to Pembridge Villas, Notting Hill"
"LINESTRING (-0.187402 51.51031,-0.197524 51.511084", "From Queensway, Kensington Gardens to Pembridge Villas, Notting Hill"
"LINESTRING (-0.187402 51.51031,-0.197524 51.511084", "From Queensway, Kensington Gardens to Pembridge Villas, Notting Hill"
"LINESTRING (-0.196422 51.509353,-0.197524 51.511084", "From Notting Hill Gate Station, Notting Hill to Pembridge Villas, Notting Hill"
"LINESTRING (-0.196422 51.509353,-0.197524 51.511084", "From Notting Hill Gate Station, Notting Hill to Pembridge Villas, Notting Hill"
"LINESTRING (-0.187402 51.51031,-0.197524 51.511084", "From Queensway, Kensington Gardens to Pembridge Villas, Notting Hill"
"LINESTRING (-0.091773 51.504627,-0.119643 51.511756", "From Hop Exchange, The Borough to Wellington Street , Strand"
"LINESTRING (-0.143613 51.523518,-0.119643 51.511756", "From Bolsover Street, Fitzrovia to Wellington Street , Strand"
"LINESTRING (-0.118272 51.516277,-0.119643 51.511756", "From Lincoln's Inn Fields, Holborn to Wellington Street , Strand"
"LINESTRING (-0.081608 51.497855,-0.119643 51.511756", "From Bermondsey Street, Bermondsey to Wellington Street , Strand"
"LINESTRING (-0.070542 51.505697,-0.119643 51.511756", "From St. Katharine's Way, Tower to Wellington Street , Strand"
"LINESTRING (-0.07813 51.526377,-0.119643 51.511756", "From Shoreditch High Street, Shoreditch to Wellington Street , Strand"
"LINESTRING (-0.143613 51.523518,-0.119643 51.511756", "From Bolsover Street, Fitzrovia to Wellington Street , Strand"
"LINESTRING (-0.110683 51.484788,-0.119643 51.511756", "From Kennington Road Post Office, Oval to Wellington Street , Strand"
"LINESTRING (-0.116542 51.504636,-0.119643 51.511756", "From Jubilee Gardens, South Bank to Wellington Street , Strand"
"LINESTRING (-0.081608 51.497855,-0.119643 51.511756", "From Bermondsey Street, Bermondsey to Wellington Street , Strand"
"LINESTRING (-0.119643 51.511756,-0.119643 51.511756", "From Wellington Street , Strand to Wellington Street , Strand"
"LINESTRING (-0.085666 51.499075,-0.119643 51.511756", "From Long Lane , Bermondsey to Wellington Street , Strand"
"LINESTRING (-0.116542 51.504636,-0.119643 51.511756", "From Jubilee Gardens, South Bank to Wellington Street , Strand"
"LINESTRING (-0.143613 51.523518,-0.119643 51.511756", "From Bolsover Street, Fitzrovia to Wellington Street , Strand"
"LINESTRING (-0.143613 51.523518,-0.119643 51.511756", "From Bolsover Street, Fitzrovia to Wellington Street , Strand"
"LINESTRING (-0.09734 51.520841,-0.119643 51.511756", "From Aldersgate Street, Barbican to Wellington Street , Strand"
"LINESTRING (-0.127854 51.517727,-0.119643 51.511756", "From Great Russell Street, Bloomsbury to Wellington Street , Strand"
"LINESTRING (-0.143613 51.523518,-0.119643 51.511756", "From Bolsover Street, Fitzrovia to Wellington Street , Strand"
"LINESTRING (-0.091773 51.504627,-0.119643 51.511756", "From Hop Exchange, The Borough to Wellington Street , Strand"
"LINESTRING (-0.139016 51.520994,-0.119643 51.511756", "From Howland Street, Fitzrovia to Wellington Street , Strand"
"LINESTRING (-0.106992 51.534504,-0.111781 51.533319", "From Liverpool Road (N1 Centre), Angel to Risinghill Street, Angel"
"LINESTRING (-0.10997 51.529163,-0.111781 51.533319", "From River Street , Clerkenwell to Risinghill Street, Angel"
"LINESTRING (-0.125078 51.534667,-0.111781 51.533319", "From Good's Way, King's Cross to Risinghill Street, Angel"
"LINESTRING (-0.099489 51.524868,-0.111781 51.533319", "From Sadlers Sports Centre, Finsbury to Risinghill Street, Angel"
"LINESTRING (-0.158264 51.514577,-0.111781 51.533319", "From Old Quebec Street, Marylebone to Risinghill Street, Angel"
"LINESTRING (-0.104708 51.52326,-0.111781 51.533319", "From Clerkenwell Green, Clerkenwell to Risinghill Street, Angel"
"LINESTRING (-0.102208 51.526153,-0.111781 51.533319", "From Percival Street, Finsbury to Risinghill Street, Angel"
"LINESTRING (-0.038986 51.512871,-0.087587 51.514441", "From Flamborough Street, Limehouse to Bank of England Museum, Bank"
"LINESTRING (-0.074754 51.523648,-0.087587 51.514441", "From Bethnal Green Road, Shoreditch to Bank of England Museum, Bank"
"LINESTRING (-0.109256 51.526443,-0.087587 51.514441", "From Tysoe Street, Clerkenwell to Bank of England Museum, Bank"
"LINESTRING (-0.038986 51.512871,-0.087587 51.514441", "From Flamborough Street, Limehouse to Bank of England Museum, Bank"
"LINESTRING (-0.120718 51.511968,-0.087587 51.514441", "From Tavistock Street, Covent Garden to Bank of England Museum, Bank"
"LINESTRING (-0.183165 51.474665,-0.126021 51.508103", "From Imperial Wharf Station, Sands End to Craven Street, Strand"
"LINESTRING (-0.150481 51.51217,-0.126021 51.508103", "From Grosvenor Square, Mayfair to Craven Street, Strand"
"LINESTRING (-0.138733 51.496753,-0.126021 51.508103", "From Howick Place, Westminster to Craven Street, Strand"
"LINESTRING (-0.128377 51.523673,-0.126021 51.508103", "From Bedford Way, Bloomsbury to Craven Street, Strand"
"LINESTRING (-0.168917 51.497056,-0.126021 51.508103", "From Holy Trinity Brompton, Knightsbridge to Craven Street, Strand"
"LINESTRING (-0.183165 51.474665,-0.126021 51.508103", "From Imperial Wharf Station, Sands End to Craven Street, Strand"
"LINESTRING (-0.119643 51.511756,-0.126021 51.508103", "From Wellington Street , Strand to Craven Street, Strand"
"LINESTRING (-0.065006 51.508622,-0.126021 51.508103", "From Pennington Street, Wapping to Craven Street, Strand"
"LINESTRING (-0.129698 51.500703,-0.126021 51.508103", "From Storey's Gate, Westminster to Craven Street, Strand"
"LINESTRING (-0.123616 51.529943,-0.126021 51.508103", "From Belgrove Street , King's Cross to Craven Street, Strand"
"LINESTRING (-0.111014 51.493686,-0.126021 51.508103", "From Walnut Tree Walk, Vauxhall to Craven Street, Strand"
"LINESTRING (-0.113001 51.50486,-0.126021 51.508103", "From Waterloo Road, South Bank to Craven Street, Strand"
"LINESTRING (-0.123616 51.529943,-0.126021 51.508103", "From Belgrove Street , King's Cross to Craven Street, Strand"
"LINESTRING (-0.129698 51.500703,-0.126021 51.508103", "From Storey's Gate, Westminster to Craven Street, Strand"
"LINESTRING (-0.183165 51.474665,-0.126021 51.508103", "From Imperial Wharf Station, Sands End to Craven Street, Strand"
"LINESTRING (-0.099828 51.493146,-0.126021 51.508103", "From Strata, Elephant & Castle to Craven Street, Strand"
"LINESTRING (-0.176268 51.524826,-0.126021 51.508103", "From Aberdeen Place, St. John's Wood to Craven Street, Strand"
"LINESTRING (-0.128377 51.523673,-0.126021 51.508103", "From Bedford Way, Bloomsbury to Craven Street, Strand"
"LINESTRING (-0.110683 51.484788,-0.126021 51.508103", "From Kennington Road Post Office, Oval to Craven Street, Strand"
"LINESTRING (-0.183165 51.474665,-0.126021 51.508103", "From Imperial Wharf Station, Sands End to Craven Street, Strand"
"LINESTRING (-0.120718 51.511968,-0.126021 51.508103", "From Tavistock Street, Covent Garden to Craven Street, Strand"
"LINESTRING (-0.113001 51.50486,-0.126021 51.508103", "From Waterloo Road, South Bank to Craven Street, Strand"
"LINESTRING (-0.132328 51.515631,-0.126021 51.508103", "From Soho Square , Soho to Craven Street, Strand"
"LINESTRING (-0.119643 51.511756,-0.126021 51.508103", "From Wellington Street , Strand to Craven Street, Strand"
"LINESTRING (-0.113001 51.50486,-0.126021 51.508103", "From Waterloo Road, South Bank to Craven Street, Strand"
"LINESTRING (-0.132328 51.515631,-0.126021 51.508103", "From Soho Square , Soho to Craven Street, Strand"
"LINESTRING (-0.123616 51.529943,-0.126021 51.508103", "From Belgrove Street , King's Cross to Craven Street, Strand"
"LINESTRING (-0.087587 51.514441,-0.126021 51.508103", "From Bank of England Museum, Bank to Craven Street, Strand"
"LINESTRING (-0.151926 51.516814,-0.150181 51.536922", "From Hinde Street, Marylebone to London Zoo Car Park, The Regent's Park"
"LINESTRING (-0.168074 51.5343,-0.150181 51.536922", "From Charlbert Street, St. John's Wood to London Zoo Car Park, The Regent's Park"
"LINESTRING (-0.168074 51.5343,-0.150181 51.536922", "From Charlbert Street, St. John's Wood to London Zoo Car Park, The Regent's Park"
"LINESTRING (-0.13151 51.509639,-0.150181 51.536922", "From Panton Street, West End to London Zoo Car Park, The Regent's Park"
"LINESTRING (-0.169774 51.519968,-0.150181 51.536922", "From Edgware Road Station, Marylebone to London Zoo Car Park, The Regent's Park"
"LINESTRING (-0.168074 51.5343,-0.150181 51.536922", "From Charlbert Street, St. John's Wood to London Zoo Car Park, The Regent's Park"
"LINESTRING (-0.132053 51.518587,-0.150181 51.536922", "From Bayley Street , Bloomsbury to London Zoo Car Park, The Regent's Park"
"LINESTRING (-0.19024 51.515529,-0.150181 51.536922", "From Westbourne Grove, Bayswater to London Zoo Car Park, The Regent's Park"
"LINESTRING (-0.168074 51.5343,-0.150181 51.536922", "From Charlbert Street, St. John's Wood to London Zoo Car Park, The Regent's Park"
"LINESTRING (-0.138072 51.517344,-0.101026 51.528246", "From Wells Street, Fitzrovia to Goswell Road (City Uni), Finsbury"
"LINESTRING (-0.09294 51.51397,-0.101026 51.528246", "From Cheapside, Bank to Goswell Road (City Uni), Finsbury"
"LINESTRING (-0.096317 51.526008,-0.101026 51.528246", "From Finsbury Leisure Centre, St. Luke's to Goswell Road (City Uni), Finsbury"
"LINESTRING (-0.125078 51.534667,-0.101026 51.528246", "From Good's Way, King's Cross to Goswell Road (City Uni), Finsbury"
"LINESTRING (-0.09294 51.51397,-0.101026 51.528246", "From Cheapside, Bank to Goswell Road (City Uni), Finsbury"
"LINESTRING (-0.09734 51.520841,-0.101026 51.528246", "From Aldersgate Street, Barbican to Goswell Road (City Uni), Finsbury"
