"LINESTRING (-0.139625 51.490962,-0.167894 51.493184", "From Gloucester Street, Pimlico to Sloane Avenue, Knightsbridge"
"LINESTRING (-0.137424 51.498865,-0.167894 51.493184", "From Buckingham Gate, Westminster to Sloane Avenue, Knightsbridge"
"LINESTRING (-0.149004 51.485821,-0.167894 51.493184", "From Chelsea Bridge, Pimlico to Sloane Avenue, Knightsbridge"
"LINESTRING (-0.173881 51.494412,-0.167894 51.493184", "From South Kensington Station, South Kensington to Sloane Avenue, Knightsbridge"
"LINESTRING (-0.183289 51.496462,-0.167894 51.493184", "From Gloucester Road (Central), South Kensington to Sloane Avenue, Knightsbridge"
"LINESTRING (-0.151126 51.510919,-0.183118 51.515607", "From Millennium Hotel, Mayfair to Cleveland Gardens, Bayswater"
"LINESTRING (-0.150481 51.51217,-0.183118 51.515607", "From Grosvenor Square, Mayfair to Cleveland Gardens, Bayswater"
"LINESTRING (-0.130699 51.50777,-0.183118 51.515607", "From Pall Mall East, West End to Cleveland Gardens, Bayswater"
"LINESTRING (-0.18697 51.51616,-0.183118 51.515607", "From Bishop's Bridge Road West, Bayswater to Cleveland Gardens, Bayswater"
"LINESTRING (-0.17977 51.51348,-0.183716 51.517932", "From Devonshire Terrace, Bayswater to Orsett Terrace, Bayswater"
"LINESTRING (-0.142844 51.506613,-0.159237 51.501855", "From Green Park Station, Mayfair to Seville Street, Knightsbridge"
"LINESTRING (-0.142844 51.506613,-0.159237 51.501855", "From Green Park Station, Mayfair to Seville Street, Knightsbridge"
"LINESTRING (-0.131961 51.508446,-0.159237 51.501855", "From Charles II Street, West End to Seville Street, Knightsbridge"
"LINESTRING (-0.15352 51.503117,-0.159237 51.501855", "From Hyde Park Corner, Hyde Park to Seville Street, Knightsbridge"
"LINESTRING (-0.15352 51.503117,-0.159237 51.501855", "From Hyde Park Corner, Hyde Park to Seville Street, Knightsbridge"
"LINESTRING (-0.165842 51.522029,-0.159237 51.501855", "From Bell Street , Marylebone to Seville Street, Knightsbridge"
"LINESTRING (-0.141423 51.514499,-0.159237 51.501855", "From Little Argyll Street, West End to Seville Street, Knightsbridge"
"LINESTRING (-0.055846 51.499169,-0.159237 51.501855", "From Rotherhithe Roundabout, Rotherhithe to Seville Street, Knightsbridge"
"LINESTRING (-0.15352 51.503117,-0.159237 51.501855", "From Hyde Park Corner, Hyde Park to Seville Street, Knightsbridge"
"LINESTRING (-0.15352 51.503117,-0.159237 51.501855", "From Hyde Park Corner, Hyde Park to Seville Street, Knightsbridge"
"LINESTRING (-0.13544 51.497829,-0.159237 51.501855", "From Butler Place, Westminster to Seville Street, Knightsbridge"
"LINESTRING (-0.141423 51.514499,-0.159237 51.501855", "From Little Argyll Street, West End to Seville Street, Knightsbridge"
"LINESTRING (-0.142844 51.506613,-0.159237 51.501855", "From Green Park Station, Mayfair to Seville Street, Knightsbridge"
"LINESTRING (-0.149569 51.50274,-0.159237 51.501855", "From Wellington Arch, Hyde Park to Seville Street, Knightsbridge"
"LINESTRING (-0.120909 51.516128,-0.159237 51.501855", "From Newton Street, Covent Garden to Seville Street, Knightsbridge"
"LINESTRING (-0.165842 51.522029,-0.159237 51.501855", "From Bell Street , Marylebone to Seville Street, Knightsbridge"
"LINESTRING (-0.165842 51.522029,-0.159237 51.501855", "From Bell Street , Marylebone to Seville Street, Knightsbridge"
"LINESTRING (-0.153645 51.512911,-0.159237 51.501855", "From North Audley Street, Mayfair to Seville Street, Knightsbridge"
"LINESTRING (-0.120909 51.516128,-0.159237 51.501855", "From Newton Street, Covent Garden to Seville Street, Knightsbridge"
"LINESTRING (-0.13544 51.497829,-0.159237 51.501855", "From Butler Place, Westminster to Seville Street, Knightsbridge"
"LINESTRING (-0.165842 51.522029,-0.159237 51.501855", "From Bell Street , Marylebone to Seville Street, Knightsbridge"
"LINESTRING (-0.124642 51.481747,-0.159237 51.501855", "From South Lambeth Road, Vauxhall to Seville Street, Knightsbridge"
"LINESTRING (-0.142844 51.506613,-0.159237 51.501855", "From Green Park Station, Mayfair to Seville Street, Knightsbridge"
"LINESTRING (-0.131961 51.508446,-0.159237 51.501855", "From Charles II Street, West End to Seville Street, Knightsbridge"
"LINESTRING (-0.192538 51.504723,-0.159237 51.501855", "From Vicarage Gate, Kensington to Seville Street, Knightsbridge"
"LINESTRING (-0.15823 51.46879,-0.159237 51.501855", "From Holden Street, Battersea to Seville Street, Knightsbridge"
"LINESTRING (-0.13544 51.497829,-0.159237 51.501855", "From Butler Place, Westminster to Seville Street, Knightsbridge"
"LINESTRING (-0.13544 51.497829,-0.159237 51.501855", "From Butler Place, Westminster to Seville Street, Knightsbridge"
"LINESTRING (-0.127554 51.493978,-0.147624 51.49395", "From Page Street, Westminster to Eccleston Place, Victoria"
"LINESTRING (-0.125979 51.526357,-0.147624 51.49395", "From Cartwright Gardens , Bloomsbury to Eccleston Place, Victoria"
"LINESTRING (-0.149569 51.50274,-0.147624 51.49395", "From Wellington Arch, Hyde Park to Eccleston Place, Victoria"
"LINESTRING (-0.149569 51.50274,-0.147624 51.49395", "From Wellington Arch, Hyde Park to Eccleston Place, Victoria"
"LINESTRING (-0.127554 51.493978,-0.147624 51.49395", "From Page Street, Westminster to Eccleston Place, Victoria"
"LINESTRING (-0.114934 51.49288,-0.147624 51.49395", "From Lollard Street, Vauxhall to Eccleston Place, Victoria"
"LINESTRING (-0.125979 51.526357,-0.147624 51.49395", "From Cartwright Gardens , Bloomsbury to Eccleston Place, Victoria"
"LINESTRING (-0.127554 51.493978,-0.147624 51.49395", "From Page Street, Westminster to Eccleston Place, Victoria"
"LINESTRING (-0.13151 51.509639,-0.147624 51.49395", "From Panton Street, West End to Eccleston Place, Victoria"
"LINESTRING (-0.127554 51.493978,-0.147624 51.49395", "From Page Street, Westminster to Eccleston Place, Victoria"
"LINESTRING (-0.142783 51.51196,-0.147624 51.49395", "From St. George Street, Mayfair to Eccleston Place, Victoria"
"LINESTRING (-0.13544 51.497829,-0.147624 51.49395", "From Butler Place, Westminster to Eccleston Place, Victoria"
"LINESTRING (-0.13151 51.509639,-0.147624 51.49395", "From Panton Street, West End to Eccleston Place, Victoria"
"LINESTRING (-0.13151 51.509639,-0.147624 51.49395", "From Panton Street, West End to Eccleston Place, Victoria"
"LINESTRING (-0.127554 51.493978,-0.147624 51.49395", "From Page Street, Westminster to Eccleston Place, Victoria"
"LINESTRING (-0.147624 51.49395,-0.147624 51.49395", "From Eccleston Place, Victoria to Eccleston Place, Victoria"
"LINESTRING (-0.149569 51.50274,-0.147624 51.49395", "From Wellington Arch, Hyde Park to Eccleston Place, Victoria"
"LINESTRING (-0.142783 51.51196,-0.147624 51.49395", "From St. George Street, Mayfair to Eccleston Place, Victoria"
"LINESTRING (-0.149569 51.50274,-0.147624 51.49395", "From Wellington Arch, Hyde Park to Eccleston Place, Victoria"
"LINESTRING (-0.211316 51.500088,-0.195455 51.500401", "From Russell Gardens, Olympia to Argyll Road, Kensington"
"LINESTRING (-0.195777 51.479463,-0.195455 51.500401", "From Erin Close, Walham Green to Argyll Road, Kensington"
"LINESTRING (-0.209378 51.489591,-0.195455 51.500401", "From Vereker Road, West Kensington to Argyll Road, Kensington"
"LINESTRING (-0.196422 51.509353,-0.195455 51.500401", "From Notting Hill Gate Station, Notting Hill to Argyll Road, Kensington"
"LINESTRING (-0.158105 51.494645,-0.165164 51.514746", "From Cadogan Place, Knightsbridge to Porchester Place, Paddington"
"LINESTRING (-0.187842 51.509908,-0.165164 51.514746", "From Black Lion Gate, Kensington Gardens to Porchester Place, Paddington"
"LINESTRING (-0.151926 51.516814,-0.165164 51.514746", "From Hinde Street, Marylebone to Porchester Place, Paddington"
"LINESTRING (-0.103137 51.506692,-0.165164 51.514746", "From Poured Lines, Bankside to Porchester Place, Paddington"
"LINESTRING (-0.171103 51.518268,-0.165164 51.514746", "From St Mary's Hospital, Paddington to Porchester Place, Paddington"
"LINESTRING (-0.130699 51.50777,-0.165164 51.514746", "From Pall Mall East, West End to Porchester Place, Paddington"
"LINESTRING (-0.157436 51.512276,-0.165164 51.514746", "From Green Street, Mayfair to Porchester Place, Paddington"
"LINESTRING (-0.130699 51.50777,-0.165164 51.514746", "From Pall Mall East, West End to Porchester Place, Paddington"
"LINESTRING (-0.103137 51.506692,-0.165164 51.514746", "From Poured Lines, Bankside to Porchester Place, Paddington"
"LINESTRING (-0.179702 51.499428,-0.165164 51.514746", "From Imperial College, Knightsbridge to Porchester Place, Paddington"
"LINESTRING (-0.151926 51.516814,-0.165164 51.514746", "From Hinde Street, Marylebone to Porchester Place, Paddington"
"LINESTRING (-0.131773 51.506633,-0.165164 51.514746", "From Waterloo Place, St. James's to Porchester Place, Paddington"
"LINESTRING (-0.131773 51.506633,-0.165164 51.514746", "From Waterloo Place, St. James's to Porchester Place, Paddington"
"LINESTRING (-0.157436 51.512276,-0.165164 51.514746", "From Green Street, Mayfair to Porchester Place, Paddington"
"LINESTRING (-0.103137 51.506692,-0.165164 51.514746", "From Poured Lines, Bankside to Porchester Place, Paddington"
"LINESTRING (-0.103137 51.506692,-0.165164 51.514746", "From Poured Lines, Bankside to Porchester Place, Paddington"
"LINESTRING (-0.176415 51.499806,-0.165164 51.514746", "From Prince Consort Road, Knightsbridge to Porchester Place, Paddington"
"LINESTRING (-0.17219 51.526448,-0.165164 51.514746", "From Lisson Grove, St. John's Wood to Porchester Place, Paddington"
"LINESTRING (-0.158456 51.502953,-0.165164 51.514746", "From Albert Gate, Hyde Park to Porchester Place, Paddington"
"LINESTRING (-0.103137 51.506692,-0.165164 51.514746", "From Poured Lines, Bankside to Porchester Place, Paddington"
"LINESTRING (-0.119123 51.519435,-0.108068 51.527842", "From Red Lion Square, Holborn to Hardwick Street, Clerkenwell"
"LINESTRING (-0.109914 51.531666,-0.108068 51.527842", "From Claremont Square, Angel to Hardwick Street, Clerkenwell"
"LINESTRING (-0.119123 51.519435,-0.108068 51.527842", "From Red Lion Square, Holborn to Hardwick Street, Clerkenwell"
"LINESTRING (-0.131961 51.508446,-0.108068 51.527842", "From Charles II Street, West End to Hardwick Street, Clerkenwell"
"LINESTRING (-0.097122 51.529423,-0.108068 51.527842", "From Macclesfield Rd, St Lukes to Hardwick Street, Clerkenwell"
"LINESTRING (-0.097122 51.529423,-0.108068 51.527842", "From Macclesfield Rd, St Lukes to Hardwick Street, Clerkenwell"
"LINESTRING (-0.135478 51.495827,-0.186753 51.491615", "From Rochester Row, Westminster to Collingham Gardens, Earl's Court"
"LINESTRING (-0.150908 51.47505,-0.186753 51.491615", "From Alfreda Street, Battersea Park to Collingham Gardens, Earl's Court"
"LINESTRING (-0.135478 51.495827,-0.186753 51.491615", "From Rochester Row, Westminster to Collingham Gardens, Earl's Court"
"LINESTRING (-0.150908 51.47505,-0.186753 51.491615", "From Alfreda Street, Battersea Park to Collingham Gardens, Earl's Court"
"LINESTRING (-0.179077 51.495592,-0.186753 51.491615", "From Natural History Museum, South Kensington to Collingham Gardens, Earl's Court"
"LINESTRING (-0.18498 51.501737,-0.186753 51.491615", "From De Vere Gardens, Kensington to Collingham Gardens, Earl's Court"
"LINESTRING (-0.179077 51.495592,-0.186753 51.491615", "From Natural History Museum, South Kensington to Collingham Gardens, Earl's Court"
"LINESTRING (-0.172078 51.482567,-0.173715 51.491211", "From Danvers Street, West Chelsea to Sumner Place, South Kensington"
"LINESTRING (-0.149035 51.481121,-0.173715 51.491211", "From Sopwith Way, Battersea Park to Sumner Place, South Kensington"
"LINESTRING (-0.076341 51.534464,-0.079608 51.521668", "From Whiston Road, Haggerston to Worship Street, Shoreditch"
"LINESTRING (-0.06415 51.51295,-0.079608 51.521668", "From Christian Street, Whitechapel to Worship Street, Shoreditch"
"LINESTRING (-0.054883 51.522561,-0.079608 51.521668", "From Cephas Street, Bethnal Green to Worship Street, Shoreditch"
"LINESTRING (-0.06415 51.51295,-0.079608 51.521668", "From Christian Street, Whitechapel to Worship Street, Shoreditch"
"LINESTRING (-0.15352 51.503117,-0.188098 51.517919", "From Hyde Park Corner, Hyde Park to Gloucester Terrace, Bayswater"
"LINESTRING (-0.15352 51.503117,-0.188098 51.517919", "From Hyde Park Corner, Hyde Park to Gloucester Terrace, Bayswater"
"LINESTRING (-0.158963 51.524517,-0.140947 51.49616", "From Park Road (Baker Street), The Regent's Park to Ashley Place, Victoria"
"LINESTRING (-0.150481 51.51217,-0.140947 51.49616", "From Grosvenor Square, Mayfair to Ashley Place, Victoria"
"LINESTRING (-0.124749 51.509462,-0.140947 51.49616", "From William IV Street, Strand to Ashley Place, Victoria"
"LINESTRING (-0.124749 51.509462,-0.140947 51.49616", "From William IV Street, Strand to Ashley Place, Victoria"
"LINESTRING (-0.124642 51.481747,-0.140947 51.49616", "From South Lambeth Road, Vauxhall to Ashley Place, Victoria"
"LINESTRING (-0.149569 51.50274,-0.140947 51.49616", "From Wellington Arch, Hyde Park to Ashley Place, Victoria"
"LINESTRING (-0.141728 51.539099,-0.140947 51.49616", "From Greenland Road, Camden Town to Ashley Place, Victoria"
"LINESTRING (-0.135635 51.488226,-0.140947 51.49616", "From St. George's Square, Pimlico to Ashley Place, Victoria"
"LINESTRING (-0.117661 51.482678,-0.140947 51.49616", "From Ashmole Estate, Oval to Ashley Place, Victoria"
"LINESTRING (-0.158963 51.524517,-0.140947 51.49616", "From Park Road (Baker Street), The Regent's Park to Ashley Place, Victoria"
"LINESTRING (-0.142207 51.485357,-0.140947 51.49616", "From Grosvenor Road, Pimlico to Ashley Place, Victoria"
"LINESTRING (-0.117661 51.482678,-0.140947 51.49616", "From Ashmole Estate, Oval to Ashley Place, Victoria"
"LINESTRING (-0.149569 51.50274,-0.140947 51.49616", "From Wellington Arch, Hyde Park to Ashley Place, Victoria"
"LINESTRING (-0.131773 51.506633,-0.140947 51.49616", "From Waterloo Place, St. James's to Ashley Place, Victoria"
"LINESTRING (-0.139625 51.490962,-0.140947 51.49616", "From Gloucester Street, Pimlico to Ashley Place, Victoria"
"LINESTRING (-0.133201 51.512515,-0.140947 51.49616", "From Wardour Street, Soho to Ashley Place, Victoria"
"LINESTRING (-0.134234 51.494591,-0.140947 51.49616", "From Greycoat Street , Westminster to Ashley Place, Victoria"
"LINESTRING (-0.132224 51.49206,-0.140947 51.49616", "From Regency Street, Westminster to Ashley Place, Victoria"
"LINESTRING (-0.134621 51.507424,-0.140947 51.49616", "From St. James's Square, St. James's to Ashley Place, Victoria"
"LINESTRING (-0.175116 51.523353,-0.140947 51.49616", "From Frampton Street, Paddington to Ashley Place, Victoria"
"LINESTRING (-0.138846 51.510048,-0.140947 51.49616", "From Sackville Street, Mayfair to Ashley Place, Victoria"
"LINESTRING (-0.144228 51.518117,-0.140947 51.49616", "From Broadcasting House, Marylebone to Ashley Place, Victoria"
"LINESTRING (-0.132224 51.49206,-0.140947 51.49616", "From Regency Street, Westminster to Ashley Place, Victoria"
"LINESTRING (-0.132224 51.49206,-0.140947 51.49616", "From Regency Street, Westminster to Ashley Place, Victoria"
"LINESTRING (-0.141423 51.514499,-0.140947 51.49616", "From Little Argyll Street, West End to Ashley Place, Victoria"
"LINESTRING (-0.132224 51.49206,-0.140947 51.49616", "From Regency Street, Westminster to Ashley Place, Victoria"
"LINESTRING (-0.19701 51.473763,-0.141923 51.489856", "From Irene Road, Parsons Green to Warwick Square, Pimlico"
"LINESTRING (-0.132102 51.498125,-0.141923 51.489856", "From Abbey Orchard Street, Westminster to Warwick Square, Pimlico"
"LINESTRING (-0.151359 51.522008,-0.141923 51.489856", "From Beaumont Street, Marylebone to Warwick Square, Pimlico"
"LINESTRING (-0.121394 51.493699,-0.141923 51.489856", "From Fire Brigade Pier, Vauxhall to Warwick Square, Pimlico"
"LINESTRING (-0.132102 51.498125,-0.141923 51.489856", "From Abbey Orchard Street, Westminster to Warwick Square, Pimlico"
"LINESTRING (-0.140741 51.488057,-0.141923 51.489856", "From Alderney Street, Pimlico to Warwick Square, Pimlico"
"LINESTRING (-0.132102 51.498125,-0.141923 51.489856", "From Abbey Orchard Street, Westminster to Warwick Square, Pimlico"
"LINESTRING (-0.121394 51.493699,-0.141923 51.489856", "From Fire Brigade Pier, Vauxhall to Warwick Square, Pimlico"
"LINESTRING (-0.121394 51.493699,-0.153645 51.512911", "From Fire Brigade Pier, Vauxhall to North Audley Street, Mayfair"
"LINESTRING (-0.105344 51.515059,-0.153645 51.512911", "From St. Bride Street, Holborn to North Audley Street, Mayfair"
"LINESTRING (-0.105344 51.515059,-0.153645 51.512911", "From St. Bride Street, Holborn to North Audley Street, Mayfair"
"LINESTRING (-0.198286 51.493724,-0.153645 51.512911", "From West Cromwell Road, Earl's Court to North Audley Street, Mayfair"
"LINESTRING (-0.141423 51.514499,-0.153645 51.512911", "From Little Argyll Street, West End to North Audley Street, Mayfair"
"LINESTRING (-0.157436 51.512276,-0.153645 51.512911", "From Green Street, Mayfair to North Audley Street, Mayfair"
"LINESTRING (-0.141423 51.514499,-0.153645 51.512911", "From Little Argyll Street, West End to North Audley Street, Mayfair"
"LINESTRING (-0.130458 51.494816,-0.152317 51.499412", "From Horseferry Road, Westminster to Belgrave Square, Belgravia"
"LINESTRING (-0.138733 51.496753,-0.152317 51.499412", "From Howick Place, Westminster to Belgrave Square, Belgravia"
"LINESTRING (-0.138733 51.496753,-0.152317 51.499412", "From Howick Place, Westminster to Belgrave Square, Belgravia"
"LINESTRING (-0.150905 51.496544,-0.152317 51.499412", "From Eaton Square, Belgravia to Belgrave Square, Belgravia"
"LINESTRING (-0.202608 51.51632,-0.165842 51.522029", "From All Saints Church, Portobello to Bell Street , Marylebone"
"LINESTRING (-0.154701 51.520583,-0.165842 51.522029", "From Paddington Street, Marylebone to Bell Street , Marylebone"
"LINESTRING (-0.154701 51.520583,-0.165842 51.522029", "From Paddington Street, Marylebone to Bell Street , Marylebone"
"LINESTRING (-0.183118 51.515607,-0.165842 51.522029", "From Cleveland Gardens, Bayswater to Bell Street , Marylebone"
"LINESTRING (-0.121394 51.493699,-0.136123 51.482362", "From Fire Brigade Pier, Vauxhall to Riverlight North, Nine Elms"
"LINESTRING (-0.136123 51.482362,-0.136123 51.482362", "From Riverlight North, Nine Elms to Riverlight North, Nine Elms"
"LINESTRING (-0.121394 51.493699,-0.136123 51.482362", "From Fire Brigade Pier, Vauxhall to Riverlight North, Nine Elms"
"LINESTRING (-0.121394 51.493699,-0.136123 51.482362", "From Fire Brigade Pier, Vauxhall to Riverlight North, Nine Elms"
"LINESTRING (-0.136123 51.482362,-0.136123 51.482362", "From Riverlight North, Nine Elms to Riverlight North, Nine Elms"
"LINESTRING (-0.121394 51.493699,-0.136123 51.482362", "From Fire Brigade Pier, Vauxhall to Riverlight North, Nine Elms"
"LINESTRING (-0.121394 51.493699,-0.136123 51.482362", "From Fire Brigade Pier, Vauxhall to Riverlight North, Nine Elms"
"LINESTRING (-0.121394 51.493699,-0.136123 51.482362", "From Fire Brigade Pier, Vauxhall to Riverlight North, Nine Elms"
"LINESTRING (-0.136123 51.482362,-0.136123 51.482362", "From Riverlight North, Nine Elms to Riverlight North, Nine Elms"
"LINESTRING (-0.160854 51.535892,-0.145211 51.520715", "From Prince Albert Road, The Regent's Park to Portland Place, Marylebone"
"LINESTRING (-0.114605 51.495656,-0.145211 51.520715", "From Sail Street, Vauxhall to Portland Place, Marylebone"
"LINESTRING (-0.114605 51.495656,-0.145211 51.520715", "From Sail Street, Vauxhall to Portland Place, Marylebone"
"LINESTRING (-0.160854 51.535892,-0.145211 51.520715", "From Prince Albert Road, The Regent's Park to Portland Place, Marylebone"
"LINESTRING (-0.176645 51.518622,-0.145211 51.520715", "From North Wharf Road, Paddington to Portland Place, Marylebone"
"LINESTRING (-0.160854 51.535892,-0.145211 51.520715", "From Prince Albert Road, The Regent's Park to Portland Place, Marylebone"
"LINESTRING (-0.176645 51.518622,-0.145211 51.520715", "From North Wharf Road, Paddington to Portland Place, Marylebone"
"LINESTRING (-0.160854 51.535892,-0.145211 51.520715", "From Prince Albert Road, The Regent's Park to Portland Place, Marylebone"
"LINESTRING (-0.176645 51.518622,-0.145211 51.520715", "From North Wharf Road, Paddington to Portland Place, Marylebone"
"LINESTRING (-0.176645 51.518622,-0.145211 51.520715", "From North Wharf Road, Paddington to Portland Place, Marylebone"
"LINESTRING (-0.131213 51.513103,-0.145211 51.520715", "From Frith Street, Soho to Portland Place, Marylebone"
"LINESTRING (-0.124678 51.51908,-0.145211 51.520715", "From British Museum, Bloomsbury to Portland Place, Marylebone"
"LINESTRING (-0.124678 51.51908,-0.145211 51.520715", "From British Museum, Bloomsbury to Portland Place, Marylebone"
"LINESTRING (-0.160854 51.535892,-0.145211 51.520715", "From Prince Albert Road, The Regent's Park to Portland Place, Marylebone"
"LINESTRING (-0.133201 51.512515,-0.145211 51.520715", "From Wardour Street, Soho to Portland Place, Marylebone"
"LINESTRING (-0.153933 51.494561,-0.140741 51.488057", "From Eaton Square (South), Belgravia to Alderney Street, Pimlico"
"LINESTRING (-0.13544 51.497829,-0.140741 51.488057", "From Butler Place, Westminster to Alderney Street, Pimlico"
"LINESTRING (-0.141923 51.489856,-0.140741 51.488057", "From Warwick Square, Pimlico to Alderney Street, Pimlico"
"LINESTRING (-0.156876 51.49313,-0.140741 51.488057", "From Sedding Street, Sloane Square to Alderney Street, Pimlico"
"LINESTRING (-0.135478 51.495827,-0.140741 51.488057", "From Rochester Row, Westminster to Alderney Street, Pimlico"
"LINESTRING (-0.132102 51.498125,-0.140741 51.488057", "From Abbey Orchard Street, Westminster to Alderney Street, Pimlico"
"LINESTRING (-0.156876 51.49313,-0.140741 51.488057", "From Sedding Street, Sloane Square to Alderney Street, Pimlico"
"LINESTRING (-0.140741 51.488057,-0.140741 51.488057", "From Alderney Street, Pimlico to Alderney Street, Pimlico"
"LINESTRING (-0.156876 51.49313,-0.140741 51.488057", "From Sedding Street, Sloane Square to Alderney Street, Pimlico"
"LINESTRING (-0.135635 51.488226,-0.140741 51.488057", "From St. George's Square, Pimlico to Alderney Street, Pimlico"
"LINESTRING (-0.058826 51.54119,-0.140741 51.488057", "From London Fields, Hackney Central to Alderney Street, Pimlico"
"LINESTRING (-0.162727 51.489932,-0.140741 51.488057", "From Royal Avenue 1, Chelsea to Alderney Street, Pimlico"
"LINESTRING (-0.140741 51.488057,-0.140741 51.488057", "From Alderney Street, Pimlico to Alderney Street, Pimlico"
"LINESTRING (-0.147478 51.492369,-0.140741 51.488057", "From Elizabeth Bridge, Victoria to Alderney Street, Pimlico"
"LINESTRING (-0.137424 51.498865,-0.140741 51.488057", "From Buckingham Gate, Westminster to Alderney Street, Pimlico"
"LINESTRING (-0.144083 51.525595,-0.17581 51.517335", "From Longford Street, The Regent's Park to South Wharf Road, Paddington"
"LINESTRING (-0.18119 51.485587,-0.17581 51.517335", "From Limerston Street, West Chelsea to South Wharf Road, Paddington"
"LINESTRING (-0.147478 51.492369,-0.17581 51.517335", "From Elizabeth Bridge, Victoria to South Wharf Road, Paddington"
"LINESTRING (-0.107913 51.498386,-0.17581 51.517335", "From Westminster Bridge Road, Elephant & Castle to South Wharf Road, Paddington"
"LINESTRING (-0.166304 51.525051,-0.17581 51.517335", "From Mallory Street, Marylebone to South Wharf Road, Paddington"
"LINESTRING (-0.193487 51.513735,-0.17581 51.517335", "From Hereford Road, Bayswater to South Wharf Road, Paddington"
"LINESTRING (-0.149569 51.50274,-0.17581 51.517335", "From Wellington Arch, Hyde Park to South Wharf Road, Paddington"
"LINESTRING (-0.107913 51.498386,-0.17581 51.517335", "From Westminster Bridge Road, Elephant & Castle to South Wharf Road, Paddington"
"LINESTRING (-0.178433 51.492479,-0.178433 51.492479", "From Queen's Gate (South), South Kensington to Queen's Gate (South), South Kensington"
"LINESTRING (-0.179854 51.501715,-0.178433 51.492479", "From Queen's Gate, Kensington Gardens to Queen's Gate (South), South Kensington"
"LINESTRING (-0.179854 51.501715,-0.178433 51.492479", "From Queen's Gate, Kensington Gardens to Queen's Gate (South), South Kensington"
"LINESTRING (-0.15352 51.503117,-0.164393 51.516517", "From Hyde Park Corner, Hyde Park to Nutford Place, Marylebone"
"LINESTRING (-0.164393 51.516517,-0.164393 51.516517", "From Nutford Place, Marylebone to Nutford Place, Marylebone"
"LINESTRING (-0.164393 51.516517,-0.164393 51.516517", "From Nutford Place, Marylebone to Nutford Place, Marylebone"
"LINESTRING (-0.15352 51.503117,-0.164393 51.516517", "From Hyde Park Corner, Hyde Park to Nutford Place, Marylebone"
"LINESTRING (-0.150817 51.505426,-0.164393 51.516517", "From Park Lane, Mayfair to Nutford Place, Marylebone"
"LINESTRING (-0.179077 51.495592,-0.164393 51.516517", "From Natural History Museum, South Kensington to Nutford Place, Marylebone"
"LINESTRING (-0.134621 51.507424,-0.164393 51.516517", "From St. James's Square, St. James's to Nutford Place, Marylebone"
"LINESTRING (-0.148105 51.514759,-0.164393 51.516517", "From Marylebone Lane, Marylebone to Nutford Place, Marylebone"
"LINESTRING (-0.15352 51.503117,-0.164393 51.516517", "From Hyde Park Corner, Hyde Park to Nutford Place, Marylebone"
"LINESTRING (-0.163667 51.520331,-0.164393 51.516517", "From Seymour Place, Marylebone to Nutford Place, Marylebone"
"LINESTRING (-0.15352 51.503117,-0.164393 51.516517", "From Hyde Park Corner, Hyde Park to Nutford Place, Marylebone"
"LINESTRING (-0.164393 51.516517,-0.164393 51.516517", "From Nutford Place, Marylebone to Nutford Place, Marylebone"
"LINESTRING (-0.10997 51.529163,-0.109914 51.531666", "From River Street , Clerkenwell to Claremont Square, Angel"
"LINESTRING (-0.131961 51.508446,-0.109914 51.531666", "From Charles II Street, West End to Claremont Square, Angel"
"LINESTRING (-0.145393 51.542138,-0.109914 51.531666", "From Castlehaven Road, Camden Town to Claremont Square, Angel"
