"LINESTRING (-0.082989 51.510484,-0.10997 51.529163", "From Great Tower Street, Monument to River Street , Clerkenwell"
"LINESTRING (-0.082989 51.510484,-0.10997 51.529163", "From Great Tower Street, Monument to River Street , Clerkenwell"
"LINESTRING (-0.19024 51.515529,-0.10997 51.529163", "From Westbourne Grove, Bayswater to River Street , Clerkenwell"
"LINESTRING (-0.10997 51.529163,-0.10997 51.529163", "From River Street , Clerkenwell to River Street , Clerkenwell"
"LINESTRING (-0.10997 51.529163,-0.10997 51.529163", "From River Street , Clerkenwell to River Street , Clerkenwell"
"LINESTRING (-0.209121 51.491026,-0.197574 51.499606", "From Gwendwr Road, West Kensington to Phillimore Gardens, Kensington"
"LINESTRING (-0.195455 51.500401,-0.197574 51.499606", "From Argyll Road, Kensington to Phillimore Gardens, Kensington"
"LINESTRING (-0.213872 51.51687,-0.197574 51.499606", "From St. Mark's Road, North Kensington to Phillimore Gardens, Kensington"
"LINESTRING (-0.215804 51.494347,-0.197574 51.499606", "From Brook Green South, Brook Green to Phillimore Gardens, Kensington"
"LINESTRING (-0.146544 51.468669,-0.197574 51.499606", "From Heath Road, Battersea to Phillimore Gardens, Kensington"
"LINESTRING (-0.213872 51.51687,-0.197574 51.499606", "From St. Mark's Road, North Kensington to Phillimore Gardens, Kensington"
"LINESTRING (-0.223616 51.485743,-0.197574 51.499606", "From Manbre Road, Hammersmith to Phillimore Gardens, Kensington"
"LINESTRING (-0.191462 51.501364,-0.197574 51.499606", "From Derry Street, Kensington to Phillimore Gardens, Kensington"
"LINESTRING (-0.217995 51.487285,-0.197574 51.499606", "From Charing Cross Hospital, Hammersmith to Phillimore Gardens, Kensington"
"LINESTRING (-0.186753 51.491615,-0.197574 51.499606", "From Collingham Gardens, Earl's Court to Phillimore Gardens, Kensington"
"LINESTRING (-0.205284 51.496712,-0.197574 51.499606", "From Warwick Road, Olympia to Phillimore Gardens, Kensington"
"LINESTRING (-0.215808 51.503802,-0.197574 51.499606", "From Hansard Mews, Holland Park to Phillimore Gardens, Kensington"
"LINESTRING (-0.210941 51.504199,-0.197574 51.499606", "From Addison Road, Holland Park to Phillimore Gardens, Kensington"
"LINESTRING (-0.093421 51.529154,-0.084605 51.521283", "From Windsor Terrace, Hoxton to Christopher Street, Liverpool Street"
"LINESTRING (-0.104724 51.52836,-0.084605 51.521283", "From St. John Street, Finsbury to Christopher Street, Liverpool Street"
"LINESTRING (-0.145393 51.542138,-0.120973 51.530059", "From Castlehaven Road, Camden Town to St. Chad's Street, King's Cross"
"LINESTRING (-0.063531 51.504719,-0.120973 51.530059", "From Hermitage Court, Wapping to St. Chad's Street, King's Cross"
"LINESTRING (-0.079201 51.537277,-0.120973 51.530059", "From Hertford Road, De Beauvoir Town to St. Chad's Street, King's Cross"
"LINESTRING (-0.118295 51.52728,-0.120973 51.530059", "From Ampton Street , Clerkenwell to St. Chad's Street, King's Cross"
"LINESTRING (-0.122299 51.530199,-0.120973 51.530059", "From Birkenhead Street, King's Cross to St. Chad's Street, King's Cross"
"LINESTRING (-0.105312 51.504043,-0.120973 51.530059", "From Southwark Station 1, Southwark to St. Chad's Street, King's Cross"
"LINESTRING (-0.127854 51.517727,-0.120973 51.530059", "From Great Russell Street, Bloomsbury to St. Chad's Street, King's Cross"
"LINESTRING (-0.135635 51.488226,-0.156876 51.49313", "From St. George's Square, Pimlico to Sedding Street, Sloane Square"
"LINESTRING (-0.139625 51.490962,-0.156876 51.49313", "From Gloucester Street, Pimlico to Sedding Street, Sloane Square"
"LINESTRING (-0.192369 51.491593,-0.156876 51.49313", "From Penywern Road, Earl's Court to Sedding Street, Sloane Square"
"LINESTRING (-0.192369 51.491593,-0.156876 51.49313", "From Penywern Road, Earl's Court to Sedding Street, Sloane Square"
"LINESTRING (-0.18267 51.494185,-0.156876 51.49313", "From Gloucester Road Station, South Kensington to Sedding Street, Sloane Square"
"LINESTRING (-0.170329 51.477684,-0.156876 51.49313", "From Westbridge Road, Battersea to Sedding Street, Sloane Square"
"LINESTRING (-0.141923 51.489856,-0.156876 51.49313", "From Warwick Square, Pimlico to Sedding Street, Sloane Square"
"LINESTRING (-0.1844 51.502042,-0.156876 51.49313", "From Palace Gate, Kensington Gardens to Sedding Street, Sloane Square"
"LINESTRING (-0.18267 51.494185,-0.156876 51.49313", "From Gloucester Road Station, South Kensington to Sedding Street, Sloane Square"
"LINESTRING (-0.168917 51.497056,-0.156876 51.49313", "From Holy Trinity Brompton, Knightsbridge to Sedding Street, Sloane Square"
"LINESTRING (-0.184318 51.468819,-0.156876 51.49313", "From William Morris Way, Sands End to Sedding Street, Sloane Square"
"LINESTRING (-0.124121 51.523418,-0.144228 51.518117", "From Russell Square Station, Bloomsbury to Broadcasting House, Marylebone"
"LINESTRING (-0.165471 51.498884,-0.144228 51.518117", "From Montpelier Street, Knightsbridge to Broadcasting House, Marylebone"
"LINESTRING (-0.158963 51.524517,-0.144228 51.518117", "From Park Road (Baker Street), The Regent's Park to Broadcasting House, Marylebone"
"LINESTRING (-0.123616 51.529943,-0.144228 51.518117", "From Belgrove Street , King's Cross to Broadcasting House, Marylebone"
"LINESTRING (-0.165471 51.498884,-0.144228 51.518117", "From Montpelier Street, Knightsbridge to Broadcasting House, Marylebone"
"LINESTRING (-0.130699 51.50777,-0.144228 51.518117", "From Pall Mall East, West End to Broadcasting House, Marylebone"
"LINESTRING (-0.147154 51.537349,-0.144228 51.518117", "From Gloucester Avenue, Camden Town to Broadcasting House, Marylebone"
"LINESTRING (-0.130699 51.50777,-0.144228 51.518117", "From Pall Mall East, West End to Broadcasting House, Marylebone"
"LINESTRING (-0.158963 51.524517,-0.144228 51.518117", "From Park Road (Baker Street), The Regent's Park to Broadcasting House, Marylebone"
"LINESTRING (-0.165471 51.498884,-0.144228 51.518117", "From Montpelier Street, Knightsbridge to Broadcasting House, Marylebone"
"LINESTRING (-0.11548 51.528915,-0.144228 51.518117", "From Great Percy Street, Clerkenwell to Broadcasting House, Marylebone"
"LINESTRING (-0.193487 51.513735,-0.144228 51.518117", "From Hereford Road, Bayswater to Broadcasting House, Marylebone"
"LINESTRING (-0.171103 51.518268,-0.144228 51.518117", "From St Mary's Hospital, Paddington to Broadcasting House, Marylebone"
"LINESTRING (-0.13225 51.528833,-0.168074 51.5343", "From Doric Way , Somers Town to Charlbert Street, St. John's Wood"
"LINESTRING (-0.138019 51.524438,-0.168074 51.5343", "From Warren Street Station, Euston to Charlbert Street, St. John's Wood"
"LINESTRING (-0.168074 51.5343,-0.168074 51.5343", "From Charlbert Street, St. John's Wood to Charlbert Street, St. John's Wood"
"LINESTRING (-0.179592 51.525575,-0.183486 51.529857", "From Clifton Road, Maida Vale to Maida Vale, Maida Vale"
"LINESTRING (-0.098341 51.505409,-0.092754 51.505974", "From Southwark Street, Bankside to Park Street, Bankside"
"LINESTRING (-0.104193 51.49605,-0.092754 51.505974", "From Gaywood  Street, Elephant & Castle to Park Street, Bankside"
"LINESTRING (-0.09644 51.507385,-0.092754 51.505974", "From New Globe Walk, Bankside to Park Street, Bankside"
"LINESTRING (-0.093913 51.496791,-0.092754 51.505974", "From Dickens Square, Borough to Park Street, Bankside"
"LINESTRING (-0.098341 51.505409,-0.092754 51.505974", "From Southwark Street, Bankside to Park Street, Bankside"
"LINESTRING (-0.114079 51.522264,-0.122502 51.523951", "From Northington Street , Holborn to Brunswick Square, Bloomsbury"
"LINESTRING (-0.13225 51.528833,-0.122502 51.523951", "From Doric Way , Somers Town to Brunswick Square, Bloomsbury"
"LINESTRING (-0.11655 51.51824,-0.122502 51.523951", "From Red Lion Street, Holborn to Brunswick Square, Bloomsbury"
"LINESTRING (-0.11655 51.51824,-0.122502 51.523951", "From Red Lion Street, Holborn to Brunswick Square, Bloomsbury"
"LINESTRING (-0.116279 51.524564,-0.122502 51.523951", "From Wren Street, Holborn to Brunswick Square, Bloomsbury"
"LINESTRING (-0.118295 51.52728,-0.122502 51.523951", "From Ampton Street , Clerkenwell to Brunswick Square, Bloomsbury"
"LINESTRING (-0.122219 51.51477,-0.122502 51.523951", "From Drury Lane, Covent Garden to Brunswick Square, Bloomsbury"
"LINESTRING (-0.122299 51.530199,-0.122502 51.523951", "From Birkenhead Street, King's Cross to Brunswick Square, Bloomsbury"
"LINESTRING (-0.11655 51.51824,-0.122502 51.523951", "From Red Lion Street, Holborn to Brunswick Square, Bloomsbury"
"LINESTRING (-0.122502 51.523951,-0.130431 51.52168", "From Brunswick Square, Bloomsbury to Malet Street, Bloomsbury"
"LINESTRING (-0.125979 51.526357,-0.130431 51.52168", "From Cartwright Gardens , Bloomsbury to Malet Street, Bloomsbury"
"LINESTRING (-0.128279 51.5293,-0.130431 51.52168", "From Ossulston Street, Somers Town to Malet Street, Bloomsbury"
"LINESTRING (-0.179668 51.511654,-0.130431 51.52168", "From Lancaster Gate , Bayswater to Malet Street, Bloomsbury"
"LINESTRING (-0.147203 51.515308,-0.130431 51.52168", "From Chapel Place, Marylebone to Malet Street, Bloomsbury"
"LINESTRING (-0.123616 51.529943,-0.130431 51.52168", "From Belgrove Street , King's Cross to Malet Street, Bloomsbury"
"LINESTRING (-0.123509 51.52625,-0.130431 51.52168", "From Tavistock Place, Bloomsbury to Malet Street, Bloomsbury"
"LINESTRING (-0.133952 51.536264,-0.130431 51.52168", "From Royal College Street, Camden Town to Malet Street, Bloomsbury"
"LINESTRING (-0.096317 51.526008,-0.130431 51.52168", "From Finsbury Leisure Centre, St. Luke's to Malet Street, Bloomsbury"
"LINESTRING (-0.131861 51.527068,-0.136039 51.519914", "From Euston Square Gardens, Euston to Scala Street, Fitzrovia"
"LINESTRING (-0.136039 51.519914,-0.136039 51.519914", "From Scala Street, Fitzrovia to Scala Street, Fitzrovia"
"LINESTRING (-0.149186 51.490491,-0.136039 51.519914", "From Ebury Bridge, Pimlico to Scala Street, Fitzrovia"
"LINESTRING (-0.124826 51.516226,-0.136039 51.519914", "From High Holborn , Covent Garden to Scala Street, Fitzrovia"
"LINESTRING (-0.124121 51.523418,-0.136039 51.519914", "From Russell Square Station, Bloomsbury to Scala Street, Fitzrovia"
"LINESTRING (-0.09885 51.515418,-0.136039 51.519914", "From Newgate Street , St. Paul's to Scala Street, Fitzrovia"
"LINESTRING (-0.154701 51.520583,-0.136039 51.519914", "From Paddington Street, Marylebone to Scala Street, Fitzrovia"
"LINESTRING (-0.150181 51.536922,-0.136039 51.519914", "From London Zoo Car Park, The Regent's Park to Scala Street, Fitzrovia"
"LINESTRING (-0.166304 51.525051,-0.136039 51.519914", "From Mallory Street, Marylebone to Scala Street, Fitzrovia"
"LINESTRING (-0.147203 51.515308,-0.136039 51.519914", "From Chapel Place, Marylebone to Scala Street, Fitzrovia"
"LINESTRING (-0.113001 51.50486,-0.123616 51.529943", "From Waterloo Road, South Bank to Belgrove Street , King's Cross"
"LINESTRING (-0.125078 51.534667,-0.123616 51.529943", "From Good's Way, King's Cross to Belgrove Street , King's Cross"
"LINESTRING (-0.132328 51.515631,-0.123616 51.529943", "From Soho Square , Soho to Belgrove Street , King's Cross"
"LINESTRING (-0.169774 51.519968,-0.123616 51.529943", "From Edgware Road Station, Marylebone to Belgrove Street , King's Cross"
"LINESTRING (-0.125078 51.534667,-0.123616 51.529943", "From Good's Way, King's Cross to Belgrove Street , King's Cross"
"LINESTRING (-0.109256 51.526443,-0.123616 51.529943", "From Tysoe Street, Clerkenwell to Belgrove Street , King's Cross"
"LINESTRING (-0.093421 51.529154,-0.123616 51.529943", "From Windsor Terrace, Hoxton to Belgrove Street , King's Cross"
"LINESTRING (-0.124807 51.53724,-0.123616 51.529943", "From Handyside Street, King's Cross to Belgrove Street , King's Cross"
"LINESTRING (-0.07023 51.536654,-0.123616 51.529943", "From Belford House, Haggerston to Belgrove Street , King's Cross"
"LINESTRING (-0.136792 51.533005,-0.123616 51.529943", "From Eversholt Street , Camden Town to Belgrove Street , King's Cross"
"LINESTRING (-0.125078 51.534667,-0.123616 51.529943", "From Good's Way, King's Cross to Belgrove Street , King's Cross"
"LINESTRING (-0.144228 51.518117,-0.123616 51.529943", "From Broadcasting House, Marylebone to Belgrove Street , King's Cross"
"LINESTRING (-0.099489 51.524868,-0.123616 51.529943", "From Sadlers Sports Centre, Finsbury to Belgrove Street , King's Cross"
"LINESTRING (-0.099489 51.524868,-0.123616 51.529943", "From Sadlers Sports Centre, Finsbury to Belgrove Street , King's Cross"
"LINESTRING (-0.158963 51.524517,-0.123616 51.529943", "From Park Road (Baker Street), The Regent's Park to Belgrove Street , King's Cross"
"LINESTRING (-0.093421 51.529154,-0.123616 51.529943", "From Windsor Terrace, Hoxton to Belgrove Street , King's Cross"
"LINESTRING (-0.120973 51.530059,-0.123616 51.529943", "From St. Chad's Street, King's Cross to Belgrove Street , King's Cross"
"LINESTRING (-0.125078 51.534667,-0.123616 51.529943", "From Good's Way, King's Cross to Belgrove Street , King's Cross"
"LINESTRING (-0.144228 51.518117,-0.123616 51.529943", "From Broadcasting House, Marylebone to Belgrove Street , King's Cross"
"LINESTRING (-0.133201 51.512515,-0.123616 51.529943", "From Wardour Street, Soho to Belgrove Street , King's Cross"
"LINESTRING (-0.101026 51.528246,-0.123616 51.529943", "From Goswell Road (City Uni), Finsbury to Belgrove Street , King's Cross"
"LINESTRING (-0.116279 51.524564,-0.123616 51.529943", "From Wren Street, Holborn to Belgrove Street , King's Cross"
"LINESTRING (-0.083632 51.502153,-0.123616 51.529943", "From Snowsfields, London Bridge to Belgrove Street , King's Cross"
"LINESTRING (-0.104708 51.52326,-0.123616 51.529943", "From Clerkenwell Green, Clerkenwell to Belgrove Street , King's Cross"
"LINESTRING (-0.126021 51.508103,-0.127854 51.517727", "From Craven Street, Strand to Great Russell Street, Bloomsbury"
"LINESTRING (-0.121328 51.517606,-0.127854 51.517727", "From Southampton Place, Holborn to Great Russell Street, Bloomsbury"
"LINESTRING (-0.083159 51.500889,-0.127854 51.517727", "From Tyers Gate, Bermondsey to Great Russell Street, Bloomsbury"
"LINESTRING (-0.083159 51.500889,-0.127854 51.517727", "From Tyers Gate, Bermondsey to Great Russell Street, Bloomsbury"
"LINESTRING (-0.138231 51.525542,-0.127854 51.517727", "From Hampstead Road, Euston to Great Russell Street, Bloomsbury"
"LINESTRING (-0.120202 51.523346,-0.125979 51.526357", "From Guilford Street , Bloomsbury to Cartwright Gardens , Bloomsbury"
"LINESTRING (-0.09885 51.515418,-0.125979 51.526357", "From Newgate Street , St. Paul's to Cartwright Gardens , Bloomsbury"
"LINESTRING (-0.139258 51.533403,-0.125979 51.526357", "From Harrington Square 2, Camden Town to Cartwright Gardens , Bloomsbury"
"LINESTRING (-0.124121 51.523418,-0.125979 51.526357", "From Russell Square Station, Bloomsbury to Cartwright Gardens , Bloomsbury"
"LINESTRING (-0.144228 51.518117,-0.125979 51.526357", "From Broadcasting House, Marylebone to Cartwright Gardens , Bloomsbury"
"LINESTRING (-0.125979 51.526357,-0.125979 51.526357", "From Cartwright Gardens , Bloomsbury to Cartwright Gardens , Bloomsbury"
"LINESTRING (-0.13214 51.519572,-0.125979 51.526357", "From Store Street, Bloomsbury to Cartwright Gardens , Bloomsbury"
"LINESTRING (-0.144228 51.518117,-0.125979 51.526357", "From Broadcasting House, Marylebone to Cartwright Gardens , Bloomsbury"
"LINESTRING (-0.125979 51.526357,-0.125979 51.526357", "From Cartwright Gardens , Bloomsbury to Cartwright Gardens , Bloomsbury"
"LINESTRING (-0.114079 51.522264,-0.125979 51.526357", "From Northington Street , Holborn to Cartwright Gardens , Bloomsbury"
"LINESTRING (-0.109006 51.521661,-0.109006 51.521661", "From Hatton Wall, Holborn to Hatton Wall, Holborn"
"LINESTRING (-0.109006 51.521661,-0.109006 51.521661", "From Hatton Wall, Holborn to Hatton Wall, Holborn"
"LINESTRING (-0.109006 51.521661,-0.109006 51.521661", "From Hatton Wall, Holborn to Hatton Wall, Holborn"
"LINESTRING (-0.104778 51.504044,-0.109006 51.521661", "From Southwark Station 2, Southwark to Hatton Wall, Holborn"
"LINESTRING (-0.109006 51.521661,-0.109006 51.521661", "From Hatton Wall, Holborn to Hatton Wall, Holborn"
"LINESTRING (-0.122502 51.523951,-0.109006 51.521661", "From Brunswick Square, Bloomsbury to Hatton Wall, Holborn"
"LINESTRING (-0.129697 51.509087,-0.109006 51.521661", "From St. Martin's Street, West End to Hatton Wall, Holborn"
"LINESTRING (-0.100791 51.518218,-0.109006 51.521661", "From West Smithfield Rotunda, Farringdon to Hatton Wall, Holborn"
"LINESTRING (-0.109006 51.521661,-0.109006 51.521661", "From Hatton Wall, Holborn to Hatton Wall, Holborn"
"LINESTRING (-0.075375 51.528187,-0.109006 51.521661", "From Columbia Road, Shoreditch to Hatton Wall, Holborn"
"LINESTRING (-0.109006 51.521661,-0.109006 51.521661", "From Hatton Wall, Holborn to Hatton Wall, Holborn"
"LINESTRING (-0.109006 51.521661,-0.109006 51.521661", "From Hatton Wall, Holborn to Hatton Wall, Holborn"
"LINESTRING (-0.133952 51.536264,-0.109006 51.521661", "From Royal College Street, Camden Town to Hatton Wall, Holborn"
"LINESTRING (-0.109006 51.521661,-0.109006 51.521661", "From Hatton Wall, Holborn to Hatton Wall, Holborn"
"LINESTRING (-0.129697 51.509087,-0.109006 51.521661", "From St. Martin's Street, West End to Hatton Wall, Holborn"
"LINESTRING (-0.109006 51.521661,-0.109006 51.521661", "From Hatton Wall, Holborn to Hatton Wall, Holborn"
"LINESTRING (-0.104778 51.504044,-0.109006 51.521661", "From Southwark Station 2, Southwark to Hatton Wall, Holborn"
"LINESTRING (-0.116542 51.504636,-0.122219 51.51477", "From Jubilee Gardens, South Bank to Drury Lane, Covent Garden"
"LINESTRING (-0.131161 51.52505,-0.122219 51.51477", "From Taviton Street, Bloomsbury to Drury Lane, Covent Garden"
"LINESTRING (-0.116542 51.504636,-0.122219 51.51477", "From Jubilee Gardens, South Bank to Drury Lane, Covent Garden"
"LINESTRING (-0.112721 51.536392,-0.122219 51.51477", "From Charlotte Terrace, Angel to Drury Lane, Covent Garden"
"LINESTRING (-0.116542 51.504636,-0.122219 51.51477", "From Jubilee Gardens, South Bank to Drury Lane, Covent Garden"
"LINESTRING (-0.075375 51.528187,-0.122219 51.51477", "From Columbia Road, Shoreditch to Drury Lane, Covent Garden"
"LINESTRING (-0.137694 51.514667,-0.122219 51.51477", "From Great Marlborough St, Soho to Drury Lane, Covent Garden"
"LINESTRING (-0.122219 51.51477,-0.122219 51.51477", "From Drury Lane, Covent Garden to Drury Lane, Covent Garden"
"LINESTRING (-0.116542 51.504636,-0.122219 51.51477", "From Jubilee Gardens, South Bank to Drury Lane, Covent Garden"
"LINESTRING (-0.082989 51.510484,-0.122219 51.51477", "From Great Tower Street, Monument to Drury Lane, Covent Garden"
"LINESTRING (-0.112432 51.526599,-0.122219 51.51477", "From Margery Street, Clerkenwell to Drury Lane, Covent Garden"
"LINESTRING (-0.082989 51.510484,-0.122219 51.51477", "From Great Tower Street, Monument to Drury Lane, Covent Garden"
"LINESTRING (-0.113001 51.50486,-0.122219 51.51477", "From Waterloo Road, South Bank to Drury Lane, Covent Garden"
"LINESTRING (-0.137694 51.514667,-0.122219 51.51477", "From Great Marlborough St, Soho to Drury Lane, Covent Garden"
"LINESTRING (-0.112432 51.526599,-0.122219 51.51477", "From Margery Street, Clerkenwell to Drury Lane, Covent Garden"
"LINESTRING (-0.138231 51.525542,-0.122219 51.51477", "From Hampstead Road, Euston to Drury Lane, Covent Garden"
"LINESTRING (-0.137424 51.498865,-0.122219 51.51477", "From Buckingham Gate, Westminster to Drury Lane, Covent Garden"
"LINESTRING (-0.137424 51.498865,-0.122219 51.51477", "From Buckingham Gate, Westminster to Drury Lane, Covent Garden"
"LINESTRING (-0.127854 51.517727,-0.122219 51.51477", "From Great Russell Street, Bloomsbury to Drury Lane, Covent Garden"
"LINESTRING (-0.137424 51.498865,-0.122219 51.51477", "From Buckingham Gate, Westminster to Drury Lane, Covent Garden"
"LINESTRING (-0.116279 51.524564,-0.122219 51.51477", "From Wren Street, Holborn to Drury Lane, Covent Garden"
"LINESTRING (-0.127854 51.517727,-0.122219 51.51477", "From Great Russell Street, Bloomsbury to Drury Lane, Covent Garden"
"LINESTRING (-0.099994 51.522853,-0.122219 51.51477", "From Berry Street, Clerkenwell to Drury Lane, Covent Garden"
"LINESTRING (-0.122219 51.51477,-0.122219 51.51477", "From Drury Lane, Covent Garden to Drury Lane, Covent Garden"
"LINESTRING (-0.145393 51.542138,-0.122219 51.51477", "From Castlehaven Road, Camden Town to Drury Lane, Covent Garden"
"LINESTRING (-0.145211 51.520715,-0.122219 51.51477", "From Portland Place, Marylebone to Drury Lane, Covent Garden"
"LINESTRING (-0.127854 51.517727,-0.122219 51.51477", "From Great Russell Street, Bloomsbury to Drury Lane, Covent Garden"
"LINESTRING (-0.113001 51.50486,-0.122219 51.51477", "From Waterloo Road, South Bank to Drury Lane, Covent Garden"
"LINESTRING (-0.116279 51.524564,-0.122219 51.51477", "From Wren Street, Holborn to Drury Lane, Covent Garden"
"LINESTRING (-0.137694 51.514667,-0.122219 51.51477", "From Great Marlborough St, Soho to Drury Lane, Covent Garden"
"LINESTRING (-0.082989 51.510484,-0.122219 51.51477", "From Great Tower Street, Monument to Drury Lane, Covent Garden"
"LINESTRING (-0.116542 51.504636,-0.122219 51.51477", "From Jubilee Gardens, South Bank to Drury Lane, Covent Garden"
"LINESTRING (-0.145211 51.520715,-0.122219 51.51477", "From Portland Place, Marylebone to Drury Lane, Covent Garden"
"LINESTRING (-0.137424 51.498865,-0.122219 51.51477", "From Buckingham Gate, Westminster to Drury Lane, Covent Garden"
"LINESTRING (-0.135777 51.51953,-0.131161 51.52505", "From Charlotte Street, Fitzrovia to Taviton Street, Bloomsbury"
"LINESTRING (-0.124678 51.51908,-0.131161 51.52505", "From British Museum, Bloomsbury to Taviton Street, Bloomsbury"
"LINESTRING (-0.135777 51.51953,-0.131161 51.52505", "From Charlotte Street, Fitzrovia to Taviton Street, Bloomsbury"
"LINESTRING (-0.074284 51.539328,-0.131161 51.52505", "From Haggerston Road, Haggerston to Taviton Street, Bloomsbury"
"LINESTRING (-0.134621 51.507424,-0.131161 51.52505", "From St. James's Square, St. James's to Taviton Street, Bloomsbury"
"LINESTRING (-0.128279 51.5293,-0.131161 51.52505", "From Ossulston Street, Somers Town to Taviton Street, Bloomsbury"
"LINESTRING (-0.150481 51.51217,-0.131161 51.52505", "From Grosvenor Square, Mayfair to Taviton Street, Bloomsbury"
"LINESTRING (-0.165164 51.514746,-0.062806 51.539834", "From Porchester Place, Paddington to Lansdowne Drive, Hackney Central"
"LINESTRING (-0.135777 51.51953,-0.062806 51.539834", "From Charlotte Street, Fitzrovia to Lansdowne Drive, Hackney Central"
"LINESTRING (-0.121328 51.517606,-0.114079 51.522264", "From Southampton Place, Holborn to Northington Street , Holborn"
"LINESTRING (-0.124121 51.523418,-0.114079 51.522264", "From Russell Square Station, Bloomsbury to Northington Street , Holborn"
"LINESTRING (-0.115057 51.512582,-0.114079 51.522264", "From Strand, Strand to Northington Street , Holborn"
"LINESTRING (-0.115057 51.512582,-0.114079 51.522264", "From Strand, Strand to Northington Street , Holborn"
"LINESTRING (-0.089782 51.53089,-0.114079 51.522264", "From Murray Grove , Hoxton to Northington Street , Holborn"
"LINESTRING (-0.128585 51.516118,-0.114079 51.522264", "From Earnshaw Street , Covent Garden to Northington Street , Holborn"
"LINESTRING (-0.131213 51.513103,-0.114079 51.522264", "From Frith Street, Soho to Northington Street , Holborn"
"LINESTRING (-0.115057 51.512582,-0.114079 51.522264", "From Strand, Strand to Northington Street , Holborn"
"LINESTRING (-0.132328 51.515631,-0.119123 51.519435", "From Soho Square , Soho to Red Lion Square, Holborn"
"LINESTRING (-0.204815 51.484386,-0.119123 51.519435", "From Normand Park, West Kensington to Red Lion Square, Holborn"
"LINESTRING (-0.141327 51.520253,-0.124678 51.51908", "From Great Titchfield Street, Fitzrovia to British Museum, Bloomsbury"
"LINESTRING (-0.13558 51.513684,-0.124678 51.51908", "From Broadwick Street, Soho to British Museum, Bloomsbury"
"LINESTRING (-0.124121 51.523418,-0.124678 51.51908", "From Russell Square Station, Bloomsbury to British Museum, Bloomsbury"
"LINESTRING (-0.16862 51.53256,-0.13225 51.528833", "From Greenberry Street, St.John's Wood to Doric Way , Somers Town"
"LINESTRING (-0.100168 51.530344,-0.13225 51.528833", "From City Road, Angel to Doric Way , Somers Town"
"LINESTRING (-0.141728 51.539099,-0.13225 51.528833", "From Greenland Road, Camden Town to Doric Way , Somers Town"
"LINESTRING (-0.138853 51.541603,-0.13225 51.528833", "From Bonny Street, Camden Town to Doric Way , Somers Town"
"LINESTRING (-0.125979 51.526357,-0.13225 51.528833", "From Cartwright Gardens , Bloomsbury to Doric Way , Somers Town"
"LINESTRING (-0.158264 51.514577,-0.13225 51.528833", "From Old Quebec Street, Marylebone to Doric Way , Somers Town"
"LINESTRING (-0.124121 51.523418,-0.13225 51.528833", "From Russell Square Station, Bloomsbury to Doric Way , Somers Town"
"LINESTRING (-0.131213 51.513103,-0.13225 51.528833", "From Frith Street, Soho to Doric Way , Somers Town"
"LINESTRING (-0.138535 51.538792,-0.13225 51.528833", "From St Martins Close, Camden Town to Doric Way , Somers Town"
"LINESTRING (-0.099141 51.512484,-0.118295 51.52728", "From Godliman Street, St. Paul's to Ampton Street , Clerkenwell"
"LINESTRING (-0.135777 51.51953,-0.118295 51.52728", "From Charlotte Street, Fitzrovia to Ampton Street , Clerkenwell"
"LINESTRING (-0.122299 51.530199,-0.118295 51.52728", "From Birkenhead Street, King's Cross to Ampton Street , Clerkenwell"
"LINESTRING (-0.122219 51.51477,-0.118295 51.52728", "From Drury Lane, Covent Garden to Ampton Street , Clerkenwell"
"LINESTRING (-0.123616 51.529943,-0.118295 51.52728", "From Belgrove Street , King's Cross to Ampton Street , Clerkenwell"
"LINESTRING (-0.116688 51.520596,-0.118295 51.52728", "From Theobald's Road , Holborn to Ampton Street , Clerkenwell"
