"LINESTRING (-0.199783 51.472817,-0.199783 51.472817", "From Parson's Green , Parson's Green to Parson's Green , Parson's Green"
"LINESTRING (-0.174347 51.476964,-0.199783 51.472817", "From Battersea Church Road, Battersea to Parson's Green , Parson's Green"
"LINESTRING (-0.214428 51.486062,-0.199783 51.472817", "From Greyhound Road, Hammersmith to Parson's Green , Parson's Green"
"LINESTRING (-0.117661 51.482678,-0.199783 51.472817", "From Ashmole Estate, Oval to Parson's Green , Parson's Green"
"LINESTRING (-0.192369 51.491593,-0.199783 51.472817", "From Penywern Road, Earl's Court to Parson's Green , Parson's Green"
"LINESTRING (-0.211316 51.500088,-0.199783 51.472817", "From Russell Gardens, Olympia to Parson's Green , Parson's Green"
"LINESTRING (-0.190346 51.46822,-0.199783 51.472817", "From Stephendale Road, Sands End to Parson's Green , Parson's Green"
"LINESTRING (-0.167919 51.484984,-0.199783 51.472817", "From Phene Street, Chelsea to Parson's Green , Parson's Green"
"LINESTRING (-0.21186 51.483217,-0.199783 51.472817", "From Humbolt Road, Fulham to Parson's Green , Parson's Green"
"LINESTRING (-0.190346 51.46822,-0.199783 51.472817", "From Stephendale Road, Sands End to Parson's Green , Parson's Green"
"LINESTRING (-0.209973 51.481021,-0.199783 51.472817", "From Aintree Street, Fulham to Parson's Green , Parson's Green"
"LINESTRING (-0.162727 51.489932,-0.199783 51.472817", "From Royal Avenue 1, Chelsea to Parson's Green , Parson's Green"
"LINESTRING (-0.198735 51.46067,-0.199783 51.472817", "From Osiers Road, Wandsworth to Parson's Green , Parson's Green"
"LINESTRING (-0.206827 51.467601,-0.199783 51.472817", "From Ranelagh Gardens, Fulham to Parson's Green , Parson's Green"
"LINESTRING (-0.191803 51.473611,-0.199783 51.472817", "From Sandilands Road, Walham Green to Parson's Green , Parson's Green"
"LINESTRING (-0.206827 51.467601,-0.199783 51.472817", "From Ranelagh Gardens, Fulham to Parson's Green , Parson's Green"
"LINESTRING (-0.192165 51.457529,-0.199783 51.472817", "From Ram Street, Wandsworth to Parson's Green , Parson's Green"
"LINESTRING (-0.20782 51.473471,-0.20782 51.473471", "From Fulham Park Road, Fulham to Fulham Park Road, Fulham"
"LINESTRING (-0.20782 51.473471,-0.20782 51.473471", "From Fulham Park Road, Fulham to Fulham Park Road, Fulham"
"LINESTRING (-0.174411 51.511933,-0.20782 51.473471", "From Bayswater Road, Hyde Park to Fulham Park Road, Fulham"
"LINESTRING (-0.196274 51.46904,-0.20782 51.473471", "From Peterborough Road, Sands End to Fulham Park Road, Fulham"
"LINESTRING (-0.192369 51.491593,-0.20782 51.473471", "From Penywern Road, Earl's Court to Fulham Park Road, Fulham"
"LINESTRING (-0.193502 51.467064,-0.20782 51.473471", "From South Park, Sands End to Fulham Park Road, Fulham"
"LINESTRING (-0.202038 51.48357,-0.20782 51.473471", "From Coomer Place, West Kensington to Fulham Park Road, Fulham"
"LINESTRING (-0.191803 51.473611,-0.20782 51.473471", "From Sandilands Road, Walham Green to Fulham Park Road, Fulham"
"LINESTRING (-0.201005 51.51787,-0.20782 51.473471", "From Westbourne Park Road, Portobello to Fulham Park Road, Fulham"
"LINESTRING (-0.18267 51.494185,-0.20782 51.473471", "From Gloucester Road Station, South Kensington to Fulham Park Road, Fulham"
"LINESTRING (-0.201005 51.51787,-0.20782 51.473471", "From Westbourne Park Road, Portobello to Fulham Park Road, Fulham"
"LINESTRING (-0.193254 51.476259,-0.20782 51.473471", "From Eel Brook Common, Walham Green to Fulham Park Road, Fulham"
"LINESTRING (-0.21555 51.463211,-0.20782 51.473471", "From Montserrat Road , Putney to Fulham Park Road, Fulham"
"LINESTRING (-0.18267 51.494185,-0.20782 51.473471", "From Gloucester Road Station, South Kensington to Fulham Park Road, Fulham"
"LINESTRING (-0.204815 51.484386,-0.20782 51.473471", "From Normand Park, West Kensington to Fulham Park Road, Fulham"
"LINESTRING (-0.195777 51.479463,-0.20782 51.473471", "From Erin Close, Walham Green to Fulham Park Road, Fulham"
"LINESTRING (-0.193502 51.467064,-0.20782 51.473471", "From South Park, Sands End to Fulham Park Road, Fulham"
"LINESTRING (-0.201968 51.475089,-0.20782 51.473471", "From Parsons Green Station, Parsons Green to Fulham Park Road, Fulham"
"LINESTRING (-0.223852 51.483732,-0.228188 51.494499", "From Rainville Road, Hammersmith to Southerton Road, Hammersmith"
"LINESTRING (-0.215087 51.490217,-0.228188 51.494499", "From Barons Court Station, West Kensington to Southerton Road, Hammersmith"
"LINESTRING (-0.115659 51.486824,-0.228188 51.494499", "From Kennington Lane Tesco, Vauxhall to Southerton Road, Hammersmith"
"LINESTRING (-0.211593 51.51323,-0.228188 51.494499", "From Clarendon Road, Avondale to Southerton Road, Hammersmith"
"LINESTRING (-0.206827 51.467601,-0.223616 51.485743", "From Ranelagh Gardens, Fulham to Manbre Road, Hammersmith"
"LINESTRING (-0.21985 51.493267,-0.223616 51.485743", "From Hammersmith Road, Hammersmith to Manbre Road, Hammersmith"
"LINESTRING (-0.215087 51.490217,-0.223616 51.485743", "From Barons Court Station, West Kensington to Manbre Road, Hammersmith"
"LINESTRING (-0.215895 51.476885,-0.223616 51.485743", "From Finlay Street, Fulham to Manbre Road, Hammersmith"
"LINESTRING (-0.206827 51.467601,-0.223616 51.485743", "From Ranelagh Gardens, Fulham to Manbre Road, Hammersmith"
"LINESTRING (-0.101536 51.49217,-0.124642 51.481747", "From Hampton Street, Walworth to South Lambeth Road, Vauxhall"
"LINESTRING (-0.122831 51.472509,-0.124642 51.481747", "From Binfield Road, Stockwell to South Lambeth Road, Vauxhall"
"LINESTRING (-0.114934 51.49288,-0.124642 51.481747", "From Lollard Street, Vauxhall to South Lambeth Road, Vauxhall"
"LINESTRING (-0.116628 51.500089,-0.124642 51.481747", "From Lambeth Palace Road, Waterloo to South Lambeth Road, Vauxhall"
"LINESTRING (-0.134234 51.494591,-0.124642 51.481747", "From Greycoat Street , Westminster to South Lambeth Road, Vauxhall"
"LINESTRING (-0.124642 51.481747,-0.124642 51.481747", "From South Lambeth Road, Vauxhall to South Lambeth Road, Vauxhall"
"LINESTRING (-0.116493 51.477839,-0.124642 51.481747", "From Caldwell Street, Stockwell to South Lambeth Road, Vauxhall"
"LINESTRING (-0.118256 51.47659,-0.124642 51.481747", "From Albert Square, Stockwell to South Lambeth Road, Vauxhall"
"LINESTRING (-0.130699 51.50777,-0.124642 51.481747", "From Pall Mall East, West End to South Lambeth Road, Vauxhall"
"LINESTRING (-0.224303 51.506093,-0.225787 51.514767", "From Westfield Library Corner, Shepherd's Bush to BBC White City, White City"
"LINESTRING (-0.224303 51.506093,-0.225787 51.514767", "From Westfield Library Corner, Shepherd's Bush to BBC White City, White City"
"LINESTRING (-0.17581 51.517335,-0.225787 51.514767", "From South Wharf Road, Paddington to BBC White City, White City"
"LINESTRING (-0.122831 51.472509,-0.133972 51.472993", "From Binfield Road, Stockwell to Union Grove, Wandsworth Road"
"LINESTRING (-0.14177 51.479501,-0.133972 51.472993", "From Battersea Park Road, Nine Elms to Union Grove, Wandsworth Road"
"LINESTRING (-0.122831 51.472509,-0.133972 51.472993", "From Binfield Road, Stockwell to Union Grove, Wandsworth Road"
"LINESTRING (-0.14177 51.479501,-0.133972 51.472993", "From Battersea Park Road, Nine Elms to Union Grove, Wandsworth Road"
"LINESTRING (-0.075459 51.509506,-0.133972 51.472993", "From Tower Gardens , Tower to Union Grove, Wandsworth Road"
"LINESTRING (-0.122831 51.472509,-0.133972 51.472993", "From Binfield Road, Stockwell to Union Grove, Wandsworth Road"
"LINESTRING (-0.079249 51.518908,-0.133972 51.472993", "From Brushfield Street, Liverpool Street to Union Grove, Wandsworth Road"
"LINESTRING (-0.148059 51.472865,-0.133972 51.472993", "From Silverthorne Road, Battersea to Union Grove, Wandsworth Road"
"LINESTRING (-0.117122 51.490994,-0.116493 51.477839", "From Black Prince Road, Vauxhall to Caldwell Street, Stockwell"
"LINESTRING (-0.119643 51.511756,-0.116493 51.477839", "From Wellington Street , Strand to Caldwell Street, Stockwell"
"LINESTRING (-0.136123 51.482362,-0.116493 51.477839", "From Riverlight North, Nine Elms to Caldwell Street, Stockwell"
"LINESTRING (-0.122492 51.486343,-0.116493 51.477839", "From Kennington Lane Rail Bridge, Vauxhall to Caldwell Street, Stockwell"
"LINESTRING (-0.147478 51.492369,-0.116493 51.477839", "From Elizabeth Bridge, Victoria to Caldwell Street, Stockwell"
"LINESTRING (-0.123179 51.506543,-0.116493 51.477839", "From Whitehall Place, Strand to Caldwell Street, Stockwell"
"LINESTRING (-0.136928 51.493985,-0.116493 51.477839", "From Vincent Square, Westminster to Caldwell Street, Stockwell"
"LINESTRING (-0.116493 51.477839,-0.116493 51.477839", "From Caldwell Street, Stockwell to Caldwell Street, Stockwell"
"LINESTRING (-0.106408 51.530515,-0.116493 51.477839", "From Chadwell Street, Angel to Caldwell Street, Stockwell"
"LINESTRING (-0.168292 51.462392,-0.116493 51.477839", "From St. John's Road, Clapham Junction to Caldwell Street, Stockwell"
"LINESTRING (-0.139956 51.493573,-0.116493 51.477839", "From Queen Mother Sports Centre, Victoria to Caldwell Street, Stockwell"
"LINESTRING (-0.178656 51.501432,-0.116493 51.477839", "From Kensington Gore, Knightsbridge to Caldwell Street, Stockwell"
"LINESTRING (-0.124642 51.481747,-0.116493 51.477839", "From South Lambeth Road, Vauxhall to Caldwell Street, Stockwell"
"LINESTRING (-0.136792 51.533005,-0.138535 51.538792", "From Eversholt Street , Camden Town to St Martins Close, Camden Town"
"LINESTRING (-0.162298 51.522511,-0.163667 51.520331", "From Boston Place, Marylebone to Seymour Place, Marylebone"
"LINESTRING (-0.068161 51.509786,-0.163667 51.520331", "From Dock Street, Wapping to Seymour Place, Marylebone"
"LINESTRING (-0.167515 51.530529,-0.163667 51.520331", "From St. John's Wood Church, The Regent's Park to Seymour Place, Marylebone"
"LINESTRING (-0.109914 51.531666,-0.163667 51.520331", "From Claremont Square, Angel to Seymour Place, Marylebone"
"LINESTRING (-0.109914 51.531666,-0.163667 51.520331", "From Claremont Square, Angel to Seymour Place, Marylebone"
"LINESTRING (-0.109914 51.531666,-0.163667 51.520331", "From Claremont Square, Angel to Seymour Place, Marylebone"
"LINESTRING (-0.156166 51.518913,-0.163667 51.520331", "From Baker Street, Marylebone to Seymour Place, Marylebone"
"LINESTRING (-0.205535 51.507481,-0.210941 51.504199", "From Lansdowne Road, Ladbroke Grove to Addison Road, Holland Park"
"LINESTRING (-0.216016 51.509224,-0.210941 51.504199", "From Rifle Place, Avondale to Addison Road, Holland Park"
"LINESTRING (-0.211593 51.51323,-0.210941 51.504199", "From Clarendon Road, Avondale to Addison Road, Holland Park"
"LINESTRING (-0.211593 51.51323,-0.210941 51.504199", "From Clarendon Road, Avondale to Addison Road, Holland Park"
"LINESTRING (-0.211593 51.51323,-0.210941 51.504199", "From Clarendon Road, Avondale to Addison Road, Holland Park"
"LINESTRING (-0.207842 51.471079,-0.210279 51.468814", "From Elysium Place, Fulham to Putney Bridge Station, Fulham"
"LINESTRING (-0.16716 51.47518,-0.210279 51.468814", "From Surrey Lane, Battersea to Putney Bridge Station, Fulham"
"LINESTRING (-0.130458 51.494816,-0.210279 51.468814", "From Horseferry Road, Westminster to Putney Bridge Station, Fulham"
"LINESTRING (-0.210279 51.468814,-0.210279 51.468814", "From Putney Bridge Station, Fulham to Putney Bridge Station, Fulham"
"LINESTRING (-0.210279 51.468814,-0.210279 51.468814", "From Putney Bridge Station, Fulham to Putney Bridge Station, Fulham"
"LINESTRING (-0.079249 51.518908,-0.157788 51.465123", "From Brushfield Street, Liverpool Street to Sugden Road, Clapham"
"LINESTRING (-0.147478 51.492369,-0.157788 51.465123", "From Elizabeth Bridge, Victoria to Sugden Road, Clapham"
"LINESTRING (-0.149004 51.485821,-0.157788 51.465123", "From Chelsea Bridge, Pimlico to Sugden Road, Clapham"
"LINESTRING (-0.18119 51.485587,-0.157788 51.465123", "From Limerston Street, West Chelsea to Sugden Road, Clapham"
"LINESTRING (-0.15352 51.503117,-0.172078 51.482567", "From Hyde Park Corner, Hyde Park to Danvers Street, West Chelsea"
"LINESTRING (-0.18697 51.51616,-0.172078 51.482567", "From Bishop's Bridge Road West, Bayswater to Danvers Street, West Chelsea"
"LINESTRING (-0.189155 51.477292,-0.172078 51.482567", "From Michael Road, Walham Green to Danvers Street, West Chelsea"
"LINESTRING (-0.166878 51.488023,-0.172078 51.482567", "From Flood Street, Chelsea to Danvers Street, West Chelsea"
"LINESTRING (-0.195197 51.454752,-0.172078 51.482567", "From Neville Gill Close, Wandsworth to Danvers Street, West Chelsea"
"LINESTRING (-0.15352 51.503117,-0.172078 51.482567", "From Hyde Park Corner, Hyde Park to Danvers Street, West Chelsea"
"LINESTRING (-0.208485 51.478939,-0.172078 51.482567", "From St. Peter's Terrace, Fulham to Danvers Street, West Chelsea"
"LINESTRING (-0.156876 51.49313,-0.172078 51.482567", "From Sedding Street, Sloane Square to Danvers Street, West Chelsea"
"LINESTRING (-0.215808 51.503802,-0.208486 51.506465", "From Hansard Mews, Holland Park to Princedale Road , Holland Park"
"LINESTRING (-0.205991 51.501391,-0.208486 51.506465", "From Abbotsbury Road, Holland Park to Princedale Road , Holland Park"
"LINESTRING (-0.061698 51.4954,-0.208486 51.506465", "From Clements Road, Bermondsey to Princedale Road , Holland Park"
"LINESTRING (-0.061698 51.4954,-0.208486 51.506465", "From Clements Road, Bermondsey to Princedale Road , Holland Park"
"LINESTRING (-0.214762 51.5129,-0.208486 51.506465", "From Grenfell Road, Avondale to Princedale Road , Holland Park"
"LINESTRING (-0.191351 51.513489,-0.208486 51.506465", "From Princes Square, Bayswater to Princedale Road , Holland Park"
"LINESTRING (-0.191351 51.513489,-0.208486 51.506465", "From Princes Square, Bayswater to Princedale Road , Holland Park"
"LINESTRING (-0.215808 51.503802,-0.208486 51.506465", "From Hansard Mews, Holland Park to Princedale Road , Holland Park"
"LINESTRING (-0.136123 51.482362,-0.141812 51.469259", "From Riverlight North, Nine Elms to Wandsworth Rd, Isley Court, Wandsworth Road"
"LINESTRING (-0.118256 51.47659,-0.141812 51.469259", "From Albert Square, Stockwell to Wandsworth Rd, Isley Court, Wandsworth Road"
"LINESTRING (-0.150908 51.47505,-0.141812 51.469259", "From Alfreda Street, Battersea Park to Wandsworth Rd, Isley Court, Wandsworth Road"
"LINESTRING (-0.149035 51.481121,-0.141812 51.469259", "From Sopwith Way, Battersea Park to Wandsworth Rd, Isley Court, Wandsworth Road"
"LINESTRING (-0.116628 51.500089,-0.141812 51.469259", "From Lambeth Palace Road, Waterloo to Wandsworth Rd, Isley Court, Wandsworth Road"
"LINESTRING (-0.16375 51.465064,-0.141812 51.469259", "From Dorothy Road, Clapham Junction to Wandsworth Rd, Isley Court, Wandsworth Road"
"LINESTRING (-0.164786 51.477292,-0.141812 51.469259", "From Ethelburga Estate, Battersea Park to Wandsworth Rd, Isley Court, Wandsworth Road"
"LINESTRING (-0.138212 51.481335,-0.141812 51.469259", "From Riverlight South, Nine Elms to Wandsworth Rd, Isley Court, Wandsworth Road"
"LINESTRING (-0.209494 51.498157,-0.2174 51.504038", "From Kensington Olympia Station, Olympia to Woodstock Grove, Shepherd's Bush"
"LINESTRING (-0.061698 51.4954,-0.2174 51.504038", "From Clements Road, Bermondsey to Woodstock Grove, Shepherd's Bush"
"LINESTRING (-0.223868 51.496664,-0.2174 51.504038", "From Little Brook Green, Brook Green to Woodstock Grove, Shepherd's Bush"
"LINESTRING (-0.061698 51.4954,-0.2174 51.504038", "From Clements Road, Bermondsey to Woodstock Grove, Shepherd's Bush"
"LINESTRING (-0.061698 51.4954,-0.2174 51.504038", "From Clements Road, Bermondsey to Woodstock Grove, Shepherd's Bush"
"LINESTRING (-0.197574 51.499606,-0.2174 51.504038", "From Phillimore Gardens, Kensington to Woodstock Grove, Shepherd's Bush"
"LINESTRING (-0.061698 51.4954,-0.2174 51.504038", "From Clements Road, Bermondsey to Woodstock Grove, Shepherd's Bush"
"LINESTRING (-0.211358 51.510101,-0.2174 51.504038", "From Walmer Road, Avondale to Woodstock Grove, Shepherd's Bush"
"LINESTRING (-0.07235 51.492668,-0.2174 51.504038", "From Harris Academy, Bermondsey to Woodstock Grove, Shepherd's Bush"
"LINESTRING (-0.213872 51.51687,-0.2174 51.504038", "From St. Mark's Road, North Kensington to Woodstock Grove, Shepherd's Bush"
"LINESTRING (-0.221791 51.49968,-0.2174 51.504038", "From Blythe Road West, Shepherd's Bush to Woodstock Grove, Shepherd's Bush"
"LINESTRING (-0.061698 51.4954,-0.2174 51.504038", "From Clements Road, Bermondsey to Woodstock Grove, Shepherd's Bush"
"LINESTRING (-0.217515 51.500353,-0.2174 51.504038", "From Richmond Way, Shepherd's Bush to Woodstock Grove, Shepherd's Bush"
"LINESTRING (-0.216493 51.491093,-0.2174 51.504038", "From Colet Gardens, Hammersmith to Woodstock Grove, Shepherd's Bush"
"LINESTRING (-0.211358 51.510101,-0.2174 51.504038", "From Walmer Road, Avondale to Woodstock Grove, Shepherd's Bush"
"LINESTRING (-0.061698 51.4954,-0.2174 51.504038", "From Clements Road, Bermondsey to Woodstock Grove, Shepherd's Bush"
"LINESTRING (-0.216016 51.509224,-0.2174 51.504038", "From Rifle Place, Avondale to Woodstock Grove, Shepherd's Bush"
"LINESTRING (-0.197574 51.499606,-0.2174 51.504038", "From Phillimore Gardens, Kensington to Woodstock Grove, Shepherd's Bush"
"LINESTRING (-0.055846 51.499169,-0.058826 51.54119", "From Rotherhithe Roundabout, Rotherhithe to London Fields, Hackney Central"
"LINESTRING (-0.204815 51.484386,-0.058826 51.54119", "From Normand Park, West Kensington to London Fields, Hackney Central"
"LINESTRING (-0.149035 51.481121,-0.058826 51.54119", "From Sopwith Way, Battersea Park to London Fields, Hackney Central"
"LINESTRING (-0.174971 51.485121,-0.058826 51.54119", "From The Vale, Chelsea to London Fields, Hackney Central"
"LINESTRING (-0.21985 51.493267,-0.215895 51.476885", "From Hammersmith Road, Hammersmith to Finlay Street, Fulham"
"LINESTRING (-0.210279 51.468814,-0.215895 51.476885", "From Putney Bridge Station, Fulham to Finlay Street, Fulham"
"LINESTRING (-0.21555 51.463211,-0.215895 51.476885", "From Montserrat Road , Putney to Finlay Street, Fulham"
"LINESTRING (-0.228188 51.494499,-0.215895 51.476885", "From Southerton Road, Hammersmith to Finlay Street, Fulham"
"LINESTRING (-0.21555 51.463211,-0.215895 51.476885", "From Montserrat Road , Putney to Finlay Street, Fulham"
"LINESTRING (-0.193502 51.467064,-0.215895 51.476885", "From South Park, Sands End to Finlay Street, Fulham"
"LINESTRING (-0.199783 51.472817,-0.215895 51.476885", "From Parson's Green , Parson's Green to Finlay Street, Fulham"
"LINESTRING (-0.173029 51.464894,-0.215895 51.476885", "From Grant Road East, Clapham Junction to Finlay Street, Fulham"
"LINESTRING (-0.223616 51.485743,-0.215895 51.476885", "From Manbre Road, Hammersmith to Finlay Street, Fulham"
"LINESTRING (-0.209378 51.489591,-0.209973 51.481021", "From Vereker Road, West Kensington to Aintree Street, Fulham"
"LINESTRING (-0.194116 51.479932,-0.209973 51.481021", "From Fulham Broadway, Walham Green to Aintree Street, Fulham"
"LINESTRING (-0.183853 51.480898,-0.207842 51.471079", "From Thorndike Close, West Chelsea to Elysium Place, Fulham"
"LINESTRING (-0.200667 51.460951,-0.207842 51.471079", "From Northfields, Wandsworth to Elysium Place, Fulham"
"LINESTRING (-0.191803 51.473611,-0.207842 51.471079", "From Sandilands Road, Walham Green to Elysium Place, Fulham"
"LINESTRING (-0.141923 51.489856,-0.193254 51.476259", "From Warwick Square, Pimlico to Eel Brook Common, Walham Green"
"LINESTRING (-0.195777 51.479463,-0.193254 51.476259", "From Erin Close, Walham Green to Eel Brook Common, Walham Green"
"LINESTRING (-0.142207 51.485357,-0.193254 51.476259", "From Grosvenor Road, Pimlico to Eel Brook Common, Walham Green"
"LINESTRING (-0.211316 51.500088,-0.193254 51.476259", "From Russell Gardens, Olympia to Eel Brook Common, Walham Green"
"LINESTRING (-0.194116 51.479932,-0.193254 51.476259", "From Fulham Broadway, Walham Green to Eel Brook Common, Walham Green"
"LINESTRING (-0.20782 51.473471,-0.193254 51.476259", "From Fulham Park Road, Fulham to Eel Brook Common, Walham Green"
"LINESTRING (-0.187404 51.487958,-0.19701 51.473763", "From Harcourt Terrace, West Brompton to Irene Road, Parsons Green"
"LINESTRING (-0.135635 51.488226,-0.19701 51.473763", "From St. George's Square, Pimlico to Irene Road, Parsons Green"
"LINESTRING (-0.184318 51.468819,-0.19701 51.473763", "From William Morris Way, Sands End to Irene Road, Parsons Green"
"LINESTRING (-0.187278 51.475142,-0.19701 51.473763", "From Imperial Road, Sands End to Irene Road, Parsons Green"
"LINESTRING (-0.172293 51.467454,-0.19701 51.473763", "From Ingrave Street, Clapham Junction to Irene Road, Parsons Green"
"LINESTRING (-0.215895 51.476885,-0.19701 51.473763", "From Finlay Street, Fulham to Irene Road, Parsons Green"
"LINESTRING (-0.169821 51.466633,-0.16716 51.47518", "From Falcon Road, Clapham Junction to Surrey Lane, Battersea"
"LINESTRING (-0.16716 51.47518,-0.16716 51.47518", "From Surrey Lane, Battersea to Surrey Lane, Battersea"
"LINESTRING (-0.169821 51.466633,-0.16716 51.47518", "From Falcon Road, Clapham Junction to Surrey Lane, Battersea"
"LINESTRING (-0.20624 51.461999,-0.16716 51.47518", "From Putney Bridge Road, East Putney to Surrey Lane, Battersea"
"LINESTRING (-0.149551 51.477619,-0.16716 51.47518", "From Queen's Circus, Battersea Park to Surrey Lane, Battersea"
"LINESTRING (-0.171103 51.518268,-0.16716 51.47518", "From St Mary's Hospital, Paddington to Surrey Lane, Battersea"
"LINESTRING (-0.179369 51.487196,-0.16716 51.47518", "From Drayton Gardens, West Chelsea to Surrey Lane, Battersea"
"LINESTRING (-0.18498 51.501737,-0.16716 51.47518", "From De Vere Gardens, Kensington to Surrey Lane, Battersea"
"LINESTRING (-0.141334 51.492345,-0.16716 51.47518", "From Guildhouse Street, Victoria to Surrey Lane, Battersea"
"LINESTRING (-0.174971 51.485121,-0.16716 51.47518", "From The Vale, Chelsea to Surrey Lane, Battersea"
"LINESTRING (-0.198735 51.46067,-0.187427 51.460864", "From Osiers Road, Wandsworth to Wandsworth Town Station, Wandsworth"
"LINESTRING (-0.204815 51.484386,-0.187427 51.460864", "From Normand Park, West Kensington to Wandsworth Town Station, Wandsworth"
"LINESTRING (-0.170703 51.470847,-0.187427 51.460864", "From Simpson Street, Clapham Junction to Wandsworth Town Station, Wandsworth"
"LINESTRING (-0.163041 51.470538,-0.187427 51.460864", "From Sheepcote Lane, Battersea to Wandsworth Town Station, Wandsworth"
"LINESTRING (-0.117974 51.494881,-0.187427 51.460864", "From Lambeth Road, Vauxhall to Wandsworth Town Station, Wandsworth"
"LINESTRING (-0.193254 51.476259,-0.187427 51.460864", "From Eel Brook Common, Walham Green to Wandsworth Town Station, Wandsworth"
"LINESTRING (-0.212607 51.460792,-0.187427 51.460864", "From Oxford Road, Putney to Wandsworth Town Station, Wandsworth"
"LINESTRING (-0.214594 51.510928,-0.205535 51.507481", "From Sirdar Road, Avondale to Lansdowne Road, Ladbroke Grove"
"LINESTRING (-0.208888 51.5212,-0.205535 51.507481", "From Bevington Road West, North Kensington to Lansdowne Road, Ladbroke Grove"
"LINESTRING (-0.205991 51.501391,-0.205535 51.507481", "From Abbotsbury Road, Holland Park to Lansdowne Road, Ladbroke Grove"
"LINESTRING (-0.216104 51.50659,-0.205535 51.507481", "From Queensdale Road, Shepherd's Bush to Lansdowne Road, Ladbroke Grove"
"LINESTRING (-0.211593 51.51323,-0.205535 51.507481", "From Clarendon Road, Avondale to Lansdowne Road, Ladbroke Grove"
"LINESTRING (-0.211593 51.51323,-0.205535 51.507481", "From Clarendon Road, Avondale to Lansdowne Road, Ladbroke Grove"
"LINESTRING (-0.211593 51.51323,-0.205535 51.507481", "From Clarendon Road, Avondale to Lansdowne Road, Ladbroke Grove"
"LINESTRING (-0.173029 51.464894,-0.180791 51.46193", "From Grant Road East, Clapham Junction to Nantes Close, Wandsworth"
"LINESTRING (-0.172293 51.467454,-0.180791 51.46193", "From Ingrave Street, Clapham Junction to Nantes Close, Wandsworth"
"LINESTRING (-0.187427 51.460864,-0.180791 51.46193", "From Wandsworth Town Station, Wandsworth to Nantes Close, Wandsworth"
"LINESTRING (-0.162727 51.489932,-0.180791 51.46193", "From Royal Avenue 1, Chelsea to Nantes Close, Wandsworth"
"LINESTRING (-0.173029 51.464894,-0.180791 51.46193", "From Grant Road East, Clapham Junction to Nantes Close, Wandsworth"
"LINESTRING (-0.122831 51.472509,-0.132102 51.472918", "From Binfield Road, Stockwell to Courland Grove, Wandsworth Road"
"LINESTRING (-0.122831 51.472509,-0.132102 51.472918", "From Binfield Road, Stockwell to Courland Grove, Wandsworth Road"
"LINESTRING (-0.12367 51.471433,-0.132102 51.472918", "From Clapham Road, Lingham Street, Stockwell to Courland Grove, Wandsworth Road"
"LINESTRING (-0.190346 51.46822,-0.132102 51.472918", "From Stephendale Road, Sands End to Courland Grove, Wandsworth Road"
"LINESTRING (-0.131213 51.513103,-0.132102 51.472918", "From Frith Street, Soho to Courland Grove, Wandsworth Road"
"LINESTRING (-0.163347 51.474392,-0.132102 51.472918", "From Albert Bridge Road, Battersea Park to Courland Grove, Wandsworth Road"
"LINESTRING (-0.12367 51.471433,-0.132102 51.472918", "From Clapham Road, Lingham Street, Stockwell to Courland Grove, Wandsworth Road"
"LINESTRING (-0.159169 51.475153,-0.132102 51.472918", "From Prince of Wales Drive, Battersea Park to Courland Grove, Wandsworth Road"
"LINESTRING (-0.118256 51.47659,-0.132102 51.472918", "From Albert Square, Stockwell to Courland Grove, Wandsworth Road"
"LINESTRING (-0.122831 51.472509,-0.132102 51.472918", "From Binfield Road, Stockwell to Courland Grove, Wandsworth Road"
"LINESTRING (-0.147714 51.483507,-0.149551 51.477619", "From Battersea Power Station, Battersea Park to Queen's Circus, Battersea Park"
"LINESTRING (-0.170703 51.470847,-0.149551 51.477619", "From Simpson Street, Clapham Junction to Queen's Circus, Battersea Park"
"LINESTRING (-0.164786 51.477292,-0.149551 51.477619", "From Ethelburga Estate, Battersea Park to Queen's Circus, Battersea Park"
