"LINESTRING (-0.138846 51.510048,-0.10997 51.529163", "From Sackville Street, Mayfair to River Street , Clerkenwell"
"LINESTRING (-0.062546 51.535678,-0.10997 51.529163", "From Regent's Row , Haggerston to River Street , Clerkenwell"
"LINESTRING (-0.111781 51.533319,-0.10997 51.529163", "From Risinghill Street, Angel to River Street , Clerkenwell"
"LINESTRING (-0.099994 51.522853,-0.10997 51.529163", "From Berry Street, Clerkenwell to River Street , Clerkenwell"
"LINESTRING (-0.099994 51.522853,-0.10997 51.529163", "From Berry Street, Clerkenwell to River Street , Clerkenwell"
"LINESTRING (-0.142844 51.506613,-0.197574 51.499606", "From Green Park Station, Mayfair to Phillimore Gardens, Kensington"
"LINESTRING (-0.144132 51.493204,-0.197574 51.499606", "From Belgrave Road, Victoria to Phillimore Gardens, Kensington"
"LINESTRING (-0.15934 51.500241,-0.197574 51.499606", "From Harriet Street, Knightsbridge to Phillimore Gardens, Kensington"
"LINESTRING (-0.192369 51.491593,-0.197574 51.499606", "From Penywern Road, Earl's Court to Phillimore Gardens, Kensington"
"LINESTRING (-0.194392 51.501945,-0.197574 51.499606", "From Kensington Town Hall, Kensington to Phillimore Gardens, Kensington"
"LINESTRING (-0.193068 51.500397,-0.197574 51.499606", "From Wright's Lane, Kensington to Phillimore Gardens, Kensington"
"LINESTRING (-0.205284 51.496712,-0.197574 51.499606", "From Warwick Road, Olympia to Phillimore Gardens, Kensington"
"LINESTRING (-0.061698 51.4954,-0.197574 51.499606", "From Clements Road, Bermondsey to Phillimore Gardens, Kensington"
"LINESTRING (-0.061698 51.4954,-0.197574 51.499606", "From Clements Road, Bermondsey to Phillimore Gardens, Kensington"
"LINESTRING (-0.21985 51.493267,-0.197574 51.499606", "From Hammersmith Road, Hammersmith to Phillimore Gardens, Kensington"
"LINESTRING (-0.222293 51.501594,-0.197574 51.499606", "From Shepherd's Bush Road North, Shepherd's Bush to Phillimore Gardens, Kensington"
"LINESTRING (-0.07235 51.492668,-0.197574 51.499606", "From Harris Academy, Bermondsey to Phillimore Gardens, Kensington"
"LINESTRING (-0.084439 51.524696,-0.197574 51.499606", "From Leonard Circus , Shoreditch to Phillimore Gardens, Kensington"
"LINESTRING (-0.193764 51.508605,-0.197574 51.499606", "From Palace Gardens Terrace, Notting Hill to Phillimore Gardens, Kensington"
"LINESTRING (-0.191462 51.501364,-0.197574 51.499606", "From Derry Street, Kensington to Phillimore Gardens, Kensington"
"LINESTRING (-0.21985 51.493267,-0.197574 51.499606", "From Hammersmith Road, Hammersmith to Phillimore Gardens, Kensington"
"LINESTRING (-0.179668 51.511654,-0.197574 51.499606", "From Lancaster Gate , Bayswater to Phillimore Gardens, Kensington"
"LINESTRING (-0.215808 51.503802,-0.197574 51.499606", "From Hansard Mews, Holland Park to Phillimore Gardens, Kensington"
"LINESTRING (-0.142844 51.506613,-0.197574 51.499606", "From Green Park Station, Mayfair to Phillimore Gardens, Kensington"
"LINESTRING (-0.142844 51.506613,-0.197574 51.499606", "From Green Park Station, Mayfair to Phillimore Gardens, Kensington"
"LINESTRING (-0.216573 51.466907,-0.197574 51.499606", "From Putney Pier, Wandsworth to Phillimore Gardens, Kensington"
"LINESTRING (-0.216104 51.50659,-0.197574 51.499606", "From Queensdale Road, Shepherd's Bush to Phillimore Gardens, Kensington"
"LINESTRING (-0.180246 51.501026,-0.197574 51.499606", "From Queen's Gate (North), Kensington to Phillimore Gardens, Kensington"
"LINESTRING (-0.191496 51.503157,-0.197574 51.499606", "From Kensington Church Street, Kensington to Phillimore Gardens, Kensington"
"LINESTRING (-0.205921 51.511624,-0.197574 51.499606", "From Ladbroke Grove Central, Ladbroke Grove to Phillimore Gardens, Kensington"
"LINESTRING (-0.21985 51.493267,-0.197574 51.499606", "From Hammersmith Road, Hammersmith to Phillimore Gardens, Kensington"
"LINESTRING (-0.061698 51.4954,-0.197574 51.499606", "From Clements Road, Bermondsey to Phillimore Gardens, Kensington"
"LINESTRING (-0.086379 51.534042,-0.084605 51.521283", "From Shoreditch Park, Hoxton to Christopher Street, Liverpool Street"
"LINESTRING (-0.09315 51.53356,-0.084605 51.521283", "From Eagle Wharf Road, Hoxton to Christopher Street, Liverpool Street"
"LINESTRING (-0.09315 51.53356,-0.084605 51.521283", "From Eagle Wharf Road, Hoxton to Christopher Street, Liverpool Street"
"LINESTRING (-0.100791 51.518218,-0.084605 51.521283", "From West Smithfield Rotunda, Farringdon to Christopher Street, Liverpool Street"
"LINESTRING (-0.069542 51.512363,-0.084605 51.521283", "From Leman Street, Aldgate to Christopher Street, Liverpool Street"
"LINESTRING (-0.069543 51.525645,-0.084605 51.521283", "From Granby Street, Shoreditch to Christopher Street, Liverpool Street"
"LINESTRING (-0.091773 51.504627,-0.084605 51.521283", "From Hop Exchange, The Borough to Christopher Street, Liverpool Street"
"LINESTRING (-0.119047 51.509631,-0.120973 51.530059", "From Embankment (Savoy), Strand to St. Chad's Street, King's Cross"
"LINESTRING (-0.109006 51.521661,-0.120973 51.530059", "From Hatton Wall, Holborn to St. Chad's Street, King's Cross"
"LINESTRING (-0.112432 51.526599,-0.120973 51.530059", "From Margery Street, Clerkenwell to St. Chad's Street, King's Cross"
"LINESTRING (-0.136792 51.533005,-0.120973 51.530059", "From Eversholt Street , Camden Town to St. Chad's Street, King's Cross"
"LINESTRING (-0.119047 51.509631,-0.120973 51.530059", "From Embankment (Savoy), Strand to St. Chad's Street, King's Cross"
"LINESTRING (-0.156876 51.49313,-0.156876 51.49313", "From Sedding Street, Sloane Square to Sedding Street, Sloane Square"
"LINESTRING (-0.161765 51.487964,-0.156876 51.49313", "From Ormonde Gate, Chelsea to Sedding Street, Sloane Square"
"LINESTRING (-0.168917 51.497056,-0.156876 51.49313", "From Holy Trinity Brompton, Knightsbridge to Sedding Street, Sloane Square"
"LINESTRING (-0.156876 51.49313,-0.156876 51.49313", "From Sedding Street, Sloane Square to Sedding Street, Sloane Square"
"LINESTRING (-0.183853 51.480898,-0.156876 51.49313", "From Thorndike Close, West Chelsea to Sedding Street, Sloane Square"
"LINESTRING (-0.179369 51.487196,-0.156876 51.49313", "From Drayton Gardens, West Chelsea to Sedding Street, Sloane Square"
"LINESTRING (-0.190346 51.46822,-0.156876 51.49313", "From Stephendale Road, Sands End to Sedding Street, Sloane Square"
"LINESTRING (-0.172078 51.482567,-0.156876 51.49313", "From Danvers Street, West Chelsea to Sedding Street, Sloane Square"
"LINESTRING (-0.16375 51.465064,-0.156876 51.49313", "From Dorothy Road, Clapham Junction to Sedding Street, Sloane Square"
"LINESTRING (-0.168917 51.497056,-0.156876 51.49313", "From Holy Trinity Brompton, Knightsbridge to Sedding Street, Sloane Square"
"LINESTRING (-0.15934 51.500241,-0.156876 51.49313", "From Harriet Street, Knightsbridge to Sedding Street, Sloane Square"
"LINESTRING (-0.166221 51.490714,-0.156876 51.49313", "From Chelsea Green, Chelsea to Sedding Street, Sloane Square"
"LINESTRING (-0.138853 51.541603,-0.144228 51.518117", "From Bonny Street, Camden Town to Broadcasting House, Marylebone"
"LINESTRING (-0.183118 51.515607,-0.144228 51.518117", "From Cleveland Gardens, Bayswater to Broadcasting House, Marylebone"
"LINESTRING (-0.08249 51.53558,-0.144228 51.518117", "From Pitfield Street North,Hoxton to Broadcasting House, Marylebone"
"LINESTRING (-0.163609 51.51809,-0.144228 51.518117", "From Shouldham Street, Marylebone to Broadcasting House, Marylebone"
"LINESTRING (-0.164207 51.517372,-0.144228 51.518117", "From Harrowby Street, Marylebone to Broadcasting House, Marylebone"
"LINESTRING (-0.138853 51.541603,-0.144228 51.518117", "From Bonny Street, Camden Town to Broadcasting House, Marylebone"
"LINESTRING (-0.157183 51.52026,-0.144228 51.518117", "From Crawford Street, Marylebone to Broadcasting House, Marylebone"
"LINESTRING (-0.151359 51.522008,-0.144228 51.518117", "From Beaumont Street, Marylebone to Broadcasting House, Marylebone"
"LINESTRING (-0.157183 51.52026,-0.144228 51.518117", "From Crawford Street, Marylebone to Broadcasting House, Marylebone"
"LINESTRING (-0.102757 51.536384,-0.144228 51.518117", "From Islington Green, Angel to Broadcasting House, Marylebone"
"LINESTRING (-0.13225 51.528833,-0.168074 51.5343", "From Doric Way , Somers Town to Charlbert Street, St. John's Wood"
"LINESTRING (-0.151359 51.522008,-0.168074 51.5343", "From Beaumont Street, Marylebone to Charlbert Street, St. John's Wood"
"LINESTRING (-0.151359 51.522008,-0.168074 51.5343", "From Beaumont Street, Marylebone to Charlbert Street, St. John's Wood"
"LINESTRING (-0.163609 51.51809,-0.183486 51.529857", "From Shouldham Street, Marylebone to Maida Vale, Maida Vale"
"LINESTRING (-0.09644 51.507385,-0.09644 51.507385", "From New Globe Walk, Bankside to New Globe Walk, Bankside"
"LINESTRING (-0.091773 51.504627,-0.09644 51.507385", "From Hop Exchange, The Borough to New Globe Walk, Bankside"
"LINESTRING (-0.074284 51.539328,-0.09644 51.507385", "From Haggerston Road, Haggerston to New Globe Walk, Bankside"
"LINESTRING (-0.173881 51.494412,-0.092754 51.505974", "From South Kensington Station, South Kensington to Park Street, Bankside"
"LINESTRING (-0.09294 51.51397,-0.092754 51.505974", "From Cheapside, Bank to Park Street, Bankside"
"LINESTRING (-0.037471 51.528224,-0.092754 51.505974", "From Antill Road, Mile End to Park Street, Bankside"
"LINESTRING (-0.06691 51.507131,-0.122502 51.523951", "From Nesham Street, Wapping to Brunswick Square, Bloomsbury"
"LINESTRING (-0.13558 51.513684,-0.122502 51.523951", "From Broadwick Street, Soho to Brunswick Square, Bloomsbury"
"LINESTRING (-0.116279 51.524564,-0.122502 51.523951", "From Wren Street, Holborn to Brunswick Square, Bloomsbury"
"LINESTRING (-0.093903 51.530991,-0.122502 51.523951", "From Wenlock Road , Hoxton to Brunswick Square, Bloomsbury"
"LINESTRING (-0.106408 51.530515,-0.122502 51.523951", "From Chadwell Street, Angel to Brunswick Square, Bloomsbury"
"LINESTRING (-0.112432 51.526599,-0.122502 51.523951", "From Margery Street, Clerkenwell to Brunswick Square, Bloomsbury"
"LINESTRING (-0.116279 51.524564,-0.122502 51.523951", "From Wren Street, Holborn to Brunswick Square, Bloomsbury"
"LINESTRING (-0.093903 51.530991,-0.122502 51.523951", "From Wenlock Road , Hoxton to Brunswick Square, Bloomsbury"
"LINESTRING (-0.122299 51.530199,-0.130431 51.52168", "From Birkenhead Street, King's Cross to Malet Street, Bloomsbury"
"LINESTRING (-0.079201 51.537277,-0.130431 51.52168", "From Hertford Road, De Beauvoir Town to Malet Street, Bloomsbury"
"LINESTRING (-0.138019 51.524438,-0.130431 51.52168", "From Warren Street Station, Euston to Malet Street, Bloomsbury"
"LINESTRING (-0.099489 51.524868,-0.130431 51.52168", "From Sadlers Sports Centre, Finsbury to Malet Street, Bloomsbury"
"LINESTRING (-0.157436 51.512276,-0.130431 51.52168", "From Green Street, Mayfair to Malet Street, Bloomsbury"
"LINESTRING (-0.120718 51.511968,-0.130431 51.52168", "From Tavistock Street, Covent Garden to Malet Street, Bloomsbury"
"LINESTRING (-0.098807 51.506725,-0.130431 51.52168", "From Tate Modern, Bankside to Malet Street, Bloomsbury"
"LINESTRING (-0.133952 51.536264,-0.130431 51.52168", "From Royal College Street, Camden Town to Malet Street, Bloomsbury"
"LINESTRING (-0.115156 51.489479,-0.130431 51.52168", "From Sancroft Street, Vauxhall to Malet Street, Bloomsbury"
"LINESTRING (-0.116191 51.535467,-0.130431 51.52168", "From Carnegie Street, King's Cross to Malet Street, Bloomsbury"
"LINESTRING (-0.124678 51.51908,-0.130431 51.52168", "From British Museum, Bloomsbury to Malet Street, Bloomsbury"
"LINESTRING (-0.112824 51.503791,-0.130431 51.52168", "From Waterloo Station 3, Waterloo to Malet Street, Bloomsbury"
"LINESTRING (-0.127854 51.517727,-0.136039 51.519914", "From Great Russell Street, Bloomsbury to Scala Street, Fitzrovia"
"LINESTRING (-0.155525 51.516204,-0.136039 51.519914", "From Portman Square, Marylebone to Scala Street, Fitzrovia"
"LINESTRING (-0.118295 51.52728,-0.136039 51.519914", "From Ampton Street , Clerkenwell to Scala Street, Fitzrovia"
"LINESTRING (-0.131213 51.513103,-0.123616 51.529943", "From Frith Street, Soho to Belgrove Street , King's Cross"
"LINESTRING (-0.127854 51.517727,-0.123616 51.529943", "From Great Russell Street, Bloomsbury to Belgrove Street , King's Cross"
"LINESTRING (-0.133972 51.472993,-0.123616 51.529943", "From Union Grove, Wandsworth Road to Belgrove Street , King's Cross"
"LINESTRING (-0.168292 51.462392,-0.123616 51.529943", "From St. John's Road, Clapham Junction to Belgrove Street , King's Cross"
"LINESTRING (-0.134621 51.507424,-0.123616 51.529943", "From St. James's Square, St. James's to Belgrove Street , King's Cross"
"LINESTRING (-0.109256 51.526443,-0.123616 51.529943", "From Tysoe Street, Clerkenwell to Belgrove Street , King's Cross"
"LINESTRING (-0.102208 51.526153,-0.123616 51.529943", "From Percival Street, Finsbury to Belgrove Street , King's Cross"
"LINESTRING (-0.116279 51.524564,-0.123616 51.529943", "From Wren Street, Holborn to Belgrove Street , King's Cross"
"LINESTRING (-0.168292 51.462392,-0.123616 51.529943", "From St. John's Road, Clapham Junction to Belgrove Street , King's Cross"
"LINESTRING (-0.168292 51.462392,-0.123616 51.529943", "From St. John's Road, Clapham Junction to Belgrove Street , King's Cross"
"LINESTRING (-0.168292 51.462392,-0.123616 51.529943", "From St. John's Road, Clapham Junction to Belgrove Street , King's Cross"
"LINESTRING (-0.127854 51.517727,-0.123616 51.529943", "From Great Russell Street, Bloomsbury to Belgrove Street , King's Cross"
"LINESTRING (-0.125979 51.526357,-0.123616 51.529943", "From Cartwright Gardens , Bloomsbury to Belgrove Street , King's Cross"
"LINESTRING (-0.168292 51.462392,-0.123616 51.529943", "From St. John's Road, Clapham Junction to Belgrove Street , King's Cross"
"LINESTRING (-0.089659 51.52548,-0.123616 51.529943", "From Old Street Station, St. Luke's to Belgrove Street , King's Cross"
"LINESTRING (-0.141423 51.514499,-0.123616 51.529943", "From Little Argyll Street, West End to Belgrove Street , King's Cross"
"LINESTRING (-0.131213 51.513103,-0.123616 51.529943", "From Frith Street, Soho to Belgrove Street , King's Cross"
"LINESTRING (-0.118677 51.5338,-0.123616 51.529943", "From Killick Street, King's Cross to Belgrove Street , King's Cross"
"LINESTRING (-0.116688 51.520596,-0.123616 51.529943", "From Theobald's Road , Holborn to Belgrove Street , King's Cross"
"LINESTRING (-0.112432 51.526599,-0.123616 51.529943", "From Margery Street, Clerkenwell to Belgrove Street , King's Cross"
"LINESTRING (-0.141728 51.539099,-0.123616 51.529943", "From Greenland Road, Camden Town to Belgrove Street , King's Cross"
"LINESTRING (-0.102208 51.526153,-0.123616 51.529943", "From Percival Street, Finsbury to Belgrove Street , King's Cross"
"LINESTRING (-0.143613 51.523518,-0.123616 51.529943", "From Bolsover Street, Fitzrovia to Belgrove Street , King's Cross"
"LINESTRING (-0.166304 51.525051,-0.123616 51.529943", "From Mallory Street, Marylebone to Belgrove Street , King's Cross"
"LINESTRING (-0.11548 51.528915,-0.123616 51.529943", "From Great Percy Street, Clerkenwell to Belgrove Street , King's Cross"
"LINESTRING (-0.114842 51.50621,-0.127854 51.517727", "From Belvedere Road 2, South Bank to Great Russell Street, Bloomsbury"
"LINESTRING (-0.09294 51.51397,-0.127854 51.517727", "From Cheapside, Bank to Great Russell Street, Bloomsbury"
"LINESTRING (-0.133201 51.512515,-0.127854 51.517727", "From Wardour Street, Soho to Great Russell Street, Bloomsbury"
"LINESTRING (-0.179854 51.501715,-0.127854 51.517727", "From Queen's Gate, Kensington Gardens to Great Russell Street, Bloomsbury"
"LINESTRING (-0.088542 51.527025,-0.127854 51.517727", "From Baldwin Street, St. Luke's to Great Russell Street, Bloomsbury"
"LINESTRING (-0.058631 51.524583,-0.127854 51.517727", "From Finnis Street, Bethnal Green to Great Russell Street, Bloomsbury"
"LINESTRING (-0.088542 51.527025,-0.127854 51.517727", "From Baldwin Street, St. Luke's to Great Russell Street, Bloomsbury"
"LINESTRING (-0.068161 51.509786,-0.127854 51.517727", "From Dock Street, Wapping to Great Russell Street, Bloomsbury"
"LINESTRING (-0.139174 51.533019,-0.127854 51.517727", "From Harrington Square 1, Camden Town to Great Russell Street, Bloomsbury"
"LINESTRING (-0.068161 51.509786,-0.127854 51.517727", "From Dock Street, Wapping to Great Russell Street, Bloomsbury"
"LINESTRING (-0.11548 51.528915,-0.127854 51.517727", "From Great Percy Street, Clerkenwell to Great Russell Street, Bloomsbury"
"LINESTRING (-0.139174 51.533019,-0.127854 51.517727", "From Harrington Square 1, Camden Town to Great Russell Street, Bloomsbury"
"LINESTRING (-0.154106 51.517703,-0.127854 51.517727", "From George Street, Marylebone to Great Russell Street, Bloomsbury"
"LINESTRING (-0.133201 51.512515,-0.127854 51.517727", "From Wardour Street, Soho to Great Russell Street, Bloomsbury"
"LINESTRING (-0.09294 51.51397,-0.127854 51.517727", "From Cheapside, Bank to Great Russell Street, Bloomsbury"
"LINESTRING (-0.13214 51.519572,-0.125979 51.526357", "From Store Street, Bloomsbury to Cartwright Gardens , Bloomsbury"
"LINESTRING (-0.195455 51.500401,-0.125979 51.526357", "From Argyll Road, Kensington to Cartwright Gardens , Bloomsbury"
"LINESTRING (-0.132053 51.518587,-0.125979 51.526357", "From Bayley Street , Bloomsbury to Cartwright Gardens , Bloomsbury"
"LINESTRING (-0.138231 51.525542,-0.125979 51.526357", "From Hampstead Road, Euston to Cartwright Gardens , Bloomsbury"
"LINESTRING (-0.130699 51.50777,-0.125979 51.526357", "From Pall Mall East, West End to Cartwright Gardens , Bloomsbury"
"LINESTRING (-0.077121 51.511594,-0.125979 51.526357", "From Crosswall, Tower to Cartwright Gardens , Bloomsbury"
"LINESTRING (-0.130699 51.50777,-0.125979 51.526357", "From Pall Mall East, West End to Cartwright Gardens , Bloomsbury"
"LINESTRING (-0.111257 51.514274,-0.109006 51.521661", "From Chancery Lane, Holborn to Hatton Wall, Holborn"
"LINESTRING (-0.07813 51.526377,-0.109006 51.521661", "From Shoreditch High Street, Shoreditch to Hatton Wall, Holborn"
"LINESTRING (-0.106992 51.534504,-0.109006 51.521661", "From Liverpool Road (N1 Centre), Angel to Hatton Wall, Holborn"
"LINESTRING (-0.122502 51.523951,-0.109006 51.521661", "From Brunswick Square, Bloomsbury to Hatton Wall, Holborn"
"LINESTRING (-0.141423 51.514499,-0.109006 51.521661", "From Little Argyll Street, West End to Hatton Wall, Holborn"
"LINESTRING (-0.122219 51.51477,-0.109006 51.521661", "From Drury Lane, Covent Garden to Hatton Wall, Holborn"
"LINESTRING (-0.148105 51.514759,-0.109006 51.521661", "From Marylebone Lane, Marylebone to Hatton Wall, Holborn"
"LINESTRING (-0.071881 51.534776,-0.122219 51.51477", "From Thurtle Road, Haggerston to Drury Lane, Covent Garden"
"LINESTRING (-0.13558 51.513684,-0.122219 51.51477", "From Broadwick Street, Soho to Drury Lane, Covent Garden"
"LINESTRING (-0.122219 51.51477,-0.122219 51.51477", "From Drury Lane, Covent Garden to Drury Lane, Covent Garden"
"LINESTRING (-0.116688 51.520596,-0.122219 51.51477", "From Theobald's Road , Holborn to Drury Lane, Covent Garden"
"LINESTRING (-0.126409 51.524,-0.122219 51.51477", "From Coram Street, Bloomsbury to Drury Lane, Covent Garden"
"LINESTRING (-0.054162 51.536424,-0.122219 51.51477", "From Victoria Park Road, Hackney Central to Drury Lane, Covent Garden"
"LINESTRING (-0.137043 51.511897,-0.122219 51.51477", "From Golden Square, Soho to Drury Lane, Covent Garden"
"LINESTRING (-0.13225 51.528833,-0.122219 51.51477", "From Doric Way , Somers Town to Drury Lane, Covent Garden"
"LINESTRING (-0.100791 51.518218,-0.122219 51.51477", "From West Smithfield Rotunda, Farringdon to Drury Lane, Covent Garden"
"LINESTRING (-0.141423 51.514499,-0.122219 51.51477", "From Little Argyll Street, West End to Drury Lane, Covent Garden"
"LINESTRING (-0.132224 51.49206,-0.122219 51.51477", "From Regency Street, Westminster to Drury Lane, Covent Garden"
"LINESTRING (-0.073438 51.51838,-0.122219 51.51477", "From Fashion Street, Whitechapel to Drury Lane, Covent Garden"
"LINESTRING (-0.122219 51.51477,-0.122219 51.51477", "From Drury Lane, Covent Garden to Drury Lane, Covent Garden"
"LINESTRING (-0.114079 51.522264,-0.122219 51.51477", "From Northington Street , Holborn to Drury Lane, Covent Garden"
"LINESTRING (-0.13214 51.519572,-0.131161 51.52505", "From Store Street, Bloomsbury to Taviton Street, Bloomsbury"
"LINESTRING (-0.104724 51.52836,-0.131161 51.52505", "From St. John Street, Finsbury to Taviton Street, Bloomsbury"
"LINESTRING (-0.102208 51.526153,-0.131161 51.52505", "From Percival Street, Finsbury to Taviton Street, Bloomsbury"
"LINESTRING (-0.138072 51.517344,-0.131161 51.52505", "From Wells Street, Fitzrovia to Taviton Street, Bloomsbury"
"LINESTRING (-0.144466 51.528302,-0.136052 51.527326", "From Albany Street, The Regent's Park to Drummond Street , Euston"
"LINESTRING (-0.144466 51.528302,-0.136052 51.527326", "From Albany Street, The Regent's Park to Drummond Street , Euston"
"LINESTRING (-0.092762 51.500296,-0.136052 51.527326", "From Swan Street, The Borough to Drummond Street , Euston"
"LINESTRING (-0.138019 51.524438,-0.062806 51.539834", "From Warren Street Station, Euston to Lansdowne Drive, Hackney Central"
"LINESTRING (-0.106992 51.534504,-0.062806 51.539834", "From Liverpool Road (N1 Centre), Angel to Lansdowne Drive, Hackney Central"
"LINESTRING (-0.106992 51.534504,-0.062806 51.539834", "From Liverpool Road (N1 Centre), Angel to Lansdowne Drive, Hackney Central"
"LINESTRING (-0.169774 51.519968,-0.062806 51.539834", "From Edgware Road Station, Marylebone to Lansdowne Drive, Hackney Central"
"LINESTRING (-0.124826 51.516226,-0.062806 51.539834", "From High Holborn , Covent Garden to Lansdowne Drive, Hackney Central"
"LINESTRING (-0.154907 51.522481,-0.114079 51.522264", "From Westminster University, Marylebone to Northington Street , Holborn"
"LINESTRING (-0.148105 51.514759,-0.114079 51.522264", "From Marylebone Lane, Marylebone to Northington Street , Holborn"
"LINESTRING (-0.130431 51.52168,-0.114079 51.522264", "From Malet Street, Bloomsbury to Northington Street , Holborn"
"LINESTRING (-0.079249 51.518908,-0.114079 51.522264", "From Brushfield Street, Liverpool Street to Northington Street , Holborn"
"LINESTRING (-0.099994 51.522853,-0.114079 51.522264", "From Berry Street, Clerkenwell to Northington Street , Holborn"
"LINESTRING (-0.124121 51.523418,-0.114079 51.522264", "From Russell Square Station, Bloomsbury to Northington Street , Holborn"
"LINESTRING (-0.109006 51.521661,-0.119123 51.519435", "From Hatton Wall, Holborn to Red Lion Square, Holborn"
"LINESTRING (-0.158264 51.514577,-0.119123 51.519435", "From Old Quebec Street, Marylebone to Red Lion Square, Holborn"
"LINESTRING (-0.113001 51.50486,-0.119123 51.519435", "From Waterloo Road, South Bank to Red Lion Square, Holborn"
"LINESTRING (-0.140741 51.488057,-0.119123 51.519435", "From Alderney Street, Pimlico to Red Lion Square, Holborn"
"LINESTRING (-0.09294 51.511553,-0.124678 51.51908", "From Queen Street 1, Bank to British Museum, Bloomsbury"
"LINESTRING (-0.123509 51.52625,-0.124678 51.51908", "From Tavistock Place, Bloomsbury to British Museum, Bloomsbury"
"LINESTRING (-0.11548 51.528915,-0.124678 51.51908", "From Great Percy Street, Clerkenwell to British Museum, Bloomsbury"
"LINESTRING (-0.158249 51.516892,-0.124678 51.51908", "From George Place Mews, Marylebone to British Museum, Bloomsbury"
"LINESTRING (-0.135188 51.525227,-0.124678 51.51908", "From Gower Place , Euston to British Museum, Bloomsbury"
"LINESTRING (-0.130431 51.52168,-0.124678 51.51908", "From Malet Street, Bloomsbury to British Museum, Bloomsbury"
"LINESTRING (-0.141728 51.539099,-0.124678 51.51908", "From Greenland Road, Camden Town to British Museum, Bloomsbury"
"LINESTRING (-0.124121 51.523418,-0.124678 51.51908", "From Russell Square Station, Bloomsbury to British Museum, Bloomsbury"
"LINESTRING (-0.062697 51.518154,-0.124678 51.51908", "From New Road 1 , Whitechapel to British Museum, Bloomsbury"
"LINESTRING (-0.135188 51.525227,-0.124678 51.51908", "From Gower Place , Euston to British Museum, Bloomsbury"
"LINESTRING (-0.09294 51.511553,-0.124678 51.51908", "From Queen Street 1, Bank to British Museum, Bloomsbury"
"LINESTRING (-0.089659 51.52548,-0.124678 51.51908", "From Old Street Station, St. Luke's to British Museum, Bloomsbury"
"LINESTRING (-0.141728 51.539099,-0.124678 51.51908", "From Greenland Road, Camden Town to British Museum, Bloomsbury"
"LINESTRING (-0.124121 51.523418,-0.124678 51.51908", "From Russell Square Station, Bloomsbury to British Museum, Bloomsbury"
"LINESTRING (-0.089659 51.52548,-0.124678 51.51908", "From Old Street Station, St. Luke's to British Museum, Bloomsbury"
"LINESTRING (-0.112824 51.503791,-0.124678 51.51908", "From Waterloo Station 3, Waterloo to British Museum, Bloomsbury"
"LINESTRING (-0.141327 51.520253,-0.124678 51.51908", "From Great Titchfield Street, Fitzrovia to British Museum, Bloomsbury"
"LINESTRING (-0.124749 51.509462,-0.13225 51.528833", "From William IV Street, Strand to Doric Way , Somers Town"
"LINESTRING (-0.124749 51.509462,-0.13225 51.528833", "From William IV Street, Strand to Doric Way , Somers Town"
"LINESTRING (-0.168074 51.5343,-0.13225 51.528833", "From Charlbert Street, St. John's Wood to Doric Way , Somers Town"
"LINESTRING (-0.125078 51.534667,-0.13225 51.528833", "From Good's Way, King's Cross to Doric Way , Somers Town"
"LINESTRING (-0.132328 51.515631,-0.13225 51.528833", "From Soho Square , Soho to Doric Way , Somers Town"
"LINESTRING (-0.122203 51.534474,-0.13225 51.528833", "From Crinan Street, King's Cross to Doric Way , Somers Town"
"LINESTRING (-0.132053 51.518587,-0.13225 51.528833", "From Bayley Street , Bloomsbury to Doric Way , Somers Town"
"LINESTRING (-0.124121 51.523418,-0.13225 51.528833", "From Russell Square Station, Bloomsbury to Doric Way , Somers Town"
