"LINESTRING (-0.139221 51.461388,-0.083159 51.500889", "From Clapham Common Station, Clapham Common to Tyers Gate, Bermondsey"
"LINESTRING (-0.0786 51.500647,-0.083159 51.500889", "From Tanner Street, Bermondsey to Tyers Gate, Bermondsey"
"LINESTRING (-0.115659 51.486824,-0.083159 51.500889", "From Kennington Lane Tesco, Vauxhall to Tyers Gate, Bermondsey"
"LINESTRING (-0.127854 51.517727,-0.153463 51.525367", "From Great Russell Street, Bloomsbury to The Tennis Courts, The Regent's Park"
"LINESTRING (-0.19024 51.515529,-0.153463 51.525367", "From Westbourne Grove, Bayswater to The Tennis Courts, The Regent's Park"
"LINESTRING (-0.138072 51.517344,-0.153463 51.525367", "From Wells Street, Fitzrovia to The Tennis Courts, The Regent's Park"
"LINESTRING (-0.138072 51.517344,-0.153463 51.525367", "From Wells Street, Fitzrovia to The Tennis Courts, The Regent's Park"
"LINESTRING (-0.09294 51.51397,-0.093913 51.496791", "From Cheapside, Bank to Dickens Square, Borough"
"LINESTRING (-0.132845 51.489975,-0.093913 51.496791", "From Rampayne Street, Pimlico to Dickens Square, Borough"
"LINESTRING (-0.103137 51.506692,-0.093913 51.496791", "From Poured Lines, Bankside to Dickens Square, Borough"
"LINESTRING (-0.117774 51.513875,-0.093913 51.496791", "From Kingsway Southbound, Strand to Dickens Square, Borough"
"LINESTRING (-0.093913 51.496791,-0.093913 51.496791", "From Dickens Square, Borough to Dickens Square, Borough"
"LINESTRING (-0.18697 51.51616,-0.138846 51.510048", "From Bishop's Bridge Road West, Bayswater to Sackville Street, Mayfair"
"LINESTRING (-0.10997 51.529163,-0.138846 51.510048", "From River Street , Clerkenwell to Sackville Street, Mayfair"
"LINESTRING (-0.147449 51.509351,-0.138846 51.510048", "From Farm Street, Mayfair to Sackville Street, Mayfair"
"LINESTRING (-0.141327 51.520253,-0.138846 51.510048", "From Great Titchfield Street, Fitzrovia to Sackville Street, Mayfair"
"LINESTRING (-0.124121 51.523418,-0.138846 51.510048", "From Russell Square Station, Bloomsbury to Sackville Street, Mayfair"
"LINESTRING (-0.18697 51.51616,-0.138846 51.510048", "From Bishop's Bridge Road West, Bayswater to Sackville Street, Mayfair"
"LINESTRING (-0.13011 51.513527,-0.138846 51.510048", "From Moor Street, Soho to Sackville Street, Mayfair"
"LINESTRING (-0.118677 51.5338,-0.138846 51.510048", "From Killick Street, King's Cross to Sackville Street, Mayfair"
"LINESTRING (-0.116628 51.500089,-0.138846 51.510048", "From Lambeth Palace Road, Waterloo to Sackville Street, Mayfair"
"LINESTRING (-0.116628 51.500089,-0.138846 51.510048", "From Lambeth Palace Road, Waterloo to Sackville Street, Mayfair"
"LINESTRING (-0.124121 51.523418,-0.138846 51.510048", "From Russell Square Station, Bloomsbury to Sackville Street, Mayfair"
"LINESTRING (-0.141327 51.520253,-0.138846 51.510048", "From Great Titchfield Street, Fitzrovia to Sackville Street, Mayfair"
"LINESTRING (-0.111435 51.48894,-0.138846 51.510048", "From Kennington Cross, Kennington to Sackville Street, Mayfair"
"LINESTRING (-0.111435 51.48894,-0.138846 51.510048", "From Kennington Cross, Kennington to Sackville Street, Mayfair"
"LINESTRING (-0.141327 51.520253,-0.138846 51.510048", "From Great Titchfield Street, Fitzrovia to Sackville Street, Mayfair"
"LINESTRING (-0.086016 51.53114,-0.088542 51.527025", "From New North Road 2, Hoxton to Baldwin Street, St. Luke's"
"LINESTRING (-0.053558 51.511066,-0.088542 51.527025", "From Sutton Street, Shadwell to Baldwin Street, St. Luke's"
"LINESTRING (-0.124749 51.509462,-0.088542 51.527025", "From William IV Street, Strand to Baldwin Street, St. Luke's"
"LINESTRING (-0.097441 51.511961,-0.088542 51.527025", "From Queen Victoria Street, St. Paul's to Baldwin Street, St. Luke's"
"LINESTRING (-0.07813 51.526377,-0.088542 51.527025", "From Shoreditch High Street, Shoreditch to Baldwin Street, St. Luke's"
"LINESTRING (-0.057159 51.511088,-0.088542 51.527025", "From Shadwell Station, Shadwell to Baldwin Street, St. Luke's"
"LINESTRING (-0.105344 51.515059,-0.088542 51.527025", "From St. Bride Street, Holborn to Baldwin Street, St. Luke's"
"LINESTRING (-0.109006 51.521661,-0.088542 51.527025", "From Hatton Wall, Holborn to Baldwin Street, St. Luke's"
"LINESTRING (-0.10548 51.532199,-0.088542 51.527025", "From Torrens Street, Angel to Baldwin Street, St. Luke's"
"LINESTRING (-0.097441 51.511961,-0.088542 51.527025", "From Queen Victoria Street, St. Paul's to Baldwin Street, St. Luke's"
"LINESTRING (-0.057159 51.511088,-0.088542 51.527025", "From Shadwell Station, Shadwell to Baldwin Street, St. Luke's"
"LINESTRING (-0.109914 51.531666,-0.088542 51.527025", "From Claremont Square, Angel to Baldwin Street, St. Luke's"
"LINESTRING (-0.105344 51.515059,-0.088542 51.527025", "From St. Bride Street, Holborn to Baldwin Street, St. Luke's"
"LINESTRING (-0.124749 51.509462,-0.088542 51.527025", "From William IV Street, Strand to Baldwin Street, St. Luke's"
"LINESTRING (-0.053558 51.511066,-0.088542 51.527025", "From Sutton Street, Shadwell to Baldwin Street, St. Luke's"
"LINESTRING (-0.124749 51.509462,-0.088542 51.527025", "From William IV Street, Strand to Baldwin Street, St. Luke's"
"LINESTRING (-0.124749 51.509462,-0.088542 51.527025", "From William IV Street, Strand to Baldwin Street, St. Luke's"
"LINESTRING (-0.124749 51.509462,-0.088542 51.527025", "From William IV Street, Strand to Baldwin Street, St. Luke's"
"LINESTRING (-0.08249 51.53558,-0.088542 51.527025", "From Pitfield Street North,Hoxton to Baldwin Street, St. Luke's"
"LINESTRING (-0.124749 51.509462,-0.088542 51.527025", "From William IV Street, Strand to Baldwin Street, St. Luke's"
"LINESTRING (-0.149569 51.50274,-0.139956 51.493573", "From Wellington Arch, Hyde Park to Queen Mother Sports Centre, Victoria"
"LINESTRING (-0.142844 51.506613,-0.139956 51.493573", "From Green Park Station, Mayfair to Queen Mother Sports Centre, Victoria"
"LINESTRING (-0.137598 51.497698,-0.139956 51.493573", "From Kings Gate House, Westminster to Queen Mother Sports Centre, Victoria"
"LINESTRING (-0.149551 51.477619,-0.139956 51.493573", "From Queen's Circus, Battersea Park to Queen Mother Sports Centre, Victoria"
"LINESTRING (-0.134234 51.494591,-0.139956 51.493573", "From Greycoat Street , Westminster to Queen Mother Sports Centre, Victoria"
"LINESTRING (-0.141334 51.492345,-0.139956 51.493573", "From Guildhouse Street, Victoria to Queen Mother Sports Centre, Victoria"
"LINESTRING (-0.131961 51.508446,-0.139956 51.493573", "From Charles II Street, West End to Queen Mother Sports Centre, Victoria"
"LINESTRING (-0.121723 51.510701,-0.139956 51.493573", "From Southampton Street, Strand to Queen Mother Sports Centre, Victoria"
"LINESTRING (-0.137043 51.511897,-0.139956 51.493573", "From Golden Square, Soho to Queen Mother Sports Centre, Victoria"
"LINESTRING (-0.137598 51.497698,-0.139956 51.493573", "From Kings Gate House, Westminster to Queen Mother Sports Centre, Victoria"
"LINESTRING (-0.137043 51.511897,-0.139956 51.493573", "From Golden Square, Soho to Queen Mother Sports Centre, Victoria"
"LINESTRING (-0.142844 51.506613,-0.139956 51.493573", "From Green Park Station, Mayfair to Queen Mother Sports Centre, Victoria"
"LINESTRING (-0.137043 51.511897,-0.139956 51.493573", "From Golden Square, Soho to Queen Mother Sports Centre, Victoria"
"LINESTRING (-0.126874 51.47787,-0.139956 51.493573", "From Hartington Road, Stockwell to Queen Mother Sports Centre, Victoria"
"LINESTRING (-0.141728 51.539099,-0.139956 51.493573", "From Greenland Road, Camden Town to Queen Mother Sports Centre, Victoria"
"LINESTRING (-0.134234 51.494591,-0.139956 51.493573", "From Greycoat Street , Westminster to Queen Mother Sports Centre, Victoria"
"LINESTRING (-0.121723 51.510701,-0.139956 51.493573", "From Southampton Street, Strand to Queen Mother Sports Centre, Victoria"
"LINESTRING (-0.139956 51.493573,-0.139956 51.493573", "From Queen Mother Sports Centre, Victoria to Queen Mother Sports Centre, Victoria"
"LINESTRING (-0.03338 51.535179,-0.139956 51.493573", "From Gunmakers Lane, Old Ford to Queen Mother Sports Centre, Victoria"
"LINESTRING (-0.134234 51.494591,-0.139956 51.493573", "From Greycoat Street , Westminster to Queen Mother Sports Centre, Victoria"
"LINESTRING (-0.03338 51.535179,-0.139956 51.493573", "From Gunmakers Lane, Old Ford to Queen Mother Sports Centre, Victoria"
"LINESTRING (-0.10454 51.505461,-0.081608 51.497855", "From Blackfriars Road, Southwark to Bermondsey Street, Bermondsey"
"LINESTRING (-0.118272 51.516277,-0.081608 51.497855", "From Lincoln's Inn Fields, Holborn to Bermondsey Street, Bermondsey"
"LINESTRING (-0.098807 51.506725,-0.081608 51.497855", "From Tate Modern, Bankside to Bermondsey Street, Bermondsey"
"LINESTRING (-0.063531 51.504719,-0.081608 51.497855", "From Hermitage Court, Wapping to Bermondsey Street, Bermondsey"
"LINESTRING (-0.103137 51.506692,-0.081608 51.497855", "From Poured Lines, Bankside to Bermondsey Street, Bermondsey"
"LINESTRING (-0.094524 51.500694,-0.081608 51.497855", "From Borough High Street, The Borough to Bermondsey Street, Bermondsey"
"LINESTRING (-0.08497 51.50964,-0.081608 51.497855", "From Monument Street, Monument to Bermondsey Street, Bermondsey"
"LINESTRING (-0.103137 51.506692,-0.081608 51.497855", "From Poured Lines, Bankside to Bermondsey Street, Bermondsey"
"LINESTRING (-0.10454 51.505461,-0.081608 51.497855", "From Blackfriars Road, Southwark to Bermondsey Street, Bermondsey"
"LINESTRING (-0.074189 51.502279,-0.081608 51.497855", "From Curlew Street, Shad Thames to Bermondsey Street, Bermondsey"
"LINESTRING (-0.102091 51.500693,-0.081608 51.497855", "From Webber Street , Southwark to Bermondsey Street, Bermondsey"
"LINESTRING (-0.079249 51.518908,-0.081608 51.497855", "From Brushfield Street, Liverpool Street to Bermondsey Street, Bermondsey"
"LINESTRING (-0.098341 51.505409,-0.081608 51.497855", "From Southwark Street, Bankside to Bermondsey Street, Bermondsey"
"LINESTRING (-0.102091 51.500693,-0.081608 51.497855", "From Webber Street , Southwark to Bermondsey Street, Bermondsey"
"LINESTRING (-0.081608 51.497855,-0.081608 51.497855", "From Bermondsey Street, Bermondsey to Bermondsey Street, Bermondsey"
"LINESTRING (-0.10454 51.505461,-0.081608 51.497855", "From Blackfriars Road, Southwark to Bermondsey Street, Bermondsey"
"LINESTRING (-0.10454 51.505461,-0.081608 51.497855", "From Blackfriars Road, Southwark to Bermondsey Street, Bermondsey"
"LINESTRING (-0.10454 51.505461,-0.081608 51.497855", "From Blackfriars Road, Southwark to Bermondsey Street, Bermondsey"
"LINESTRING (-0.101536 51.49217,-0.081608 51.497855", "From Hampton Street, Walworth to Bermondsey Street, Bermondsey"
"LINESTRING (-0.115659 51.486824,-0.081608 51.497855", "From Kennington Lane Tesco, Vauxhall to Bermondsey Street, Bermondsey"
"LINESTRING (-0.102091 51.500693,-0.081608 51.497855", "From Webber Street , Southwark to Bermondsey Street, Bermondsey"
"LINESTRING (-0.063531 51.504719,-0.081608 51.497855", "From Hermitage Court, Wapping to Bermondsey Street, Bermondsey"
"LINESTRING (-0.098341 51.505409,-0.081608 51.497855", "From Southwark Street, Bankside to Bermondsey Street, Bermondsey"
"LINESTRING (-0.089887 51.520858,-0.073955 51.526293", "From Bunhill Row, Moorgate to Palissy Street, Shoreditch"
"LINESTRING (-0.079249 51.518908,-0.073955 51.526293", "From Brushfield Street, Liverpool Street to Palissy Street, Shoreditch"
"LINESTRING (-0.062697 51.518154,-0.073955 51.526293", "From New Road 1 , Whitechapel to Palissy Street, Shoreditch"
"LINESTRING (-0.089659 51.52548,-0.073955 51.526293", "From Old Street Station, St. Luke's to Palissy Street, Shoreditch"
"LINESTRING (-0.059091 51.528692,-0.073955 51.526293", "From Clarkson Street, Bethnal Green to Palissy Street, Shoreditch"
"LINESTRING (-0.062697 51.518154,-0.073955 51.526293", "From New Road 1 , Whitechapel to Palissy Street, Shoreditch"
"LINESTRING (-0.089887 51.520858,-0.073955 51.526293", "From Bunhill Row, Moorgate to Palissy Street, Shoreditch"
"LINESTRING (-0.087262 51.506304,-0.073955 51.526293", "From Duke Street Hill, London Bridge to Palissy Street, Shoreditch"
"LINESTRING (-0.09734 51.520841,-0.083067 51.523196", "From Aldersgate Street, Barbican to Clifton Street, Shoreditch"
"LINESTRING (-0.098341 51.505409,-0.101384 51.49652", "From Southwark Street, Bankside to Ontario Street, Elephant & Castle"
"LINESTRING (-0.111435 51.48894,-0.101384 51.49652", "From Kennington Cross, Kennington to Ontario Street, Elephant & Castle"
"LINESTRING (-0.116628 51.500089,-0.101384 51.49652", "From Lambeth Palace Road, Waterloo to Ontario Street, Elephant & Castle"
"LINESTRING (-0.103137 51.506692,-0.101384 51.49652", "From Poured Lines, Bankside to Ontario Street, Elephant & Castle"
"LINESTRING (-0.105593 51.488852,-0.101384 51.49652", "From Kennington Station, Kennington to Ontario Street, Elephant & Castle"
"LINESTRING (-0.116628 51.500089,-0.101384 51.49652", "From Lambeth Palace Road, Waterloo to Ontario Street, Elephant & Castle"
"LINESTRING (-0.098341 51.505409,-0.101384 51.49652", "From Southwark Street, Bankside to Ontario Street, Elephant & Castle"
"LINESTRING (-0.120718 51.511968,-0.101384 51.49652", "From Tavistock Street, Covent Garden to Ontario Street, Elephant & Castle"
"LINESTRING (-0.07813 51.526377,-0.101384 51.49652", "From Shoreditch High Street, Shoreditch to Ontario Street, Elephant & Castle"
"LINESTRING (-0.105593 51.488852,-0.101384 51.49652", "From Kennington Station, Kennington to Ontario Street, Elephant & Castle"
"LINESTRING (-0.116628 51.500089,-0.101384 51.49652", "From Lambeth Palace Road, Waterloo to Ontario Street, Elephant & Castle"
"LINESTRING (-0.085814 51.495061,-0.101384 51.49652", "From Bricklayers Arms, Borough to Ontario Street, Elephant & Castle"
"LINESTRING (-0.103137 51.506692,-0.101384 51.49652", "From Poured Lines, Bankside to Ontario Street, Elephant & Castle"
"LINESTRING (-0.130431 51.52168,-0.129697 51.509087", "From Malet Street, Bloomsbury to St. Martin's Street, West End"
"LINESTRING (-0.167894 51.493184,-0.129697 51.509087", "From Sloane Avenue, Knightsbridge to St. Martin's Street, West End"
"LINESTRING (-0.132102 51.472918,-0.129697 51.509087", "From Courland Grove, Wandsworth Road to St. Martin's Street, West End"
"LINESTRING (-0.163041 51.470538,-0.129697 51.509087", "From Sheepcote Lane, Battersea to St. Martin's Street, West End"
"LINESTRING (-0.137424 51.498865,-0.129697 51.509087", "From Buckingham Gate, Westminster to St. Martin's Street, West End"
"LINESTRING (-0.167894 51.493184,-0.129697 51.509087", "From Sloane Avenue, Knightsbridge to St. Martin's Street, West End"
"LINESTRING (-0.014691 51.546805,-0.099981 51.532661", "From Timber Lodge, Queen Elizabeth Olympic Park to Graham Street, Angel"
"LINESTRING (-0.106992 51.534504,-0.099981 51.532661", "From Liverpool Road (N1 Centre), Angel to Graham Street, Angel"
"LINESTRING (-0.014691 51.546805,-0.099981 51.532661", "From Timber Lodge, Queen Elizabeth Olympic Park to Graham Street, Angel"
"LINESTRING (-0.104298 51.526717,-0.099981 51.532661", "From Finsbury Library , Finsbury to Graham Street, Angel"
"LINESTRING (-0.09022 51.491484,-0.099981 51.532661", "From Rodney Road , Walworth to Graham Street, Angel"
"LINESTRING (-0.124807 51.53724,-0.099981 51.532661", "From Handyside Street, King's Cross to Graham Street, Angel"
"LINESTRING (-0.075885 51.536585,-0.099981 51.532661", "From Dunston Road , Haggerston to Graham Street, Angel"
"LINESTRING (-0.120202 51.523346,-0.085603 51.53095", "From Guilford Street , Bloomsbury to New North Road 1, Hoxton"
"LINESTRING (-0.075885 51.536585,-0.085603 51.53095", "From Dunston Road , Haggerston to New North Road 1, Hoxton"
"LINESTRING (-0.06142 51.532091,-0.085603 51.53095", "From Pritchard's Road, Bethnal Green to New North Road 1, Hoxton"
"LINESTRING (-0.116688 51.520596,-0.086016 51.53114", "From Theobald's Road , Holborn to New North Road 2, Hoxton"
"LINESTRING (-0.109025 51.534408,-0.086016 51.53114", "From Cloudesley Road, Angel to New North Road 2, Hoxton"
"LINESTRING (-0.160854 51.535892,-0.160854 51.535892", "From Prince Albert Road, The Regent's Park to Prince Albert Road, The Regent's Park"
"LINESTRING (-0.160854 51.535892,-0.160854 51.535892", "From Prince Albert Road, The Regent's Park to Prince Albert Road, The Regent's Park"
"LINESTRING (-0.084605 51.521283,-0.089887 51.520858", "From Christopher Street, Liverpool Street to Bunhill Row, Moorgate"
"LINESTRING (-0.107987 51.517428,-0.089887 51.520858", "From New Fetter Lane, Holborn to Bunhill Row, Moorgate"
"LINESTRING (-0.09294 51.51397,-0.089887 51.520858", "From Cheapside, Bank to Bunhill Row, Moorgate"
"LINESTRING (-0.107987 51.517428,-0.089887 51.520858", "From New Fetter Lane, Holborn to Bunhill Row, Moorgate"
"LINESTRING (-0.09294 51.51397,-0.089887 51.520858", "From Cheapside, Bank to Bunhill Row, Moorgate"
"LINESTRING (-0.09294 51.51397,-0.089887 51.520858", "From Cheapside, Bank to Bunhill Row, Moorgate"
"LINESTRING (-0.096496 51.517821,-0.089887 51.520858", "From Museum of London, Barbican to Bunhill Row, Moorgate"
"LINESTRING (-0.09294 51.51397,-0.089887 51.520858", "From Cheapside, Bank to Bunhill Row, Moorgate"
"LINESTRING (-0.09294 51.51397,-0.089887 51.520858", "From Cheapside, Bank to Bunhill Row, Moorgate"
"LINESTRING (-0.056667 51.511542,-0.089887 51.520858", "From Watney Street, Shadwell to Bunhill Row, Moorgate"
"LINESTRING (-0.194757 51.493343,-0.194757 51.493343", "From Nevern Place, Earl's Court to Nevern Place, Earl's Court"
"LINESTRING (-0.194757 51.493343,-0.194757 51.493343", "From Nevern Place, Earl's Court to Nevern Place, Earl's Court"
"LINESTRING (-0.170983 51.486892,-0.194757 51.493343", "From Manresa Road, Chelsea to Nevern Place, Earl's Court"
"LINESTRING (-0.142844 51.506613,-0.194757 51.493343", "From Green Park Station, Mayfair to Nevern Place, Earl's Court"
"LINESTRING (-0.140947 51.49616,-0.194757 51.493343", "From Ashley Place, Victoria to Nevern Place, Earl's Court"
"LINESTRING (-0.142844 51.506613,-0.194757 51.493343", "From Green Park Station, Mayfair to Nevern Place, Earl's Court"
"LINESTRING (-0.206029 51.49087,-0.194757 51.493343", "From West Kensington Station, West Kensington to Nevern Place, Earl's Court"
"LINESTRING (-0.149569 51.50274,-0.193764 51.508605", "From Wellington Arch, Hyde Park to Palace Gardens Terrace, Notting Hill"
"LINESTRING (-0.149569 51.50274,-0.193764 51.508605", "From Wellington Arch, Hyde Park to Palace Gardens Terrace, Notting Hill"
"LINESTRING (-0.10527 51.515809,-0.193764 51.508605", "From Stonecutter Street, Holborn to Palace Gardens Terrace, Notting Hill"
"LINESTRING (-0.159237 51.501855,-0.193764 51.508605", "From Seville Street, Knightsbridge to Palace Gardens Terrace, Notting Hill"
"LINESTRING (-0.159237 51.501855,-0.193764 51.508605", "From Seville Street, Knightsbridge to Palace Gardens Terrace, Notting Hill"
"LINESTRING (-0.163609 51.51809,-0.193764 51.508605", "From Shouldham Street, Marylebone to Palace Gardens Terrace, Notting Hill"
"LINESTRING (-0.09022 51.491484,-0.120718 51.511968", "From Rodney Road , Walworth to Tavistock Street, Covent Garden"
"LINESTRING (-0.081608 51.497855,-0.120718 51.511968", "From Bermondsey Street, Bermondsey to Tavistock Street, Covent Garden"
"LINESTRING (-0.124749 51.509462,-0.120718 51.511968", "From William IV Street, Strand to Tavistock Street, Covent Garden"
"LINESTRING (-0.139258 51.533403,-0.120718 51.511968", "From Harrington Square 2, Camden Town to Tavistock Street, Covent Garden"
"LINESTRING (-0.029138 51.516196,-0.120718 51.511968", "From Burdett Road, Mile End to Tavistock Street, Covent Garden"
"LINESTRING (-0.102091 51.500693,-0.120718 51.511968", "From Webber Street , Southwark to Tavistock Street, Covent Garden"
"LINESTRING (-0.091773 51.504627,-0.120718 51.511968", "From Hop Exchange, The Borough to Tavistock Street, Covent Garden"
"LINESTRING (-0.124749 51.509462,-0.120718 51.511968", "From William IV Street, Strand to Tavistock Street, Covent Garden"
"LINESTRING (-0.091773 51.504627,-0.120718 51.511968", "From Hop Exchange, The Borough to Tavistock Street, Covent Garden"
"LINESTRING (-0.081608 51.497855,-0.120718 51.511968", "From Bermondsey Street, Bermondsey to Tavistock Street, Covent Garden"
"LINESTRING (-0.116279 51.524564,-0.120718 51.511968", "From Wren Street, Holborn to Tavistock Street, Covent Garden"
"LINESTRING (-0.093885 51.517008,-0.120718 51.511968", "From Wood Street, Guildhall to Tavistock Street, Covent Garden"
"LINESTRING (-0.122759 51.487807,-0.120718 51.511968", "From New Spring Gardens Walk, Vauxhall to Tavistock Street, Covent Garden"
"LINESTRING (-0.122759 51.487807,-0.120718 51.511968", "From New Spring Gardens Walk, Vauxhall to Tavistock Street, Covent Garden"
"LINESTRING (-0.117069 51.53136,-0.120718 51.511968", "From Calshot Street , King's Cross to Tavistock Street, Covent Garden"
"LINESTRING (-0.085666 51.499075,-0.120718 51.511968", "From Long Lane , Bermondsey to Tavistock Street, Covent Garden"
"LINESTRING (-0.093885 51.517008,-0.120718 51.511968", "From Wood Street, Guildhall to Tavistock Street, Covent Garden"
"LINESTRING (-0.206029 51.49087,-0.197524 51.511084", "From West Kensington Station, West Kensington to Pembridge Villas, Notting Hill"
"LINESTRING (-0.200838 51.514311,-0.197524 51.511084", "From Turquoise Island, Notting Hill to Pembridge Villas, Notting Hill"
"LINESTRING (-0.196422 51.509353,-0.197524 51.511084", "From Notting Hill Gate Station, Notting Hill to Pembridge Villas, Notting Hill"
"LINESTRING (-0.201554 51.512136,-0.197524 51.511084", "From Chepstow Villas, Notting Hill to Pembridge Villas, Notting Hill"
"LINESTRING (-0.145393 51.542138,-0.111781 51.533319", "From Castlehaven Road, Camden Town to Risinghill Street, Angel"
"LINESTRING (-0.10454 51.505461,-0.111781 51.533319", "From Blackfriars Road, Southwark to Risinghill Street, Angel"
"LINESTRING (-0.145393 51.542138,-0.111781 51.533319", "From Castlehaven Road, Camden Town to Risinghill Street, Angel"
"LINESTRING (-0.145393 51.542138,-0.111781 51.533319", "From Castlehaven Road, Camden Town to Risinghill Street, Angel"
"LINESTRING (-0.097122 51.529423,-0.111781 51.533319", "From Macclesfield Rd, St Lukes to Risinghill Street, Angel"
"LINESTRING (-0.145393 51.542138,-0.111781 51.533319", "From Castlehaven Road, Camden Town to Risinghill Street, Angel"
"LINESTRING (-0.145393 51.542138,-0.111781 51.533319", "From Castlehaven Road, Camden Town to Risinghill Street, Angel"
"LINESTRING (-0.067937 51.51793,-0.111781 51.533319", "From Old Montague Street, Whitechapel to Risinghill Street, Angel"
"LINESTRING (-0.145393 51.542138,-0.111781 51.533319", "From Castlehaven Road, Camden Town to Risinghill Street, Angel"
"LINESTRING (-0.107987 51.517428,-0.087587 51.514441", "From New Fetter Lane, Holborn to Bank of England Museum, Bank"
"LINESTRING (-0.107987 51.517428,-0.087587 51.514441", "From New Fetter Lane, Holborn to Bank of England Museum, Bank"
"LINESTRING (-0.071881 51.534776,-0.087587 51.514441", "From Thurtle Road, Haggerston to Bank of England Museum, Bank"
"LINESTRING (-0.075459 51.509506,-0.087587 51.514441", "From Tower Gardens , Tower to Bank of England Museum, Bank"
"LINESTRING (-0.172528 51.533043,-0.150181 51.536922", "From Wellington Road, St. John's Wood to London Zoo Car Park, The Regent's Park"
"LINESTRING (-0.101384 51.49652,-0.101026 51.528246", "From Ontario Street, Elephant & Castle to Goswell Road (City Uni), Finsbury"
"LINESTRING (-0.089659 51.52548,-0.101026 51.528246", "From Old Street Station, St. Luke's to Goswell Road (City Uni), Finsbury"
"LINESTRING (-0.101384 51.49652,-0.101026 51.528246", "From Ontario Street, Elephant & Castle to Goswell Road (City Uni), Finsbury"
"LINESTRING (-0.075885 51.536585,-0.101026 51.528246", "From Dunston Road , Haggerston to Goswell Road (City Uni), Finsbury"
"LINESTRING (-0.134621 51.507424,-0.166878 51.488023", "From St. James's Square, St. James's to Flood Street, Chelsea"
"LINESTRING (-0.142207 51.485357,-0.166878 51.488023", "From Grosvenor Road, Pimlico to Flood Street, Chelsea"
"LINESTRING (-0.140947 51.49616,-0.166878 51.488023", "From Ashley Place, Victoria to Flood Street, Chelsea"
"LINESTRING (-0.147478 51.492369,-0.166878 51.488023", "From Elizabeth Bridge, Victoria to Flood Street, Chelsea"
"LINESTRING (-0.14177 51.479501,-0.166878 51.488023", "From Battersea Park Road, Nine Elms to Flood Street, Chelsea"
"LINESTRING (-0.147478 51.492369,-0.166878 51.488023", "From Elizabeth Bridge, Victoria to Flood Street, Chelsea"
"LINESTRING (-0.142207 51.485357,-0.166878 51.488023", "From Grosvenor Road, Pimlico to Flood Street, Chelsea"
"LINESTRING (-0.140947 51.49616,-0.166878 51.488023", "From Ashley Place, Victoria to Flood Street, Chelsea"
"LINESTRING (-0.14177 51.479501,-0.166878 51.488023", "From Battersea Park Road, Nine Elms to Flood Street, Chelsea"
"LINESTRING (-0.1844 51.502042,-0.150481 51.51217", "From Palace Gate, Kensington Gardens to Grosvenor Square, Mayfair"
"LINESTRING (-0.075459 51.509506,-0.150481 51.51217", "From Tower Gardens , Tower to Grosvenor Square, Mayfair"
"LINESTRING (-0.169249 51.515953,-0.150481 51.51217", "From Southwick Street, Paddington to Grosvenor Square, Mayfair"
"LINESTRING (-0.150908 51.47505,-0.150481 51.51217", "From Alfreda Street, Battersea Park to Grosvenor Square, Mayfair"
"LINESTRING (-0.144165 51.510736,-0.150481 51.51217", "From Bruton Street, Mayfair to Grosvenor Square, Mayfair"
"LINESTRING (-0.123616 51.529943,-0.150481 51.51217", "From Belgrove Street , King's Cross to Grosvenor Square, Mayfair"
"LINESTRING (-0.179668 51.511654,-0.150481 51.51217", "From Lancaster Gate , Bayswater to Grosvenor Square, Mayfair"
"LINESTRING (-0.144165 51.510736,-0.150481 51.51217", "From Bruton Street, Mayfair to Grosvenor Square, Mayfair"
"LINESTRING (-0.144165 51.510736,-0.150481 51.51217", "From Bruton Street, Mayfair to Grosvenor Square, Mayfair"
