"LINESTRING (-0.033828 51.514115,-0.017676 51.503083", "From Salmon Lane, Limehouse to Upper Bank Street, Canary Wharf"
"LINESTRING (-0.025996 51.509303,-0.017676 51.503083", "From Westferry DLR, Limehouse to Upper Bank Street, Canary Wharf"
"LINESTRING (-0.012413 51.508896,-0.017676 51.503083", "From Newby Place, Poplar to Upper Bank Street, Canary Wharf"
"LINESTRING (-0.008428 51.503143,-0.017676 51.503083", "From Lancaster Drive, Blackwall to Upper Bank Street, Canary Wharf"
"LINESTRING (-0.002275 51.509474,-0.017676 51.503083", "From East India DLR, Blackwall to Upper Bank Street, Canary Wharf"
"LINESTRING (-0.054162 51.536424,-0.017676 51.503083", "From Victoria Park Road, Hackney Central to Upper Bank Street, Canary Wharf"
"LINESTRING (-0.007542 51.493381,-0.017676 51.503083", "From Jubilee Crescent, Cubitt Town to Upper Bank Street, Canary Wharf"
"LINESTRING (-0.002275 51.509474,-0.017676 51.503083", "From East India DLR, Blackwall to Upper Bank Street, Canary Wharf"
"LINESTRING (-0.027772 51.505703,-0.017676 51.503083", "From Westferry Circus, Canary Wharf to Upper Bank Street, Canary Wharf"
"LINESTRING (-0.074754 51.523648,-0.017676 51.503083", "From Bethnal Green Road, Shoreditch to Upper Bank Street, Canary Wharf"
"LINESTRING (-0.054162 51.536424,-0.017676 51.503083", "From Victoria Park Road, Hackney Central to Upper Bank Street, Canary Wharf"
"LINESTRING (-0.074754 51.523648,-0.017676 51.503083", "From Bethnal Green Road, Shoreditch to Upper Bank Street, Canary Wharf"
"LINESTRING (-0.002275 51.509474,-0.017676 51.503083", "From East India DLR, Blackwall to Upper Bank Street, Canary Wharf"
"LINESTRING (-0.158456 51.502953,-0.017676 51.503083", "From Albert Gate, Hyde Park to Upper Bank Street, Canary Wharf"
"LINESTRING (-0.191462 51.501364,-0.218337 51.506256", "From Derry Street, Kensington to Westfield Southern Terrace ,Shepherd's Bush"
"LINESTRING (-0.193068 51.500397,-0.218337 51.506256", "From Wright's Lane, Kensington to Westfield Southern Terrace ,Shepherd's Bush"
"LINESTRING (-0.165842 51.522029,-0.218337 51.506256", "From Bell Street , Marylebone to Westfield Southern Terrace ,Shepherd's Bush"
"LINESTRING (-0.200838 51.514311,-0.218337 51.506256", "From Turquoise Island, Notting Hill to Westfield Southern Terrace ,Shepherd's Bush"
"LINESTRING (-0.202038 51.48357,-0.218337 51.506256", "From Coomer Place, West Kensington to Westfield Southern Terrace ,Shepherd's Bush"
"LINESTRING (-0.208565 51.515108,-0.218337 51.506256", "From Blenheim Crescent, Ladbroke Grove to Westfield Southern Terrace ,Shepherd's Bush"
"LINESTRING (-0.13225 51.528833,-0.141728 51.539099", "From Doric Way , Somers Town to Greenland Road, Camden Town"
"LINESTRING (-0.130504 51.526838,-0.141728 51.539099", "From Endsleigh Gardens, Euston to Greenland Road, Camden Town"
"LINESTRING (-0.130504 51.526838,-0.141728 51.539099", "From Endsleigh Gardens, Euston to Greenland Road, Camden Town"
"LINESTRING (-0.143613 51.523518,-0.141728 51.539099", "From Bolsover Street, Fitzrovia to Greenland Road, Camden Town"
"LINESTRING (-0.130504 51.526838,-0.141728 51.539099", "From Endsleigh Gardens, Euston to Greenland Road, Camden Town"
"LINESTRING (-0.187402 51.51031,-0.141728 51.539099", "From Queensway, Kensington Gardens to Greenland Road, Camden Town"
"LINESTRING (-0.183846 51.523344,-0.18119 51.485587", "From Warwick Avenue Station, Maida Vale to Limerston Street, West Chelsea"
"LINESTRING (-0.17021 51.474535,-0.18119 51.485587", "From Orbel Street, Battersea to Limerston Street, West Chelsea"
"LINESTRING (-0.205284 51.496712,-0.18119 51.485587", "From Warwick Road, Olympia to Limerston Street, West Chelsea"
"LINESTRING (-0.190393 51.490163,-0.18119 51.485587", "From Bramham Gardens, Earl's Court to Limerston Street, West Chelsea"
"LINESTRING (-0.17021 51.474535,-0.18119 51.485587", "From Orbel Street, Battersea to Limerston Street, West Chelsea"
"LINESTRING (-0.140741 51.488057,-0.18119 51.485587", "From Alderney Street, Pimlico to Limerston Street, West Chelsea"
"LINESTRING (-0.185296 51.495362,-0.18119 51.485587", "From Emperor's Gate, South Kensington to Limerston Street, West Chelsea"
"LINESTRING (-0.159237 51.501855,-0.18119 51.485587", "From Seville Street, Knightsbridge to Limerston Street, West Chelsea"
"LINESTRING (-0.17021 51.474535,-0.18119 51.485587", "From Orbel Street, Battersea to Limerston Street, West Chelsea"
"LINESTRING (-0.18119 51.485587,-0.18119 51.485587", "From Limerston Street, West Chelsea to Limerston Street, West Chelsea"
"LINESTRING (-0.174971 51.485121,-0.18119 51.485587", "From The Vale, Chelsea to Limerston Street, West Chelsea"
"LINESTRING (-0.132845 51.489975,-0.18119 51.485587", "From Rampayne Street, Pimlico to Limerston Street, West Chelsea"
"LINESTRING (-0.186753 51.491615,-0.18119 51.485587", "From Collingham Gardens, Earl's Court to Limerston Street, West Chelsea"
"LINESTRING (-0.18119 51.485587,-0.18119 51.485587", "From Limerston Street, West Chelsea to Limerston Street, West Chelsea"
"LINESTRING (-0.09315 51.53356,-0.09315 51.53356", "From Eagle Wharf Road, Hoxton to Eagle Wharf Road, Hoxton"
"LINESTRING (-0.062546 51.535678,-0.09315 51.53356", "From Regent's Row , Haggerston to Eagle Wharf Road, Hoxton"
"LINESTRING (-0.08249 51.53558,-0.09315 51.53356", "From Pitfield Street North,Hoxton to Eagle Wharf Road, Hoxton"
"LINESTRING (-0.090847 51.525893,-0.09315 51.53356", "From Bath Street, St. Luke's to Eagle Wharf Road, Hoxton"
"LINESTRING (-0.102757 51.536384,-0.09315 51.53356", "From Islington Green, Angel to Eagle Wharf Road, Hoxton"
"LINESTRING (-0.102757 51.536384,-0.09315 51.53356", "From Islington Green, Angel to Eagle Wharf Road, Hoxton"
"LINESTRING (-0.033085 51.532513,-0.09315 51.53356", "From Ford Road, Old Ford to Eagle Wharf Road, Hoxton"
"LINESTRING (-0.089659 51.52548,-0.09315 51.53356", "From Old Street Station, St. Luke's to Eagle Wharf Road, Hoxton"
"LINESTRING (-0.102757 51.536384,-0.09315 51.53356", "From Islington Green, Angel to Eagle Wharf Road, Hoxton"
"LINESTRING (-0.097122 51.529423,-0.09315 51.53356", "From Macclesfield Rd, St Lukes to Eagle Wharf Road, Hoxton"
"LINESTRING (-0.058005 51.527152,-0.09315 51.53356", "From Pott Street, Bethnal Green to Eagle Wharf Road, Hoxton"
"LINESTRING (-0.07813 51.526377,-0.09315 51.53356", "From Shoreditch High Street, Shoreditch to Eagle Wharf Road, Hoxton"
"LINESTRING (-0.11934 51.531066,-0.09315 51.53356", "From Northdown Street, King's Cross to Eagle Wharf Road, Hoxton"
"LINESTRING (-0.038986 51.512871,-0.022793 51.497304", "From Flamborough Street, Limehouse to Alpha Grove, Millwall"
"LINESTRING (-0.020157 51.499041,-0.022793 51.497304", "From Lightermans Road, Millwall to Alpha Grove, Millwall"
"LINESTRING (-0.06415 51.51295,-0.022793 51.497304", "From Christian Street, Whitechapel to Alpha Grove, Millwall"
"LINESTRING (-0.014409 51.49447,-0.022793 51.497304", "From East Ferry Road, Cubitt Town to Alpha Grove, Millwall"
"LINESTRING (-0.088542 51.527025,-0.047548 51.528869", "From Baldwin Street, St. Luke's to Globe Town Market, Bethnal Green"
"LINESTRING (-0.047218 51.526041,-0.047548 51.528869", "From Bancroft Road, Bethnal Green to Globe Town Market, Bethnal Green"
"LINESTRING (-0.063386 51.521905,-0.047548 51.528869", "From Selby Street, Whitechapel to Globe Town Market, Bethnal Green"
"LINESTRING (-0.055894 51.528936,-0.047548 51.528869", "From York Hall, Bethnal Green to Globe Town Market, Bethnal Green"
"LINESTRING (-0.058681 51.506946,-0.047548 51.528869", "From Reardon Street, Wapping to Globe Town Market, Bethnal Green"
"LINESTRING (-0.055312 51.52568,-0.047548 51.528869", "From Bethnal Green Garden, Bethnal Green to Globe Town Market, Bethnal Green"
"LINESTRING (-0.069543 51.525645,-0.047548 51.528869", "From Granby Street, Shoreditch to Globe Town Market, Bethnal Green"
"LINESTRING (-0.018703 51.528169,-0.047548 51.528869", "From Bow Church Station, Bow to Globe Town Market, Bethnal Green"
"LINESTRING (-0.062546 51.535678,-0.057133 51.527607", "From Regent's Row , Haggerston to Hollybush Gardens, Bethnal Green"
"LINESTRING (-0.062546 51.535678,-0.057133 51.527607", "From Regent's Row , Haggerston to Hollybush Gardens, Bethnal Green"
"LINESTRING (-0.090847 51.525893,-0.057133 51.527607", "From Bath Street, St. Luke's to Hollybush Gardens, Bethnal Green"
"LINESTRING (-0.03338 51.535179,-0.057133 51.527607", "From Gunmakers Lane, Old Ford to Hollybush Gardens, Bethnal Green"
"LINESTRING (-0.03338 51.535179,-0.057133 51.527607", "From Gunmakers Lane, Old Ford to Hollybush Gardens, Bethnal Green"
"LINESTRING (-0.047218 51.526041,-0.093051 51.511246", "From Bancroft Road, Bethnal Green to Queen Street 2, Bank"
"LINESTRING (-0.158264 51.514577,-0.093051 51.511246", "From Old Quebec Street, Marylebone to Queen Street 2, Bank"
"LINESTRING (-0.075459 51.509506,-0.093051 51.511246", "From Tower Gardens , Tower to Queen Street 2, Bank"
"LINESTRING (-0.123702 51.506767,-0.093051 51.511246", "From Northumberland Avenue, Strand to Queen Street 2, Bank"
"LINESTRING (-0.093051 51.511246,-0.093051 51.511246", "From Queen Street 2, Bank to Queen Street 2, Bank"
"LINESTRING (-0.075459 51.509506,-0.093051 51.511246", "From Tower Gardens , Tower to Queen Street 2, Bank"
"LINESTRING (-0.075459 51.509506,-0.093051 51.511246", "From Tower Gardens , Tower to Queen Street 2, Bank"
"LINESTRING (-0.132328 51.515631,-0.093051 51.511246", "From Soho Square , Soho to Queen Street 2, Bank"
"LINESTRING (-0.122492 51.486343,-0.093051 51.511246", "From Kennington Lane Rail Bridge, Vauxhall to Queen Street 2, Bank"
"LINESTRING (-0.158264 51.514577,-0.093051 51.511246", "From Old Quebec Street, Marylebone to Queen Street 2, Bank"
"LINESTRING (-0.117661 51.482678,-0.102996 51.486929", "From Ashmole Estate, Oval to Doddington Grove, Kennington"
"LINESTRING (-0.09022 51.491484,-0.102996 51.486929", "From Rodney Road , Walworth to Doddington Grove, Kennington"
"LINESTRING (-0.102996 51.486929,-0.102996 51.486929", "From Doddington Grove, Kennington to Doddington Grove, Kennington"
"LINESTRING (-0.118256 51.47659,-0.102996 51.486929", "From Albert Square, Stockwell to Doddington Grove, Kennington"
"LINESTRING (-0.130908 51.464995,-0.102996 51.486929", "From Gauden Road, Clapham to Doddington Grove, Kennington"
"LINESTRING (-0.143613 51.523518,-0.147983 51.519167", "From Bolsover Street, Fitzrovia to New Cavendish Street, Marylebone"
"LINESTRING (-0.130504 51.526838,-0.147983 51.519167", "From Endsleigh Gardens, Euston to New Cavendish Street, Marylebone"
"LINESTRING (-0.160854 51.535892,-0.147983 51.519167", "From Prince Albert Road, The Regent's Park to New Cavendish Street, Marylebone"
"LINESTRING (-0.147983 51.519167,-0.147983 51.519167", "From New Cavendish Street, Marylebone to New Cavendish Street, Marylebone"
"LINESTRING (-0.138072 51.517344,-0.147983 51.519167", "From Wells Street, Fitzrovia to New Cavendish Street, Marylebone"
"LINESTRING (-0.126409 51.524,-0.147983 51.519167", "From Coram Street, Bloomsbury to New Cavendish Street, Marylebone"
"LINESTRING (-0.141327 51.520253,-0.147983 51.519167", "From Great Titchfield Street, Fitzrovia to New Cavendish Street, Marylebone"
"LINESTRING (-0.127854 51.517727,-0.147983 51.519167", "From Great Russell Street, Bloomsbury to New Cavendish Street, Marylebone"
"LINESTRING (-0.125979 51.526357,-0.147983 51.519167", "From Cartwright Gardens , Bloomsbury to New Cavendish Street, Marylebone"
"LINESTRING (-0.137424 51.498865,-0.125972 51.49764", "From Buckingham Gate, Westminster to Abingdon Green, Westminster"
"LINESTRING (-0.161765 51.487964,-0.125972 51.49764", "From Ormonde Gate, Chelsea to Abingdon Green, Westminster"
"LINESTRING (-0.140947 51.49616,-0.125972 51.49764", "From Ashley Place, Victoria to Abingdon Green, Westminster"
"LINESTRING (-0.140947 51.49616,-0.125972 51.49764", "From Ashley Place, Victoria to Abingdon Green, Westminster"
"LINESTRING (-0.135635 51.488226,-0.125972 51.49764", "From St. George's Square, Pimlico to Abingdon Green, Westminster"
"LINESTRING (-0.122219 51.51477,-0.125972 51.49764", "From Drury Lane, Covent Garden to Abingdon Green, Westminster"
"LINESTRING (-0.179854 51.501715,-0.125972 51.49764", "From Queen's Gate, Kensington Gardens to Abingdon Green, Westminster"
"LINESTRING (-0.156876 51.49313,-0.125972 51.49764", "From Sedding Street, Sloane Square to Abingdon Green, Westminster"
"LINESTRING (-0.137424 51.498865,-0.125972 51.49764", "From Buckingham Gate, Westminster to Abingdon Green, Westminster"
"LINESTRING (-0.115659 51.486824,-0.125972 51.49764", "From Kennington Lane Tesco, Vauxhall to Abingdon Green, Westminster"
"LINESTRING (-0.163347 51.474392,-0.125972 51.49764", "From Albert Bridge Road, Battersea Park to Abingdon Green, Westminster"
"LINESTRING (-0.172078 51.482567,-0.125972 51.49764", "From Danvers Street, West Chelsea to Abingdon Green, Westminster"
"LINESTRING (-0.15352 51.503117,-0.19096 51.51244", "From Hyde Park Corner, Hyde Park to Ilchester Gardens, Bayswater"
"LINESTRING (-0.158264 51.514577,-0.19096 51.51244", "From Old Quebec Street, Marylebone to Ilchester Gardens, Bayswater"
"LINESTRING (-0.196422 51.509353,-0.19096 51.51244", "From Notting Hill Gate Station, Notting Hill to Ilchester Gardens, Bayswater"
"LINESTRING (-0.142943 51.496863,-0.19096 51.51244", "From Allington Street, Victoria to Ilchester Gardens, Bayswater"
"LINESTRING (-0.076793 51.513406,-0.19096 51.51244", "From Jewry Street, Aldgate to Ilchester Gardens, Bayswater"
"LINESTRING (-0.076793 51.513406,-0.19096 51.51244", "From Jewry Street, Aldgate to Ilchester Gardens, Bayswater"
"LINESTRING (-0.19096 51.51244,-0.19096 51.51244", "From Ilchester Gardens, Bayswater to Ilchester Gardens, Bayswater"
"LINESTRING (-0.18267 51.494185,-0.19096 51.51244", "From Gloucester Road Station, South Kensington to Ilchester Gardens, Bayswater"
"LINESTRING (-0.133201 51.512515,-0.19096 51.51244", "From Wardour Street, Soho to Ilchester Gardens, Bayswater"
"LINESTRING (-0.19096 51.51244,-0.19096 51.51244", "From Ilchester Gardens, Bayswater to Ilchester Gardens, Bayswater"
"LINESTRING (-0.033828 51.514115,-0.014582 51.490645", "From Salmon Lane, Limehouse to Mudchute DLR, Cubitt Town"
"LINESTRING (-0.014409 51.49447,-0.014582 51.490645", "From East Ferry Road, Cubitt Town to Mudchute DLR, Cubitt Town"
"LINESTRING (-0.009152 51.499286,-0.014582 51.490645", "From Preston's Road, Cubitt Town to Mudchute DLR, Cubitt Town"
"LINESTRING (-0.009506 51.496454,-0.014582 51.490645", "From St. John's Park, Cubitt Town to Mudchute DLR, Cubitt Town"
"LINESTRING (-0.085666 51.499075,-0.08497 51.50964", "From Long Lane , Bermondsey to Monument Street, Monument"
"LINESTRING (-0.091773 51.504627,-0.08497 51.50964", "From Hop Exchange, The Borough to Monument Street, Monument"
"LINESTRING (-0.085666 51.499075,-0.08497 51.50964", "From Long Lane , Bermondsey to Monument Street, Monument"
"LINESTRING (-0.129697 51.509087,-0.08497 51.50964", "From St. Martin's Street, West End to Monument Street, Monument"
"LINESTRING (-0.129697 51.509087,-0.08497 51.50964", "From St. Martin's Street, West End to Monument Street, Monument"
"LINESTRING (-0.079249 51.518908,-0.0801 51.52959", "From Brushfield Street, Liverpool Street to Hoxton Street, Hoxton"
"LINESTRING (-0.106992 51.534504,-0.0801 51.52959", "From Liverpool Road (N1 Centre), Angel to Hoxton Street, Hoxton"
"LINESTRING (-0.036017 51.525941,-0.0801 51.52959", "From Clinton Road, Mile End to Hoxton Street, Hoxton"
"LINESTRING (-0.079249 51.518908,-0.0801 51.52959", "From Brushfield Street, Liverpool Street to Hoxton Street, Hoxton"
"LINESTRING (-0.079249 51.518908,-0.0801 51.52959", "From Brushfield Street, Liverpool Street to Hoxton Street, Hoxton"
"LINESTRING (-0.093421 51.529154,-0.0801 51.52959", "From Windsor Terrace, Hoxton to Hoxton Street, Hoxton"
"LINESTRING (-0.089782 51.53089,-0.0801 51.52959", "From Murray Grove , Hoxton to Hoxton Street, Hoxton"
"LINESTRING (-0.183834 51.497924,-0.179369 51.487196", "From Gloucester Road (North), Kensington to Drayton Gardens, West Chelsea"
"LINESTRING (-0.219346 51.482944,-0.179369 51.487196", "From Crabtree Lane, Fulham to Drayton Gardens, West Chelsea"
"LINESTRING (-0.173715 51.491211,-0.179369 51.487196", "From Sumner Place, South Kensington to Drayton Gardens, West Chelsea"
"LINESTRING (-0.161203 51.496886,-0.179369 51.487196", "From Pont Street, Knightsbridge to Drayton Gardens, West Chelsea"
"LINESTRING (-0.174971 51.485121,-0.179369 51.487196", "From The Vale, Chelsea to Drayton Gardens, West Chelsea"
"LINESTRING (-0.161203 51.496886,-0.179369 51.487196", "From Pont Street, Knightsbridge to Drayton Gardens, West Chelsea"
"LINESTRING (-0.179369 51.487196,-0.179369 51.487196", "From Drayton Gardens, West Chelsea to Drayton Gardens, West Chelsea"
"LINESTRING (-0.166878 51.488023,-0.179369 51.487196", "From Flood Street, Chelsea to Drayton Gardens, West Chelsea"
"LINESTRING (-0.185296 51.495362,-0.179369 51.487196", "From Emperor's Gate, South Kensington to Drayton Gardens, West Chelsea"
"LINESTRING (-0.17977 51.51348,-0.179369 51.487196", "From Devonshire Terrace, Bayswater to Drayton Gardens, West Chelsea"
"LINESTRING (-0.179369 51.487196,-0.179369 51.487196", "From Drayton Gardens, West Chelsea to Drayton Gardens, West Chelsea"
"LINESTRING (-0.14177 51.479501,-0.179369 51.487196", "From Battersea Park Road, Nine Elms to Drayton Gardens, West Chelsea"
"LINESTRING (-0.17977 51.51348,-0.179369 51.487196", "From Devonshire Terrace, Bayswater to Drayton Gardens, West Chelsea"
"LINESTRING (-0.141423 51.514499,-0.16862 51.53256", "From Little Argyll Street, West End to Greenberry Street, St.John's Wood"
"LINESTRING (-0.145393 51.542138,-0.16862 51.53256", "From Castlehaven Road, Camden Town to Greenberry Street, St.John's Wood"
"LINESTRING (-0.145393 51.542138,-0.16862 51.53256", "From Castlehaven Road, Camden Town to Greenberry Street, St.John's Wood"
"LINESTRING (-0.214428 51.486062,-0.224303 51.506093", "From Greyhound Road, Hammersmith to Westfield Library Corner, Shepherd's Bush"
"LINESTRING (-0.21819 51.511486,-0.224303 51.506093", "From Evesham Street, Avondale to Westfield Library Corner, Shepherd's Bush"
"LINESTRING (-0.205279 51.487244,-0.224303 51.506093", "From Star Road, West Kensington to Westfield Library Corner, Shepherd's Bush"
"LINESTRING (-0.201554 51.512136,-0.224303 51.506093", "From Chepstow Villas, Notting Hill to Westfield Library Corner, Shepherd's Bush"
"LINESTRING (-0.201554 51.512136,-0.224303 51.506093", "From Chepstow Villas, Notting Hill to Westfield Library Corner, Shepherd's Bush"
"LINESTRING (-0.205279 51.487244,-0.224303 51.506093", "From Star Road, West Kensington to Westfield Library Corner, Shepherd's Bush"
"LINESTRING (-0.228188 51.494499,-0.224303 51.506093", "From Southerton Road, Hammersmith to Westfield Library Corner, Shepherd's Bush"
"LINESTRING (-0.187842 51.509908,-0.224303 51.506093", "From Black Lion Gate, Kensington Gardens to Westfield Library Corner, Shepherd's Bush"
"LINESTRING (-0.158264 51.514577,-0.224303 51.506093", "From Old Quebec Street, Marylebone to Westfield Library Corner, Shepherd's Bush"
"LINESTRING (-0.192165 51.457529,-0.224303 51.506093", "From Ram Street, Wandsworth to Westfield Library Corner, Shepherd's Bush"
"LINESTRING (-0.214428 51.486062,-0.224303 51.506093", "From Greyhound Road, Hammersmith to Westfield Library Corner, Shepherd's Bush"
"LINESTRING (-0.225787 51.514767,-0.224303 51.506093", "From BBC White City, White City to Westfield Library Corner, Shepherd's Bush"
"LINESTRING (-0.21819 51.511486,-0.224303 51.506093", "From Evesham Street, Avondale to Westfield Library Corner, Shepherd's Bush"
"LINESTRING (-0.214428 51.486062,-0.224303 51.506093", "From Greyhound Road, Hammersmith to Westfield Library Corner, Shepherd's Bush"
"LINESTRING (-0.18377 51.5171,-0.18377 51.5171", "From Bishop's Bridge Road East, Bayswater to Bishop's Bridge Road East, Bayswater"
"LINESTRING (-0.185296 51.495362,-0.18377 51.5171", "From Emperor's Gate, South Kensington to Bishop's Bridge Road East, Bayswater"
"LINESTRING (-0.109914 51.531666,-0.18377 51.5171", "From Claremont Square, Angel to Bishop's Bridge Road East, Bayswater"
"LINESTRING (-0.112721 51.536392,-0.11934 51.531066", "From Charlotte Terrace, Angel to Northdown Street, King's Cross"
"LINESTRING (-0.062546 51.535678,-0.11934 51.531066", "From Regent's Row , Haggerston to Northdown Street, King's Cross"
"LINESTRING (-0.106992 51.534504,-0.11934 51.531066", "From Liverpool Road (N1 Centre), Angel to Northdown Street, King's Cross"
"LINESTRING (-0.10997 51.529163,-0.11934 51.531066", "From River Street , Clerkenwell to Northdown Street, King's Cross"
"LINESTRING (-0.062546 51.535678,-0.11934 51.531066", "From Regent's Row , Haggerston to Northdown Street, King's Cross"
"LINESTRING (-0.118272 51.516277,-0.117774 51.513875", "From Lincoln's Inn Fields, Holborn to Kingsway Southbound, Strand"
"LINESTRING (-0.21985 51.493267,-0.21985 51.493267", "From Hammersmith Road, Hammersmith to Hammersmith Road, Hammersmith"
"LINESTRING (-0.204666 51.509591,-0.21985 51.493267", "From Lansdowne Walk, Ladbroke Grove to Hammersmith Road, Hammersmith"
"LINESTRING (-0.21985 51.493267,-0.21985 51.493267", "From Hammersmith Road, Hammersmith to Hammersmith Road, Hammersmith"
"LINESTRING (-0.223868 51.496664,-0.21985 51.493267", "From Little Brook Green, Brook Green to Hammersmith Road, Hammersmith"
"LINESTRING (-0.149569 51.50274,-0.21985 51.493267", "From Wellington Arch, Hyde Park to Hammersmith Road, Hammersmith"
"LINESTRING (-0.199783 51.472817,-0.199783 51.472817", "From Parson's Green , Parson's Green to Parson's Green , Parson's Green"
"LINESTRING (-0.206827 51.467601,-0.199783 51.472817", "From Ranelagh Gardens, Fulham to Parson's Green , Parson's Green"
"LINESTRING (-0.21186 51.483217,-0.199783 51.472817", "From Humbolt Road, Fulham to Parson's Green , Parson's Green"
"LINESTRING (-0.190346 51.46822,-0.199783 51.472817", "From Stephendale Road, Sands End to Parson's Green , Parson's Green"
"LINESTRING (-0.190346 51.46822,-0.199783 51.472817", "From Stephendale Road, Sands End to Parson's Green , Parson's Green"
"LINESTRING (-0.199783 51.472817,-0.199783 51.472817", "From Parson's Green , Parson's Green to Parson's Green , Parson's Green"
"LINESTRING (-0.190346 51.46822,-0.199783 51.472817", "From Stephendale Road, Sands End to Parson's Green , Parson's Green"
"LINESTRING (-0.199783 51.472817,-0.199783 51.472817", "From Parson's Green , Parson's Green to Parson's Green , Parson's Green"
"LINESTRING (-0.199783 51.472817,-0.199783 51.472817", "From Parson's Green , Parson's Green to Parson's Green , Parson's Green"
"LINESTRING (-0.199783 51.472817,-0.199783 51.472817", "From Parson's Green , Parson's Green to Parson's Green , Parson's Green"
"LINESTRING (-0.199783 51.472817,-0.199783 51.472817", "From Parson's Green , Parson's Green to Parson's Green , Parson's Green"
"LINESTRING (-0.222456 51.488144,-0.199783 51.472817", "From Beryl Road, Hammersmith to Parson's Green , Parson's Green"
"LINESTRING (-0.206827 51.467601,-0.199783 51.472817", "From Ranelagh Gardens, Fulham to Parson's Green , Parson's Green"
"LINESTRING (-0.130699 51.50777,-0.199783 51.472817", "From Pall Mall East, West End to Parson's Green , Parson's Green"
"LINESTRING (-0.214762 51.5129,-0.20782 51.473471", "From Grenfell Road, Avondale to Fulham Park Road, Fulham"
"LINESTRING (-0.226606 51.488108,-0.20782 51.473471", "From Crisp Road, Hammersmith to Fulham Park Road, Fulham"
"LINESTRING (-0.191722 51.461083,-0.20782 51.473471", "From Smugglers Way, Wandsworth to Fulham Park Road, Fulham"
"LINESTRING (-0.215895 51.476885,-0.20782 51.473471", "From Finlay Street, Fulham to Fulham Park Road, Fulham"
"LINESTRING (-0.215895 51.476885,-0.20782 51.473471", "From Finlay Street, Fulham to Fulham Park Road, Fulham"
"LINESTRING (-0.216305 51.483356,-0.20782 51.473471", "From Everington Street, Fulham to Fulham Park Road, Fulham"
"LINESTRING (-0.180389 51.46517,-0.20782 51.473471", "From Hibbert Street, Battersea to Fulham Park Road, Fulham"
"LINESTRING (-0.21186 51.483217,-0.20782 51.473471", "From Humbolt Road, Fulham to Fulham Park Road, Fulham"
"LINESTRING (-0.061698 51.4954,-0.228188 51.494499", "From Clements Road, Bermondsey to Southerton Road, Hammersmith"
"LINESTRING (-0.228188 51.494499,-0.228188 51.494499", "From Southerton Road, Hammersmith to Southerton Road, Hammersmith"
"LINESTRING (-0.204815 51.484386,-0.228188 51.494499", "From Normand Park, West Kensington to Southerton Road, Hammersmith"
"LINESTRING (-0.228188 51.494499,-0.228188 51.494499", "From Southerton Road, Hammersmith to Southerton Road, Hammersmith"
"LINESTRING (-0.226606 51.488108,-0.223616 51.485743", "From Crisp Road, Hammersmith to Manbre Road, Hammersmith"
"LINESTRING (-0.229116 51.492084,-0.223616 51.485743", "From Bridge Avenue, Hammersmith to Manbre Road, Hammersmith"
"LINESTRING (-0.229116 51.492084,-0.223616 51.485743", "From Bridge Avenue, Hammersmith to Manbre Road, Hammersmith"
"LINESTRING (-0.223852 51.483732,-0.223616 51.485743", "From Rainville Road, Hammersmith to Manbre Road, Hammersmith"
"LINESTRING (-0.215618 51.464786,-0.223616 51.485743", "From Felsham Road, Putney to Manbre Road, Hammersmith"
"LINESTRING (-0.223616 51.485743,-0.223616 51.485743", "From Manbre Road, Hammersmith to Manbre Road, Hammersmith"
"LINESTRING (-0.205279 51.487244,-0.223616 51.485743", "From Star Road, West Kensington to Manbre Road, Hammersmith"
"LINESTRING (-0.122759 51.487807,-0.124642 51.481747", "From New Spring Gardens Walk, Vauxhall to South Lambeth Road, Vauxhall"
"LINESTRING (-0.117495 51.498241,-0.124642 51.481747", "From Archbishop's Park, Waterloo to South Lambeth Road, Vauxhall"
"LINESTRING (-0.110699 51.501444,-0.124642 51.481747", "From Baylis Road, Waterloo to South Lambeth Road, Vauxhall"
"LINESTRING (-0.124469 51.485917,-0.124642 51.481747", "From Vauxhall Cross, Vauxhall to South Lambeth Road, Vauxhall"
